,tokenized_text,is_after_split_date
0,hey didnt know im taking posts adding detailed explanations theyre easier use since folks using therapists support via patreon everything continue freely available,False
1,theres still time join team telstra program close tomorrow tuesday pm sharp applied havent yet completed application time,False
2,ideas adhd traits handicap crippled via effects pharmaceutical medications see blame relentlessly painful watch reminds could ended championing social responsibility,False
3,important appreciate perspective vital recognize foster strengths,False
4,society need labels characteristics yes labels divide us understand labels currently needed musn lose sight inclusion part,False
5,wonder long gets mr musk infiltrates neuralink influences spend money movement,False
6,seen yet,False
7,depression take seriously together,False
8,paving way universal design inclusivity workplace,False
9,happy talking weeks happens dont privilege verbal communication,False
10,oh shit never thought bros bf trans spectrum finding wildly hard find counselor isnt cis person obsessed gender identity disinterested experience add pretty relevant life,False
11,neurodivergence provoking new mind sight via,False
12,almost ability explain autism disqualifies us autistic douglas mainstream media doesnt get autistic representation tpga,False
13,dont see difference video games cause mass shootings including implicit ableism towards,False
14,youre clearly woman profound mental illness thats exploited cult bullies hatemongers calls nothing else talk thats,False
15,great business examples spreading positive impacts ibm ultranaughts leading example please,False
16,day retail employee noticed rose gold hand sanitizer holder matched rose gold smartphone holder wallet attached said thats kind put together aspires little know thats extent put together,False
17,cognitive diversity way think see perceive world communicate act interesting article read,False
18,shout st wilfrids catholic primary school registering take part celebration takes kinds different minds,False
19,managers familiar advantages coming gender culture backgrounds etc look super interesting article,False
20,shout st nicholas church england primary school nursery registering take part celebration takes kinds different minds,False
21,jaime,False
22,worried explain feel way reasons absenting debate would become obvious youd feel exposed dont feel obliged answer feel would expose trolls,False
23,lots autistic people struggle sleep neurorebel made great article exploring reasons things help,False
24,rdi amazing autism programme helped thrive special needs jungle,False
25,dx neurological disorders find narrative autistic advocates rather elitist,False
26,let content suggestions following start please support,False
27,autism symptoms clinical expert shares insight,False
28,rt continuing education architects create environments support multiplicity neurocognitive abilities needs read article supplementary content take online quiz earn one aia lu,False
29,shout arnold lodge school warwickshire registering take part celebration takes kinds different minds,False
30,need find direction want support chart way towards career mentoring program help formulate progress towards employment goal,False
31,imo approach education implies working diversity mental health conditions learning disabilities also variations sexuality gender consider merely natural variations human personally think education fails otherwise,False
32,examples like exactly important pick conversation known representation within technology teams makes vital point education us,False
33,handson teaching new pupils exploring number patterns fivespot patterns screenshots patterns made,False
34,latest podcast amazing disability justice advocate honoured white house listen full episode,False
35,new mission mondays blog post procrastination adhd make procrastination common,False
36,missing critical detail could made difference see,False
37,possibly happy time world like filled monstrous toady extraverts even monstrous psychopathic masters cant demonising allows hooray selective empathy extraverted monsters,False
38,latest nlp educational contexts thanks,False
39,childrens theme express finding way show see world help feel good,False
40,shout crowmarsh gifford church england school oxfordshire registering take part celebration takes kinds different minds,False
41,shout crowmarsh gifford church england school oxfordshire registering take part celebration takes kinds different minds,False
42,neurominorities empowered movement gained selfconfidence ownership identities accepting brains different difference okay,False
43,us see hear touch communicate understand world different great strengths also challenges areas may need extra support yrs whats spiky profile,False
44,current politics disabled society rather enabled thrive valued equally check,False
45,important intersections society represented counselling training teams etc etc,False
46,dont think ableism ie using tard insult racism ways people exploited ignore hierarchicies exist within outside class support revolution white able man top afterwards,False
47,always understand something better drawing probably scrutinise visuals dont appear add anything,False
48,fyp recs laser topics things youre interested viral broadly meaning common interests like fun science philosophy facts get surfaced quickly niche interests need actively seeded,False
49,great tips giant field reading teaching reading wisdom dr marion blank,False
50,tools show colors look us users come closer experience others gives glimpse anything could simulate spectrums people get glimpse like,False
51,wat accepting people different neural construction like adhd autism accepting others different less intelligent frick agree,False
52,wondering anyone relate political viewpoint psychological term,False
53,saying hi,False
54,harry potter fans,False
55,latest san anselmo california daily thanks,False
56,read,False
57,paving way universal design inclusivity workplace,False
58,yell teachers best ap biology teacher tell us different gender studies studies love,False
59,amiable reminder members eligible category film inclusion based personal experience resonates many around world,False
60,join us wednesday february explain role executive functions operate lives particularly related hoarding behaviours chronic disorganisation extreme clutter click find,False
61,lighthearted look,False
62,shout rugby high school warwickshire registering take part celebration takes kinds different minds,False
63,paving way universal design inclusivity workplace,False
64,shout arnold lodge school warwickshire registering take part celebration takes kinds different minds,False
65,facts refers dyslexia dyspraxia dyscalculia adhd says people autism spectrum uk uk adults w autism fulltime paid employment,False
66,liam toner uses portraiture explore means human read interview enjoy artwork,False
67,working flexibility freelancing offer opportunity nd individuals reach true workplace potential amazing written freelancing adjust help us understand,False
68,paving way universal design inclusivity workplace,False
69,fb live feb pm link bring glass wine water beer juice please come good bad ugly well ill try make presentable,False
70,batman remote learning today batman much better student batmans ta,False
71,team members challenge groupthink status quo help company bring new perspective process improvement problem solving innovation,False
72,shout springfield academy darlington registering take part celebration takes kinds different minds,False
73,meeting need jane mcneice,False
74,dyslexia assessments provide assessments legal education employment purposes provide assessments zoom facetoface psychologists experience related conditions,False
75,love existing intersection gender variance im social outcast matter,False
76,dont get separate different kinds diversity welcoming certain kinds others limited certain groups really diversity cant call,False
77,pleasure try spread message many genuinely know opened eyes fuelled personal creativity,False
78,beautiful friendship,False
79,shout abbots langley primary school registering take part celebration takes kinds different minds,False
80,things interesting androids human get part droid brain supplement viewed droid part prosthetic trans prosthetic,False
81,dcd help steam stem thanks ox daughter ex mphys astrophysics continuing art good luck ox soar,False
82,like cover neurology brain topics accessibility,False
83,sorry read hope getting right help unfortunately becoming familiar story many families mh services underfunded little adaptation kind much love,False
84,joanna grace shares experiences maternity care mother autism support healthcare professionals understanding working people neurodivergence,False
85,science culture seminars continue friday talk higher education,False
86,lol still people like earth high level stupidity dont even understand human human condition human relationship psychology metaphysic emotional conflict vulnerable imposter syndrome great drama human,False
87,tic tourette syndrome patient umbrella association twitter follow us read,False
88,taking selfcare time ghosted agents expressed interest responded information asked fell silent talk much people understand appear mostly cope well,False
89,project submitted evidence hm inspectorate probation give better support autistic people people learning disability prison,False
90,makes really interesting read achievements plans edi data drives work incredibly proud see outlined key area work student employee reading,False
91,context im thinking specific needs like large print general good practice eg line spacing font font size contrast stops buying physical books remotely cant see inside using google books,False
92,remembered friends bday today well proud lool,False
93,posted article overlap gender diversity got yet expecting glad made people happy though saddest thing,False
94,words wisdom proponent shell happy know everyone field listened agreed much detriment,False
95,mean disability group doesnt refer visible disabilities mine isnt separation really weird,False
96,blessingcurse dichotomy writing,False
97,wonderful moment workplace taking good step employee groups race disability lgbtq etc reason split disability,False
98,words wisdom proponent,False
99,interviewed global autism project,False
100,information visit want better support teachers year message,False
101,developing adhd seriously suggesting birth,False
102,adaptations essential inclusion,False
103,afternoon busy day filled really good conversations cpd positive action slow sure progress,False
104,thanks fantastic opportunity excited begin project transform lives people disabilities embedding radical acceptance value based leadership,False
105,delivered lunch time finished tea time oh simply wonderful mum nd books means much honestly important read,False
106,harm others community thank,False
107,went freelance specifically difficulties fitting traditional workplaces difficulties major catalyst seeking diagnosis,False
108,paving way universal design inclusivity workplace,False
109,shout st nicholas church england primary school nursery registering take part celebration takes kinds different minds,False
110,excellent article online learning year absolutely served grade son reality check really resonates time step,False
111,enabling workplace feb online event,False
112,ashley h applied ux ui designer position spectroomz celebrate,False
113,hosted meeting today inspirational jude morrow training international education minister peter weir jude says need heroes autistic children young people thanks jude ongoing work minister engaging,False
114,sounds like working people know like good work simply taken granted intelligent enough recognise gifts bring rather whatever normals,False
115,mentoring program help formulate progress towards employment goal weekly hour mentoring online support group online employment support course get mentored,False
116,know dei b right well dont grit flow weve broken starting diversity,False
117,ai humans designing algo person spec junior programmers one tech majors specifications reduce gender place cultural moral ethical diversity reduce potential outputs,False
118,brother luca eligible category film inclusion based personal experience resonates many around world,False
119,ai humans designing algo person spec junior programmers one tech majors specifications reduce gender place cultural moral ethical diversity reduce potential outputs,False
120,want see according christian klein sap chief executive sap teams colleagues autism report rise patent applications innovations products increase management skills empathy,False
121,wife taking two pronged approach learning,False
122,bill bouchey hok surviving wfh hangover,False
123,mention continuously left conversation,False
124,guess start group since support group accessible unless magically guess rules even though supportive years anybody,False
125,tickets gone live march free eight generous sponsors seven categories six amazing judges nominations come along celebrate us,False
126,every school college university signing follow register,False
127,im seeing entire foundation based sex differences still even changes terms hes making palatable times using language values sugarcoat includes listening autistics,False
128,jims essay one founding documents movement must read youve never read,False
129,yes think least comes,False
130,great insights month issue fascinating profiles including laura carrara cagni pg intriguing look thank emily martin,False
131,didnt know learn im like thanks mom dad school system letting lol,False
132,visible yep yep,False
133,childrens services dire daughter reffered screening yrs ago seen panel diagnosis yet although said something yet understood treatment help education shes missed three years,False
134,yes hear term anachronistic somewhat inaccurate research helped influence later thought including getting away simply deficit model,False
135,sometimes diagnostic label sometimes photographs show overcome live hard communicate child ran away hairdressers touch scissors waterspray much,False
136,good resources ideas look help discussing listening skills key stage im hoping avoid dispel seemingly endless call firm eye contact way address cater sensitive way year,False
137,person autism makes things foggy sometimes please stop microaggressions end stigma,False
138,slp schools wanted show kids sensory processing differences amazing may made differently perfect preschool nd grade mo pip gabby broken ears,False
139,honestly person didnt get diagnosed adult hood think teacher experience knowledge would gold even tweet wasnt serious think would make positive inpact teacher,False
140,havent vaccinated covid yet canada incredibly embarrassing slow vaccine rollout relate alices point adult functioning,False
141,fuck wrong availability information alone fact sufficient abuse occur even sufficient prevention people fucking awful regardless information comes territory idea,False
142,save date firstever wiggles stomps squeezes calm jitters story feb rd,False
143,things get hard give go oh person communicate person make decisions person severe low included ed,False
144,autism kids capable stay safe,False
145,shout st wilfrids catholic primary school registering take part celebration takes kinds different minds,False
146,another critical part diversity equity inclusion dei efforts people think differently need change need accommodations turn job best place work,False
147,paving way universal design inclusivity workplace,False
148,also facilitates internalized ableism people pride superpowers really connected community tend really harsh people neurotype make disabilities special skills,False
149,soooooooooooooooorry,False
150,mean sensory differences geek club books,False
151,added element mom husband sometimes take lack acknowledging name lack eye contact attention offensive like girls like explaining autism consent gets difficult,False
152,believe neogenders similar nature even difficulties understanding creator one much connect allows nonneurodivergent people use linked,False
153,hey back smth wrote song using racial slurs insulting people nationality weight sure black south asian stays stays struggled body shaming would appreciate apology,False
154,least right one thing transgender identity isnt policy direction feel homosexual identity wasnt long ago totally alien majority thats alien include,False
155,students dyslexia encouraged use simple tools online schooling online school success dyslexia,False
156,play well together know alone spent years battling host symptoms blaming lack faith special place imaginary hell xians teach selfdepreciation virtue,False
157,felt honoured run training today absolute pleasure meet passionate skilled team part many engaging thought provoking discussions,False
158,reminder dont know said every day mental illness neurodivergence framing mental illness part ideology actively harms autistic people nd folk,False
159,want change thesis topic workplace,False
160,bending conversations things interest,False
161,thanks joining community help parents connect great professionals organizations,False
162,learning microsofts efforts hiring employee support im signing mentor,False
163,acknowledging aspects made possible actually manage symptoms,False
164,fuck intersectionality abled cis straight tall judeochristian capitalist upper middle class white men sometimes oyu gotta clench bhole,False
165,hiring program changes lives brings amazing autistic talent teams accepting applications years cohort learn apply,False
166,look treated misogyny ableism idea performing quirks reinforce marketed image totally erases reinforces idea women nd also taking agency,False
167,accommodate autistic loved ones neverending pandemic ways respect needs style managing stress reminders based feedback friends contacts autistic community,False
168,video manic pixie dream girls broken k second video awesome linked seen wanted mention something ended cutting original video,False
169,studies like important please help university research project exploring autistic people communicate effect access appropriate mental health support services,False
170,anonymous survey parents children autism regarding distance learning participate years age older live us child autism grades k,False
171,sent flags ross holding awesome folks much covid times continue enrich vibrant community trailblazing,False
172,lot autistic artists contact ask think best tell agents production companies mostly fear stigma answer yes scary thread offer tips go,False
173,studies thing common literally diversity even much smh,False
174,multicultural childrens book day promotes diversity childrens literature including stories wiggles stomps squeezes,False
175,starts conversation work publicly announcing work cool cool wanna present yeah sure brain gunna adhd style procrastinate month slap together something random night,False
176,excellent meeting today discuss current view autism autistic people live change happen future,False
177,almost like practice evidencebased something person pathologizing itmaking like infection let normalize remove shame thanks posting,False
178,thanks recommend books well context domains learning please let know free resources discount codes colleagues access,False
179,episode goes live tomorrow tune tomorrow hear jon holloway talk photography dyslexic superpower listen subscribe,False
180,shout abbots langley primary school registering take part celebration takes kinds different minds,False
181,going hire consultant probably aim hire someone actually theories theory mind empathy caused lot harm creating misconception autistic people empathize,False
182,course dream school well suited academically young stillfiguringoutneurodiversity girl ended graduating cal state school still better byu,False
183,brain incredibly powerful also fragile easily damaged injury toxins trauma also incredibly resilient gets needs able heal,False
184,committed promoting within workplace uk staff voted broking giant charity partner next two years details,False
185,paving way universal design inclusivity workplace,False
186,delighted welcome hmi nick whittaker author ofsted framework pupils speak evenings appg adhd,False
187,supporting home learning learners mike hussey director school services adhd foundation charity offers useful tips guidance parents teachers,False
188,observatory educational innovation,False
189,halo unroll long thread adhd masking talk soon,False
190,huh years calling news sources know better implying sick tired ableists diagnosing distance jaded shorthand explaining behaviour rationalise labelling insert,False
191,shout home schooling moment lots talk mums home schooling tag dad supporting needs,False
192,heard,False
193,college professor writing prond book apparently year yet another nd book still waiting one antind book side guess mine par publication,False
194,episode live jon holloway talks photography dyslexic superpower listen subscribe,False
195,stop using way evade responsibility,False
196,allowing autistic people dictate way diagnoses produced damaging people like exist people existence dissected people slightest clue harm caused autistic folks,False
197,super cool charter school speak ruined son self confidence flunking classes one year english teachers december school idea teach highly gifted kids good thing made choice leave,False
198,really though strong grasp statistics background research special interest brains work,False
199,realize intersectionality abled cis straight tall judeochristian capitalist upper middle class white men maybe ok watch,False
200,range differences individual brain function behavioral traits regarded part normal variation human population people view autism disorder others see part normal variations human,False
201,hey students education dedicated eradicating stigma surrounding education awareness also broader issues mental health christian faith flourishing spring meeting dates coming soon,False
202,rory study new zealanders adhd treatment,False
203,thank data design community honour learn design strategies engage autistic people session recording,False
204,queer faces adhd nora nord photography project highlights underrepresented beauty see,False
205,tomorrow reddit ama dr russell barkley answering live interview answer select questions,False
206,im pitching manuscript time around yall need someone whos really tuned continuity im gal also provide insight autism ptsd etc im pretty good grammar,False
207,support group via zoom feb online event,False
208,earth behind play possibly mean thinking means socialize way think kids emotional maturity able play important depending frame also really ablist pov,False
209,yes course choices matter one choose add grow poor come environment asking help seen weakness idea mental illness lack willpower frankly insulting helpful,False
210,adhd anyone else decide pens notebooks buy panic spent bunch money pens,False
211,stop hiding behind avoid acountability,False
212,good podcasts,False
213,likewise given really want call crazy either sensitive word people movement,False
214,seriously though ever want chat ive found frank discussions incredibly liberating even dont exactly match one another talking brings opportunities selfunderstanding,False
215,feminist pedagogy realize pushback paternalistic system system never going serve women color well least serve nonblack poc well either student prof certainly,False
216,love personal inspiring learning much friend parents caregivers educators,False
217,mg ya novels mental health added jan fbpost book club suggestions organized topics characters settings formats authors ideas talking texts teachers guide book clubs across curriculumsee,False
218,oh hai twitter novelists adhd asking secret project wang us dm email sarahwritershqcouk thaaankss pls rt,False
219,find dyslexia addressing dyslexia toolkit,False
220,know needs hear kid years ahead class academically notice occasional social quirks maybe get evaluated fine b c smart certain age smart enough,False
221,new blog smart foods brain health,False
222,join us feb webinar includes personal accounts people living dementia impairment learn consider impacts design built environment,False
223,great start working new group early years champions av consortia schools liverpool today looked adhd autism early years,False
224,look arrived post today working visual perception book hooked much,False
225,number members learning disability whos employers failed make reasonable adjustments escalated rather support,False
226,quack pleased made official welcome club full people,False
227,new marcia brissetbailey cofounder cultural perspective committee trustee marcia worked within education community sector years champion cultural perspective,False
228,video article,False
229,blocked guess name said group really given information need priorities despite superficial use language,False
230,anyone good resources wanna know,False
231,often boast specialist skills makes experts field interest,False
232,direct access proud able hire employee autism spectrum one front believe excellent allows opportunities might otherwise find work easily another unique minds,False
233,belfast adult autism advice service available today pm would like advice support individual member family please contact team dbradleycedarfoundationorg,False
234,quote welcome applications underrepresented people gaming industry including limited bame lgbqt women people physical disabilities mental health issues parents carers get applying awesome bunch,False
