,tokenized_text,is_after_split_date
4067,irony one last stories wrote ending booked psychiatrist teen suicide awareness isnt lost,False
4068,recent development google want know problem anyone want big problems means hurling insults bullying others autism huge spectrum lot want make,False
4069,,False
4070,almost like species reason,False
4071,really interesting thread try ally felt similar inflection point new ambassador group one companies work visibly raising profile understanding,False
4072,thank autistic relate community much,False
4073,didnt know antineurodiversity crowd extremely saddened learn people dont think autism natural hurts much learn people ive diagnosed barely year selfdxed several,False
4074,rt people autism asperger dyslexia adhd bring massive value workplace,False
4075,saturday morning im keeping tweets mind writing chapter textbook,False
4076,like idea,False
4077,people autism asperger dyslexia adhd bring massive value workplace,False
4078,people autism asperger dyslexia adhd bring massive value workplace,False
4079,image really speaks career trajectory professional aspirations source,False
4080,much looking forward taking part webinar free tuesday please join thank opportunity raise awareness dyspraxia,False
4081,download mobi radical guide women adhd embrace live boldy break barriers,False
4082,mental health screening assessments,False
4083,greate talks key words embraced panel poc tech panel microsoft workshop diversity inclusion,False
4084,cognitive distortions feed radicalism national council severe autism,False
4085,honesty communication cultural theory yenn purkis autism page,False
4086,stcentury skills central bespoke empower science workshops run young people,False
4087,dunno dont know enough say seen things ascribed adhd look like personality traits clinical,False
4088,want book help children managing moods bad days looking something displays powerful sibling bond book w illustrations embraces different kids different needs strengths challenges,False
4089,interesting even considered appreciate lesson diversity,False
4090,relaunch creative team content reflect inclusivity feature diversity example age diversity gender identity thread please rt,False
4091,dr karl knig colleagues founders camphill inspired anthroposophy teachings,False
4092,ends monday connected autism ticket use code earlybird checkout,False
4093,many programs activities featured blogs website check follow please retweet,False
4094,like good thing one person nerodiverse gottit,False
4095,got back myspace students find many followers freak dont even know talk people talk sometimes keeps live simple,False
4096,recharge austin texas,False
4097,wow idea hated autistic people kate hudson ought ashamed disgusting,False
4098,includes squad represent,False
4099,blog post effectively advocate child school,False
4100,people autism aspergers dyslexia adhd bring massive value workplace via people skills others dont value,False
4101,want fighting,False
4102,yet antineurodiversity people insist awesome whatever seems ones political agendas biases accounts movie sucks outside anything portrayal autism,False
4103,job struggles,False
4104,really great thread autism makes ton sense heard autistic sibs,False
4105,threat unsure came conclusion also unsure getting data traumatized sounds like made mind enemy movement nothing change mind,False
4106,need talk ask work one panels thats shared end valuable incredible id love many people possible able see,False
4107,kids love talk things never change watch gabriele nicolet explain happens due brainbased differences insightful video,False
4108,five days first virtual benefit lineup divine audience tap tix support inclusive concerts audiences autism,False
4109,friendly schools postsecondary education,False
4110,happy saturday,False
4111,seed pod open prioritising minority ethnic community deaf disabled working class lgbtqi,False
4112,great tips one heroes field reading teaching reading wisdom dr marion blank,False
4113,blown away guests fantastic discussion,False
4114,got something say questions disability hate crime lived experience disability mental ill health family carer join friendly event cps speak find whats done,False
4115,ends monday connected autism ticket use code earlybird checkout,False
4116,parent needs celebrated understood enlightening alternative way seeing world learnt much,False
4117,regardless believes students overcome obstacles right support,False
4118,skimming list see many manc traf schools signed yet celebration mar,False
4119,one best ways grow kind keep learning helps us understand people around us gives us chance conscious go day learning infographic h,False
4120,missed recent minds behind mind event autism identity catch youtube panel includes selfadvocates parents professionals sharing perspectives multiple identities impact lives,False
4121,want understand better ive started following people recommended advocated people responsible programme work,False
4122,related note dont know gifted talented classes special education classes time due problems writing hand thats one reasons im vocal advocate bad one thing means nothing,False
4123,notes conroe independent school district,False
4124,like piglet stay safe,False
4125,white male still dxd many autistics many totally excluded society feminists say men trash dont matter,False
4126,shout baysgarth school north lincolnshire signing take part celebration schools taking part worldwide,False
4127,march pm next part femfest brighton supported showing brilliant acts include,False
4128,multicultural childrens book day promotes diversity childrens literature including stories wiggles stomps squeezes,False
4129,love creative weird random nerdy affectionate kinda person especially autistic,False
4130,navah around many families people autismit completely typical us autism present anything socially,False
4131,neurotypical world adhd work people adhd emotional regulation much harder misunderstood words taken wrong way failed attempts fit adhd mental health practice,False
4132,truly sex worker special interest community building bigger anyone realizes see clear day starting drive crazy one else sees going keep talking,False
4133,neurodivergence common netflix category estimated people people huge,False
4134,totally disagree advocates loudly declare nothing wrong w asd people need acceptance meanwhile son epilepsy gi disease awareness danger ignoring end spectrum tremendous injustice,False
4135,kind telling really stop think extroverts want cure dont believe look even tried barbaric stone age shit like faecal transplants easily casue deaths compromised immune systems,False
4136,also physical ability cannot even conversation unless youre talking brain damage something like potential inherent benefits paraplegic,False
4137,wiggles stomps squeezes calms jitters perfect collaboration author illustrator want help others understand,False
4138,uk call participation research,False
4139,hundreds people saying sort stuff many cases ing others read spontaneous response matches plan going long movie tee abusive certain parts spectrum,False
4140,speaking autistic important topics include traits e sensory sensitivity intense interests social communication inextricably linked trauma camouflaging consequences costs late misdx tiktok,False
4141,hey people explain spoons spoons getting giving,False
4142,proud girl going hide true autistic self comfort others selfish learn accept,False
4143,im tired ppl bringing nd headcanons canon everything prove pov pov based,False
4144,coincidence organisations making call actually led lived experience autistic peoples organisations expressed big misgivings instead suggested commissioner,False
4145,aside drunk duck found first home group different approach focusing mental health wellness helped find confidence get matriarch started offer great activities participate,False
4146,yeah people really understand drug dependence anyone adhd share myriad number times people suggest could take medication try harder meditate etc etc etc,False
4147,bring im literally nd promise whether langa nd im talking specific facts happened story,False
4148,antineurodiversity movement like top mustache twirling one dimensional villain stuff,False
4149,year teacher showed us video autism showed level autists maybe showed level would thought hey could autism would got help way earlier lot scarring experiences would avoided,False
4150,another type diversity celebrate theme month helpful tips understanding remember even diagnosis may different needs jules,False
4151,happens literally say loud thank past cody taking care future cody,False
4152,feeling think lot also comes pathologized weight mental illness race etc health care particularly higher ed special cesspool,False
4153,depends high mind needs get like nt mind going routine normally blessing fixated high goal,False
4154,leaves antineurodiversity advocates speak use agenda ultimately keep us line silence autistic person calls martyr complex,False
4155,interesting antineurodiversity crowd set scenario wherein youre able use social media cant possibly severe enough understand autistic children high support needs children given means w speak,False
4156,oopsie whoopsie bookclub tonight already front loading rsd thankyouverymuch true ambivert think get lonely shifting lurking mode gets difficult older get come terms extent,False
4157,theres word used sort thing isnt cure feel eldritch horror applicable like cures want make us happy little tribal stupid selffetishising pod people thanks,False
4158,anti either people dont actually know movement reactionary weirdos,False
4159,think person feels nasty little extroverts express undue happiness finding cure whatever form dont want cure youre fucking creepy dont want creepy clone pod people stop,False
4160,hi another element told yet telling dyspraxia actually wanted say another beautiful aspect neurodivergence lots love care,False
4161,really love variation symbol designed specifically represent adhd,False
4162,find preference selfdiagnosed seek confirmation professional possible degree media stereotypes bias stigma poor training lack support child adult psychologists teachers factor hesitancy,False
4163,working hire people autism growing trend tech including seattlebased avanade pushing ranks,False
4164,im updating work disabled people creative walking walking art watching reading listening please friends self defined incl chronic illness mental health crave work made us us thanks xx,False
4165,agree access ambassador insurance sector welcome support launch gain group autism insurance look forward gaintogether workshop insurance firms feb,False
4166,todays philosophy bring work platform designed help showcase cv underutilized talents find meaningful employment,False
4167,super power,False
4168,well publicised fact tix tourettes indeed root stage name ticks takes lot overcome negative stigma attached tourettes general still quite prevalent society today,False
4169,northeast women launch new support group raise awareness,False
4170,explain im going avoid word walls ive thinking education frenchspeaking countries french world languages careers im aiming improving pupils cultural capital,False
4171,thank consider aspect decorating walls thank reflection toon many ideas thread already share,False
4172,ends monday connected autism ticket use code earlybird checkout,False
4173,giant spearheading drive make creative industries,False
4174,spends last ten minutes talk discussing movement kinda go last part didnt realize recent quiet retraction theory defining career,False
4175,heard referred movement rather one already going involve heavy lifting rename something got traction maybe easier shift definitions sure referring,False
4176,bank america intersection cybersecurity,False
4177,im using creative synonymous introversion context theres much evidence shows extroverts arent ceative theres good body study thinking think obvious though,False
4178,would interested sen senco way lot new teachers clue school doors closed realise complexities living us even get help fight us oldies,False
4179,slp white means white savior attitude damn real field preoccupation ignoring buddying aba encouraging assimilation easily results trampling disabled points view,False
4180,working hire people autism growing trend tech including seattlebased avanade pushing ranks,False
4181,ive done big post vaccines dont cause autism wakefield fraud autistic kid awesome ableism problem disability,False
4182,getting academic accommodations adhd adhd friendly psych cognitive disability matter,False
4183,people autism asperger dyslexia adhd bring massive value workplace rt,False
4184,bro im starting new course program play therapy know really good career bitch literally could fall asleep last night woke middle night anxiety induced dream hate anxiety,False
4185,embracing adhd dyslexia gives adland creative edge,False
4186,writing cathartic experience highly suggest everyone try least life spreading joy sadness anger write sake python,False
4187,diversity forms honestly ableism racial diversity lgbtq socioeconomic etc always want highlight nontraditional careers make space industry unique major challenge jpl says cant interview jplers,False
4188,make collage help remember learn saving notes pictures paper helps think clearly slows racing thoughts relaxes helps remember learn,False
4189,,False
4190,didnt say could trigger something caused traumatic events tho mentioned,False
4191,btw keep hoping last time ill talk autism relation music never neurotypicals otherwise weirdly reactionary antineurodiversity types keep crawling woodwork vile,False
4192,cozy weekend read hes swerving track shes hitting brakes come join sexy mechanic manages navigating life loss love,False
4193,inconvenient questions r v rdy talk abt diversity alongside cybersecurity,False
4194,former english teacher know way parents teachers choose words really matters great phrases consider using help support encourage inclusion school home,False
4195,go church considers queer sin also welcoming people special needs people complex,False
4196,made fun someones grammar struggling grammar common symptom people use neopronouns try,False
4197,watched pixar short film loop today daughter used opportunity talk disability good thread resources movie good one check kids,False
4198,therapist point blank asked forgiving accommodating kids,False
4199,remember autistics gaslight neurotypicals nds gaslit often act ways abusers know,False
4200,pictish sacred assembly spaces western fairy tale origins autism twice exceptionality,False
4201,blogging actually lot fun thought would getting share enjoy fun python,False
4202,definite must read,False
4203,yeah truth fun standardized world,False
4204,use link access variety committees insar several proponents autistic researchers committee,False
4205,wish insar think autism sucks bullshit want science find treatment breakthroughs asd committee maybe theyll create one wont hold breath,False
4206,celebrate,False
4207,jonathan stewarts new notion video today using notion dani schnakenberg,False
4208,percy adhd part demigodness,False
4209,normalize expressions emotion,False
4210,ends monday connected autism ticket use code earlybird checkout,False
4211,cpi journey become inclusive learning workforces adapting become workplace read whitepaper,False
4212,condition considered disorder part wants depathologize people look brains work differently,False
4213,grateful openness vulnerability friend nails painted chance discuss w see video,False
4214,autism kids capable,False
4215,curated design frontend resources free design ebooks accessibility overlays uxd illustration codepen demos front back frontend css layout flaws design thinking font ide etc,False
4216,since learning identifying lot neurotypical behaviors value interpersonal relationships survival,False
4217,learn common types depression children,False
4218,pdf free neurotribes legacy autism future neurotribes legacy autism future steve silberman pdf download neurotribes legacy autism,False
4219,insightful post ty sharing,False
4220,thank waiting actually tell wtf happening fully armed new diagnosis like u give care bc shit mental health give everything alongside chronic illness,False
4221,say believe accommodations trying force one word much messy unhelpful especially trying express news culture,False
4222,never understood people reacting autism tragedy kind terminal sentence amazing things see world amazing ways wait hope day celebrated given tragedy narrative,False
4223,instead asking cause childs misbehaviour ask cause distress shift lense correction compassion,False
4224,isnt covers neurological differences including autism adhd dyspraxia dyslexia many nobody forgotten unless forgetting everyone neurological differences isnt autistic,False
4225,caveat saying many want need return f f vital reasons privacy safety somatic work presence connection another person healing tool simply treasure time space,False
4226,wait wait wait wait view refer brain akin separate entity thing people make distinction self person brain whack sounds fake,False
4227,increasing emphasis autism also created huge rift community im sorry disagree different needs im aware rifts local autists group includes people wildly differing needs rifts see,False
4228,looking forward attending tech built everyone means tech built everyone inclusion tech festival,False
4229,provide autism assessments legal education employment purposes provide assessments zoom facetoface psychologists experience related conditions dyspraxia,False
4230,im adhd likely autism spectrum thats harder diagnosis know definetly connect everything wrote expectation appear normal extroverted immense lot work places say theyre inclusive presented,False
4231,assumption one pathway wrong gates operates particular mindset part id rather see spend fortune bit right spending totally wrong,False
4232,meaning shifted judy singer original formulation fit diversity used elsewhere especially corporate world prefer normal usage always argued uphill battle forever,False
4233,also helped support assemblies phse lessons communication perm ex overturned abs policy changed,False
4234,video discussed still new journey case youre wondering yes getting nails painted colour rainbow celebrate,False
4235,identifying learners concern,False
4236,thx response inclined agree felt bit uncomfortable grateful lot masking bc seem see within community stories burnout trauma etc pro masking way seems could equal antineurodiversity,False
4237,months away graduating mental health pro con needed pause placement get together hard although im one really knocked confidence thanks sharing x,False
4238,students welcome embraced would start sel exactly help seems adults system,False
4239,gotta level stats,False
4240,media try less like sherlock sheldon dumbass sia film like orla derry girls imo,False
4241,definetely push back harder discussion school settings behaviour dedicating time discussing hostile actions feel one person actually lovely someone else,False
4242,human minds work like ecosystem like individuals competition heres know,False
4243,human minds work like ecosystem like individuals competition heres know,False
4244,interesting feel like stammering clinical area slt lived experience considered asset therapist love see energy mental health,False
4245,fast illogical brain matures cptsd really common working good therapist really helps thoughts,False
4246,lot thanks sharing mid last year youngest child developed rapid onset tourettes syndrome life hasnt yet explains historical stuff wasnt obvious time gift creatives,False
4247,different brains focuses energies supporting educating aspergers alzheimers looks like important free webinar managing stress im recommending adult struggling loved,False
4248,please support claudes sen law reform uk education system,False
4249,ive many conversations people feel immense shame becoming unwell substance use wondering didnt miraculously fix trauma support decriminalization drugs also respect means people react differently,False
4250,tried expose cult leader sarah kurchak got bunch gifs sakaguchi vs ueno thirst tweets guy named charisma,False
4251,honesty communication cultural theory via,False
4252,im neurodiversityoriented autism fb group almost everyone parent autistic kid every someone say something like year old wont stop stomping feet shaking head want let stim interrupting school,False
4253,looking human resources conferences present presentation rudolph red nosed reindeer represent recommendations please let know,False
4254,going fantastic event mix academic talks live performances visual introduce concept synaesthesia highlight creative possibilities open,False
4255,kids dyslexia better shown use simple tools online schooling online school success dyslexia,False
4256,fucking beautiful thank u lovely reminder lololol,False
4257,screams funding needed also incentives people enter mental health professions lets make sure services designed neurotypicals,False
4258,anyone know effects caffeine coffee may autistic people,False
4259,predatory human concept loyalty know know reality ex kgb agent confirms trump russian asset,False
4260,like movement push needs intersectional layers discrimination huge effect neurodivergence expressed otherwise marginalized,False
4261,sensoryfriendly swimming swim lessons,False
4262,want make difference lives people mental health problems learning disabilities leeds seeking experienced leader head pathway integration mh ld apply closing march,False
4263,creative team content reflect feature example age diversity gender identity thread please rt,False
4264,seconds days bring back one night funds support inclusive concerts audiences tap link tix,False
4265,worked really hard normalizing therapy kids friends family helped understand address,False
4266,adds value workplace,False
4267,tax exhausting,False
4268,supporting learners homeschooling helpful fact sheet mike hussey director school services adhd foundation charity,False
4269,tell teachers put iep target,False
4270,workplace part finding work,False
4271,youre female like math science youre minority youre autistic youre supposed good math youre autistic female python,False
4272,social ecology mental functions great paper important parallels secondperson neuroscience neuropsychiatry papers,False
4273,forms mental functioning work well given time large part determined construct environment,False
4274,know divergent book series world realising helpful messages teenage girls struggling work fit society,False
4275,article proponent conflating us murderers blaming inadequate sex education problems autistics forming relationships mentioned great surprise,False
4276,download free radical guide women adhd embrace live boldly break barriers,False
4277,ecology thought rethinking foundations mental disorder,False
4278,story life,False
4279,really frightening anyone heard please rt,False
4280,love learning lot things think certain subcategories geology degree philosophy interesting also rlly love learning abt cultures,False
4281,totally surprising students dyslexia often test far true knowledge ability heres,False
4282,adhd autism isnt fashionable stop trying make trendy yall sitting thinking fun cute struggling stop,False
4283,proud author moment latest book manuscript finished sent publisher today next awesome book coauthored yenn purkis autism selfadvocacy handbook,False
4284,recent study canada found considering condition undiagnosed girls figure probably higher discrimination exists anywhere exists sex bias,False
4285,awesome spectrum kids adults,False
4286,wonderful hear preference something hear campus lot kiddo got diagnoses well college years im familiar adult terms stanford others hosted summits,False
4287,one thing come notice capitalism marginalizes oppresses nonconforming sexuality gender purposefully obfuscates well,False
4288,read real hate groups,False
4289,great post words links wonderful k coined site,False
4290,best kinds autism portrayal opinion autistic character list symptoms person views autism realistic perspective make sense python,False
4291,true children especially dyslexia handson science beats worksheets every time,False
4292,guess see way reclaim movement attached significance doesnt belong dont think idea movement necessary acknowledge word need fix movement,False
4293,problem many people movement means specific toxic beliefs possible reclaim would rather use energy blazing new trail dont think word tainted btw movement,False
4294,ive seen people equating movement started reading critiques left wondering members movement defining word way,False
4295,thinking start term thats unique enough distinguish taint similar enough suggest covering basic ideas basically start rebrand used reclaim generic term one loaded baggage,False
4296,neurodivergence provoking new mind sight via,False
4297,ive seen pushback enough think fairly widespread belief movement means something pretty specific people shunned shamed using,False
4298,theres entire adhd subreddit million subscribers basically says rules going back members socalled movement apparently promoted superpower antimedication narrative,False
4299,probably joke se sim im sorry,False
4300,woohoo home stretch tickets smash first virtual benefit ticket goal midnight help tap tix,False
4301,friends opened new exciting roles candidates check cyber security systems administrator roles,False
4302,classroom creates aware curious compassionate community carry wider world,False
4303,knew day peds rotation ms took selfconvincing planned trauma surgeon im start developmental pediatrics fellowship could happier,False
4304,concept familial broad autism phenotype exists boomers gen x autistic children grandchildren want diagnosed autism,False
