,tokenized_text,is_after_split_date
2874,cuckoos nest makes anti hero bit ambiguous mcmurphy pulling long con blowing bighearted fool archetype trying return inmates life make realize theyre sane want early blow,False
2875,strengthen cybersecurity defense likely,False
2876,much know works enough understand kids struggle specific steps compensate comprehend information different ways,False
2877,embracing gives adland creative edge,False
2878,aware controversial subject talked adhd got berated rejecting medical model disorders never said disorder going ashamed cry neurotypical,False
2879,acceptable people learning disabilities neuro diverse told lives worth saving,False
2880,cant feel anything besides guilt anxiety materialism hate negative emotions,False
2881,count diverse,False
2882,mean dark triad bastards want cure forms kind telling want probably shady reason less easy control studies shown im point life id want go way,False
2883,identitarians insufferable ableist,False
2884,done trying contort fit shape others expectations fri feb pm pt learn unlock unconventional mind w neuroscientist author dr nicole tetreault live ghf experts,False
2885,want find autism spectrum gain better understanding autistic folks thread embrace diversity science life,False
2886,going using b canadian holiday february family day finally put end hiatus quick twitterbased hint case agents publishers twitter,False
2887,movement nature less prone dogpiling cultic dishonesty people claim visible selfown,False
2888,could excited interview shabnam anam next saturday february pm talk amazing education career decolonising curriculum join us,False
2889,top thread eye opening yet familiar,False
2890,autism let tell lot trained teachers got clue,False
2891,companies experienced surprising array benefits programs straightforward firms become successful finding hiring good even great talent toughtofill skills categories,False
2892,find apply official member let know exist organisation many people complain though,False
2893,supporting human rights autistic people,False
2894,wonder ever pay reparations movement particularly asan something one suggested,False
2895,autism police part movement murder hornet division fit structure noone tells anything,False
2896,strengthen cybersecurity defense,False
2897,rejecting old approach deficitsbased assessment system focusing positives help funnel investments effective initiatives,False
2898,check masterclass series,False
2899,accepted associate trainer position today catch training education next month,False
2900,company centres excellence ncoes u theres one toronto,False
2901,placing utmost importance compliance nothing encourage divergent thinking among students hirt,False
2902,cannot continue say educators parents country appreciate differences perpetuate sameness core educational values hirt,False
2903,students interested museum spaces may worth listen,False
2904,shout olsen house school registering take part celebration schools taking part worldwide takes kinds different minds,False
2905,open letter today vc challenges colleagues start conversations around disability listen lived experience implement best practice recommendations,False
2906,feels weird consider autism rad see everyone nowadays celebrating gives strange feeling though glad people happy identities,False
2907,culture fit vis vis vis vis affinity bias question though many founders understood three terms properly emphasis first five year growth plans startup ecosystem sessions,False
2908,affinity bias shadowing hiring decisions time remember hearing two founders clarifying look hiring n gender referring boys hired first ten employees hv worked previous teams,False
2909,thread treated pathology even nothing negative linked associated behaviors difference deviancy would zhuangzi say take look phil students,False
2910,dyslexia smth linked actually,False
2911,dyslexia highly heritable condition,False
2912,celebrate differences make us unique become strengths,False
2913,help make justice system fairer autistic people want hear autistic people needs change including courts prisons probation make voice heard,False
2914,campaign podcast weeks show campaigns creativity culture editor expands cover feature among agency creatives,False
2915,public education purposely normative e kids defy norms definition,False
2916,dyslexia assessments provide assessments legal education employment purposes provide assessments zoom facetoface psychologists experience related conditions,False
2917,know know fiercely private comes kids navigating son needs kindergartner pandemic tough looking connect parents,False
2918,really lovely little thread challenges vs support friends regarding phd whilst managing stories like warm heart,False
2919,autistic people much movement even existed continue need listening voices amping,False
2920,great meet speak today mentioned developers behind really interesting games exploring topics like human mind feel sure least conversation work,False
2921,organization paying enough attention action words,False
2922,different planet arts carousel sky amaze,False
2923,,False
2924,saw bot post reddit basically like dont talk movement harmful confused movement theres harmful,False
2925,collection books range topics including race ethnicity sexual orientation gender disability see whats collection,False
2926,download epub radical guide women adhd embrace live boldy break barriers,False
2927,capitalist work ethic narratives demand consistency predictability lot discourse rails agree also want achieve goals best progress without ableistly harming,False
2928,joining us webinar thinking differently work diversein lexxic register,False
2929,accurate experience wish aspects taught school think would improve understanding neurotypical people weird things,False
2930,theyd employ accessibility corespondent paper instead letting culture critics pretend know stuff,False
2931,asking demands movement actually inform professional practice insightful analysis excellent thoughts,False
2932,mind eye let try describe aphantasia neurological condition leaves people unable visualise thoughts,False
2933,celebrating uwo grad operates autism respite care center appleton uw oshkosh today,False
2934,shout st francis assisi catholic primary school registering take part celebration schools taking part worldwide takes kinds different minds,False
2935,j li neurotribes legacy autism future english edition,False
2936,day half term updating training library putting covid friendly set ups updating handouts resources work website make difference people hidden disabilities,False
2937,human microbiome webinar could major impact child adhd studies reported gut bacteria may effect mental health date time thu february,False
2938,really helpful heartfelt thread currently working part thinktank help employers understand get everyone teams via increased understanding difference positive contributions welcome,False
2939,understanding trauma experiences also critical secure stairs trauma informed model integrated care rolled across secure estate aim holistic formulation considers attachment trauma etc together,False
2940,day universe socially acceptable open war relentless assault lets end cant many different less c c dnrs,False
2941,shout olsen house school registering take part celebration schools taking part worldwide takes kinds different minds,False
2942,suggestions,False
2943,good thread ive heard many times people know creeped one behaviours like important understand someone might important,False
2944,apprenticeship recognising intrapreneurship,False
2945,legend james r laidler getting incredible hulk symptom vaccines vaers one greatest trolling events,False
2946,havent already go check new profiler children aged years find childs unique pattern strengths challenges,False
2947,people autism asperger dyslexia adhd bring massive value workplace,False
2948,shout willow bank junior school berkshire registering take part celebration schools taking part worldwide takes kinds different minds,False
2949,shout willow bank junior school berkshire registering take part celebration schools taking part worldwide takes kinds different minds,False
2950,come hear presentation well speakers swinburne deakin rmit come learn starting journey,False
2951,piece shit film set movement back years fact got golden globe nominations shows voices still ignored,False
2952,tips part,False
2953,great reactions parents since launching profiler parents last fabulous resource amazing lovely comments,False
2954,learn significant impact ey centers excellence ncoe ey business excluding individuals agenda missed opportunity many organizations,False
2955,ecology thought rethinking foundations mental disorder via psychology today,False
2956,strengthen cybersecurity defense likely,False
2957,strengthen cybersecurity defense,False
2958,feeling remember forgot put necklace day,False
2959,shout st francis assisi catholic primary school registering take part celebration schools taking part worldwide takes kinds different minds,False
2960,manifestation exists humanity beautiful diversity hopefully meaning made sense considered commenting separately wanted keep original thread accessible bc really important,False
2961,selfexpression communication appear many forms type communication partner question arose today conversing highly accredited autism guru,False
2962,riverrhees emanagement tips february tips reflections realising potential keeping honest supporting,False
2963,miranda foster nomination amazing work creating network created training staff changed way recruit amongst many awesome achievement,False
2964,advice addiction diabetes copd metal health weight management download nhs ayrshire arran app apple android,False
2965,something run time time ufyh made disability mental illnessfriendly every challenge tweet may possible everyone may physically demanding pose executive function challenges etc,False
2966,looking level learner support check free support learners handbook practical tips like ones,False
2967,aware sign,False
2968,need understand us care disabled due physical body im black brown dont see race relevant whatever said except disability rights bring misunderstood hurts people,False
2969,hi steve youre absolutely right dyslexia goes handinhand creative thinking texthelp bit make schools workplaces inclusive ensuring supported stigmatised thanks share ln,False
2970,big question schools get understand nurture show real career options,False
2971,without wouldnt gchq mix minds missioncritical deputy director al explains gives advantage documentary,False
2972,download free radical guide women adhd embrace live boldy break barriers,False
2973,every single one us something offer months story lets work documentary follows young people id dd community navigate work world,False
2974,shout respectful schools support team tasmania registering take part celebration team works schools build inclusive school communities support teachers meet diverse learning needs students,False
2975,autish wants millionaire video game youtube youtube link bio,False
2976,autism ailment part enemies anxiety depression operating system brain,False
2977,twitter see replies difficult resist tipping see replies almost impossible resist tipping see replies rush say whatever shit springs mind order,False
2978,movement,False
2979,best start phonics dont get stuck dyslexic student knows letter sounds important introduce tools well phonics beyond dyslexia,False
2980,launching soon,False
2981,u workplaces benefit via,False
2982,truth please aware celebrate,False
2983,something suspected looking right im asking lots related traits,False
2984,twitter friends please share would help function well work autistic employee thank advance,False
2985,advice wider community add around discovering early teenager acceptance meds,False
2986,im angry standpoint misinformation damaging thoughtless sets many back kids work life partner friends tie hurts soul,False
2987,discussing within business,False
2988,someone multiple diagnoses go identity cant really differentiate whether characteristic either asd p ld etc python,False
2989,shout embrace difference australia registering take part celebration takes kinds different minds,False
2990,spot seemingly mass narrative something children false demeaning outright disgraceful something infact empower people communities richer life experience,False
2991,shout university leeds registering take part celebration universities taking part worldwide takes kinds different minds,False
2992,thanks drew anderson covering autism work program morning winwin individuals autism companies employ,False
2993,utter myth equality supporters generally dont care autistic people think gives us answer eh feel free copy paste discussion hatemongers try allege dont care yes,False
2994,enjoy,False
2995,thats feel general autistic community moving support idea id recommend looking society disables autism empowers regardless us autistic people identify though music dangerous us,False
2996,good insights eys global technology consulting leader dan higgins importance improving talent tech biz,False
2997,didnt realise many british based colloquialisms effect people misread mean vice versa miss face face interaction text adds minefield misinterpretation different spellings context text form anxious self like,False
2998,insult female colleagues meet disclosure blatant sexism people get social constructs sexism symptom root cause sexism,False
2999,happy family day,False
3000,allistic yes means specifically notautistic encompasses types brain including sociallydeemedonlyacceptable neurotypical neurotypes include autism adhd schizophrenia tbi bipolar etc,False
3001,found looked seeing adhd makes curious diagnosed third grade mom didnt believe medicating children,False
3002,concerned way respond example colleagues need address glossing sexism way half hearted acknowledgment way address either issue,False
3003,mark calendars middle grade magic virtual event looking forward speaking panel mental health register,False
3004,sit pretzel twist positions time remember seeing thread autistic people sit differently whoever giving grief sit needs read,False
3005,isnt disability different ability often advantages muggle brains,False
3006,new stem curriculum launch nasas network,False
3007,embracing differences workplace,False
3008,work neuk collective member robyn benson link structures,False
3009,thank hope parents get always goal writing autism,False
3010,comes diversity thought competitive advantage companies spoke w real impact centers excellence colleagues business,False
3011,work neuk collective member max alexander achievements jelly achievements molds,False
3012,many issues sia movie music covers many word count allows,False
3013,aye good hear find insulting times people say oh everyone feels like form disability nd gets slapped credible,False
3014,registration open lets join across globe spread autism awareness please adhere covid safety requirements together part make difference,False
3015,shout university leeds registering take part celebration universities taking part worldwide takes kinds different minds,False
3016,shout saint alberts primary school glasgow registering take part celebration schools taking part takes kinds different minds,False
3017,world opportunity autistry students excited part dr lynn cominskys nasa network,False
3018,hiring spring looking experience field disability services autism consider applying pathfinders assistant bridgevalley see flyer details email spencerpolingbridgevalleyedu apply,False
3019,embracing future talent management podcast,False
3020,yeah bf mum worked disabled kids years told adhd like shock atypical case badly trained,False
3021,lets get k interested leftist politics philosophy youre real treat havent watched yet,False
3022,online workshops environmental activism identity masterclasses break packages,False
3023,check seminar wednesday february pm ct broader autism phenotype constellationsdisability matrix paradigm register,False
3024,happy family day stay safe,False
3025,maybe often called spectrum id honestly thought people sit somewhere along bandwidth entirely neurotypical much know im nt lot responses social mores norms im diagnosed anything,False
3026,people speak autism nt world need correction around use appropriate language current triggering words describing autistic children problem impairment,False
3027,autism behind worlds leading technologies recognise celebrate strengths adults autism spectrum often exhibit superior performance check latest video,False
3028,join learning cic thursday,False
3029,four clippings today,False
3030,join friday pm pt free must preregister talk representation sensory differences connection media,False
3031,mean really hard grasp dark triad traits actually result contrary arrogance egotism accept theyd able spot actual person dark triad traits theyve groomed see dark triad,False
3032,leftist politics via,False
3033,know exactly youre talking since something experience often discourse ive learned always havent effectively clearly communicated exactly mean often fact,False
3034,wowed amanda later amelia baggs video language communication intelligence interaction environment takes person world ht,False
3035,free iep livelearnlunch webinars autism plus date topic recruiting supporting employees hints tips employers advisers,False
3036,rationalist crowd actually holding ill call boutique miscellaneous progressive issues e g animal rights euthanasia psychedelic drug legalization running themes germinated left behind,False
3037,think might subject qualify neuroatypical,False
3038,example oppression disabled people endure,False
3039,shout lumineer academy melbourne australia registering take part celebration schools taking part around takes kinds different minds,False
3040,hi wanted apologised sounded rude last replies regarding hydrocephalus trying invalidate experiences views may seemed way wording sorry,False
3041,wow almost half way goal followers,False
3042,great article misunderstood subject,False
3043,relief mr adhd anxiety mr almost autism conversations mental health self care feelings daily thing household boys lucky living age appreciation,False
3044,peoples brains wired differently doesnt mean differences necessarily abnormal read,False
3045,please visit subscribe unique dyslexic eye show page,False
3046,please visit subscribe unique dyslexic eye show page,False
3047,please visit subscribe unique dyslexic eye show page,False
3048,please visit subscribe unique dyslexic eye show page,False
3049,please visit subscribe unique dyslexic eye show page,False
3050,please visit subscribe unique dyslexic eye show page,False
3051,please join us tomorrow pm instagram free one hour instagram live event,False
3052,shout embrace difference australia registering take part celebration takes kinds different minds,False
3053,yes would great followup find evie finds something hbr others articles workplace could good find orgs embrace,False
3054,nothing next nothing difference diversity everything come cpd learning since completing training,False
3055,also chris whitty said mental health counts one underlying conditions within mil nd sprint vaccines schizophrenia bipolar spectrum disorders nobody told spectrum lifelong mental health issue,False
3056,looking back earliest posts day talking passport privilege etc caused lot polite backlash back also really wanted highlight seems arent many nd travel bloggers haha,False
3057,luckily told handled discussed happens kids dont language sense wrong less likely tell someone education needs catch,False
3058,online part art tech society convening part maker festival premiere gathering activists diverse global movements fighting humane digital world decentralization creativeai open source web,False
3059,whew done reading critiques movement anyone others please share brain goes digestion mode day two thoughts gather ideas start gel really shit complicated,False
3060,lead new toolkit schools tiredness pain dislocations sprains stomach spasms bowel bladder reflux sensory issues skin differences bruises rashes anxiety dizziness brain fog allergies eyes ears teeth issues,False
3061,youre person one one proud among us writes unfavorable things movement nothing new unusual everyone criticizes,False
3062,hey im trying active retweeting im advocate im autistic adhd ocd dpd avpd im trying learn rally make sense self conscious,False
3063,seeking alternative pathways fill skill gaps within workforce help disrupting traditional recruitment process tap talent pool,False
3064,maybe im kind gatekeepy forming parasocial relationships describe influencers going help function way medication therapy,False
3065,really fantastic conversation tonight hit favorite topics incl relationship w creativity genius high ability philosophy socrates like writing shit og luddite preventing burnout thx,False
3066,dyslexic doesnt mean slow learner teaching children dyslexia though low iq backfires every time essentials teaching dyslexic child read,False
3067,another reason hire someone autism spectrum compared neurotypicals higher fluid intelligence due stronger visual thinking,False
3068,definitely view always high im wondering perception based social stigma start smoking weed nts smoke start always try categorize nd experience weed nt terms nds see,False
3069,partnered launch hiring pilot taking time support candidates recruitment onboarding process,False
3070,look like across races openlearn open university,False
3071,day eccentricity positive attribute rest well friends,False
3072,thx sharing man talking brings much needed empathy world makes us feel less crazy connected,False
3073,therapists knew anything autism adults,False
3074,notable episode diversity glossed sort laughed people use fidgeting ie phone appropriate fidget strategy paying attention even seem like,False
3075,working next post march hint guess number gets upgrade python,False
3076,autistic person seem almost eerily calm im anxious please rt,False
3077,enriches us,False
3078,neurodivergence provoking new mind sight via,False
3079,great article myth autistic people arent empathetic everyone else doesnt care,False
3080,read agents mocking people done wrong way people usually think person rude sometimes see mental illness thing said group mock events make afraid try,False
3081,guess five days since ive gotten twitter argument proponent hope hold lot longer people bring worst,False
3082,us multiple hats professors researchers physicians literally get hrs interviews peter daughter w autism attuned mental health guessing hes tired accused speaking profit,False
3083,good article sure incur wrath proponents,False
3084,created resource library sign free includes resources useful tips memes workplace,False
3085,first page winter institute coverage excited supporting education,False
3086,couldnt agree hope industries workplaces embrace,False
3087,looking support employees business tips help ensure employee success post also includes information resource workplace,False
3088,awkward moment meltdown nd mom starts recording sits puts choke hold,False
3089,wonder many studies done females autism,False
3090,join us live workshop professionals using support autistic children families newcastle new south wales,False
3091,normalizing supporting adapting,False
3092,claiming think trendy ignoring like families deal real disorder put ego aside minutes cognitive distortions feed radicalism,False
3093,folks time get silly come join us might still surprises left hand,False
3094,great see bay areas studios consulting nasas new network,False
3095,create programming businesses organizations address social emotional issues within space,False
3096,module threats exploits minute module agents introduced risk threats individuals businesses face threats managed,False
3097,stay safe,False
3098,young woman spectrum sheds light mindset behind antiparent cyberbullying,False
3099,stop trying speak us different experiences environments affects certain way doesnt mean itll affect everyone way different neurotypicals holy shit listen us stop ignoring ableism,False
3100,pdf download radical guide women adhd embrace live boldly break barriers,False
3101,like study morning others prefer afternoon evening homeschooling provides luxury individual differences individual scheduling home school freedom,False
3102,breaks never reward privilege especially child adhd scheduled daily routine young children never contingent behaviour,False
3103,hey found really awesome etsy listing,False
3104,get free radical guide women adhd embrace live boldly break barriers,False
3105,march brill lava elastic show also got fabulous megafunny poetry ace,False
3106,psychologists carry learning disability assessments children adults right support education call us,False
3107,ecology thought,False
3108,neurotribes legacy autism future neurotribes legacy autism future price reviews ratings,False
3109,eds chronic illness rather,False
3110,neurotribes legacy autism future neurotribes legacy autism future price reviews ratings,False
3111,dyslexia assessments provide assessments legal education employment purposes provide assessments zoom facetoface psychologists experience related conditions,False
3112,society people educated mental illnesses,False
3113,hello im single coparent boys tweet lot tabletop roleplaying parenting shouting leftwing politics,False
3114,conveniently unable speak hear juvenile bullies spoken miserable power hungry exclusionary parents handy,False
3115,experienced early consistent judgement whole family sounds traumatic experience empathic linked things people want address history wrt mental health,False
3116,wow im like things race etc,False
