,tokenized_text,is_after_split_date
1426,superpower bit like weapon got double edge would hate becomes trendy challenges well strengths needs recognised well,False
1427,im smiling month much store many know im proud dyslexic dyslexia one many gifts wish someone told teenager im glad see dyslexia helps shine brighter,False
1428,weve last minute cancellation theres one place left online aware training ocn level course feb ceo quick book place,False
1429,important leaders understand,False
1430,embracing differences workplace,False
1431,suggest state parents autistic children families includes neurotypes dyspraxic parents dyslexic children might think aimed part species,False
1432,great see positive content adland thank autistics tech know,False
1433,would company ignore population also customers large buying power embracing drives new ideas wellbeing go hand hand help productivity staff retention,False
1434,great minds think alike tap talent pool embracing adhd dyslexia gives adland creative edge delighted excited alongside great minds adland,False
1435,wonderful feature really dives creative sectors often though people hidden away stem many flourish buck stereotype creative industries,False
1436,wonder mental illness considered,False
1437,hello hi tapping new interest black women girls specifically yall book documentary social media recommendations would greatly appreciate,False
1438,following search link popped promoted tweet four seasons total landscaping minute realized ad like theyre wow okay,False
1439,know sign,False
1440,published article month ago interest argentina singapore encourage old schools participate,False
1441,shout bradford youth service registering take part celebration takes al kinds different minds,False
1442,autism kids capable awesome,False
1443,new study revealed mutations distant chromosomal regions increase likelihood diagnosed autism,False
1444,fun fact time word pops book mention title steve silbermans book,False
1445,sounds interesting ask measurable outcome easy companies institutions send representatives events say value attended like awareness days catalyze change,False
1446,uptimize presented future de conference got amazing feedback missed uptimize hosting another virtual event end feb member community stay tuned,False
1447,would speak autistic adult strategy passion looking ways connect people knowledgeable definitely right person haha,False
1448,check new profiler parents well done team,False
1449,believe concept believe human beings lives meaning treated support people movement genuinely helpful lens write im pushing,False
1450,embracing differences workplace speaks,False
1451,really zealot desperately trying push something id probably mention word bit often know,False
1452,mental illness,False
1453,touched topic part recent talk gave diversity surgery surprised pleasantly number attendees contacted afterwards say thank raising awareness acceptance essential first step think,False
1454,hopefully least moral victory moral otherwise,False
1455,raindow infinite sign autism symbol nerudivergent symbol guess pop neurodivergence,False
1456,want learn works creativity read piece atticus award,False
1457,great see spotlight put programmes employ autism internship scheme helped secure role diversity inclusion team,False
1458,providing authentic relevant appropriate work within abilitybased classes core practice flexschool allowing students opportunities demonstrate understanding traditional concepts ways make sense,False
1459,medical trauma millennial phone hating come together make calling arrange medical care top tier hated task im sure medical receptionists mostly nice people gods short interaction make sweat,False
1460,excited,False
1461,embracing differences workplace,False
1462,registration open new masterclass series run conjunction ucd project first session feb prof simon baroncohen registration info,False
1463,brings good adhd fast feet find classes,False
1464,workplace new q w kelly grier ey,False
1465,question dycp applications youre mentioning focusing go youre still awaiting diagnosis e less chance securing funding think asking friend genuinely,False
1466,ethrworld embracing differences workplace,False
1467,shout island free school isle wight registering take part celebration takes al kinds different minds,False
1468,today homework got much research,False
1469,delivering webinars free nasens annual webinar pass including title introduction arent pass holder already sign today,False
1470,neurodiversityaffirming therapists im fb group ndaffirming mental health practitioners might referrals youd like check geographic area,False
1471,yes autism coexisting traits ocd adhd intellectual disability selective mutism nevertheless different less different yet still beautiful unique,False
1472,module semester one essays media popular culture im keen,False
1473,theres autism joke goes youve met one person autism youve met one person autism commend talked piece wish confidence speak autism maybe willhttps tcovjvbptcuao,False
1474,id also like connect others im south east asian born living germany felt like german discourse serious enough im sticking english resources trying learn people different backgrounds starting,False
1475,huge evidence base justifying need move away move,False
1476,im completing good supervisor training pleased amongst research students highlighted specifically supervisors empathetic nurturing support styles thank helen brooks,False
1477,would like introduce new community ambassador chelle,False
1478,else needs little inspiration monday whats helping jump,False
1479,excellent read,False
1480,shout sudbourne primary school lambeth registering take part celebration takes al kinds different minds,False
1481,join dr punit shah next march pm,False
1482,workplace rapidly advancing,False
1483,join us wednesday february explain role executive functions operate lives particularly related hoarding behaviours chronic disorganisation extreme clutter click find,False
1484,confusion gaslighting taken advantage please rt,False
1485,add little gem list things helpful say employees tell theyre autistic never would known struggling um yeah thats im masking ass,False
1486,happy monday everyone take break check excited share,False
1487,definitely thats problem lies long people see either fully positive fully negative wont able discussion fully encompasses nds affect lives also reservations parents talking,False
1488,embracing differences workplace reuters training pool,False
1489,next teammate kristin cerutti speaking summit discuss way shared spaces designed meet needs across spectrum register join,False
1490,vindicating read always good know people know autistic people empathic everyone else psychology today,False
1491,hollywood says autistics bad romance plan prove wrong todays show think become awkward pm est,False
1492,something thats often early sign someone made abelist comment pretty standard,False
1493,nursing school part ii lab clinical,False
1494,son drops truth bomb used think people interesting realized talk coffee weather son autism ld freaking awesome,False
1495,exactly movie autism made without autistic people going truthful autism nonautistic parents may know kids best autistic people know autism best anyone reporting sias movie without autistic insights failing,False
1496,thought actually includes neurotypical people someone posted recently actually neurotypical together make,False
1497,anyone see new app parents yet childrens profiler parents doit,False
1498,thanks sharing examples gears turning see exactly abused im going read articles shared continue reflecting definitely see would reject,False
1499,term kinda covers idea differences peoples brains work normal rather deficits cover things like adhd autism,False
1500,friday bbc radio derby,False
1501,wuts,False
1502,familiar impact trauma please,False
1503,yeah find whole conversation meant imply disability frustrating havent seen anyone making claims like said im new examples nd activists saying,False
1504,ok thank willing discuss think would different claim autism symbol definitely think claiming isnt autism symbol erases tight historical links btwn arm cont,False
1505,thread fantastic job describing many aspects ocd disagree ocd value use theres theory ocd adhd ways opposite end spectrum humans collectively evolved advantage survival,False
1506,great thread learning,False
1507,doesnt make value generic symbol less movement expanded include neurodevelopmental disorders mental illness fall umbrella,False
1508,yknow autistic person ive always written final product drawn way actually helpful finally learn break never could,False
1509,way use rainbow infinity specifically represent autistic pride best symbol right im using puzzle pieces created autistic people movement born autism rights movement,False
1510,specifics team straight white dudes goal male female least match across skin colour every metric physical ability gender identity etc soon,False
1511,really enjoyed meeting prefects thanks asking awesome questions,False
1512,yes thanks steve great also another often overlooked misunderstood form diversity body christ,False
1513,sensory space learning affirms agency context community,False
1514,youre tweet excited puzzle pieces replaced infinity symbols autism specific platform stating arent able used represent autism broadly,False
1515,shout sudbourne primary school lambeth registering take part celebration takes al kinds different minds,False
1516,assume emotional state autistic person facial expression alone please rt,False
1517,included quickly count number dots two boxes matching emotions facial expressions trying use ai systems smart ways everyones advantage,False
1518,shout maple view school derby registering take part celebration takes al kinds different minds,False
1519,one atlas members talks experience autism spectrum disorder white lodge,False
1520,toolkit lgbtq youth adults autism intellectual disability community may face substantial challenges comes gender sexuality identity toolkit aims increase awareness sexual identity,False
1521,four employees neurological conditions stated believe employer could provide support whilst working home,False
1522,let us words deeds serve rule help force love harm task karl knig,False
1523,non university students,False
1524,movement people includes autistic people allowed use infinity symbol represent autism lot needs done autistic rights still,False
1525,every algorithm rigorously tested bias yet tests include matching emotions facial expressions okay sure stares,False
1526,one atlas members talks experience autism spectrum disorder,False
1527,read article agree matty think autism disability also saw another article included bipolar disorder imho neither autism bipolar normal brain functions nothing normal,False
1528,thrilled see feature great minds dont think alike today really depth piece including interviews people across industry including,False
1529,thats helpful information thank english word didnt exist created autistic person part autism rights movement weve disability rights much longer specific movement new,False
1530,yes rainbow infinity symbol autistic people use represent autism without using puzzle piece also used represent whole,False
1531,lot movement came autism rights movement,False
1532,beautiful part human diversity youre challenging find career works natural strengths work one coaches find career right,False
1533,side effects better diagnosed,False
1534,keep thinking coined term others making living writing researching shes struggling pension,False
1535,omg literally talking presentation teacher literally asked whats word mean,False
1536,watch webinar incredible dr jessica eccles need register free unique innovative could learn lot given common hereditary connective tissue disorders,False
1537,yesssssss mentees joined via leap year hiring program graphic basically conversational ice breaker,False
1538,also found another young asian author listed article,False
1539,latest tech social media daily thanks,False
1540,ill add though dont agree either dont believe antivaxxers censored im glad least twitter neutral nd debate far may change soon,False
1541,also censor people write anything unfavorable wont censor proponents,False
1542,talk complicated history vaccines autism,False
1543,may every bit crucial human race biodiversity life general becoming important people realise,False
1544,arts engagement children play significant role developing social emotional maturity cultivating empathy jonathan shmidt chapman,False
1545,none even considering lot people never question whether theyre neurotypical arent familiar actually much recognize actually based trauma muddies things,False
1546,go understand direct causes mental illhealth injury separate issue often gets much confused mental illness toxicity neglected issue mh see various injury means recovery,False
1547,shout nightingale community academy london registering take part celebration takes al kinds different minds,False
1548,really looking forward discussion tomorrow national adhd competencies developed establishing consistency adhd service provision across life span necessity,False
1549,interested tip iceberg offered mozfest sign mustattend virtual tech event year,False
1550,nga michael hales discusses agency pilot program recent podcast program collaboration increase opportunities individuals nga listen,False
1551,rise diversity inclusion movement society focused inclusion working towards higher level integration,False
1552,leaders look transform organizations talent significant impacts companies thank discussing unique talents individuals channeled productive ways,False
1553,concise relatable way seen dyspraxia described awesome,False
1554,preventable tragedies past loss regular social supports cultural neglect loss rewarding activities various w mh system contributor confusing mental illness low social cohesion,False
1555,born immediately invent cyberbullying dark energy social networking ddos knew good posting,False
1556,great presentation role,False
1557,going discuss relationship autistic person different experience neurotypical,False
1558,shout island free school isle wight registering take part celebration takes al kinds different minds,False
1559,autistic advocate author manager teacher painter etc ive quoted briefly upcoming book autism briefcase straight talk living world time connect please best,False
1560,mostly result mental illness however low empathy among neurotypical people often sign low intelligence yall wild numbers,False
1561,thats kind carol yr right money theres veritable feeding frenzy corporations institutions righteous thought something,False
1562,marillion sugar mice fleesh version art,False
1563,telstra launches hiring pilot,False
1564,many autistic people recover socializing please rt,False
1565,palilalia common kids,False
1566,neurodivergence provoking new mind sight via,False
1567,telstra become latest australian employer launch hiring program,False
1568,children diagnosed dr used clear language child never neurotypical covers people also think clear line neurotypical either nt,False
1569,havent seen much wild modules inclusive management content though general im finding resources lacking lots talk defining supporting,False
1570,like points made im going consider bit understanding terms came blog,False
1571,telstra recruitment program kicks today wish best luck participants involved hope program gives opportunity shine,False
1572,look refers variation human brain regarding sociability learning attention mood mental functions coined sociologist judy singer along w journalist harvey blume thx posting explaining,False
1573,nd thing thing,False
1574,online course individuals come get armed skills tools weapons become guardians learn,False
1575,help difficult decisions,False
1576,concept bullcrap science legal basis im fb censor words censored nds want anything opposing published,False
1577,youre antineurodiversity believe people w different types brains treated fairly w dignity youre antineurodiversity movement meaning cancelling anything group doesnt like fb doesnt know difference u use different words,False
1578,relased proposed directors board election process moment medicine,False
1579,special interests poverty education autism fun parties photography probably like looking,False
1580,suicide attempt diagnosed pddnos told til last year puts autism spectrum embraced partly knew group accepting friends working theatre group focused,False
1581,weve come long way affirming students identities variety ways still ways go especially comes diagnoses shouldnt dirty words things never directly addressed,False
1582,fabulous lend program seminar today focused doctoral candidate advocate patrick dwyer grateful willing share expertise trainees,False
1583,awesome trade show ideas virtual inperson,False
1584,find difficult person reason mesmerised noticed tag check videos much needed ppl,False
1585,call mentally challenged call incredibly motherfucking gifted tiny human brain cant conceive grasp explanations dont scare,False
1586,important know diagnoses get extremely impatient zoom cant pay attention ppl speaking min anxiety hack something hand dissipate nrg x focus anxious,False
1587,largely depends much like imoif talking many activists problem areif people want prove rather judgemental description bpd example biochemical thing questions,False
1588,autistic people know laughed please rt,False
1589,dyslexia commonly caused difficulty phonological processing,False
1590,mozfest space diverse minds,False
1591,reader chapter neuroqueering music therapy jessica leza idk shes,False
1592,shout seven fields primary school wiltshire registering take part celebration takes al kinds different minds,False
1593,first article year interviewed february issue great minds think alike honour able share voice bpd bipolar often left convo,False
1594,good awful features wonderful talking beautiful memoir loved recording w rebecca hope love listening ps preorder signed copy book,False
1595,new md pam groups tohealth business,False
1596,mornings podcast listen episode chatting things museums someone supported museums autism access work outside interesting hear like inside,False
1597,read full manifesto,False
1598,third key ask manifesto support families children young people need calling political parties,False
1599,one area need help parents navigate autistic world embrace movement,False
1600,delighted honoured playing small part important historical relationship business virtual trade mission india accessibility inclusivity one,False
1601,thank university college dublin trailblazer promoting awareness time shift needle inclusion benefit individuals society,False
1602,mentoring program help formulate progress towards employment goal weekly hour mentoring online support group online employment support course read,False
1603,shout hayfield school doncaster registering take part celebration takes al kinds different minds,False
1604,embracing differences workplace link,False
1605,one month go celebration still late register,False
1606,nick walkers explore creativity truly weaves developmental queer theory neuroqueering psychoanalytic bodyoriented psychology amazing call embrace creativity,False
1607,dated blog,False
1608,dated blog,False
1609,shout maple view school derby registering take part celebration takes al kinds different minds,False
1610,shout cedar road primary school northampton registering take part celebration takes al kinds different minds,False
1611,february newsletter read inclusive hiring select tech role intersectionality entretiens structurs,False
1612,talk design like relevant also wasnt almost midnight id walking store buy vitamins mildly successful last alternating hades runs work fun,False
1613,working hard raise awareness neurological conditions weeks focus tourettes syndrome information found instagram,False
1614,working hard raise awareness neurological conditions,False
1615,working hard raise awareness neurological conditions weeks focus tourettes syndrome,False
1616,anyone feel like one told wouldnt realized woods meant satirical,False
1617,great news chasing someone run webinar style session including company work possibly something suitable global well including disabilities also welcome,False
1618,workdays clear metrics output standards allows individual set schedule perform best much welcoming primary caretakers etc,False
1619,fellow adhders dentist recommended biotene mouthwash toothpaste side effects dex amazing highly recommend,False
1620,one seriously fucked teamed organization extremely hostile autistic community viewing within damaged goods requiring eradication rather also propagated use fatal control technique,False
1621,video basically explains whole life amazing please go watch especially people life,False
1622,prepare sensoryfriendly tourism stella waterhouse,False
1623,great interview ey leans,False
1624,one great mysteries judging whether contrary opinion due b leftist c small knee jerk toward idpol pc troll e everyone wrong,False
1625,latest guest blog post available interesting read covid vaccine roll goes full swing,False
1626,even beginner classes helpful many autistic people please rt,False
1627,gosh whole diagnoses personality disorders fraught interesting certainly relation considering impulse emotional regulation empathy spite many kinds empathy tied diagnoses personality disorders,False
1628,need find direction want support chart way towards career mentoring program help formulate progress towards employment goal,False
1629,find benefit supporting doit profiler help joining free tomorrow,False
1630,check benny shakes things podcast benny comic cerebral palsy friend djbespoke interviewed yesterday cohosting friday p youtube facebook,False
1631,shout nightingale community academy london registering take part celebration takes al kinds different minds,False
1632,proposal accepted space looking forward going one look soon,False
1633,lies behind scenes exploring benefits read latest blog post part one part two follow later,False
1634,word looking,False
1635,main man dan telling seed pod,False
1636,studies show michelangelo albert einstein either certainly almost certainly autistic could imagine someone saying michaelangelo put paintbrushes,False
1637,life ive told makes simple robbed lot motivation could contribute yet sit watching sheer tribal idiocy extroverts antivaxxers et al disagree opposite seems true,False
1638,thank congratulated first grading university overwhelmed reach first disability something interest forgot hide full name pic last post,False
1639,autism part like showing real autism best part devalue look nothing wrong,False
1640,anti made othering invented us designed stigmatise whoever disagrees long grow visible numbers many representations get shown biased bigoted self centred paranoid,False
1641,learning style descriptor accommodations person needs given spectrum every child unique needs even subclinical,False
1642,macildowie recruitment retention excited announce brand new event centred vital employee engagement topic businesses interested workplace,False
1643,todays lesson focusing phonics singing using tpr group task learning part manifesto every child gifted learn think differently,False
1644,allyship also means taking crosssectionality account celebrate ensuring simultaneously challenging stereotypes relating ethnicity age disability socioeconomic status protected characteristics,False
1645,cant avoid stress always improve ability manage,False
1646,miscategorise adhd mental illness rather physiological,False
1647,delighted announce tickets years free link get registering march pm pm see,False
1648,scotland technology industry asked help people jobs plug widening skills gap fastgrowing digital economy read geordies story pursuit career cyber security,False
1649,disgusting neurotypicals talking like kind disease really illustrates dont fucking understand us,False
1650,shout meadow park school liverpool registering take part celebration takes al kinds different minds,False
1651,embracing future talent management,False
1652,dyslexia assessments provide assessments legal education employment purposes provide assessments zoom facetoface psychologists experience related conditions,False
1653,sorry getting bit deep tl lunch think sometimes hard grasp looking everything level first treating symptoms often treating wrong,False
1654,,False
1655,theres myth hiring autistic talent result reduced productivity poorer business outcomes success staff autistic proof,False
1656,need inclusive disabilities asset management finance insurance includes excluded combatting taboo disability asset management investment,False
1657,im different proud magic ngoindia,False
1658,friendly schools postsecondary education,False
1659,holding tool information zoom webinar prospective mentees tuesday february pm learn register,False
1660,shout east sussex college group registering take part celebration takes al kinds different minds,False
1661,delighted partnered universities across uk training staff support students let work together boost nation workforce find,False
1662,allyship science,False
1663,mozfest space diverse minds,False
1664,camhs need funding specialists need merge specialties one person sees think diagnose whole child person thus freeing many appointments one stop shop much time effort wasted seeing one person times,False
1665,certainly first heard wikipedia pages outspoken advocates edited negatively deleted entirely really takes cake frankly disgusting,False
1666,reach show care support,False
1667,agreed counselling might helpful get final year highschool big bro recently diagnosed adhd gp recommending clinic specialises,False
1668,absolutely loved feature well done,False
1669,new md pam groups tohealth business,False
