,tokenized_text,is_after_split_date
3856,nfts holders get lifetime passive income seeme products exclusive discounts inclusive community minting june dont miss whitelisting,True
3857,nfts holders get lifetime passive income seeme products exclusive discounts inclusive community minting june dont miss whitelisting,True
3858,nfts holders get lifetime passive income seeme products exclusive discounts inclusive community minting june dont miss whitelisting,True
3859,nfts holders get lifetime passive income seeme products exclusive discounts inclusive community minting june dont miss whitelisting,True
3860,nfts holders get lifetime passive income seeme products exclusive discounts inclusive community minting june dont miss whitelisting,True
3861,nfts holders get lifetime passive income seeme products exclusive discounts inclusive community minting june dont miss whitelisting,True
3862,nfts holders get lifetime passive income seeme products exclusive discounts inclusive community minting june dont miss whitelisting,True
3863,nfts holders get lifetime passive income seeme products exclusive discounts inclusive community minting june dont miss whitelisting,True
3864,nfts holders get lifetime passive income seeme products exclusive discounts inclusive community minting june dont miss whitelisting,True
3865,social media full negative trolls always choose put people instead positive supportive,True
3866,nfts holders get lifetime passive income seeme products exclusive discounts inclusive community minting june dont miss whitelisting,True
3867,nfts holders get lifetime passive income seeme products exclusive discounts inclusive community minting june dont miss whitelisting,True
3868,nfts holders get lifetime passive income seeme products exclusive discounts inclusive community minting june dont miss whitelisting,True
3869,perhaps worrying springer book hardly backstreet printing operation springer wrote recently ask whether wed seen sign prejudice disability mmmm,True
3870,agree theres assumption lack reading means students dont care couldnt bothered case edi commitment recognise students chronic illnesses caring commitments disabilities paid work etc,True
3871,looks like really useful resource primary schools help children learn,True
3872,artxv genesis collection consists pieces unique art worlds leading artists dropping get feel nft might like visiting feature google arts culture,True
3873,join equality diversity inclusion sig meeting nd june pm chris picknett quality efficiency lead southern health nhs foundation trust discuss disability workplace register,True
3874,attended meeting learning schools project think potential make big difference staff pupils primary schools think coproduced nd people completely free use,True
3875,ignoring sad wish germany would adapt quicker new studies thingsthe awareness social structure medical institutions therapy shockingly bad,True
3876,oh sounds great looking google result though english would confirm worry country clue therapists know label many see adhd behavioral problem autism genetic disease,True
3877,latest dyslexia update thanks,True
3878,growing unstable environment world doesnt understand concept also family doesnt understand made feel like bad person kid recently everything made sense continues,True
3879,today went live gather universe available rewatch next two days get tickets,True
3880,gee introduced us idea relatively new term reflects full array human perceptions experiences umbrella term disabilities including adhd autism dyslexia dyscalculia learning disabilities tourette syndrome,True
3881,gee abraham presented perspectives expertise lgbtq identity information literature personal experiences community insight highlights captured learning,True
3882,student dyslexia learning phonics years growth reading strategies raised reading level grades months amazon review dyslexia tool kit expanded edition,True
3883,celebrating using immersion blender brain,True
3884,amazing day hull artists making processes systems language accessible range ways ideas experiences amazing relaxed open space share feedback criticism really put candour absolutely buzzing,True
3885,talking normalize academics humans real human struggles talk openly mental health live anxiety adhd hope others know alone talk safely,True
3886,happy send info via email message could include individual experiences inspirational stories section talk experience happy article written posted ahp student,True
3887,see hope stand e pictures incoming,True
3888,recommended read inclusion choosing kinder design check via,True
3889,please share research widely survey link,True
3890,impressive see mature considerate forward thinking idea years cohort congratulations young innovators showcasing,True
3891,learn navigate conflict difficult conversations affects relationship,True
3892,help saw training either linkedin gave nonneurodiverse immersive experience sadly note training anyone got suggestions,True
3893,let normalise neurodivergence celebrate dei encompasses everyone something talked enough healthcare particularly clinical trials proud part couch health,True
3894,know many people arent fascists think excuse tbh,True
3895,autism kids need little help little hope somebody believes,True
3896,im saying indicator either rather bit sore use decisive evidence especially lot seems come kind people would also denounce ableism celebrate etc,True
3897,categories may already cover environmental factors aces poverty discrimination power balances also trauma,True
3898,really excited invited take part panel discussion social work team please join us nd june discussing dyslexic n skills,True
3899,findings show currently many mental health services adequately support autistic people even cause additional harm new systemic study science,True
3900,sexuality survey put survey together person take part personal information name address email asked survey,True
3901,twitter hashtags,True
3902,cai solutions matthew found team enjoys working role grow hes sure hes made right decision joining learn matthews journey,True
3903,accident changed life twinkling eye rev shelley pick asks related brain injury communities faith know,True
3904,post surprises people true unschooling one excellent choice dyslexia,True
3905,tomorrows program get free tickets come join us today,True
3906,great project,True
3907,recent tics conference amazing packed value lived experience buzz feedback outstanding well done,True
3908,looking great brings value others helping please join download app start talking room,True
3909,looking great brings value others helping please join download app start talking room,True
3910,looking great brings value others helping please join download app start talking room,True
3911,thanks great review theres nothing better reviews happy readers,True
3912,reason unabashed archive,True
3913,embraced,True
3914,final day london comic con panel,True
3915,inclusion choosing kinder design,True
3916,remember autism contagious kindness,True
3917,places autism awareness training going fast passionate making services accessible celebrating want promote culture inclusivity understanding youth group miss,True
3918,read guide benefits workforce employers start approach hiring courtesy,True
3919,coke effectthis problem professional educators keep saying see would parents telling going home good day school,True
3920,relevant information tangible tools apply right course developed presented someone real experience interested giving school district something new relevant,True
3921,one babes speaking pride event next two days tickets free link check,True
3922,weekly seo podcasts coming way join chat first two episodes dyscalculia adhd maybe also cornettos cats next weeks guest,True
3923,people brain function differences like autism dyslexia bring unique strengths employers yet face multiple barriers hiring process unequal challenges workforce download navigating practical guide,True
3924,real gift able think different manner also takes lot courage admit people around limitation people often bring creativity box thinking,True
3925,gifted kids special ed kids end bell curve need make priority two gifted kids ive seen struggle school blessing curse,True
3926,think stressing relationship gender disability important point best luck,True
3927,children disabilities underrepresented medical research strategies facilitate best practices primary offices,True
3928,style book prefer let us know comments,True
3929,exciting delivering batch wands primary school see school enthusiastic helping children improve reading info contact us,True
3930,happens get engineers involved eggsperiments come along zone see takes crack egg stronger weaker hard boiled find sunday afternoon,True
3931,exciting delivering batch wands primary school see school enthusiastic helping children improve readingfor info contact us,True
3932,think yes mental illnesses effect brain falls least understand,True
3933,reading posts ahead tonights consultation sema proposed learning disability autism bill,True
3934,gm initiative space thru collabs supporting nonprofit studios artists disability selected participate marketplace launch creator first collab,True
3935,great news,True
3936,let talk good cultural fit really means,True
3937,excited announce new partnership together community partners bringing sensoryfriendly family concerts parry sound july read,True
3938,rt simplek embracing employees starting,True
3939,would love hear learning affirming approach think well called dld speech disorders,True
3940,said earlier fully believe need push acute awareness people w stigma needs broken need visible gonna snap,True
3941,r least relaxing thing world like makes physically cringe flavor,True
3942,im searching opportunities unpaid paid work mental health organizations must remote freelance work experience writing graphic design presentations social media content creation dm email,True
3943,team members push us challenge assumptions think outside box,True
3944,becomes sadday one exploited misfortune becomes tool instead adversary peple taking advantage neurodiversitysyndrome fit category,True
3945,hi wanted say totally okay defend neopronouns please link adhd become much prevalent neopronouns may seem like coronation please remember us,True
3946,support work checking merch shop new website working new designs available end,True
3947,children grow adults,True
3948,embracing employees starting,True
3949,nurturing children inclusive diverse lens exploring language concepts ableism disablism deficit approach general neurodiversityaffirming practice,True
3950,let anyone ever tell disability holds back local authority awful companies incredible go way support us,True
3951,proud team going burst excitement change real making real difference,True
3952,normalizing selfadvocates speaking breaking stigma via,True
3953,need honest conversations around grief real thank naming sometimes wonder fact norm built faulty system around impossibly narrow stamdards,True
3954,multigenre literary anthology like stories queer neuroqueer vibes definitely anthology writing stories selected based primarily literary merit tend reject anything overly didactic,True
3955,anthology writing learn submit,True
3956,mother child get really triggered reading questions consider intelligent people luttig speaking issues people country need educate speech impediments general,True
3957,first day hope dont find im neurotypical,True
3958,browse collections episodes like new episode ditching conventional methods organizing environment health wellbeing spirituality intuition,True
3959,happy share basically version task master genuinely loads fun albeit bit gimmicky feel lot hope got loads ideas,True
3960,research shows estimated autistic people u unemployed compared around general population latest newsletter discusses topic hiring explores means,True
3961,truly abhorrent draconian bill fear number suicides among children parents teachers cause absolutely room humanity let alone creativity heaven forbid tories always hated feared lefty teachers,True
3962,loved hearing dr katherine breward regarding remove barriers improve overall bschool program experience,True
3963,done little work preceptorship,True
3964,hate words meant specific situations get weaponized whatever someone doesnt like socmed ive told im privleged specifically autistic traits like thats privilege thats,True
3965,lot folks said already misunderstanding exactly presented became teacher early aughts received absolutely training anything related missed diagnosis looking back missed students,True
3966,mother child get really triggered reading questions consider intelligent people luttig speaking issues people country need educate speech impediments general,True
3967,back march time created delivered sessions within football coaches club asked deliver times changing love,True
3968,opposite condition aphantasia say suffer disability,True
3969,next ellie middleton advocate personal brand manager,True
3970,retailers must find new ways tap diverse talent pools order meet needs businesses building programs designed attract support workers great place start read,True
3971,think child crucial make sure see specialist sooner proper diagnosis sooner way treatment therapy child live fulfilling life,True
3972,different minds podcast series chats people walks life different ways brain work interpret information highlights people naturally think things differently,True
3973,thats horrible im inherently honest dont want make lie pressure makes difficult sell attacks particular chunk sell lie right circumstances format one,True
3974,flares air conditioning collectibles service,True
3975,everyone wants supportive comes showing single trait told overshare bullied sharing personal info online queer status think one blame excuse,True
3976,one many helpful affirming infographics autisticality facebook page,True
3977,starting soon pm youre west coast like pm et excited part amazing panel look forward talking researching intersectional perspective thank organizing,True
3978,autism kids capable,True
3979,morgen pride day dubbel pride,True
3980,surprise actually fourth speaker breaking silos enlighten us myths misconceptions involving autism make sure miss event claim spot,True
3981,look forward welcoming one charity patrons prof barry carpenter cbe june conference new paradigm liverpool uk,True
3982,think smaller push neurodiversitysupportive approach bit effective lovely autistic us folk though really great knowledgeable also loves nerd stuff,True
3983,work hybrid working lessons teams,True
3984,delighted welcome gian luca lisa ceo sfi health switzerland address delegates june conference new paradigm liverpool uk,True
3985,josh connolly outstanding,True
3986,fortunate work different locations day opportunity meet new people open discussing,True
3987,superpowers celebrating diversity oak tree,True
3988,believe long government free ill follow fierce supporter protect,True
3989,well intentioned poorly informed new excuse poor behaviour,True
3990,inappropriate judge individual focusing skill creature possess like fish specialized swim superbly ability climb tree impossible,True
3991,went long enough find pride day email text straight back bed,True
3992,dli ceo thing talking manu sakar global dialogue series important space,True
3993,organisations waking challenges facing neuro diverse employees well benefits broadening hiring pool employ talent,True
3994,tears anxiety despair never part reading please dont force student read aloud especially front others oral reading comes hard,True
3995,like say stuff embarrass compliment,True
3996,something different im selling performance rights play nft next,True
3997,something different im selling performance rights play nft next,True
3998,check past connection vortex summit coralie rousseau sari solden guest speaker bring awareness women add adhd tips tools approaches direction,True
3999,diagnosed kiddo assessed whole life makes sense emotionally cathartic realise much responsible challenges gifts life changing also medication incredibly helpful,True
4000,dialectical contradictions nature nothing everything almost never,True
4001,noticed looot people big yarn arts spectrum,True
4002,common ptsdinducing myth autistic behavior please rt,True
4003,meaning connection support growth community helps us thrive share support today help community thank,True
4004,relate kindergarten teacher ready levels damn near ran district,True
4005,excited see young people contributing conversation read directly article,True
4006,like willfull insistence communities social media past years forget trailblazers never denial fact disability,True
4007,innate human variation broken neurotypical deficit genetic mistake evolved simply human,True
4008,support tune via player choice,True
4009,divergence good divergence creative divergence leads new divergence tested change divergence survival mechanism divergence life divergence existence divergence forward facing narratives,True
4010,think probably rephrase dont think theyre thing per se theyre interrelated manifestations one singular thing bleed spectrum clear boundary line rather binarily separated types,True
4011,works winner dbjs inaugural diversity equity inclusion awards,True
4012,zero need autism therapy autistic people may need specific therapies specific needs like neurotypical people need people understand paradigm respect autistic autonomy,True
4013,dude write batverse cool often think im cool realised know lot lot yay adhd useless lot least interesting useful,True
4014,conditional even still everyone still thinks good bad everything,True
4015,didnt know today wish id worn pride earrings,True
4016,thank girl informing pride day elebrating accordingly forgot fill meds worlds biggest coffee hoping thing mg slow release dexamphetamine,True
4017,ackshually imho people aspergers like often better able support free speech principled way neurotypical normies like guy,True
4018,studying music better reading outcomes cool new research last years summarize research music dyslexia,True
4019,alphabet war ask exist many children books validate experiences children disabilities reading lists people looking better understand living ld,True
4020,wonderful result agm motion recognising supporting nd social workers unanimously passed fantastic step forward changing culture profession celebrating skills,True
4021,autism class teacher would hope aware cass interim report findings approximately one third children young people referred gids autism types,True
4022,always looking suggestions books add ar particularly ones help us increase representation underrepresented themes like lgbtq racism disability tell us suggestions,True
4023,london today come meet host sendcast dale stand c great podcasts come see us find,True
4024,garden nicely plants fungi reptile birds small mammals molluscs arthropods insects individuals e sparrow biodiverse part biodiversity society individual people part wider human,True
4025,new erasmus project working develop awareness support work website development provide details later summer,True
4026,oooh well stand science explaining humans fantastic general science psychology books award winning brilliant storyteller medicine history mortal,True
4027,dont miss days go gain expo rd june via zoom register today,True
4028,day cafe meet share thoughts way society organises impact marginalised communities,True
4029,voice people didnt one mercyhursts autism center named brad mcgarry,True
4030,lgbtia atypicals happening tomorrow group anyone formal self diagnosis autism aspergers ad h provides confidential safe space lgbtia people autism spectrum pm pm caledonian rd london n dn,True
4031,andover surrounding area peeps,True
4032,thanks much sophie well definitely looking ras significant experience autism affirming approach make sure participants properly supported years longitudinal qualitative research,True
4033,proud group business development manager daniel pidcock sharing experience living inspire others including giving fantastic talk recently read,True
4034,worry gate keeping systems place none come across friendly,True
4035,would greatly appreciate could follow instagram account versity answer couple questions pertaining neurodiveristy higher education google form ig page link,True
4036,hey guys group year students taylors university trying raise social awareness higher educational institutes move project,True
4037,later today ill meeting network reflect annual conference brighton table hotel lobby one refuge places patternseeking brain whenever needed recover noise overload,True
4038,viewing secondary schools moment eldest gender neutral loos yay support groups yay pride flags yay diverse teaching global majority teaching yay hearing impaired units oh,True
4039,free leaders work page report organisations share practical steps taking develop workplaces minds flourish click login register free view,True
4040,international aspergers inside supportive practical guide anyone aspergers syndrome neurotribes legacy autism future,True
4041,also hesitant blast minister arrogant partly trying think best people partly learning autistic child know often aloofness rudeness comes nerves hope minvets,True
4042,great exhibition road festival happening south kensington june offering full programme free events arts science families enjoy also zone range exciting activities offer,True
4043,making teammates feel safe,True
4044,neurodivergence provoking new mind sight via,True
4045,four hours talk go live gather universe get tickets,True
4046,two hours talk go live gather universe get tickets,True
4047,buildings design mind,True
4048,know employees protected equality act workplaces legal duty put place reasonable adjustments find nd law friendly event weds june zoom,True
4049,ready,True
4050,courageous leadership spectrum autism faith gifts grand canyon synod courtesy rick kirkham home tutor oahu specializing adhd adhd subscribe following twitter,True
4051,pleasant surprise interesting speaker event breaking silos organises june freelance copywriter advocate talk myths misco,True
4052,context deal world start games gavin ferreiro multiple times questioned games played nt practical goals much,True
4053,get involved sharing story,True
4054,think know mean words autistic autistic friend told returning office found one autistic staff tears one wellknown nd advocate berated vociferously muddling divergent,True
4055,whoopi goldberg wellknown actor comedian along way developed tricks work around dyslexia someone read script dictating instead writing books,True
4056,thank wonderful fundraisers everybody donated addvance families support incredibly grateful,True
4057,voices simon preston man speaks following death year old daughter advocate workplace trigger warning,True
4058,coming kickoff free tickets available,True
4059,looking forward welcoming corporate sponsors charity patrons conference delegates umbrella ball sponsored heathrow airport thanks young see red carpet pm june much deserved celebration,True
4060,covers many varying levels people gender spectrums caring struggle fathom load carerautistic people,True
4061,live london youre condition email us yesgeniuswithinorg find help,True
4062,come many different forms reasons use centerbased model care,True
4063,fantastic news thanks sharing celebrating pride day,True
4064,day concentration improved slight increase productivity work feeling hopeful,True
4065,another great educational session around,True
4066,love book please dont hidden hidden neurodivergence cant use terms interchangeably specific meaning hate marketing departments publishers terms,True
4067,hiding dyslexia behind happy smile early diagnosis dyslexia essential,True
4068,personally behalf group autism insurance investment colleagues thank sir robert,True
4069,happy share link new digital course youth ministry,True
4070,evening talk go live gather universe info get free tickets go,True
4071,bco latest research report designing examines ways office space disable enable individuals setting forth set principles better office designs,True
4072,summer webinar review accessibility arts robert marsden reviews recent webinar chaired director michelle payne,True
4073,saturday celebrating pride day video evan ben talk experience autistic students,True
4074,us fully accept embrace wishing best day ahead,True
4075,us fully accept embrace wishing best day ahead,True
4076,nfts holders get lifetime passive income seeme products exclusive discounts inclusive community minting june dont miss whitelisting,True
4077,nfts holders get lifetime passive income seeme products exclusive discounts inclusive community minting june dont miss whitelisting,True
4078,nfts holders get lifetime passive income seeme products exclusive discounts inclusive community minting june dont miss whitelisting,True
4079,nfts holders get lifetime passive income seeme products exclusive discounts inclusive community minting june dont miss whitelisting,True
4080,nfts holders get lifetime passive income seeme products exclusive discounts inclusive community minting june dont miss whitelisting,True
4081,nfts holders get lifetime passive income seeme products exclusive discounts inclusive community minting june dont miss whitelisting,True
4082,nfts holders get lifetime passive income seeme products exclusive discounts inclusive community minting june dont miss whitelisting,True
4083,nfts holders get lifetime passive income seeme products exclusive discounts inclusive community minting june dont miss whitelisting,True
4084,nfts holders get lifetime passive income seeme products exclusive discounts inclusive community minting june dont miss whitelisting,True
4085,nfts holders get lifetime passive income seeme products exclusive discounts inclusive community minting june dont miss whitelisting,True
