,tokenized_text,is_after_split_date
1932,wish could come amazing informative threads like coming terms still put lot words daunting,True
1933,gifts metamap,True
1934,big splash dolphin design celebrates,True
1935,understand could frightened somebody meltdown film case attacked extremely unlikely get maybe ptsd posting meltdown thats illegal shows big lack empath side,True
1936,great point often invisible little effort made help kid adhd autistic diagnosed child college wanted official docs accommodation drs appointment took months referral psych another dropped,True
1937,massive congratulations super leans team amazing free whole class curriculum teach yearolds,True
1938,leans free curriculum introduce pupils aged concept help explore impacts school experiences teacherdelivered resource whole class fantastic resource schools adopt,True
1939,another brilliant tonight focus education huge thank amazing young people youth workers facilitators great hear send project lead lesley rudge gmyca members,True
1940,often someone giving hard time hard time,True
1941,yes think fascinating subject,True
1942,sidenote movement separate disability attempting improve lives one tiny portion disabled community leaving everyone else behind leaving systems oppression tact,True
1943,people brain function differences like autism dyslexia bring unique strengths employers yet face multiple barriers hiring process unequal challenges workforce download navigating practical guide,True
1944,retailers must find new ways tap diverse talent pools order meet needs businesses building programs designed attract support workers great place start read,True
1945,wed love meet,True
1946,common two conditions,True
1947,work intersection nothing short incredible,True
1948,best part partner also mutual patience understanding,True
1949,summary unmasking autism discovering new faces laziness exist devon price disability visibility firstperson stories twentyfirst century alice wong care work dreaming disability justice leah lakshmi piepznasamarasinha,True
1950,fantastic resource teach children promote ni schools,True
1951,know im freak nature im like thousands around world disgraced spectrum adhd intentional passing knowledge others im polymath confident offer others ashamed,True
1952,delighted present remote research early findings royal society biology many societies project continues grow strength importance,True
1953,new article autism green flags signs someone know might autistic ausome,True
1954,important progress affirming practice learning spans education health particularly structures meet childrens mental health childrens community services,True
1955,heres group nd affirming dieticians facebook,True
1956,kids tell stories print several fonts sizes let read words powerful tool dtk chap selfgenerated stories short via,True
1957,day release clips staff pupils talking collated support learning specialist paula gilhooly,True
1958,autismi beautiful brokenchallenged challengingoverwhelmed spoiledautism choiceyour acceptance,True
1959,explore creativity thrive center host night materials provided june p member nonmember tomlinson south meridian ymca register,True
1960,autistic child laughs angry inappropriate emotional responses please rt,True
1961,write signs telling parents,True
1962,tell parents id like examined sort without causing even trouble,True
1963,yet awareness sen adhd first question always ask whats experience training understanding adhd already know answer get,True
1964,seen fab resources today part main resource provides great insight curriculum year olds amazing learning teachers,True
1965,honestly first opened emailed asked coming accessibility friendly review course never got back,True
1966,throwback brought new understanding audience eyeopening talk learn disclosure advocacy haley,True
1967,hi please download episode get recognition eventually job feed daughter ever one download autism acceptance benefits podbean,True
1968,teachers understanding masking knowledge identifying different signs realising cant wont,True
1969,absolutely essential understand history nd movement language paradigm everything need get started,True
1970,class race gender ablebodyedness grading privileges one small segment population detriment others reason alone exist,True
1971,great talk education,True
1972,confoundingly nts unspoken social rules become upset people break rules despite fact explicitly directly communicated anyone,True
1973,people get labelled talked way regular basis thought time turn tables change sbntiitr,True
1974,many people neurological conditions autism spectrum disorder dyslexia extraordinary skills including pattern recognition memory mathematics yet often struggle fit profiles sought empl,True
1975,dream world schools understand cater sad read also informative,True
1976,youre aiming create inclusive classroom workplace life friends family important know basics starting understanding difference two common diagnoses,True
1977,loads positive feedback pod grad show came interview us project would love see schools hospitals festivals,True
1978,self reminder ashamed embrace,True
1979,endorsed nami san diego studied university california san diego approved treatment modality south african josh guides dynamic presentation breakout session unpacks gamechanging gifts,True
1980,session offers fresh set lenses allow elicit gifts meaning purpose metamap territory drawn synergizing worldviews depth psychology greek philosophy shamanism spirituality current research,True
1981,gifts metamap change way look things things look change,True
1982,free webinar gifts metamap june compassionate approaches crisis webinar series national empowerment center continuing offer webinars peerrun services serving individuals experiencing emotional crisis,True
1983,days intense topic classroom real challenge became overwhelming near end day trainers understand ask question shows force changing people willing accommodate,True
1984,communication key today interns talked importance nonverbal communication workplace beyond,True
1985,free curriculum mainstream primary schools introduce pupils aged years concept impacts experiences school always interested mainstream sen normalisation reading weekend,True
1986,please go check new,True
1987,adhd autism dyspraxia dyslexia fall within spectrum conditions speak us,True
1988,less likely automatically follow social rules around gender sexuality relationship could neurological link idk someone know recently posited trans flavor could see case made,True
1989,heres short video unison reading great way let dyslexic students participate practice avoid embarrassment dtk chap choral reading short via,True
1990,throw debate kinda throws curve ball lefts narrative identity politics diversity would change everything far right thinks anyone mental issues crazy,True
1991,identify art share hope consider submitting exhibition age experience level medium would love hear say,True
1992,youth canada aged live rurally virtual care may assist ei treatment needs accessible facilities werent always structurally accessible inclusive diverse bodies important note accessible treatment include,True
1993,like sobbing notice upset please rt,True
1994,reading neurodiverent mind rolls eyes right fckin head part solution building neurodiversityaccepting world deny social awkwardness exists remove term socially awkward social misses suddenly disappear,True
1995,calling educators whole well worth read change perception possibly half people classroom,True
1996,need make movement understood curriculum level need teach teachers needs neurodivergentled informed,True
1997,things get better like movement inclusivity acceptance need make movement understood curriculum level students young ceo katie koullas,True
1998,themes show tackled season relatable help many people feel seen heard death grief trauma depression ptsd identity sexuality religion much truly recommend watching show,True
1999,day help opened new account able lodge support request disclose breaches acl dda defamation deleted account zero fucks given,True
2000,one says listening autistic adults insights going make everyone life easy make many people lives easier us autistic adults kids families struggling want shake least stress,True
2001,placing focus autistic people others sensory sensitivities perceive process environment reframing sensory modifications caring adjustments rather impositions create spaces thrive,True
2002,got brah,True
2003,people brain function differences like autism dyslexia bring unique strengths employers yet face multiple barriers hiring process unequal challenges workforce download navigating practical guide,True
2004,people invisible disabilities dont walk around telling people problems must embedded everyday life towards everyone meet special needs,True
2005,please download listen podcast episode autism acceptance,True
2006,brain towards knowledge paramount dealing undiagnosed recognizing seeking help therapy meds life changing expert yet dm rings true chat,True
2007,always denied want find anything good decided start embracing way brain works differently outside least find positives getting diagnosed one best things,True
2008,used hate diagnosed severe far used think brain broken broken read beginning understand brain different strengths,True
2009,see strange never heard definitely methodological problems sample size low population lgbt diverse group axes average mental illness ceteris paribus controls harder come,True
2010,exactly highly underidentified population astonishing things,True
2011,san diego ccoe proudly supporting county san diego initiative join supervisor terra lawson remer june call board supervisors create employment opportunities,True
2012,since strongly genetic wonder plays families parents got hyperfixations example disappointment directed passion rather results knew interest key,True
2013,tell additional needs parent look tired already know thattell great job might know,True
2014,theres reason good loved way better parents understand love falling apart order thrive shouldnt romanticised mothers sacrifices far long,True
2015,superb thread resources truly deeply understanding applying concept schools,True
2016,applied job centre excellence autism matched person spec job description yet didnt make sift live manchester impersonal rejection message ended,True
2017,primary school staff fantastic free neuroaffirmative resource teach classes,True
2018,company looking smart creative people bring something unique table solve business problems hiring employee might worth exploring read ceo article,True
2019,exactly situation everyone different sure dont explain treated way different especially front peers would completely shut yes ever find good articles pls send,True
2020,life tough right bad news news invokes anger upset horror hopefully little ray timelines evie gorgeous year old excited sunny play outside special school,True
2021,mention changing anything regarding nonautistic peers whisper double empathy problem suggestion upskilling whole school oh children studied boys,True
2022,ndis support worker agency network great still naturally knowledgeable listen try adapt rhe best helps agency hire diverse people,True
2023,icymi new blog learning laughs lots unlearning read,True
2024,autscape conference autistic people organised autistic people conference held august theme year interdependence details contact infoautscapeorg,True
2025,support inclusivity hybrid workplace explore new features,True
2026,simone biles american gymnast boasts olympic world championship medals simone isnt afraid speak attention deficit hyperactivity disorder doesnt let hold back attaining goals,True
2027,need tutor child suspect dyslexia child differentiated teaching feel excluded low self esteem,True
2028,went women tech thing honestly get irked diversity ever talked gender,True
2029,sounds like terrible teacher truly teacher please read recent research adhd regardless cognitive neurological function people want treated like everyone else,True
2030,morning everyone still harping mean please also passionate raising awareness especially,True
2031,thread really eye opening society think,True
2032,need tutor therapist child suspect dyslexia via,True
2033,followers must read report good agenda guidelines incorporate movement company workings report helps,True
2034,daughter elvi tens thousands children failed thank please get onceinageneration reforms right,True
2035,bcos new report designing undertaken provides understanding bringing together science livedexperience design aspects download,True
2036,number companies involved modest learn make progress initiatives bringing employees organisation via,True
2037,day release clips staff pupils talking collated support learning specialist paula gilhooly,True
2038,day release clips staff pupils talking collated support learning specialist paula gilhooly,True
2039,ever spoken person coined read anything wrote going people badly use terms discourse ideas like social model etc get badly interpreted ppl online,True
2040,create supports via,True
2041,whoever came words one question plan,True
2042,bring something unique table help solve business problems way others cant farida charania explores one embrace workplace,True
2043,thank kind words still spaces left anyone would like join free launch event tuesday,True
2044,james dont get started actually raised trustee would like fines libraries accessibility definitely another way fining old model piano lid,True
2045,still tickets left launch event tuesday focused educators maybe know someone would like join us,True
2046,mental health matters newest erg thrive creates safe supportive space inclusive neurotypical people fivetran,True
2047,workplace environment designed support individuals explore work make,True
2048,thought vital design workplaces mind,True
2049,runthrough community event morning panel members registered attend next delighted working deliver unique training opportunity,True
2050,still two weeks left submit application funded phd studentship kate langley schools mental health questions please get touch please rt,True
2051,leans free curriculum mainstream primary schools introduce pupils aged years concept impacts experiences school available download free users worldwide,True
2052,training implementing paradigm matters,True
2053,love new umbrellas installation celebrate reminding us unique incredible minds,True
2054,rt afrika support inclusivity hybrid workplace explore new features,True
2055,encompass exactly via r,True
2056,todays recommendation show ive directing brilliantly inventive silly dissection gender sports,True
2057,pit exploring autism disease conditions essay,True
2058,puzzle piece outdated offensive hate symbol meaning puzzling condition needs fixed fit correct symbol autism gold infinity rainbow infinity general,True
2059,totally get tony really helpful shared thank perspective need consider close home,True
2060,specialists supporting state independent specialist cpd management book next inset audit mock inspection jmc,True
2061,support inclusivity hybrid workplace explore new features,True
2062,support inclusivity hybrid workplace explore new features,True
2063,support inclusivity hybrid workplace explore new features,True
2064,support inclusivity hybrid workplace explore new features,True
2065,support inclusivity hybrid workplace explore new features,True
2066,support inclusivity hybrid workplace explore new features,True
2067,support inclusivity hybrid workplace explore new features,True
2068,support inclusivity hybrid workplace explore new features,True
2069,good morning happy friday,True
2070,thanks musicians union members participated first three training sessions exploring issues executive functioning mental health teaching strategies music teachers,True
2071,rather wonderful took time talk decided serious point cope well unconfs unless room people already knew similar things ashridge though,True
2072,anyone interested team member assembled great list information please check,True
2073,workplace,True
2074,fantastic hour morning mapping final months much energy appetite make real difference,True
2075,introduction short courses introduces key terminologies emerging language use important delivered ey send specialist kerry murphy rd june pm pata members sign,True
2076,one day time parents future take care happy friday,True
2077,believe brings fresh perspective business performance webinar june exploring workplaces develop environment unlocks strengths,True
2078,support inclusivity hybrid workplace explore new features,True
2079,support inclusivity hybrid workplace explore new features,True
2080,even increasing serotonin levels helps bit better,True
2081,hotel number modifications made house make disability friendly accessible,True
2082,join alistair cox hays ceo dr nancy doyle founder discussion making workplace inclusive individuals adjusting hiring processes leadership sign,True
2083,covering range subjects common terms around information supporting sleep useful resources section range helpful downloadable documents take look,True
2084,ever hear grown visuals children adults regardless neurology benefit visual supports especially feeling stressed following labelled colour coded arrow find appointment morning,True
2085,embrace workplace,True
2086,important points hiring cultural fit dangerous creativity innovation,True
2087,interested learning workplace make sure read chat friends ceo josie dobrin employer training trainee simba martins employers embrace,True
2088,lemme check diary blank things dont want yet lol im san diego lol oh hey discussion group email fab,True
2089,read discovered passion poetry helps tackle bigger issues like mental health,True
2090,fascinating article artist work featured upcoming festival,True
2091,jaimegraceuksworld started february share stories help others understand world,True
2092,fabulous shelves minds,True
2093,related forbes article back questions researched funded compared neurotypes,True
2094,todays friday focus delighted announce another fantastic workshop local business coach talia zamora register,True
2095,wrote piece influenced life parenting bit son cool editor got fabulously talented illustrate thanks,True
2096,looks fantastically comprehensive resource schools introduce year olds concept,True
2097,reminder use inclusive imagery comms include race gender age body type abilities religion,True
2098,todays nois notes feature art important click,True
2099,westside hosted launch sensory services mayor galway city cllr colette connolly cathaoirleach galway county cllr peter keaveney attendance,True
2100,another possibility might working towards something like theory congitive mutual aid think fits well core idea indicates mental functioning problem solving etc always collective relational matter,True
2101,schools majority us learn read hone skills throughout educational careers negative early experiences create aversion reading pleasure,True
2102,heard pda type autism saying idea people going quick judge,True
2103,swa digitally inclusive using technology information available languages customised suit individual needs,True
2104,creating space screen see creator jason katims sadie dean,True
2105,thank inviting join discussion yp amazing much still done services would great see part,True
2106,grateful alcoholic true mental illness gives us something build life around like normies need passion,True
2107,dangerous tell others life style change helped mental illness telling also meds,True
2108,ohhhhh god wanted ask mom today childhood see epic moments today friday brother wouldnt home said might able visit,True
2109,autistic child really admitting guilt repeating say please rt,True
2110,say hi amber today public engagement assistant talking experience importance workplace find,True
2111,great minds think unalike heres reaction im proud support business social enterprise run including organisation,True
2112,important connect brains bodies convinced without connection issues continue,True
2113,course suggesting attempts depathologization wrongful indeed powerful voices within movement mad pride advocate depathologization social justice goal,True
2114,latest dyslexia update thanks,True
2115,queer sense transgressing social rules also deeper sense liberated unbound particular form desire perfect time reread insightful piece,True
2116,workplaces benefit colleagues authentic selves virtually join colleagues june develop environments embrace,True
2117,proud support umbrella project june oct,True
2118,autism parentsi change way child views world instead change way world views child,True
2119,awful way reward anything good grief sorry daughter cool school dumb good dynamic either even punishing,True
2120,new event businesses join us event june take action support sector book huge untapped pool talent,True
2121,register,True
2122,support inclusivity hybrid workplace explore new features,True
2123,people brain function differences like autism dyslexia bring unique strengths employers yet face multiple barriers hiring process unequal challenges workforce download navigating practical guide,True
2124,right well suited computer programming,True
2125,days go gain expo rd june via zoom register today,True
2126,say kids really matters understanding talk kids matters even see recognize anyone know story like,True
2127,check work shelly dival designing,True
2128,missed really looking forward one thanks organising,True
2129,still time register event next tuesday cant make session live register receive recording session,True
2130,physical disabilities many people experiencing homelessness facing additional barriers accessing services disability needs must incorporated provision temporary accommodation recommendations,True
2131,shout fellow add adhd colleagues quick witted empathetic gregarious,True
2132,admittedly event held unison id love see hosting related events,True
2133,thank much joining us community development day today comment member team really summarises impact lived experience peer knowledgesharing,True
2134,want news interviews ticket giveaways take two minutes sign itakom mailing list,True
2135,heres dale host stand c manchester today youre come chat weekly podcast lots great episodes focused listen free,True
2136,join gain group autism insurance investment expo free virtual event rd june find register,True
2137,available pack resources lesson plans teach primary school children really love resources great quality totally free really neurodiversityaffirming developed coproduced excellent team,True
2138,places autism awareness training going fast passionate making services accessible celebrating want promote culture inclusivity understanding youth group miss,True
2139,last online hub using development dialogue uncover potential together join free meet chat engage learn please rt,True
2140,doesnt expose quick glance ones photo social following unless decide open loud proud neurodiversityare,True
2141,change narrative adhd,True
2142,figure works best even neurotypicals get wrong billion people planet many unique brains works one may work works million may work unique,True
2143,congratulations berkeley heights campus flexible festival students organized event showcase talent raise donations amnesty international read event,True
2144,little insight offer addvanced solutions community network know family would benefit support please spread word share information,True
2145,theory applications stuttering therapy dr chris constantino transcending stuttering masterclass wednesday june pm est virtual learning opportunity one best leading thinker aut,True
2146,channels still going strong contributions various people recent posts include things agile comms handbook facts sharepoint keep changing titles back times new roman,True
2147,want hilarious middle grade magic try theyre freaking awesome want perfect autistic teen novels try want world fantastic genre one,True
2148,dear teachers makes constant eye contact part rubric presentations making clear give shit,True
2149,dyslexia failed schools assessor must psychologist must include iq school allowed identify cut rich parents go private failure trust education psychologists making packet report criminal,True
2150,sounds like great resource,True
2151,specialisterne usa recruiting partnered bny mellon recruit positions pittsburgh pa new york ny learn apply please visit,True
2152,attending next check kay sargents talk designing monday ct rooftop fulton market,True
2153,im sorry experience programmes talk feedforward focused future rather telling people theyve done wrong,True
2154,third step,True
2155,dyslexia inadequate universities cant train teachers incompetent teachers cant train children school understand conditions creates discriminatory employment environment,True
2156,kpmgs marcus murph five conversations organizations talent read thoughts marcus,True
2157,sian williams westminster mps missinforming british people elements every gove dept public sector illegally operating years lack education put adjustments beginning,True
2158,taught create space succeed believed success possible taught kinder world wherein may find little way compassion dave hingsburger rip,True
2159,one true time blindness result adhd another sense issue risk negatively impacting almost every aspect life,True
2160,new pathway added app support families waiting receive treatment get touch discover get running local hospital department find,True
2161,lately catching figma presentations youtube far designing treyce meredith rocks highly recommended thanks great event,True
2162,autism kids need little help little hope somebody believes,True
2163,enewsletter great way stay connected find link ama episode released earlier well resources parents educators ways support work,True
