,tokenized_text,is_after_split_date
5472,join alistair cox hays ceo dr nancy doyle founder genius within june discussion making workplace inclusive individuals adjust hiring processes leadership,True
5473,much dont need fear score tagged precisely reason absolutely agreed prefer call disease doesnt need curing,True
5474,see tomorrow,True
5475,means much,True
5476,wsp snack learn webinar designing mind body considering broaden approach accessibility,True
5477,md chris jay speaking skills employability summit london happen summit chris talking overcoming obstacles promote recruitment retention people disability,True
5478,five detailed ways design office,True
5479,radio silent moved suited environment months acute mh facility mh asd correct support acute mh wake realise service breaking supporting patients,True
5480,embrace,True
5481,thanks team fr invitation attend days inclusive design forum attending thoroughly enjoyed morning session included session designing autism factory tour,True
5482,says included believe yes,True
5483,absolutely fantastic see kildare town today fair play keep good work everyone else involved,True
5484,working therapy day person conference sat oct suzy rowland ruth williams david moat learn ways supporting clients individual couples work,True
5485,blogger looking reach new audiences positive inspiring posts autism dm interested guest blogger adulting spectrum,True
5486,important know areas impacted dyspraxia dyspraxia isnt one size fits individual living dyspraxia different weaknesses abilities,True
5487,dunno many frum men impostor syndrome social anxiety,True
5488,autism community many high functioning autistic persons take view condition one one medical impairment view respected,True
5489,language classroom perhaps topic want learn luckily great starting point latest article written dr anne margaret smith,True
5490,afternoon crowd side atlantic im sure leaves asiapacific tl r gender identity roughly described meh think theres lot developmental complexity behind,True
5491,ways lead workplace via,True
5492,inclusive event planning build content journeys via,True
5493,check law,True
5494,excited announce course live looks thinkers bring challenges face explores strategies enable people engage thrive,True
5495,latest dyslexia update thanks,True
5496,id ask another question approaches managing key basic good management,True
5497,grew functional representations found coping strategies could able find see damage,True
5498,think untapped talents organisation could missing learn make people management strategy smart everyone thrive,True
5499,autism processing errorautism different operating system,True
5500,omg beautiful,True
5501,even though want showcase coaches coaches gallery year everyone recommended community,True
5502,global teams training hot inside subject matter absolute fire,True
5503,thing,True
5504,iconic umbrella project back celebrating locations across uk call see,True
5505,register,True
5506,loooking forward new paradigm conference friday let us know comments coming,True
5507,sorry sorry say fk neurotypically challanged absolutely disgusting degrades value person inherent humanity voices stories matter need honor genuine,True
5508,five detailed ways design office,True
5509,intersectional approach inclusion work,True
5510,new badge available upon ebay search adhd autism badge,True
5511,look muppets analogy undiagnosed im tired pretending isnt,True
5512,amazing way via,True
5513,blog new normal remote working affecting workers disability carlo tramontano write digit blog remote research,True
5514,completed group session children today teaching using great books bought konfident kids website,True
5515,thanks submitting entry superpower initiative read,True
5516,cognitive matters miss webinar colleagues accounting design best practices lessons learned applicable setting well,True
5517,maybe start referring neurotypicals challenged,True
5518,save date thursday july pm next dip webinar dive subject cognitive diversity workplace click register,True
5519,basic good management key work,True
5520,autism look directly mean listening,True
5521,canary code probably biggest organizational framework opportunity aha orgs since work read full approach,True
5522,awareness different kinds families cultures traditions yes awareness disability yes gender identity could taught sociology pshe subjects taught secondary age need maturity needed primary age,True
5523,wouldnt wish adhd worst enemy let alone newborn im really tired narrative understand autism thats community illness adhd literally illness,True
5524,totally love start learning journey neurodivergency proud,True
5525,agree concept without controversy one criticism encompassing vastly different disorders somewhat agree annoys term applied especially individual level,True
5526,last pleasure hosting burrow trained staff use,True
5527,great day program new undergrads identify gets familiar campus connects students,True
5528,want support celebrate autistic kid wear shirt says beautiful something like specifically calling autistic kid many negative associations,True
5529,personally behalf group autism insurance investment building resilient households group thank,True
5530,autistics stigmatized decades aspergers became popular term parents didnt want kids called autistic less stigmatized terms arrived agree exists im autistic,True
5531,agree helpful talking id rather addressed individually actual disorder blanket term dont refer gay man lgbtq man dont like called im autistic,True
5532,dont add adhd parent child adhd friends diagnosis aware rates add adhd rapidly increasing felt needed improve knowledge useful person parent,True
5533,ameera also super contributor mighty publication bringing humanity health bylines published strong focus mental health intersectionality pieces reached readers,True
5534,dreaming autistic daughter might feel followed notional curriculum instead national curriculum,True
5535,make events inclusive audience heres blog top tips making events inclusive,True
5536,diff internal communication vital journey acceptance reverse mentoring schemes partner peop,True
5537,know competition episode downloads far extremely proud please check autism acceptance accepting big law broadly important,True
5538,launch umbrella project billboard campaign across uk supported beautiful alison moyet,True
5539,new paradigm conference professionals sectors public services come together learn debate impacts health services dekko comics rossie stone guest speaker info,True
5540,met volunteers organisers today long festival celebrating learning disabilities culture conversation comedy find brochure,True
5541,paper recently read interesting direction take intersectional feminism,True
5542,enrollment time contact us learn afya cares internship program,True
5543,led entender project supported students democratising promoting change prospects argentina mexico find,True
5544,new today breaking stigma w mind yr life founder dr luisa sanz enjoy please help us keep breaking stigmas around yrlife,True
5545,different day cpd training creased puddles fantastic tools recognise value differences important trainers adapt delivery according student needs,True
5546,lovely see sshine students talking raising awareness,True
5547,presenting first irl asset nft holders get chance receive percentage book sales minting starts tomorrow june P utc tcogsnntuv,True
5548,presenting first irl asset nft holders get chance receive percentage book sales minting starts tomorrow june P utc tcogsnntuv,True
5549,presenting first irl asset nft holders get chance receive percentage book sales minting starts tomorrow june P utc tcogsnntuv,True
5550,presenting first irl asset nft holders get chance receive percentage book sales minting starts tomorrow june P utc tcogsnntuv,True
5551,abigoliah schamaun fought priti patel,True
5552,presenting first irl asset nft holders get chance receive percentage book sales minting starts tomorrow june P utc tcogsnntuv,True
5553,people struggle driving ever got stuck automatic pilot unintentionally broke law,True
5554,learn new dance moves explore dance styles create costumes decorate stage perform family friends ages aug thrive center tomlinson south meridian ymca register financial assistance available,True
5555,presenting first irl asset nft holders get chance receive percentage book sales minting starts tomorrow june P utc tcogsnntuv,True
5556,presenting first irl asset nft holders get chance receive percentage book sales minting starts tomorrow june P utc tcogsnntuv,True
5557,lots members autistic adhd show features marjorlein robertson adhd,True
5558,presenting first irl asset nft holders get chance receive percentage book sales minting starts tomorrow june P utc tcogsnntuv,True
5559,presenting first irl asset nft holders get chance receive percentage book sales minting starts tomorrow june P utc tcooaibfjdxfl,True
5560,presenting first irl asset nft holders get chance receive percentage book sales minting starts tomorrow june P utc tcogsnntuv,True
5561,presenting first irl asset nft holders get chance receive percentage book sales minting starts tomorrow june P utc tcooaibfjdxfl,True
5562,presenting first irl asset nft holders get chance receive percentage book sales minting starts tomorrow june P utc tcogsnntuv,True
5563,presenting first irl asset nft holders get chance receive percentage book sales minting starts tomorrow june P utc tcooaibfjdxfl,True
5564,presenting first irl asset nft holders get chance receive percentage book sales minting starts tomorrow june P utc tcogsnntuv,True
5565,presenting first irl asset nft holders get chance receive percentage book sales minting starts tomorrow june P utc tcooaibfjdxfl,True
5566,presenting first irl asset nft holders get chance receive percentage book sales minting starts tomorrow june P utc tcogsnntuv,True
5567,presenting first irl asset nft holders get chance receive percentage book sales minting starts tomorrow june P utc tcooaibfjdxfl,True
5568,presenting first irl asset nft holders get chance receive percentage book sales minting starts tomorrow june P utc tcooaibfjdxfl,True
5569,presenting first irl asset nft holders get chance receive percentage book sales minting starts tomorrow june P utc tcooaibfjdxfl,True
5570,article discuss key benefits hiring discuss needs tapped,True
5571,another reason love deloitte deloitte deloitte program firm looking attract engage hire qualified performing talent,True
5572,presenting first irl asset nft holders get chance receive percentage book sales minting starts tomorrow june P utc tcotvgthct,True
5573,presenting first irl asset nft holders get chance receive percentage book sales minting starts tomorrow june P utc tcooaibfjdxfl,True
5574,celebrating,True
5575,truly something celebrate grubbing attention sympathy child also okay position give real consent coerced consent like guess,True
5576,help brains better work certain extent idea also refers one falls autism spectrum easy maintain attention focus read,True
5577,interviewed founder recently spoke journey space let us know type world would like leave future generations,True
5578,ever struggled find suitable job order succeed illustration photo woman writing tablet computer using laptop antoni shkraba free use taken,True
5579,feel way largest minority world deserve empowerment inclusion celebration,True
5580,selfdiagnosis precede formal diagnosis opinion check site linked profile ton resources around autism particular,True
5581,read programs support retail employees,True
5582,newest issue spoonie magazine live check weeks batch amazing art writing disability chronic illness,True
5583,sound features panel discussions opportunities member participation space closes get info advertise,True
5584,doesnt accept,True
5585,take look full interview,True
5586,chose remote work remote work cool allowed take control asd plays professional development hugely encouraging see company like virbela talking future work,True
5587,homeopathy treatment autism work exactly take pill societal structure changes makes everyone realise autism isnt disorder knew homeopathy powerful,True
5588,samuel cody celebrating amazing virtual umbrella project great working thanks ods electrical kindly sponsoring display,True
5589,neurodiversityaffirming therapy positions therapy goals best practices therapist collective,True
5590,want included receive nd small project let know supporting using irl fit include address nft contract please retweet,True
5591,started preparing yesterday days leave well much actually preparing preparing prepare,True
5592,presenting first irl asset nft holders get chance receive percentage book sales minting starts tomorrow june P utc tcowwaoepxaw,True
5593,presenting first irl asset nft holders get chance receive percentage book sales minting starts tomorrow june P utc tcowwaoepxaw,True
5594,presenting first irl asset nft holders get chance receive percentage book sales minting starts tomorrow june P utc tcowwaoepxaw,True
5595,presenting first irl asset nft holders get chance receive percentage book sales minting starts tomorrow june P utc tcowwaoepxaw,True
5596,presenting first irl asset nft holders get chance receive percentage book sales minting starts tomorrow june P utc tcowwaoepxaw,True
5597,presenting first irl asset nft holders get chance receive percentage book sales minting starts tomorrow june P utc tcowwaoepxaw,True
5598,providing male perspective social work personal experience ocd discusses impact practice including possibility acting intrusive thoughts result ocd,True
5599,bit surprised come across anything like neurodiversityfocused hacker infosec communities strong code conduct discord slack irc matrix whatever,True
5600,adjusting work environments accommodate simply smart yet need im talking specialized school first theyre next generation employees,True
5601,autism adhd meant struggles started early life made determined fight right live happy life,True
5602,study postidentification programme also study shameless promotion book autistic also papers stephen knapp ed autistic community movement,True
5603,best dyslexia book parents read far easy follow gives clear directions parents thank amazon review dyslexia tool kit expanded edition,True
5604,comic books graphic novels terrific tools reading vocabulary like use fox trot calvin hobbes far side,True
5605,im thrilled premiere first twitter note via new opportunity write longform content directly twitter many us writers spend majority day wanted share new project color,True
5606,jaimegraceuksworld started february share stories help others understand world,True
5607,check books authors advocated celebrate learning stories,True
5608,check new access language tools offer translation screen reader color font styling options tools help attention reading aids,True
5609,sheer hypocrisy post nothing bully sen children families shame,True
5610,wonder might touch bc think way,True
5611,changing workplace make life easier people adhd conditions intriguing blog points useful directions,True
5612,autism smallest success often joyous,True
5613,rt people autism asperger dyslexia adhd bring massive value workplace,True
5614,join us july pt special online event discuss cannot see workplace register,True
5615,recording podcast research special guest pierreyves houlmont phd candidate assistant uliège shared experience autist adhd research,True
5616,ever wonder person might think black white mean actually see gry area,True
5617,person impulsive may answers giving second thought mean lie actually busy inside world,True
5618,toys stage clothes celebrating win,True
5619,friends please kinder whatevers causing doubt belonging community please consider pitching invisible illnesses count counts selfid counts count matter,True
5620,words one young lady primary department proud far come happy finally,True
5621,happiness received little attention field autism spectrum disorders time take uturn approach change exclusive focus makes autism different happiness people autism,True
5622,continue work creating intentionally inclusive workplaces cultures everyone please take minute fill survey experience understanding,True
5623,universities wildly exciting badly organized experiments might even find adhd confers advantage situations,True
5624,article organized thank,True
5625,want know speak person please,True
5626,specialisterne usa recruiting proud partnered deloitte recruit several intermediate positions across variety disciplines learn apply please visit,True
5627,making effort unteach kids challenging think word normal good place begin,True
5628,wow autism promoted like fun simulator experience switched alternatively could listen autistic people empathy provide support celebrate,True
5629,listen podcasts often really glad listened one courtney discusses life realizing autistic listen,True
5630,affirmative resources recommend books developed great lesson plans worksheets great ideas individual group sessions great give parents,True
5631,impressions last weekend june would like thank visitors came us participated events special thanks goes transforming library zone,True
5632,day made comment autism support group reply accessibility questionnaire linkedin article,True
5633,engineer take part research help develop framework inclusion engineering respond july,True
5634,id prefer shirt says autism acceptance great rather idk trying get attention kid,True
5635,hey im diagnosed nov r autisticadults r r autisticwomen youre actually tech writer ive met thats autistic hit want talk shop special interests weird another person lol,True
5636,possible kirsty dominant within family late diagnosis x,True
5637,feeling inspired grateful seen fantastic session thanks letting join speak group sharing stories,True
5638,angers breaks heart time,True
5639,neurodivergence provoking new mind sight via,True
5640,goal type work able use brain imaging data aid developing personalized healthcare approaches asd sources,True
5641,okay spent time twitter today probably ages gonna depart follow ig instead shenanigans chronic illness content goddamn comedic genius ig follower,True
5642,five detailed ways design office,True
5643,one left complete survey domestic violence perpetrator mens behaviour change programs closes june pls complete retweet access survey,True
5644,different peers etc managed relate leads struggles well cant recommend series enough ive obsessed w past days fuck,True
5645,thank sharing article,True
5646,autisma sensory meltdown temper tantrum,True
5647,paradigm different brains groups people aspects brains work common,True
5648,look beyond stereotypes hiring promoting employees people work every role every level though majority employed roles skill level experience expertise,True
5649,presenting first irl asset nft holders get chance receive percentage book sales minting starts tomorrow june P utc tcoksyqogqb,True
5650,presenting first irl asset nft holders get chance receive percentage book sales minting starts tomorrow june P utc tcotvgthct,True
5651,wanted give voice spectrum way show casting actual individuals roles chaotic idiots tir na noc lead characters autistic stereotypes,True
5652,presenting first irl asset nft holders get chance receive percentage book sales minting starts tomorrow june P utc tcoksyqogqb,True
5653,presenting first irl asset nft holders get chance receive percentage book sales minting starts tomorrow june P utc tcoksyqogqb,True
5654,presenting first irl asset nft holders get chance receive percentage book sales minting starts tomorrow june P utc tcoksyqogqb,True
5655,graham us adult smoking leading hypothesis people issues selfmedicating nicotine helps natural product remember,True
5656,presenting first irl asset nft holders get chance receive percentage book sales minting starts tomorrow june P utc tcoksyqogqb,True
5657,presenting first irl asset nft holders get chance receive percentage book sales minting starts tomorrow june P utc tcoksyqogqb,True
5658,please replace symbols fit accordingly autistic community missing persons posters thank,True
5659,another win love seeing expanding job opportunities adults,True
5660,looking executive functioning students impairments typically looks like someone versus underlying factor cant see,True
5661,supporting see timeline information,True
5662,fortunate partnered agent made space points emily makes thread feel like industry whole could benefit notes publishing,True
5663,trouble difficulty dissociating healthy manner advise get help recognizing legitimate practical acceptable nongaslighting positive help hard come,True
5664,part look follow ttrpg stuff autism stuff platform end lot posts librarians feed im complaining mind sure algorithm came,True
5665,source information coping mechanism skills autism talk openly complex complicated aspects autism dissociation fundamental part,True
5666,presenting first irl asset nft holders get chance receive percentage book sales minting starts tomorrow june P utc tcofwskpnkghu,True
5667,presenting first irl asset nft holders get chance receive percentage book sales minting starts tomorrow june P utc tcofwskpnkghu,True
5668,students colleagues friends asc awesome variety different ways long may part enriching aspect human life,True
5669,great discussions pm presentation created looking nd terminology considering applications autistic cyps cahms beeu service shropshire,True
5670,umbrella project,True
5671,microsoft hiring program software engineers student within months graduating graduated past months bachelors masters eng compsci related field check,True
5672,games puzzles build reasoning language skills improving cognitive skills games,True
5673,want know new research want know identify gang problems pandemic political issues affecting families community student learning nah,True
5674,ever wondered better join us june bst pm ist pm sgt microsoft teams empauwer ai hosting panel ways better employ engage,True
5675,fondly remembering tried talk even little dissertation committee member said pathological obsession autobiography,True
5676,pls supply dated proof much seem want position preeminent maven abt time replied invite talk instead sniping usa maybe even read thesis context,True
5677,things love gamer adhd gamer adhd favorite things,True
5678,similarly article seeks take discussion guys whether due lack skill responding social cues effectively therefore alienated put creep one example thus changing entire discussion dishonestly,True
5679,chess thinking skills focused attention lifelong enjoyment improved selfesteem post chess improves attention,True
5680,vaccines cause adults autism,True
5681,,True
5682,us talking expanding queer include folks even framing diversity sexual identities orientations subset room big tent definition jokes aside,True
5683,neurominorities comprise least world population almost never hear mentioned via check,True
5684,guest toni bator shares perspective coach specializes working individuals also discuss tips strategies better support individuals work,True
5685,experience working perpetrator intervention space complete share survey examining mens behaviour change programs,True
5686,time year folks third annual walk run stroll roll september rd learn register team,True
5687,wonder long till cyborgs running government stuff much better world throwing people going cyborgs,True
5688,rt learn champion work via,True
5689,zipped back reality getting lost history invention aviation im back figure embracing difference way function easier resisting,True
5690,know story behind word must learn sociologist author speaker,True
5691,masking physically emotionally psychologically exhausting lead shutdown burnout survival strategy autistics rather asking tone set aside accept accommodate,True
5692,den houting j insider perspective autism,True
5693,tend use also includes neurotypical ie majority binary terms discussing specific forms atypical use term commonly used understood autistic dyslexic etc clarity,True
5694,beyond door autism kids capable,True
5695,learn champion work via,True
5696,infinite symbol true representation,True
5697,people cant accept wreck lives instead blame struggles face disability something traumatic actually embrace struggle barriers put place society,True
5698,premium families really make difference knack seeing potential helping way could read,True
5699,get conditioned society think disabilities visible ones whole case counts wired way world demands us diabetes counts absolutely lead unable go function,True
5700,deep super powers available anyone willing invest,True
5701,live join us gain expo starting via zoom register today hear fantastic range speakers,True
5702,specialist krysalis partners gain,True
5703,specialist krysalis partners gain,True
5704,specialist krysalis partners gain,True
5705,know system hard adults often access depends attitudes skills priorities gate keeping professional access education thwarted mental health parenting question year waiting lists,True
5706,often converse workplace picture conveys thousand words depicts diversity community might render suitable workplace might overclocking workplace idea identify diversity first,True
5707,thanks lead way one first friendly businesses thanks,True
5708,id love read something educator,True
5709,thanks heathrow airport continued support umbrella project one first businesses achieve friendly business award,True
5710,master degree found struggling parse instructions another complication passengers reading learning disorders dense language appears twist,True
5711,know youre trying good etc many people isnt quirky personality garnish reason theyre locked unjustly struggle massively life die prematurely,True
5712,launch nd phase pilot,True
5713,happy excited share released autism respecting difference phoebe caldwell simple introduction brainworld,True
