,tokenized_text,is_after_split_date
0,many folks claim support selfdiagnosis paradigm mad liberation actually still believe dominating expertise mental health system believe real professional diagnosis,True
1,productivity speed,True
2,individuals often skills employers need digital tech roles problem solving logical thinking attention detail strategic thinking high creativity,True
3,hi welcome june celebrate autism forms instead centristrepublican mix high functioning autism love object shows much kiss objects keronian preferably female objects unless rocky bfdi,True
4,increasing demand within data marketing industry analytical dataminded individuals inevitably lead talent pool becoming stretched,True
5,adhd superpower extraordinary ability brainpower generator neurons ability harvest mind waves air nervous system harnessing electrical energy high efficiency adhd front row seat universe thoughts,True
6,please read paradigm shining light problem normativity ableism path neurodivergentaffirming practice redefining stammering,True
7,hi might interested guest lecture german university talking book club find super interesting think students future teachers english would agree cannot send dm,True
8,thankful diversity within allows lots space understanding well traits complement one another synergize neat ways,True
9,wish tnc success many anniversaries come ontnc alpha sanford host teacher always teacher,True
10,support much appreciated scope currently covering later year intend also offer dedicated course autistic trauma,True
11,steep rise employment tribunal claims discrimination,True
12,reading tweets occurs psychs giving opinions dsms length away realise part arent point next time claim,True
13,hang challenge try focus positive aspects like improved memory attention detail theres great comfort structure daily routine life hope find support need,True
14,big mood everything neurological gets swept like found anxiety caused inoperable brain tumour tomorrow would see positive type superpower starts feel absurd like performing ableds,True
15,like substitute disability present dsm numbers insurance companies use numbers always determined access life insurance example number seriously frighteningaccess life,True
16,stands symptom,True
17,feel much better reading book really helps theory real practical advice follow right away thank amazon review dyslexia tool kit expanded edition,True
18,ever son presents neurotypical frequently spend fast passing time quickly experience,True
19,feel bad mean hes got much going right also harnessing wild creativity sounds like great deal occasional sex symbol live ever peace however would define,True
20,one recent pieces art done acrylic paint spray paint tell think,True
21,hope work together pushing awareness mental health,True
22,tq hosting space love thoughts perspective raising awareness mental health healing initiatives hope discussions future,True
23,course led believe gabs would explore themes mental health course healing trauma future discography hope gabs knows could write whole essay ep impactful much serious music,True
24,however next day listening got back home mall medicate definitely impressive song took hint new musical direction gabs would journey exploring themes mental health,True
25,parenting child adhd challenging shout wonderful parents best children constantly judged others dont understand disorder,True
26,subject matter experts intersection would want interviewed podcast,True
27,autistic sensory sensitivity heal well hurt,True
28,vulnerable post please kind overwhelm lead dropping balls unintentionally combine online students struggling keep emails owe professional response please hesitate text,True
29,know likely may also type sensory processing disorder,True
30,join us learn make owl programs welcoming inclusive guests share firsthand experiences help facilitators lead owl programs enjoyable meaningful participants noon pm et,True
31,people gonna realize intersectionality abled cis straight tall judeochristian capitalist upper middle class white men,True
32,grateful invited tedx soho believe ghosts black mona lisa chinese wine much inspire,True
33,yes thank writing books important kids tried write given great model well way kids enjoy reading,True
34,keep talking,True
35,situation parents prefer pfl learn us professionals inadvertently perpetuate stigma children change professionals adopt neurodiversityaffirmative approach autism includes ifl,True
36,happy genius within find events near follow link month amplifying posts members community feel free tag us,True
37,workplace june join us next event part resilience mind body soul purse series speakers hidden capacities password qwerty,True
38,super proud son found passed level hospitality outlet supervisor qualification severely dyslexic struggled traditional education,True
39,great sunny abertawe ignore clouds discuss autism coaching programme ministry justice,True
40,workplace,True
41,today raise concerns many low school attendance learners whose unidentified needs exacerbated lockdown poor mental health tip iceberg go upstream,True
42,vascillate adhd adhd resourced coping much days champion days check internalised ableism consistent inconsistency,True
43,staff working businesses across liverpool city region invited sign free webinar learn learning disabilities conditions taking place june pm register place online,True
44,organisations like youth club charity centre locally specialises could offer chance finding friendships outside school,True
45,start,True
46,although lot stake able share challenges spread awareness without anonymous real life first earn respect via positives forming identity based strength weak,True
47,realised due lack awareness seem year divided social quaters months masking trying get comfortable reach point get way comfortable mess hush back month long flashback guilt,True
48,alliance project codesigning testing materials facilitate peer support young people mainstream schools project twitter run fantastic postdoc follow updates,True
49,point appropriated without care one two major neurotypes said major issue pride queer write several essays marginal group dynamics real world effects words matter,True
50,wellbeing wednesday help support brain health boost alertness memory mood strategically including foods diet,True
51,still places online engagement session discuss forthcoming learning disability autism bill,True
52,researcher education composer musicals shamefully coming nt straight pretty regular occurrence wouldnt way,True
53,worked closely someone use word convergence without getting strong mental image funnel consolidation provoked thoughts cube stuck thinking pattern shapes excuse pun talk merging,True
54,june means community learning series happening next differing minds joining us talking attend become already partner check inbox,True
55,cant go something,True
56,cycle social anxiety autism say something awkward immediately try take corrective measures measures even awkward correct repeat working breaking cycle limiting corrections,True
57,new paediatric pathway added app support families waiting receive treatment get touch discover get running local hospital department find,True
58,neurodivergence provoking new mind sight via,True
59,month another one webinars effective recruitment practises taking place wednesday june interested please follow link,True
60,todays guest stephanie hutchings managing director resilient workplace chat workplace listen full podcast,True
61,pool start june least mile got miles go competed end month,True
62,pool start june least mile got miles go competed end month,True
63,find chaseries official listings support,True
64,survey language choices would like people complete,True
65,new blog learned wonderful isaac lot unlearn read,True
66,request individuals working investment industry please fill survey put together workstream survey,True
67,adhd aspergers often overlap work sepecialist service part,True
68,also helpful us parents family become aware accept normal yes adhd brings challenges also brings strengths superpowers almost finding using make difference,True
69,think time hiding behind diagnosis seen many parents claimed unsuccessful child children dont let function normally,True
70,seen blogs global equality collective thanks superstar send parents exclusions gec education case dei pls read rt,True
71,expert psychologist providing consultancy lawyers barristers managers,True
72,june trainings student engagement selfregulation intersectionality get ducks row,True
73,place try understand consider make allowances different styles communication matter ethnicity language,True
74,slightly spoiler stranger things literally vecna metaphor mental health problems like get trough day like put stuff repeat till get sick,True
75,trying get stem particularly cs program programs traditional interview processes confusing tell youre getting answer truthfully obscure ask twisted questions job,True
76,mainly onedimensional characters male focused stories usually written men mh issues certainly classic cliched traits think one must,True
77,neurospicy laundry pomodoro washer tasks min dryer tasks min hint least one task block tied something fun nds noodle music,True
78,learning school leans resource pack launching month come along introduction event june learn get free tickets,True
79,appreciate,True
80,proud charity partners come along workplace mental health conference agenda covers topics like psychological stability female culture overworking book tickets,True
81,places autism awareness training going fast passionate making services accessible celebrating want promote culture inclusivity understanding youth group miss,True
82,feel im always intrigued mind works work differently depending human top mind amazing challenges one area positively tip scales areas,True
83,yah really putting loved first episode whole thing becoming cringey many levels russia story ever tie back robin completely different person tropey lines thrown irksome,True
84,microsoft ibm dell sap hewlett packard google cloud texthelp heavyhitting tech companies robust awareness program need see,True
85,started taking photos like beautiful definitely feeds trueism brain may see things differently things stunningly beautiful im proud,True
86,june launch month means learning school resource pack soon join free online launch event tuesday june exciting times,True
87,given opportunity demonstrate skills required job proved instrumental getting,True
88,designing treyce config might bit late party loved talk super insightful,True
89,might need check first employers partners carers childminders etc hours work pointed us poor respecting standpoint giving people fixed reliable deadline work,True
90,wip emotions mindbody connection psych defences selfinterest attention memory learning interests sex differences interest development sensemaking social interactions human r general selfimprovement meaning life,True
91,jump tribunal claims shows employers afford ignore issues,True
92,vast number challenges affect essay writing role assistive technology play helping students overcome challenges,True
93,recruiting support manager focus supporting prisoners achieve progress education skill work pathways exciting opportunity join team make real difference,True
94,latest dyslexia update thanks,True
95,im present first run talk company hopefully theyll enjoy,True
96,autism workplace promoted friends hosted karen bopp circa ubc learn adjust practices better support accept include autistic individuals workplace,True
97,autism parents lacking discipline picking battles difference,True
98,heard culture youth support culture day cultural systems nurture children fields like ps sports great,True
99,found facebook absolutely,True
100,great examples reframing language way accepting respectful neurodiversityaffirming,True
101,absolutely disgusted article astounded total lack empathy understanding around views like individuals fighting years deflection nhs services,True
102,room couldnt handle stranger house son w v shy im grieving want peace housemate room im fairly antisocial especially right,True
103,today eic joins discuss state state guide state supreme court elections returns continue convo black communities,True
104,reaching employers looking managers hr reps participate survey better understand experiences managing employing people,True
105,discussing organisation uk date june pm twitterspace link cohosts,True
106,making teammates feel safe,True
107,lmao purist routinely exclude people tourette bpd ocd schizophrenia majority make sweeping public statements means listen concerns honestly beef except discomfort new,True
108,celebrated whole sharing colleagues lived experiences participating educational workshops,True
109,summary lets discuss mental health interventions gun control theyre somehow mutually exclusive lastbutone paragraph take swipe movement something clearly dont understand,True
110,notice highlighted special interest group sig happening today june st greece time music intercultural mind learn register,True
111,yes may due anxiety factors exhausting,True
112,usual time im told asked make xp within days xp days,True
113,hands natural sensory seeker also sensory avoider trauma juggling two headache,True
114,autism brains wired differently still connected heart,True
115,powerful story still often go wrong young people dyslexia conditions also go right recognised people supported flourish thanks sharing,True
116,fantastic get shoutout course screen industry built screen industry,True
117,awesome trade show ideas virtual inperson,True
118,hour fitness cerritos ca,True
119,people said experienced discrimination employment selection process exclusive new memberonly factsheet tips expert advice support employees inspiring examples best practice,True
120,diversity everyone includes may differences may visible mean exist,True
121,spectrum covering neuro differences like autism adhd around people uk may represents significant proportion existing staff job applicants customers,True
122,two poems spoonie journal via,True
123,oversimplifications like article address real world issues disability reasonable adjustments choice comes medication,True
124,standard quality life screener approved use adults autism providing reliable measures populations,True
125,omg actually worked brain didnt feel overwhelmed wall text,True
126,im listening ryan tubridy show wednesday june rté radio great listen,True
127,essential understand sensitivity core many modernday neurodivergences operates shows honour along framework generate widespread healing especially women divergent mind,True
128,going leave write rewrite response many times say better anyway,True
129,thread awesome,True
130,aberdeen trinity centre roof adorned colourful umbrellas raise awareness,True
131,tomorrow curiosities phil lesnie winning wondrous compelling appreciation read starred review,True
132,adhd frazzled brain coping paperwork workload organise today preparation court weeks,True
133,may june brain disorder causing person make involuntary behaviours sounds let spread awareness,True
134,failure provide reasonable accommodations autistic employee highlights importance inclusivity around workplacehttps tcocivfwvxssx,True
135,still hits deep,True
136,pride clever inside wondering ever oreos package look inside every cookie vary,True
137,join natasha nelson conversation tune talk,True
138,im one felt robin making autistic selfdeclaration episode,True
139,diversity companies hire employees aware anyone adhd autism etc working organisation excelled workplace,True
140,whoever wrote crap never autistic knows anything autism maybe theyre proponent claiming,True
141,find research team weve website,True
142,every month feature one meet bryson delightfully tough little guy kdm c syndrome,True
143,address lack talent hiring work employer roundtable launching career connector ndcc career portal dedicated jobseekers learn head,True
144,today elementary clarenville grade students engaged autism understanding sessions grade focus friend someone autism learning,True
145,resources adults hard comprehend autism spectrum requires needsbased supports agebased caps,True
146,hello caroline phd student immunology hobbies include video games one interesting fact adhd best advocate academics,True
147,autism world every accomplishment precious gift,True
148,everyone treated exactly ie equally unfairness experienced people groups different needs sometimes people need different tools help create equality equity makes equality possible,True
149,ago someone us company wrote offer almost k introductory edi webinar shocked find lucrative nd consultancy even sceptical edi stuff know much money drives,True
150,brain charity offers training nationally,True
151,neurodivergence become aware expert psychology tutors help us promote awareness changing way society views source,True
152,understanding become aware expert psychology tutors help us promote awareness changing way society views source,True
153,really interesting sessions coming inequalities next committee exploring broader systemic issues contribute worse mental health people conditions details,True
154,im organizing hybrid conference us please message youd like add info news work inas conference,True
155,looking forward attending annual conference speaking lived experience book place going great day,True
156,new article social skills training neurotypicals autistic guide socialization communication allistics attention allistic adults parents allistic children,True
157,monthly walk talk mums kids coming monday would love see,True
158,reference includes neurotypes includes neurotypical neurotypical,True
159,june virtual event join canadian chapter along platinum sponsors sphere discuss talent sources focusing,True
160,awful people celebrate,True
161,tourette syndrome deeply affected family proud embracing,True
162,era sandy read novella,True
163,tuesday class kink,True
164,happy pride month know persons autism likely identify lgbtq month celebrating living whole self unapologetically hope,True
165,read short story,True
166,keep things web related super excited talk soon web watch space,True
167,gold standard autistic children interesting take take time listen,True
168,read short story,True
169,big feelings okay things okay unmasking autism discovering new faces,True
170,law firm silence disability rights making uncomfortable like blame literally work barely want around,True
171,author raises point many salespeople trained sex toys disability,True
172,live damien fair directors lecture future noninvasive functional imaging era big data,True
173,lets talk track morning talks stop trying unicorn get cybersec read room improve interview process candidates employers considering invisible obstacles like info,True
174,hey different organization g word documentary production giftedness maybe youll like us invite check us thanks cc,True
175,science learning early intervention,True
176,hey different organization g word documentary production giftedness maybe youll like us invite check us thanks cc,True
177,without rain nothing grows learn embrace storms life,True
178,different need negative connotation different wonderful unique kind lives people learn special needs embrace differences,True
179,shout affirming salts rs therapist pro aac presumes competence constantly reminds strengths keeps open mind rpm eye contact targets genuinely cares makes time join ehcp meetings,True
180,science natural response curiosity best handson outdoors maybe videos textbook homeschool science students dyslexia,True
181,online classes may frustrating dyslexic students ways make better eschool success dyslexia,True
182,already strange kid feel need gender way people going get teased matter brainbows proud,True
183,leading kids entertainment companies embracing practices nurture talent finding multitude benefits gilly fogg talks kidscreen,True
184,hello folk thread mine wonderful trans autistic amazing beings please go give follows,True
185,terrific article issue business monthly page autism hiring program initiative howard county autism society invite employers candidates join us expand workforce,True
186,hence decided time try honest p life controlled maybe study others share experience try make special intrests like art come forward via,True
187,elon could get pass coming cutthroat tone deaf latest email consistent success sure style leadership one others justify especially starting need build lot trust,True
188,new special interest group,True
189,try cover work internship article write workplace think speech notes right slacked last one feel bad,True
190,yo elon whats take workplace,True
191,mention intersection race usa kill right,True
192,abolish series everybody knows psychiatric diagnoses dsm sham right mainstream mental health discourse whitewashed ok good,True
193,part interview series read find support inclusion academia research industry engagement initiatives,True
194,one building neurodiversityinclusive online cs courses earlycareer devs podcast teaching many tech topics like inclusive education becoming tech speaker beating perfectionism shes fashion designer behind,True
195,autistic people often find socializing neurotypical people challenging please rt,True
196,help disability mental health accessibility many us live executive dysfunction chronic pain fatigue trauma communicate learn differently status quo dont forget youre able grant us access compassion,True
197,reference previous post nick walker saying criminal saying hate asd saying pathology outloud heres blog post wrote,True
198,believe proponents right free speech successfully denied facebook despite fact nick walker nds advocate prosecuting putting prison saying much hate autism pathology,True
199,nds might gotten twitter shadow ban way im aware far know twitter thankfully remained neutral debate im still least time,True
200,got fomo yet usually amped severe anxiety public events might wonder atlanta largest tech conference feel seen talent headphones wonderful touch doubled comfort tool,True
201,matter many times world gets turned upside long hope always turn back around,True
202,ive come across book anyone read local library process acquiring ive placed hold comes looks interesting autism self advocacy handbook barb cook yenn purkis,True
203,tracking dyslexic readers need audiobooks,True
204,rene lives work happy birthday one favorite actors performance odo taught deal thanks,True
205,listened panel ableism gave lot think personal end women diagnosed differently men brother loud classes learning difficulties diagnosed adhd,True
206,hi aliens league enterprises always way finding reason part planet matter different,True
207,class night present annual jeffrey snyder go distance scholarship,True
208,historical reframing repositioning slt giving explanation profession come needs move towards essential narrative change across ahps,True
209,office occupiers invest report argues,True
210,one archives one author coped early stages pandemic,True
211,dr verlezza kicking knowledge ableism gonna help better classroom,True
212,benefits cognitive diversity workplace well many,True
213,thank means lot hear making difference know movement eventually going surge present pulling moment closer present second second every life matters every moment counts,True
214,kids supported learn according needs children disability special needs spectrum deserve quality education children every yes race gender income level,True
215,garcia presents summary roadmap ahead frmatthewlc,True
216,found lot good things book little repetitive heard elsewhere probably read topic,True
217,movement,True
218,feel kid read dictionary still youre smart stupid common refrain exhausting im exactly brilliant im also exactly unable things hello,True
219,autism awareness month friend wrote set firstperson accounts like get diagnosed adult make sense life read type content invaluable grateful,True
220,seriously heard equally fall equitable pediatrician ran school health clinic deep expertise,True
221,us gays chronic illnesses,True
222,yup say neurotypical vs really frequency normal hand society constructed notion nt normal,True
223,normal illusion perspective beautiful bad weird labels negative connotation synonymous atypical imo ask ppl neuro normal means get different answrs,True
224,really mental health issue,True
225,wrote book touches along many facets autistic life hope youll check,True
226,brilliant composer musician creating beautiful uplifting music addressing dealing life threatening illness scotland groovemachine,True
227,people gonna realize intersectionality abled cis straight tall judeochristian capitalist upper middle class white men,True
228,children autism observant notice everything including attitude towards,True
229,education autistic culture builds results movement answers three important questions autistic culture relate cultures relate movement,True
230,education movement builds paradigm answers three important questions urgent need paradigm shift involved shift must learn movement,True
231,education paradigm education answers important question mindset language new paradigm differ language old paradigm,True
232,seizure medications taken pregnancy may pose high risk development nearly million participants included study important data,True
233,makes sense variable attention stimulus trait rather attention deficit hyperactivity disorder,True
234,awareness action far organisations come moving celebration purpose read latest leaders article,True
235,design solutions must inclusive functional supportive wide spectrum conditions new report launched last available download photo courtesy morgan sindall,True
236,happy opening day us start officially open years hard work thanks go everyone supported us children,True
