,tokenized_text,is_after_split_date
3370,talking henry levenberg wanted share resource jeff thompson phd may resilience awe conference,False
3371,really making joke lol think born bad mindbody duality many bad mental health takes,False
3372,first day back bit al lot meetings including presentation sgt thinks insp well help spread knowledge support offer force officers,False
3373,ideally well also people seeing therapists getting concrete diagnoses especially delve medication im saying positive think adhd gets bad rap societys repulsion general,False
3374,critical caregivers understand stimming nothing concerned unless potentially dangerous harmful info please visit,False
3375,giving autistic children ptsd school,False
3376,thank insightful presentation evening,False
3377,good take think lot constructed choice counterhegemonic calculated execute something differently im sure much ever choice dont choose brain fog tell im foggy,False
3378,labour activists demand policy via,False
3379,since experience many clinicians peers ask hard evidence diagnosis people misdiagnosed bring mdts advocate consider specific case,False
3380,family checking launch later today onsite representing cheers,False
3381,context something see bit university services see paper linked people register us diagnosis eupd since way experience may see underlying missed,False
3382,new article explains categories relate everyday life,False
3383,autism hard sometimes kindness,False
3384,yes huge part problem lack basic knowledge adult mental health clinicians seeing person discrepancies spikey profile maybe leaping eupd,False
3385,words look sound familiar challenging identify right one let spell aid bespoke fields help navigate explore learn new words use app,False
3386,article thought experiment considering sensory differences workplace,False
3387,many employers embracing notion people think learn differently vicki thrasher shares help expedite process,False
3388,diagnosed adults region private psychologists otherwise sparkling anxiety misdiagnosed depression chronically underfunded nhs,False
3389,name alyssa recently finished phd interdisciplinary neuroscience like apple trees apples stuff,False
3390,considered disability conditions would land wheelchair sure call disgusting people adhd autism need accommodations like wheelchair users one physical mental emotional,False
3391,anyone going find odd mulholland drive,False
3392,real,False
3393,speculating one author journey autism spectrum,False
3394,premium tried using templates streamline certain repetitive features tips,False
3395,frist center autism innovation receive edward kennedy community service award recognition centers engineering research related autism value workplace learn,False
3396,autistic people often realize deeply hurt neurotypical person feelings library story please rt,False
3397,making venn diagram arbitrary discussion obligated give rat red ass folks sentiments eat day perseverate things shout asd,False
3398,anyone get joke account pokes fun people get treated every day going norm treated neurotypical people way get treated makes easy see nonsensical,False
3399,autism every success worth money buy,False
3400,hey portia thank also heads autistic people like person first language autism autism prefer autistic autistic person autistic people drop infographics,False
3401,pride lounge members new wednesday night dinner circle connection world walks life genders ages experiences wonderful come together share meal talk listen one community,False
3402,yeme day image description picture pride flag progress pride flag text reads love part community trans gender divergent community get belong,False
3403,nearly people final shortlist diversity inclusion champion award mostly shut accessibility happy work somewhere engages readily conversations,False
3404,bad science autism,False
3405,bad science autism,False
3406,purchased tommee tippee knock cups available without lidsperfect persons son loves links special interests animals,False
3407,way works people make mistakes culture neurodivergence seen inherently bad thing true natural normal okay,False
3408,experience innovative groundbreaking results stem multidisciplinary multidiverse teams beyond people different skills genders nationalities check inclusive collaboration workforce,False
3409,great info arent companies following,False
3410,support embrace movement love humanity,False
3411,support embrace movement love humanity,False
3412,sensoryfriendly coworking space design shared offices,False
3413,support embrace movement love humanity,False
3414,support embrace movement love humanity,False
3415,support embrace movement love humanity,False
3416,support embrace movement love humanity,False
3417,support embrace movement love humanity,False
3418,support embrace movement love humanity,False
3419,support embrace movement love humanity,False
3420,support embrace movement love humanity,False
3421,world day,False
3422,dont seem realise cure society technology likely stagnate sit around talking,False
3423,numbers us hate saying goddamn much hurting brain think,False
3424,twitter hard adhd dont even realize much youve written finish notice circle red text says,False
3425,becomes complicated mental healthcare system arbitrarily unethically decides identity personality disorder carrying forward psychiatric legacy sexism ableism,False
3426,radical guide women adhd embrace live boldy break barriers download epub,False
3427,dyslexia requires full toolbox techniques mistake use one method especially isnt working dyslexia instruction go beyond multisensory phonics,False
3428,im going nerd,False
3429,experience witness one never forget let rage night felt like never mask,False
3430,want definition linkedin user pretty much every professional world linkedin account gods ever spend minutes day looking news feed turn badge,False
3431,derritt mason earnest elfin dream gay angel daniel matos narrative future past ill throw piece ya,False
3432,autism brains wired differently still connected heart,False
3433,finding child dyslexic may cause anxiety relief actions take,False
3434,many autistic people recover socializing please rt,False
3435,great profile novel mind contributor la parent,False
3436,havent taken notes years ive gone back close years age im noticing dont know think related similar many lesser known barriers especially fine motor control,False
3437,actual system rather gathering passionate dedicated individuals working diligently families one deals mental health addictions physical disabilities etc,False
3438,prejudices keep employment prospects individuals shockingly low,False
3439,download kindle radical guide women adhd embrace live boldly break barriers,False
3440,bit panic attack thinking get job,False
3441,neurodivergence provoking new mind sight via,False
3442,movements like welcome everyone adhders aspies introverts indigo children people alexandrias genesis valid,False
3443,even treat kids giving autistic children ptsd school,False
3444,happy core team leader great organization,False
3445,team welcomes back selfadvocate discuss new way sees latest episode click link listen,False
3446,found trainings work love love working place offers resources help us brains successful,False
3447,met person autism met one person autism,False
3448,couldnt done without facebook last years argued adults teenager facebook learned peoples behaviors specialized advocacy knowing humans history key progression,False
3449,give readon dyslexia workplace dyslexia future proof business via,False
3450,therapy thursday versatility adaptability bibliotherapy make excellent supplement selfimprovement kinds,False
3451,morning day editing creating new cover letter ahead love book much plan xoxo,False
3452,e surviving society alternative womans hour vivienne isebor black women education chantelle vivienne discuss personal experiences navigating life education multiple traits,False
3453,professional join us nd sep learn get advice employing people special guests michael vermeersch aidan healy attend visit,False
3454,usually dealing girl often reasons fitting mental image girl therefore boy sit tell boys go rapidly see disaffected girls,False
3455,relax enhancing adolescent coping abilities looks interesting empowering families important home school support dovetailed learners,False
3456,evenbreak explores sep pm exploring workplace aidan healy lexxic microsoft covering benefits good practices,False
3457,school refusal acute school related anxiety issues classroom learning social interactions bullying sensory overload poor staff relationships support discipline coproduced plans work,False
3458,season films exploring starts today season asks language cinema challenged changed autistic perspectives join us,False
3459,discussion surrounding bad like spaces like sorting legos color stacking randomly signifier anything youre talking literal children playing blocks,False
3460,maintenance officer handy person job st apply maintenance officer handy person job x,False
3461,new initiative champion finance,False
3462,understand desire raise someone understands fairness think go easy kid bad attitude could well ascribed adolescencehttps tcoehdzoejg,False
3463,win depressed girl cleans room changes bedsheets first time months,False
3464,,False
3465,beat post holiday blues join zoom yoga classes bookings kids family yoga saturdays family pets welcome parents carers yoga fridays,False
3466,help create safe provide way skills support,False
3467,champion group gain launches,False
3468,absolutely irlen business seeks make money like every business made irlens syndrome sell glasses irlens syndrome likely neurodiversityrelated visual disturbances,False
3469,disagreement proponents movement see better approach neurodifferences medical model confusing divisive intervention align movement,False
3470,also definitely bring focusing neurotypical part story due diversity brain development,False
3471,never realized recently little actually make eye contact,False
3472,self diagnosis valid live someone know autism formal diagnosis helps good good right wrong,False
3473,excited image one beautiful new series celebrating,False
3474,instead using word normal sounds like something aspire like typical atypical words guest podcast topic abigail tennant,False
3475,nothing like training adult class set like high school class confirm thought differently wired brain great learning today exactly years ago update methods,False
3476,tips help feeling anxious,False
3477,looked children sometimes assume challenges related attachment moved around system consider mix rates much higher general population,False
3478,thanks kerryn great question lot work around space,False
3479,support embrace movement love humanity,False
3480,support embrace movement love humanity,False
3481,things dont exist unless need autistic perspective please rt,False
3482,text inas ismail cofounder autsera leena haque initiative lead ux designer bbc bst tuesday st september info techfordisabilityorguk,False
3483,text london advocates tech disability london tech tech presentation ashley peacock ceo passio panel chair yonah welker explorer board member org panel members,False
3484,come listen chaotic idiots series got incredibly talented people part link,False
3485,employment gap learning disabilities wider population reaches record highs experts call local government departments offer increased support workplace read,False
3486,teamed present autism cinema exploration season debates new ideas arising relationship autism cinema browse discover book tickets,False
3487,yes youve long msp really gets evidence also highlights near womens prisons traumatic head injuries often victims dv new joint review across justice system e w eyeopening findings,False
3488,hey heres post might missed read essentialness selfcare,False
3489,assessments provide autism assessments legal education employment purposes experience related conditions,False
3490,adhd assessments provide assessments legal education employment provide assessments zoom facetoface psychologists experience related conditions dyspraxia,False
3491,browse full season book tickets find series screentalks discussions introductions accompany film screenings season relaxed screenings,False
3492,autism cinema exploration starts today cinema reflective autism experience rare help usher new sensory relational ways world lets see whats coming,False
3493,thanks pressing point perhaps could government champion cant bring say tsar,False
3494,despite known benefits hiring talent workingage adults learning remain jobless according data via,False
3495,retail shops turn volume sensory overload unpleasant even upsetting many shoppers bad business,False
3496,health professionals learn,False
3497,penultimate edit done cover letter done time refuel xoxo,False
3498,chris hughes cochair sds workstream issues clear call action tech companies give talented individuals opportunity,False
3499,negotiating concept psychology today united kingdom,False
3500,rt honoring hispanic latino americans,False
3501,honoured invited write article diversity workplace opinion time think differently diversity trudi beswick institute directors iod,False
3502,incredible workshop unlocking hidden talent people long term health conditions learning within recruitment help businesses providing incredible workshops today,False
3503,fantastic hope see leaders one three facing harassment discrimination worried telling people could risky painfully true seen ceo say incompatible charity leadership,False
3504,see would difficult caregivers often neurotypical parents struggle relate childrens need strive understand childs different way seeing world either need help,False
3505,great rare therapists respect patient wants selfidentity mental illness brain psyche designed ptsd cptsd add mix ppl especially women get misdiagnosed myriad things,False
3506,starling offer brand new online training professionals working vse sector introduction read apply,False
3507,congratulations celebrating years supporting organisations businesses individuals passionate helping individuals maximise full potential,False
3508,dont miss season including films talks flamin alumni steven eastwood running september,False
3509,shout filwood fantastic filwood community centre bristol registering take part celebration,False
3510,nearly sure join us exploring tech used actively benefit community tech event w st september bst register,False
3511,benedetta doro offers advice candidates needing support encouragement recruitment process,False
3512,big indeed massive,False
3513,watch video gain better understanding role stimming autism info please visit,False
3514,wonderful opportunity role,False
3515,learn workplace heather flanagan,False
3516,blog talk movies shown school movies students particularly,False
3517,one go online toolkit hannah conroy giving lowdown funding free tickets still available eop members,False
3518,ffilm fer complexity skin short film speak narrate experiences learn complexities affect everyday encounters,False
3519,three years since pv established campaigned every day cyp frameworks published given much hope need come,False
3520,personally behalf group autism insurance thank,False
3521,plz take mins day sign check email cant imagine life children young people let make policies wales holistic conditions,False
3522,look forward hearing dr nola norris research conversations online conference october dr norris speaking nature learning memory autism spectrum register,False
3523,bit late ill fault new interview live buzz instagram group advocate mental health,False
3524,thanks support conversion therapy ban bill efforts create well done honored panelist would happy,False
3525,yes also counts disrespect varies much households cultures please lash someone cut life make sure verbalized ideally nonaggressively dont appreciate behavior,False
3526,grateful talk natalie,False
3527,autism kids brains wired differently hearts also connected,False
3528,mean gif complete sincerity actually saw head read tweet also explaining weeding collection development therapist last night metaphor ways hamstring cataloging home months,False
3529,going fantastic presenting working university future festival,False
3530,webinars amazing community please sign would love see,False
3531,coming soon launching online sept new show series featuring stunning artwork neelam ahmad along work kwaga sillingi marina devlin,False
3532,mel paul live,False
3533,really nice planning day events disability race well research meetings plan future studies papers blessed work many wonderful people,False
3534,asking despite least similar characteristics latter common largely afaik focuses former wondering many autistic advocates thought schizotypal actually considered autism,False
3535,paul mels mad misadventures returns five minutes,False
3536,representation matters mystery recipe podcast includes authentic autistic character,False
3537,difference knowing things called illnesses anymore hearing professional something,False
3538,exciting see programme relaxed screenings tickets available,False
3539,another brilliant nordic series katla fascinating mystery really human characters personalities sexualities everything presented organically,False
3540,weve teamed present autism cinema exploration season debates new ideas arising relationship autism cinema browse discover book tickets,False
3541,thank stay connected receive study results ready,False
3542,limitations categorising children way asks moving away core deficit approach developmental disorders,False
3543,educator scotland adhd foundation charity hosting conference exploring practical strategies support classroom edinburgh autumn tuesday october pm tickets,False
3544,develop professionals visible invisible conditions learn stronger together session sept,False
3545,followers chance read book yes would recommend,False
3546,free online event saturday pm fabulous children author,False
3547,love bit type child thriving treated like autistic child,False
3548,hi paul reflect fact govts call evidence spanned whole includes autism isnt limited v important bit work,False
3549,many employers embracing notion people think learn differently vicki thrasher shares help expedite process,False
3550,please support order allow continue work deeply deeply appreciated,False
3551,comprehensive sexpositive program kind removing stigma attached knowledge make informed informed choices,False
3552,congratulations govt response call evidence due soon bold changes needed ensure people better served justice system,False
3553,welcome back selfadvocate discuss new way sees latest episode click link listen,False
3554,big news new book brain power available preorder discover brain works train learn become best empowering inclusive guide coming february,False
3555,rcslt gave evidence criminal justice system review evidence continue work improve access speech language therapy people communication swallowing needs across justice system,False
3556,rcslt welcomes developing cross govt strategy justice system outlined evidence review review also recommended improved screening better use reasonable adjustments,False
3557,alice thats great response im really appreciative generally disability cannot seen termed invisible disability could something like faulty immune system could high cost function world eg,False
3558,among x,False
3559,youre dealing parents suddenly realize youve navigating parents undiagnosed whole life,False
3560,saturday pm join author zoom brilliant author talk elle discuss importance representation books register free tcosqrgtywx,False
3561,thank lorna mchugh sharing story dyslexia blog contains personal reflections takeaways event,False
3562,resilient first read elijah mcclain well like novels really feel knife went heart young man trying comply crying confused,False
3563,important thing recognize teaching children manner teach neurotypical children recipe failure,False
3564,wrote fantasy essentially dealing sudden onset wrote family could know felt like much appreciated support agent hoping justice,False
3565,pity decided save nhs hmp services money investment really hope continue get voices heard adhd muma handbook,False
3566,worth read powerful stories women sharing unique experiences adhd journey diagnosis,False
3567,part wayword festival join visual artist jill boyd dance performancemaker claire cunningham poet nuala watt panel discussion explores intersections creative work disability information,False
3568,outside looking hard understand inside looking hard explain,False
3569,majority students staff school amazing anyone else experienced,False
3570,know everything hip trendy person days youre feeling comfy home fancy coming virtual event saturday promise good form going informal cant wait virtually meet everyone,False
3571,next interagency autism coordinating committee meeting october want submit comment deadline october,False
3572,disagreement proponents movement see better approach neurodifferences medical model confusing divisive intervention align movement,False
3573,watch video gain better understanding role stimming autism info please visit,False
3574,sensory toys got students play whilst learning need little chalkboards got banner bootle team bunting go tomorrow lesson plans done,False
3575,really like live adhd jessica mccabe tedxbratislava via,False
3576,found really cool animated mini film value cognitive diversity,False
3577,seven years ago today presented life work peter putney vermont,False
3578,increasingly employers recognize diversity inclusion solely compliance eeo laws instead compelling business case right thing dig possibilities,False
3579,make difference attending sponsoring supporting visit,False
3580,interesting stuff twitter youtube finish nietzsche book area would like explore since learning autistic,False
3581,learn finalist city rfp process visit,False
3582,really dont get know im one fucked,False
3583,many employers embracing notion people think learn differently vicki thrasher shares help expedite process,False
3584,great big thanks everyone made live show today worries missed still view videos,False
3585,school segregation never ended lines instead racial lines,False
3586,yes phonics essential may need tools well teach gifts weaknesses dyslexia tool kit expanded edition available,False
3587,neurodivergence like adhd creates strengths well challenges,False
3588,need new autism strategy unfortunately autistic people still face whole heap challenges many areas life aim strategy make changing priority,False
3589,finally roundtable meeting booked senior ministers discuss support people fall criminal justice system lack support mainstream education im really pleased,False
3590,thanks tag kate collection mental health think call poems another place check love platforming disability mental health,False
3591,recommend project differences originals feature elements value combining information visual art explore elements positive sense value,False
3592,sensoryfriendly coworking space design shared offices,False
3593,worthwhile workshop supports autism caregivers,False
3594,early morning works students others prefer afternoon evening homeschooling provides luxury individual differences individual scheduling home school freedom,False
3595,world better place organisations like next hundred years,False
3596,thread reason never tell people one person knows well family everything thats thread happened even though proved people wrong drained depressed exhausted,False
3597,workplace valuing individuality nurturing skills via,False
3598,individuals dyslexia dyspraxia adhd often incredibly creative strategic making well suited startups ux graphic design chris hughes cochair sds workstream,False
3599,wiki aims tackle basic misunderstanding lack knowledge among nts,False
3600,really good day work feeling incredibly thankful proud newest erg,False
3601,congratulations christine awarded cihr grant purpose grant aid understanding children subacute stage recovery stroke,False
3602,hp vodafone microsoft run recruitment drives specifically targeted people organisations missing,False
3603,monthly reminders old new peeps,False
3604,foreword diversity inclusion belonging zego video focuses head experience design benny zuffolini talks challenges opportunities come workplace,False
3605,good thats typical result smokers ones physically addicted use smoking nicotinedelivery method selfmedicate australia highest tobacco taxes still decrease smoking percentages,False
3606,first part series esports part higher education media fellowship college esports coming soon stories big techbacked skills certification programs corporate initiatives follow,False
3607,oh dear read read article sort content would identified years ago know internalised ableism disability rights framing messaging essential reporting disability content,False
3608,youre acknowledging youre taking one example single individual trying imply general issue affecting people disagree following yet another personal attack someone,False
3609,vote luz dont think never joked feel like dorys neurodivergence treated joke butt,False
3610,wrong acknowledging affect influence someones perceptions interpret world around nothing wrong someone asd adhd recognizing affects perspective,False
3611,feel like incumbent upon culture org build inclusiveness perceived less human speak many co acute focus issues including disability ergs trend focusing,False
3612,wonderful happy join us mission,False
3613,ppl look r ones things differently view world opposite rest admire difference yet admire different every reason,False
3614,still realizing moms best parent definitely tries really irritating work ive done facebook reads ignored allllllllll back business usual dont care lmfao,False
