,tokenized_text,is_after_split_date
0,recently started online course called autism workplace ive taken first module far would recommend anyone works people,False
1,autistic loved one stares paces talking someone else otherwise busy please rt,False
2,neurotribes steve silberman great autismpositive look long history autism storytelling animal jonathan gottschall brains addicted stories short history nearly everything bill bryson,False
3,miss presentation collaboration hoosier alliance artists inclusion theatre dance llc view,False
4,using enable trolling next level bollocks,False
5,happy hanukkah jewish friends beyond box,False
6,yeah access work full ra assessment report issue knowing start ras definitely helped coach sounds rather interesting search engine rabbit hole come,False
7,mean,False
8,regardless age race sexual orientation ethnicity religion gender identity expression disability status citizenship feature makes unique welcome cues,False
9,including persons disabilities talent workplace thu dec pm pm utc register,False
10,done wish could edit realised option include,False
11,game internet addiction affects us children info visit,False
12,aint trying make productive focusmate person want,False
13,finished shift giving tuesday telethon remember every donation given today doubled helping atpf better serve families san diego san francisco,False
14,think tarot book without binding pages love jessica opening people self exploration tarot people need way work mind fun open via see,False
15,thinking cyclical trauma one informing always literally wild,False
16,dumb question even thin im jk good question says lot much confusion mental health different fields interact neurological condition psychological results,False
17,new heartmind online resource neurodiversityinclusive sel strategies,False
18,music music nice shopping,False
19,needs improved training academics mental health disabilities appropriate management people etc everywhere academia changing slowly going take concerted effort induce systemic change,False
20,time pose allies autistic people supporters lite one way research collaborations academics countries known allies,False
21,movement norway difficult situation whenever autism discussed publicly abaers invited comment experts comments consistently antineurodiversity harmful autistic people,False
22,differences autistic meltdowns tantrums look commonality comparing tantrums meltdowns using questions,False
23,dungeons dragons creating social community social anxiety report games publisher indicates,False
24,reality majority children unidentified misdiagnosed families let change,False
25,please dont apologise humble opinion dont want waste energy people nothing show care compassion humility around movement work hard,False
26,lets get amazing weather channel,False
27,hard function got adhd anxiety disorder paralyzing isolating depressing,False
28,need share somewhere wish wasnt relatable credit,False
29,new post autistic hull man goes home years hospital,False
30,days go addvance advent calendar top tips survive festive season,False
31,meeting humans mental illness physical disability made realize even flesh material unknown scary another thing made break like robots,False
32,would recommend collaborating behaviorists tell lies one collaborators calling extremism identity politics talking aba cured aggressive autism,False
33,want find diagnosis child empowering come along talk today via link,False
34,anyone good interesting marxist analysis work disciplining structuring social disorders working framework read,False
35,wifes article toxic nothing positive messages share around,False
36,much looking forward hosting guest lecturer efl class today w,False
37,wonderful opportunity hear lived experience flex old muscles confident communication pro excellent session disability long term conditions networks take book free place,False
38,managing director gives us newest,False
39,hi folks question members wanted light building celebration colour pick rainbow think would best hard without making stripes looks lgbtq mess purple,False
40,school prison pipeline want stop cycle move autism code socialmedical model equitable,False
41,property maintenance zetetick housing results response times speak,False
42,wanted salute thank community beautiful loved beautiful warrior,False
43,hello folks name kai studying relationship gender diversity part collecting survey data neurotypical folks age information,False
44,dont need cure autism need make living easier,False
45,matter advice guidance differently wired professonals,False
46,sum different parts never met average typical person,False
47,long proven acceptance integration differences team members generates better outcome shares methods business leaders consider,False
48,interested joining recruiter ally seeking always understand better,False
49,minds play dwayne hernandez hayden payne interview live youtube channel mycare channel health wellbeing show special,False
50,educator southern california area wanting inperson workshop handson includes collaboration time lesson ideas tech tips help learners center learning wellness,False
51,chapter book picture book dealing voice sensory issues hyperactivity comes books people embracing us rather books ask us learn rules,False
52,knowledge aces toxic stress continues grow important learn support correct,False
53,autism recovery sexual violence featured title days activism genderbased violence learn,False
54,true one things love focus person label fosters inclusion encouragement support amazing community full passionate people incredible empathy open everyone,False
55,introducing rachelle cox rachelle tells stories focus caught chat practice accessible creative industries,False
56,warrington offer sensory equipment lending library try buy used available years ago warrington funding ended happy get involved,False
57,producing documentary exploring lives people help grow understanding intrigued get touch see image email would great represented,False
58,utterly hilarious went support said dont feel struggling lecture dont attend leave course come back saying thats acceptable attendance mandatory yall preach accessibility,False
59,thrill meet champions last incredible bunch plans coming together youth work toolkit autism awareness training watch space,False
60,also help,False
61,blog discuss holiday shopping individual customers point view,False
62,another strong commitment make trinity inclusive day day,False
63,cult people even aware ridiculous getting holy crap psychologist need listen lived experience asd lol made pd dx easy ndm people want help crave identity pd,False
64,people autism people every right treated shouldnt anything like difficult treat otherwise youre denying percentage population treatment get training,False
65,whole workplace thing smacks asperger lot time,False
66,area would like strategies read full article ready get coached wondering started,False
67,want learn autism spectrum disorder asd basic facts get started,False
68,want learn autism spectrum disorder asd dont know start basic facts get started,False
69,oh wow thank sharing reading totally agree lack education persistent stereotypes exhausting,False
70,man might social share thought disabled area stop making assumptions stop discriminating stop persecuting make faux pas socially distancing entire lives,False
71,recently wrote piece related actually specific case neurodivergence entomology im sure different fields,False
72,sally gardners powerful message education listen subscribe,False
73,parent carer professional working children young people send join us today free workshop dr omisakin talking positives workshop click register,False
74,gold red often used autism broadly really rainbow seems used personally go twinkling fairy lights lovely visual stim suspect covering whole building might pose challenge,False
75,singularly unhelpful invalidating throes mental illness didnt know needed help three decades told lazy needed get organised didnt know would reasonable adjustment,False
76,looking forward welcoming elizabeth takyi aspire inspire cic later today talk workplace dyslexia like join us session please drop dm,False
77,likely also struggle working traditional environments prioritise neurotypical functioning marianne eloise read blog freelancing,False
78,arguing movement opposition aba based misunderstandings,False
79,part uk disability history month university southamptons dr kurt sylvan leading online event exploring radical empathy future mental health may look like tickets see,False
80,thank much brilliant author kay kerr list books insight autism picture books ya,False
81,welcome pandemic,False
82,today start spreading holiday cheer asked team genius share holiday season highs lows pleasures enjoy holidays,False
83,absolutely agree also look culture ask stopping people best many things work small proportion workforce carry always,False
84,tiktok therapist learning weirdness common grew believing traits struggle often judged harshly calling cards oddly enough traits people love,False
85,important fundamentals individuals engage company reflect organisation values every opportunity consider audience content inclusive could,False
86,adhd things,False
87,concept normal variations human brain account things like adhd autism spectrum disorder ocd conditions find,False
88,autism look like welcomes campus,False
89,web services team always working web accessibility game continue work support people firstgeneration students experience web different ways learn,False
90,fantastic group people committed advancing understanding great working colleagues,False
91,autistic community movement edited steven k kapp discovered interested activism advocacy discourses follow twitter thoughtprovoking threads book journal recommendations,False
92,autism parentingwhen feel like complete failure one minute invincible next,False
93,mean probably onetoone analogy yes concept comes autistic activism term coined pretty much explicitly response autistic people taking limited view looked like,False
94,pain disorders combined developmental cptsd throw balance fucking bad even didnt hurt getting around would honestly still need accessibility aids keep losing balance falling like always,False
95,relatable adhd incredibly disruptive sometimes harnessed good,False
96,making skin crawl seeing oh word,False
97,worse careful clear mean use words like means used harm us,False
98,words careful clear mean use words like means lose value us useful concepts,False
99,wecan making room entrepreneurship via,False
100,many reasons wrong diversity means matters people using diverse way means normal problem especially obfuscates entire point normal,False
101,examples conditions include adhd autism dyspraxia dyslexia dyscalculia dysgraphia tourettes syndrome often comes unique advantageous talents abilities,False
102,contemplate plurality,False
103,looking lived experiences serve educate others consider sharing story submitting pitch,False
104,though thing according judy springer diverse brain bc brain alike would set aside certain brains diverse dont mean blast mentions thinking loud ive thought,False
105,adjust wishing happy hanukkah,False
106,put practice expertise advice build ramp download box set check schedule listen live,False
107,national disability employment awareness month ndeam great success pprc hosted exclusive interview wanda k deschamps celebrate engaging talent disability inclusion revolution wanda founder liberty co champion,False
108,latest hyperfixation ive sticker creation kick,False
109,date online event beyond disorders radical empathy future mental health rescheduled friday december details,False
110,much stigma around mental health wonder people dont get support need kindness makes big difference,False
111,weeks ago introduced autistic triad st autistic bitesize tonight ill talking triad comes play socialise dont know triad find,False
112,literally training preached accessibility inclusion yet wont let lectures home,False
113,shes spent thousands hours helping autistic children spare seconds vote please,False
114,life partners rosies story rosie one first tenants one first life partners delighted still us thirteen years later,False
115,hyperfocus executive dysfunction done right,False
116,adhd autistic brain bffs adhd autistic feels like episode odd couple brain,False
117,financial sector via,False
118,good result overall sure continued dedication open inclusive accepting launch support group knocking door top next time,False
119,shared,False
120,iso reading material beyond autism add adhd brilliant nd friends good lead,False
121,mad experience discrimination workplace awesome see ilm leading research change leader thank,False
122,lego therapist awesome,False
123,hope one day psychologists consider infections initial evaluation,False
124,ok apparently quoting said,False
125,checkout module circas free online prod program autism workplace designed employment support staff better assist autistic job seekers thank leading development new resource,False
126,find triad shapes way socialise bitesize concise informative autistic available pm gmt youtube,False
127,thankyou helping raise awareness needs better understood often feel like uphill battle constant need advocate love better understood,False
128,pls visit amelia site esp esp profession holds st law struggling get reasonable adjustments selection process great tips blog design assessment centres adjustments,False
129,lovely chat swans yorkshire hepworth hildegard perception ed sanders,False
130,really pleased announced public support center received maker grant money going used pay contributors build professional survey publish journal,False
131,greatest contribution world may something may someone raise,False
132,public resource center building resource advocacy center doc supports people either know suspect might grant help take doc next level,False
133,book review clear,False
134,tapping new cyber security skills,False
135,agree love,False
136,save animals teach people,False
137,working legal field want see arent alone want learn best work colleagues join us thurs pmest live community conversation prereg,False
138,founder gone joined tiktok go give follow things employment law mental health managing law firm much heres latest one showing dubai click follow,False
139,new episode models pt looking medical social deficit models think disability difference impacts supports funding priorities,False
140,thank mentioning response today column spot describing differentlywired mind might part issue,False
141,found thread useful want read watch entire debate movement dr belmonte full transcription video available let know followup qs,False
142,fragmented ive learned sometimes need set pace matches people sometimes found hard result,False
143,seeking neurodiversityaffirming mental health practitioners trying form peer consultation group neurodiversityaffirming therapists mostly benefit lol want connect talk likeminded clinicians,False
144,similarities important differences research hear caar director dr punit shah discuss years salvesen lecture december pm sign free,False
145,days want force way train people husband written work yesterday utilizing adhd strategies workplace constantly interupts hyperfocus tedious tasks expects still quiet,False
146,learning thriving dyslexia fascinating post published,False
147,also obviously women vs men sexuality race physical mental differences every sort different way,False
148,icymi day available listen youtube hear event click link,False
149,recordings webinar event last live youtube channel organised videos playlist easy viewing follow link watch session,False
150,scores autistic people experience sensory overload leading burnout serious impact mental health study media highlights ways help prevent recover burnout,False
151,huge thank joining us online cambridge thinklab discuss current project research team lot think work,False
152,coming soon college success students autism spectrum perspective jay kuder amy accardo john woodruff practical guidance transition college career readiness graduation read book page,False
153,hope paddy dad kid neurodisability im pleased youve done forms needs light shining great job putting goes another landmark prog getting message,False
154,register supporting sel music education,False
155,data true p amazing day coming pm ill ok going go slow pm isnt good idea write tomorrow pm avoid people dont think much take hours clear,False
156,healthcare lecturer student would really interested involved want look improve support clinical placements,False
157,absolutely chuffed deliver training national autistic society yesterday executive functioning clutter,False
158,thank transparent vulnerable honest conversation ella,False
159,understanding intersection race ethnicity begin recognizing persistent racial disparities,False
160,world needs people unabashedly things heres im unabashedly fandoms community building communitydriven products media ethics endurance sports creator biz models cocreation baseball whats lmk,False
161,never exciting time join team,False
162,one go apply join specialisterne ni team currently opportunities available come join growing team passionate supporting autistic people,False
163,nice probably challenging subject terms diversity inclusion,False
164,delighted join true ability erg team morning inspiring discussion mark friday many types see increased awareness helps us understand differences,False
165,myths dyspraxia busted read blog dyspraxia myths hidden condition,False
166,fantastic resources,False
167,employers better support candidates employees disabilities paralympic gold medallist ellie simmonds shares top tips great read,False
168,project great progress huge operational challenges organisations,False
169,talk life project december,False
170,hello december first day month last day year part ongoing work around autism acceptance throughout december well shining light autistic people families across region really want christmas,False
171,turn mersey care nhs project great work exciting progress,False
172,happy pursuing potential new projects related personal journey group volunteers helped loads next monthly zoom meet wednesday december,False
173,watching paddy christine mcguinness family autism wonderful open look lives way went diagnosis,False
174,christine paddy mcguinness documentary bbc tonight fantastic demystifying autism thank sharing experience,False
175,put monthly webinar calendars months episode supporting sel music education find episode past episodes demand,False
176,amazing documentary right else watching,False
177,oh must good maths computers people differences neuro typical person means,False
178,mainstream classroom teacher slt senco tell examples great autism training learn help really sticks head,False
179,autism adhd music business andy edwards industry inclusion,False
180,deserve heard listen,False
181,senses emotions veracity triad find imagined deficit shape way socialise autism bitesize socialising,False
182,houses supported living adults learning disabilities autism needed desperately ever work commissioners well,False
183,lexicon future vol n describes idea people experience interact world around many different ways one right way thinking learning behaving,False
184,friends running series virtual information sessions fasd caregivers professionals registration free find links session,False
185,onewoman show mum undiagnosed dysfunctional families dec put together allneurodiverse creative team book donate,False
186,cvi online course opens today,False
187,anyone diagnosed autism definition autistic someone higher support needs autistic someone lower support needs catharine alvarez everyone little bit autistic,False
188,dams first community art showcase youth artists spectrum celebration denver art museum features artworks blue ribbon arts initiative organization martin buildings brand new wonderscape space,False
189,new tpga post video plus full transcript editor debate matthew belmonte movement center mind brains summit see thread prefer read twitter,False
190,facing mounting stress mental health challenges organizations need attuned needs shift perception work period,False
191,fantastic resources help young children learn understand available bargain price,False
192,support group every wed g warm safe supportive env pupils allies chat play games genius square uno includes adhd autism ocd tourettes syndrome dyslexia dysgraphia dyscalculia,False
193,tiny charity huge charity final charity today awards know weve got hardly chance winning got worth try vote could make difference,False
194,autismi beautiful brokenchallenged challengingoverwhelmed spoiledautism choiceyour acceptance,False
195,moon landing initiative brings nfts supports art nonprofits,False
196,broke giving tuesday record claimed match raising yesterday deeply grateful generosity support couldnt accomplished goal without,False
197,linkedin group come join social worker identify,False
198,children live add adhd flourish get plenty movement outdoor play handson learning add adhd tips teachers parents,False
199,dogs pawesome love dogs saying goes best friends owning dog many benefits makes active,False
200,high school teacher possibly students dont read wonderful stuff heres help without sacrificing classroom time personal time,False
201,watching uk launch could game changer agenda international reach led,False
202,school equity team wants dig deeper current work looking reading materials hear voices students board equity team says currently speced umbrella ill prepared help us,False
203,accountants like numbers colours match whether opinion smell taste knowing sensory thing,False
204,winning award would help us secure funding carry work helping thousands families autistic children need help win please vote,False
205,please donate yet k goal trying get k tomorrow make taxdeductible donation page,False
206,yes lot media coverage centre neurotypicals doesnt celebrate note check brilliant radio,False
207,suspect might find song different recommended people like lol,False
208,engaging advocacy art dance theatre martial arts,False
209,falling love making music,False
210,certain things challenging due ways superpower,False
211,excited developing peer consultation group neurodiversityaffirming therapists brilliant check thread starting qt details livestreamed info session tomorrow morning cst come join us,False
212,happy hanukkah,False
213,ep team share experiences adult diagnoses,False
214,absolutely love skill talent gifts brings art world immeasurable diversity incredible thank bobby sharing,False
215,brilliant brave paddy thank honesty help many people talk enough fact defect difference,False
216,biodiversity,False
217,biodiversity well said,False
218,lovely story celebrating generous give time energy project donated shown love encouragement thank sharing,False
219,wow wonderful story share great indeed well done raising money also celebrating,False
220,today mixed number subtraction unlike denominators kid trouble got first try without help brains wild got whole thread worth important save later,False
221,world realise huge chunk issues due take like publish knowledge always structures,False
222,many positive conversations neurodivergence general world still going shit,False
223,cmht member obs doesnt personally deal adhd issues fooking idiots agree accountability thats,False
224,premium ive come understand connected something larger johnpaul jones read,False
225,sounds like sort heartwarming content need time year watch preview,False
226,stuff people like worlds mess folks never get regardless cultures religions thanks,False
227,breach equality act surely wtaf traits bits like kind professional still thinks high functioning come significant cost less severe,False
228,amazing insightful wonderful family,False
229,social vs task priority differences neurotypes theory please rt,False
230,inspiring see honest reflections thank sharing emotional vulnerability,False
231,thank much documentary highlighting part society nothing ashamed,False
232,great touching programme help raise awareness personal journey people families go praise christine honest open diagnosis,False
233,twitter take little hot takes people find super easy change knew someone past life think actually fair especially consider also claim,False
234,went whole day without call school feel like wellness check,False
235,british art prize occupied counties ireland typical metronormative homogenous artworld liberalism would happy project art works victory,False
236,whole family spectrum runs generations loved documentary acceptance needed non acceptance brings shame negative feelings children work families spectrum,False
237,october adhd awareness orange dot ribbon sweatshirt,False
238,paddy touched sharing story tonight relate many levels speaking autism allows us break chains may otherwise prevent us living life gift amazing family amazing gifts,False
239,great work tonight wrote family highlight positive strengths autism adhd dyslexia work drive innovation performance productivity workforce,False
240,amazing honest documentary tonight paddy christine mcguinness kids autistic conclusion people autism need change rest world needs change accept welcome proud son,False
241,good hoped would well done raising awareness beautifully especially specific tendencies girls,False
242,living independently doesnt mean living without support well said,False
243,webinar getting disability inclusion right partnership join us one well joined powerful line keynote speakers sharing lived experiences register,False
244,save date friday rd december film release,False
245,sister funny always need clear instructions things thanks,False
