,tokenized_text,is_after_split_date
2869,celebration appreciated,False
2870,thank raising awareness acceptance understanding diversity makes school communities stronger,False
2871,discover ways working compliment natural way resist judging conforming neurotypical standards productivity easy possible process also struggle,False
2872,ive advocate years fought jrc autism speaks help craft laws better lives disabled people death threats family threatened lied vilified people care,False
2873,autism kids weird gift,False
2874,disappointed evening news broadcast tonight feature elon musk reporter mocks awkwardness doesnt take investigative reporter discover autistic celebrating please least train team better,False
2875,im always best rapid change rooms hair friendships even videogames part something deal getting irrationally mad damn haircut stupid mean ungodly made cry hair jerk,False
2876,join next convo things racelessness,False
2877,squaddies love community need stop acting like theyre h ms personal reps prefer ss manners make mistake dms open chat dont qt humiliate dont get aggressive,False
2878,confused,False
2879,journals neurodivergents,False
2880,weighted blankets make sounds,False
2881,thing office parties remember p practical paper plates patronising passive aggressiveness,False
2882,blues day time shine shoes day,False
2883,phrasing unmistakeably starkly pathologizing autistics dismissive model calling pseudophilosophy,False
2884,term nearly ends helpful tips families christmas,False
2885,n individual differences brain functioning regarded normal variations within human population,False
2886,flippant,False
2887,miss free webinar friday last medha gupta discusses flourishing otherness watch playback,False
2888,zetetick housing specialises providing quality housing supported living means zetetick housing source,False
2889,wholesome meme get day,False
2890,teeth grinding,False
2891,ive always insecure developmental disability im unemployed live parents ect one redeeming qualities makeup art least,False
2892,,False
2893,im keeping psychedelic studies specifically bpd,False
2894,youre reading challenge learn tourettes like brain thats wired little differently important us humans empathy understanding,False
2895,looking recs affirming accounts female w follow client grappling w understanding accepting diagnosis suggestions welcome,False
2896,neurodivergence provoking new mind sight via,False
2897,topics follow disability advocacy autism lgbtqia transgender stuff race culture ethnicity native american native alaskan first nations topics mental health awareness support suicide prevention books comics art fandom fic cool shit,False
2898,nope block gender critical transexclusionary rhetoric racist homophobic transphobic rhetoric people identify p aba ableism towards disabilities fandom exclusionists kink shamers purity police bullies basically,False
2899,,False
2900,intersectionality disability wheres within intersectionality paradigm,False
2901,entire staff know well adulthood starting nd consult group,False
2902,movement important essential community needs supported grown,False
2903,synopsis radical guide women adhd embrace live boldy break barriers,False
2904,disability studies quarterly,False
2905,little inspiration draws close many us begin contemplate might like experience new year,False
2906,interview sport podcast korfball discussed gender inclusion sport,False
2907,read latest article anyone interest adult adhd size matter adhd might talking brain size course written edited,False
2908,celebrate support child differences read,False
2909,latest podcast one series conversation pleasure interesting thank pippa,False
2910,new post celebrate support child differences,False
2911,celebrate world benefit significantly talents empathy emotional intensity certitude sensitivity ability detect details depth thought embrace many things need,False
2912,need holistic knowledge understanding dyslexia workplace right reasonable adaptions deserve strengths recognised supported,False
2913,get fab event love poetry evenings fab performance brilliant performers otherwise known brilliant performers londonbased able travel,False
2914,blog discuss part marvel cinematic universe strong representation autism community,False
2915,introduction read blog,False
2916,definition variation differences neurological structure function exist among human beings especially viewed normal natural rather pathological learn,False
2917,,False
2918,academia autistic advantage qualitative research impact social sciences,False
2919,academia autistic advantage qualitative research impact social sciences,False
2920,topic strongly supported past time goes become topic concern awareness timeline events make aware happened past,False
2921,modern workplace interesting discussion heard podcast chris rainey joined guest sara milesson vice president human resources trelleborg,False
2922,todays variation differences neurological structure function exist among human beings especially viewed normal natural rather pathological,False
2923,informed one first steps improvement one must appropriate knowledge help make change please take time read visual article ableism awareness,False
2924,anyone also require outside stimulation calm,False
2925,guys amazing community,False
2926,rt new academia autistic advantage qualitative research,False
2927,time monthly newsletter read day workweek efficient storytelling quality vs hires strategy newsletter free,False
2928,important work change committing building inclusive workplace joining team business,False
2929,seems true queer spectrum even opens door things like kink discovering like greater permission resources explore community,False
2930,hear team got involved nib via video thanks pawel dolicher aspieman studio,False
2931,one good thing transgender gaining transferable skills delicately informing trusted people different affects daily life applying also informing others disability,False
2932,brilliant cpd day coming february naomi moore presenting girls explore awareness understanding communication ways working pm,False
2933,definition variation differences neurological structure function exist among human beings especially viewed normal natural rather pathological learn,False
2934,cream indeed unveils delight diagnosis embraces asks us think disorder,False
2935,know board senior management team neurotypes represented proud make sure valued genius within,False
2936,academia autistic advantage qualitative research,False
2937,days go addvance advent calendar top tips survive festive season,False
2938,real mental health solidarity peers way important anything tech togetherness allyship critical,False
2939,forensics eye detail,False
2940,ive spent three decades using personfirst language theres growing number adults prefer sometimes passionately identify first language article spells issue well thoughts,False
2941,claire speaking autistic theological hermaneutic towards liberation theology phew,False
2942,word day,False
2943,autismfrom outside looking hard understand inside looking hard explain,False
2944,definition variation differences neurological structure function exist among human beings especially viewed normal natural rather pathological learn,False
2945,definition variation differences neurological structure function exist among human beings especially viewed normal natural rather pathological learn,False
2946,screen time onesizefitsall model info visit,False
2947,,False
2948,community brilliant geeks weirdos persist seeing things novel unique ways fuel background working cyshcn informs work,False
2949,word day woo,False
2950,lthtr staff dyslexia support group meeting tomorrow dec via ms teams email dyslexia lthtr nhsuk link,False
2951,thank anna always joy,False
2952,supported living bring change people want see although change part life happening constantly difficult many,False
2953,eeoc receiving growing number disability discrimination charges based conditions inhouse attorneys paying attention,False
2954,definition variation differences neurological structure function exist among human beings especially viewed normal natural rather pathological learn,False
2955,definition variation differences neurological structure function exist among human beings especially viewed normal natural rather pathological learn,False
2956,see beyond label community world missing big time far go much learn,False
2957,great dos donts families,False
2958,icymi newest edition g word quarterly read latest newsletter keep wonderful gifted community last one,False
2959,steps building supportive inclusive workplace employees employees valuable productive members workforce build culture supports,False
2960,many people use forever avoid relapse nicotine gum particular postmarketing surveylance longterm nicotine use reduces parkinsons disease risk may prevent aging dementias clearly helps people issues,False
2961,definition variation differences neurological structure function exist among human beings especially viewed normal natural rather pathological learn,False
2962,work gentleman whose presents extreme exaggeration hes upset part role mentor coach communicating others hear braindead useless understand analysis first review,False
2963,bring array added benefits organisation least different skillset approach,False
2964,want read incl discuss texts others feel invited join intersectional rg facilitate,False
2965,youd like attend intersectional rg arent mailing list yet check register make sure answer questions pls,False
2966,friday well discuss intersectional rg class distress adhd emily pond ken fowler jacqueline hessons influence socioeconomic status psychological distress canadian adults add adhd,False
2967,valuable powerful contributions community groups staff great hear many facets diversity considered,False
2968,intersectional reading group going years awesome eh,False
2969,super relevant neurodivergentaffirming models practice benefit evening much bias misinformation especially health professionals need sea change,False
2970,definition variation differences neurological structure function exist among human beings especially viewed normal natural rather pathological learn,False
2971,definition variation differences neurological structure function exist among human beings especially viewed normal natural rather pathological learn,False
2972,know todays find,False
2973,square peg round hole adult life ive felt place recovery stroke ive led research ive discovered moderate autism ive adult life,False
2974,one reasons im moving somewhat away term suggests experiences difficulties injustices similar obvs arent,False
2975,dont think twitter active li insta tiktok ellie middleton love content around recently started li newsletter,False
2976,mental health screening assessments,False
2977,employers adopt inclusive practices welcome workers success future belongs businesses extend efforts include,False
2978,,False
2979,twitter know find online meetings easier face face really struggle esp platforms e g teams always obvious whos speaking dont recognise faces voices anyone relate tips missing,False
2980,children responded favourably showed world trying warn experiencing vast majority people walk talk really upsets ruling elite,False
2981,sign accountability academy february pilot edition,False
2982,attending christmas social events repercussions days afterwards difficult writes blogger jenna grace,False
2983,reports phd projects website cover join working practices age austerity visible policing community engagement police community partnerships,False
2984,happy announce eys expansion strategic alliance together well revolutionise finance tax services digital economy help talent nurtured new servicenow delivery centerhttps tcokwsaqjltpn,False
2985,best support leaners blog mac gander educator three decades experience field,False
2986,also made worse due undx cant usually speak distressed ir else say think people want hear dont want cause trouble problem due stigma fear asking help means im truly desperate attention seeking,False
2987,make holiday season excitement stress holidays challenging come join us adhd chat tonight starting pm et,False
2988,word day,False
2989,vaccine clinic spots available people eligible third dose open tuesday saturday via appointment walkin staff trained support people mental illness,False
2990,person need provide documentation employers validation geek review ep haley moss embracing legal profession makes us better,False
2991,next network east berkshire takes place wednesday january pm opportunity explore early years early identification intervention follow link take part register,False
2992,variation differences neurological structure function exist among human beings especially viewed normal natural rather pathological,False
2993,january pm pm register today navigating path selfdiscovery via,False
2994,congratulations mentee receiving walter grant adriana skilled writer creating much need childrens literature featuring shes great person check full thread,False
2995,definition variation differences neurological structure function exist among human beings especially viewed normal natural rather pathological learn,False
2996,hi im author two books submitting debut ya suspense teen mom angela must choose stay abusive boyfriend rundown trailer risk future proud,False
2997,areas experience barriers minsterial training need theological colleges open meeting training requirements nd people students eg dyslexia autistic nd dyspraxic,False
2998,write nonfiction pieces well primarily importance mental health childrens literature also talk topic conferences podcasts professional development sessions,False
2999,gave ted talk last september tedxpaloaltocollege topic autism world tough place live youre must make world better everyone,False
3000,reading neuroqueer heresies im loving everything rigidly constructed id categories gatekeeping totally miss point queerness,False
3001,would define partially nonverbal,False
3002,singaporeans,False
3003,december newsletter month topic day workweek efficient storytelling quality vs diversity hires strategy,False
3004,check workplace essentials article renee rosales theara,False
3005,word day,False
3006,definition variation differences neurological structure function exist among human beings especially viewed normal natural rather pathological learn,False
3007,happy yeah still learning much concept umbrella term neurodivergencies implies different nd individuals humankind,False
3008,word day brought dictionary dot com celebrate today every day,False
3009,easy come solutions especially dont consider problem fully embrace understand messy traits often overlap different people lead different lives require different solutions,False
3010,todays,False
3011,tips time management screening tools go,False
3012,available preorder inspiring honest book presents us challenge change society treats values one another preorder,False
3013,todays,False
3014,one day like talk tattoo publication blog adhd tattooing bc def made getting easy worth talking,False
3015,blunt real always blunt tho gets shit said,False
3016,,False
3017,starting new job would important,False
3018,word day,False
3019,common ground seek common ground recognise diversity eg sensory seeking v sensory avoiding claire outlines challenge competing needs many disabled people used,False
3020,lets play olympics disclose yoursim disclosing mine vote iearned works compulsoryfor everyone apart noncitizens criminally convicted sucks queerness age irrelevant,False
3021,claires presentation full great ideas couldnt keep part book towards liberation theology,False
3022,variation difference neurological structure function exist among human beings example recognizing autism example,False
3023,definition variation differences neurological structure function exist among human beings especially viewed normal natural rather pathological learn,False
3024,definition variation differences neurological structure function exist among human beings especially viewed normal natural rather pathological learn,False
3025,modern made strides fostering dei still one area work done employees check article insights strategies inclusion,False
3026,mustread many wellmeaning campaigns encourage disclosure illness problem always followed resources necessary actually help people,False
3027,word day december,False
3028,mission start conversation every workplace raise profile across organisation clear practical training find,False
3029,movement something positive thats advocating inclusion acceptance different ways thinking however discriminate profoundly autistic attack parents try heal medical comorbidities help kids,False
3030,variation differences neurological structure function exist among human beings especially viewed normal natural rather pathological,False
3031,challenge making interpretation thats happening religious texts explicit autistic people advantage nd congregation forces us look assumptions nt majority control set,False
3032,introduction read blog,False
3033,love todays word definition variation differences neurological structure function exist among human beings especially viewed normal natural rather pathological learn,False
3034,az challenge n disability differences adhd asc whole range conditions starting dys interesting read subject,False
3035,definition variation differences neurological structure function exist among human beings especially viewed normal natural rather pathological learn,False
3036,compares used describe ethnicity tho white people didnt ethnicity neurotypical norm autistic nd deficit different,False
3037,clarification words describes variability differences people mixed group nb people sometimes describe,False
3038,moon landing initiative space thru collabs nonprofit studios artists disability would connect,False
3039,gm moon landing initiative space thru collabs nonprofit studios artists disability,False
3040,let talk ways impacts gender sexuality nd people following best describes relationship assigned gender birth,False
3041,word day,False
3042,seem lose followers tweet mental health,False
3043,published adhd autistic burnout different,False
3044,concerned sets opposite neurotypical animated breath god clear misundertanding everyone vs predominant neurotype,False
3045,helpful reductionist anthropology whole human identity located brain,False
3046,love happens word day inbox,False
3047,word day,False
3048,interesting something like see research critical studies autisticled theology,False
3049,gary keep us youre looking kindness initiative space thru collabs nonprofit studios artists disability,False
3050,april virtasant wrote importance workforce people asset tech companies,False
3051,today delivered final training session year live dark hole month see next year delivered training sessions workplaces reaching participants,False
3052,gm gm another great mention moon landing potential diversity inclusivity investment nft space,False
3053,sharing case anyone else would like offer information regarding workplace support etc,False
3054,autism world every accomplishment precious gift,False
3055,flag march takes kinds minds conference,False
3056,introduces paradigm experience divergent deficit diversity distinct experience,False
3057,definition variation differences neurological structure function exist among human beings especially viewed normal natural rather pathological learn,False
3058,v happy listening talking autism faith christian church live tweeting end term brain fried enjoying listening someone clever talk something interesting,False
3059,use terms rather feeling conform person said z etc,False
3060,neva,False
3061,job opportunity announcement got psychology similar interest autism research excellent organisational skills want make contribution communication literature join team deadline january,False
3062,firms better support employees workplace recruitment processes phil steventon paralegal tiger law authored rd article,False
3063,know im great admirer work miss pick latest book autism selfdx,False
3064,amongst kindergartners amazing observe,False
3065,better support candidates workplace check guest blog evangelist,False
3066,absolutely brilliant shocking article dr ludmila praslova harvard business review autism discrimination workplace please value contribution protect us unlawful discrimination,False
3067,big thanks todays internal introduction working autism session half team important us,False
3068,bounce squish light stretch christmas sensory ball kit promotes visual perception handeye coordination great destressor merry christmas,False
3069,think anti increase coat tails transphobia another front rw culture wars,False
3070,know little suggestion avenue research hypothesis major sensitivity texture taste etc thing short term eat theres wrong way eat fine,False
3071,true literally closest friend group token straight married one others even poly rest us mishmash lgbtqia rep chronic illness diversity norm,False
3072,late thank featuring october newsletter adhd awareness month check newsletter find link panel talk conference back october,False
3073,definition variation differences neurological structure function exist among human beings especially viewed normal natural rather pathological learn,False
3074,completely agree wrote paper terminology used ontario qubec harmful follows medical model w considering genetically natural would love push,False
3075,clarify autistic dyslexic dyspraxic despite got degree diagnosis help work science research diagnosed till clear despite still empathy people care,False
3076,probable idea would expand term include gnc experiences experiences also vein minority totally benign variations human experience,False
3077,word day,False
3078,doesnt hold people back work discrimination via,False
3079,definition variation differences neurological structure function exist among human beings especially viewed normal natural rather pathological learn,False
3080,developing solution thru age u based years work give us min get min true inclusive women lgbtq,False
3081,noticed trees wonders mighty minds wonders words spoken silence,False
3082,nope flagged yesterday gap input via lens critical disability studies critical autism studies brought paradigm today due speak yesterday tech,False
3083,definition variation differences neurological structure function exist among human beings especially viewed normal natural rather pathological learn,False
3084,yummy chocolates getting ready christmas ho ho ho,False
3085,conference looks interesting takes kinds minds,False
3086,todays,False
3087,im calling people yr whod interested sharing romantic relationship experiences views current past sex education short mins survey,False
3088,noorohdivursitee dahy nyoor noun variation differences neurological structure function exist among human beings especially viewed normal natural rather pathological,False
3089,learn differently hear suggests managers coworkers embrace differences comes fostering help tech industry become supportive ever,False
3090,therapy implications huge know exists yet tell twitter healing requires x teach empathy z whole branches psychology hinge believing universally correct thinking formulas,False
3091,two ways interpret results thread one way say wow overlap queer huge way say gender sexuality sure seem heavily informed changed hmmm,False
3092,empowers naomi rubin costar seasons,False
3093,know half employees say clearly defined instruction support helpful thing employer darn secret,False
3094,smart employers embrace makes teams capable,False
3095,want hear see unending parade amazing clothing may suggest following currently progress seen finished loved,False
3096,ey built teams jumpstarted innovation,False
3097,tiktok discriminating autism,False
3098,autism shows adhd anxiety affect stuff idk feel new nd community,False
3099,anyone reyes syndrome,False
3100,results,False
3101,anyone visual auditory processing challenges diagnosed,False
3102,said repeatedly way informs things likely enough make us diverge cis hetero allo various ways heard reacting ad nauseam straight guy wants claim queer missing,False
3103,saying doesnt affect lmao,False
3104,word day variation differences neurological structure function exist among human beings especially viewed normal natural rather pathological,False
3105,seizures cause,False
3106,seizures classed nd,False
3107,ots page facebook series posts sidebyside comparisons traditional ableist approaches ndaffirming approaches found insightful,False
3108,adult community mh meeting person offering strengths based plan normalising offering alternative view pretending expert know strategies one fits support people discover,False
3109,anyone interested exploring topic x free,False
3110,terms quotient would position abnormal limited cognitive skills inclined pathological behavior,False
3111,feel lack cultural awareness culture within population groups could factor presenting barriers,False
3112,course label conversion therapy call support understand environmental context life experiences support gain valid consent capacity assessment addressing trauma exploring meaning identity bad,False
3113,yes sure makes think experience theres nothing less neurodiversityaffirming training professionals assumes nobody room,False
3114,let celebrate,False
3115,regular monthly rant something matter world,False
3116,didnt know movement paradigm college learned social model ots need promote principle making environments accessible usable everyone changing people,False
3117,working school challenge learning affirming addressing emotional regulation lot existing approaches based teaching children right generally neurotypical ways stay calm focused,False
3118,interesting r think seen affirming affirming guess makes sense,False
3119,word day,False
