,tokenized_text,is_after_split_date
1687,im ashd dyslexia club perhaps thats ended halloween party lions ricky definitely help creativity,False
1688,call police get mandatory training officer assaulted young autistic boy school channel news,False
1689,latest blog talk rituals like raksha bandhan pave way harmonious codependence among siblings read latest blog email dms always open doubts queries,False
1690,call police get mandatory training officer assaulted young autistic boy school via,False
1691,inset monday fabulous see schools embracing understanding importance staff needed aware,False
1692,r e psychiatry uk adhd assessment assessed doctor specializes child adolescent mental health psychedelics doctor specializes adult,False
1693,assessments provide dyspraxia assessments legal education employment purposes provide assessments zoom facetoface psychologists experience related conditions,False
1694,vision prioritize human potential strip away mentally physically routine predictable left complex messy work requires collective intelligence jobs likely n,False
1695,hey quanta hiring writer would see interested hiring write research seems like would fit nicely overall mission maybe apply young autistic person wants writer,False
1696,restorative ground takes expansive view street seat playground calm refuge place meet friend landscape explore public diverse public realm providing experiences,False
1697,cloud exec rob enslin talks workforce autism career program seeks top talent,False
1698,episode today talk twiceexceptional learners learned much think check,False
1699,collective approaches making support artistic practices work artists different neurotypes ensure support listen back last months conversation yoki chris art studio,False
1700,people really make difference workplace assistive technologies job application processes pose much less problem,False
1701,need better soon relied upon call police get mandatory training officer assaulted young autistic boy school via,False
1702,also talk like abstract thing people learn different ways different cognitive styles dont actually seem get staff thats language around accommodations really insulting,False
1703,months ago attended national conference one topics attended session nothing curiousity mind completely blown away guest speaker sarah taylor,False
1704,superpowers coping skills gained response trauma often feels like disability superpower,False
1705,next st oct designing mind fancy joining us book,False
1706,companies increasingly prioritize initiatives critical incorporate efforts explore shedding light benefits employees bring,False
1707,memory loss,False
1708,free work report download page report featuring practical advice range employers click login register free access,False
1709,video episode live episode international speaker author learning coach susan fitzell explains way future thanks show,False
1710,put together handy backpack checklist help pupils ensure everything need get routine getting ready school check,False
1711,fueled belief competitive business advantage cofounder shares voices never demand learn ows businesses,False
1712,theme,False
1713,every day youre teachers childrens books help kids grownups see beauty start make societal shift mere awareness complete acceptance,False
1714,thanks inviting ecs present work experience projects developed collaboration great listening check youtube channel,False
1715,believe remember hard find struggling best moment moment come,False
1716,aww big guy gave big smile first day back school positive vibes new school year,False
1717,workplace strength make room emma recognize patterns within complex code james develop several different solutions complicated problems unlikely either find job specialist skills,False
1718,many employers embracing notion people think learn differently vicki thrasher shares help expedite process,False
1719,published document inclusion checklist organizational success outlines best practices recruiting hiring retaining advancing providing longterm support individuals,False
1720,cw police brutality ableism ableist hate crime violence children amount training going stop officer assault disabled child result deep institutional ableism within police justice system large,False
1721,tile webinar supporting education dr chiara horlin dr elliott spaeth oct pm uk register,False
1722,heyy someone adhd absolutely cannot use planner recommend checking one made someone adhd catered bought one seriously considering,False
1723,kid may fit mold mean successful might trajectory new episode talks twiceexceptional learners love listen,False
1724,kid may fit mold mean successful might trajectory new episode talks twiceexceptional learners love listen,False
1725,kid may fit mold mean successful might trajectory new episode talks twiceexceptional learners love listen,False
1726,kid may fit mold mean successful might trajectory new episode talks twiceexceptional learners love listen,False
1727,kid may fit mold mean successful might trajectory new episode talks twiceexceptional learners love listen,False
1728,kid may fit mold mean successful might trajectory new episode talks twiceexceptional learners love listen,False
1729,kid may fit mold mean successful might trajectory new episode talks twiceexceptional learners love listen,False
1730,kid may fit mold mean successful might trajectory new episode talks twiceexceptional learners love listen,False
1731,kid may fit mold mean successful might trajectory new episode talks twiceexceptional learners love listen,False
1732,kid may fit mold mean successful might trajectory new episode talks twiceexceptional learners love listen,False
1733,kid may fit mold mean successful might trajectory new episode talks twiceexceptional learners love listen,False
1734,kid may fit mold mean successful might trajectory new episode talks twiceexceptional learners love listen,False
1735,kid may fit mold mean successful might trajectory new episode talks twiceexceptional learners love listen,False
1736,kid may fit mold mean successful might trajectory new episode talks twiceexceptional learners love listen,False
1737,kid may fit mold mean successful might trajectory new episode talks twiceexceptional learners love listen,False
1738,kid may fit mold mean successful might trajectory new episode talks twiceexceptional learners love listen,False
1739,kid may fit mold mean successful might trajectory new episode talks twiceexceptional learners love listen,False
1740,kid may fit mold mean successful might trajectory new episode talks twiceexceptional learners love listen,False
1741,kid may fit mold mean successful might trajectory new episode talks twiceexceptional learners love listen,False
1742,kid may fit mold mean successful might trajectory new episode talks twiceexceptional learners love listen,False
1743,kid may fit mold mean successful might trajectory new episode talks twiceexceptional learners love listen,False
1744,kid may fit mold mean successful might trajectory new episode talks twiceexceptional learners love listen,False
1745,kid may fit mold mean successful might trajectory new episode talks twiceexceptional learners love listen,False
1746,kid may fit mold mean successful might trajectory new episode talks twiceexceptional learners love listen,False
1747,kid may fit mold mean successful might trajectory new episode talks twiceexceptional learners love listen,False
1748,hiring computer systems category spectrum identify learning social disorders apply sept bring new ways thinking ssc,False
1749,tomorrow day cant wait see flexschoolers start school year,False
1750,hey heres post might missed read essentialness selfcare,False
1751,ocd anxiety disorder characterized obsessive thoughts well repetitive behaviours one feels compelled information please visit visit,False
1752,reading lifelong process taking look child relevant set wider milestones key part recognising somebody struggling reading,False
1753,ive say im super proud article ive handful folks reach share experiences program easily one best parts day,False
1754,recently realised might thing family conversation mum today always wear jumper oh dear always see oh yes dear ive got ten,False
1755,call police get mandatory training officer assaulted young autistic boy school,False
1756,diversity conference update dr lutza ireland reminds us theres lots intersectionality within words harvey blume may every bit crucial human race biodiversity life general,False
1757,personally im hoping shops sell blue pumpkin basketss autistic children stop im spectrum many us autistic dont like color blue along puzzle piece use color gold rainbow ribbon,False
1758,ive asked write piece adhd hsp probably going use starting point video hypothetical future make videos something antisemitism short version adhd hsp asd share lot,False
1759,asperger would rate highfunctioning enough still contribute society fine cool nazis,False
1760,completely ignore research concept certainly odds thier goals thats case really different andrew wakefield,False
1761,weeks go next hmsa professional hypermobility masterclass meet speaker thread dr jessica eccles presenting emerging themes evidence implications future practice,False
1762,attracting talent diversity inclusion become one important topics workforces society whole rightly,False
1763,cctv footage obtained exclusively channel news police officer seen threatening kick yearold boy lying ground officer grabs drags along floor room,False
1764,many ways watch language arts,False
1765,love curious form please join us guided wine tasting,False
1766,family autistic child assaulted police officer school called officers receive mandatory training deal children similar conditions,False
1767,looking books celebrate inclusion differences check amazing list,False
1768,autistic people word allistic refer people without lived experience trans people word cis describe people without lived experience trans would anticipate black communities conversational need,False
1769,many employers embracing notion people think learn differently vicki thrasher shares help expedite process,False
1770,looked social profile appears isnt affirming based language framework placing children play groups within social levels lead disruption fighting worry ax based nt social development,False
1771,shocking footage police officer concerned prosecuted convicted highlights training severely lacking quarters,False
1772,specialisterne canada recruiting excited partnered cibc hire several positions toronto learn apply visit application deadline september,False
1773,would consider creative folks autodidacts used ai change enhance passions careers would dream interviewed feeling could interested see ai,False
1774,new picture book series kids via,False
1775,kinda hate someone compliments irl never know say usually either end saying nothing start laughing like dumbass,False
1776,hp vodafone microsoft run recruitment drives specifically targeted people organisations missing,False
1777,inperson online wish best new year ahead also reach us need support,False
1778,tbf never know creativity combination things give different way viewing world means provide commentary unique perspective,False
1779,many employers embracing notion people think learn differently vicki thrasher shares help expedite process,False
1780,autism parentinga world every accomplishment precious gift,False
1781,especially love many us choose see gift much,False
1782,people disabilities mental health conditions even people enjoy consuming audiobooks deserve reasonable accommodation learn along everyone else,False
1783,whether despite aesthetic insights always first rate,False
1784,great article totally agree authors workplace strength make room via,False
1785,completely agree although surely training range behaviours policing needs big overhaul social service rather minimilitary arm government,False
1786,new hearing aid travel,False
1787,giving autistic children ptsd school psychology today,False
1788,means throwing back instant classic movie one rare representations hallmark repertoire overall good movie,False
1789,please help one children tourettes syndrome wales adults,False
1790,new content alert sitting lk music friday chat things music shape industry course playing tunes ya video goes pm hope tune,False
1791,author alone feeling like society sees starryeyed positivity might start overlook forget daily challenge dyslexia take talk,False
1792,thanks dero struggles certain things tremendous aptitude others early recognized kitchen happy place palate extraordinary complained lack balance monotextures etc try keep,False
1793,planning big intermedia project intersection gender diversity specifically transness,False
1794,great news company hosting panel bad news mental health day,False
1795,thanks kate think sen needs making stressful desperately need wellsupported coming small school going shock big school wellversed,False
1796,academic realm also quite present broader culture whole lot people adopted terminology paradigm still thinking ways rooted pathology paradigm source,False
1797,terms paradigm presence culture community much mixed bag one hand paradigm deeply meaningful liberating many people hand problem arisen,False
1798,common days see website article uses word proceeds talk autism forms neurodivergence highly pathologizing ways example referring conditions promoting,False
1799,growing popularity term led widespread appropriation buzzword lot individuals organizations understand implications still much thinking operating within pathology paradigm far,False
1800,call get mandatory young,False
1801,need fixing understanding accommodating via,False
1802,whether someone autism training assault adult assaulting child offence,False
1803,watch,False
1804,premium stealth dyslexics often compensated reading pattern check article learn,False
1805,upcoming coffee morning next carers around sth ldn girls dx suspected,False
1806,need go beyond gender diversity manifestos need see well,False
1807,unfortunately uncertainty around whether disclose diagnosis employers create barriers individuals,False
1808,setting tomorrows hacking autism hackathon richardson texas,False
1809,ppl coined term still alive participating movement,False
1810,workplace strength make room via,False
1811,upcoming film nonspeaking woman searing brilliant debunks myth insights movement relevant certain class autistics mustsee everyone,False
1812,understanding autism naoise dolan interviewed pandora sykes,False
1813,workplace strength make room via,False
1814,like whats even point discussing systemic ableism completely ignoring system part mentions hans asperger completely context movement isnt radical head ass,False
1815,disorder disability promotes social model society unable accept diversity humans diversity using term idendifying yr self different disableddefinition given,False
1816,googled giftedness find sources,False
1817,pls stop saying neurodivergency pleaseeeeeee neurodivergence,False
1818,use term remove stigma disability society accepts way obstacles removed term definition given judy singer becouse many using term wrong way,False
1819,find build support nuerodiversity workplace today,False
1820,across number differences sadly value means lot,False
1821,understanding colleagues flexible work culture individuals reach potential recognised highly valuable employees,False
1822,set group social workers still absolutely shocked total lack awareness stigma ok social worker needs change,False
1823,especially think people always existed anything would guess people likely good friendships,False
1824,glasgow lives angela still got stigma great piece via,False
1825,dr tony lloyd oct colin foley emma weaver october adhd foundation charity present annual virtual adhd virtual conference partnership,False
1826,workplace strength make room via,False
1827,oh everybody feels like know dont cos theyre join use brain story map senses uniquely shapes world,False
1828,well isnt means sorta rejects idea particular brains normal healthy particular brains abnormal unwell implicitly,False
1829,examples epilepsy tourette syndrome synesthesia people conditions neurotype diverges understand typical neurological makeup helpful framing,False
1830,seems way must fit tho least opposed normal healthy brain,False
1831,framework view feels skewed actually means adhd dyslexia example specific words use describe particular set symptoms deal paradigm conditions fall,False
1832,depends ask cuz bit fuzzy generally people consider ones separate,False
1833,lead first day youngest emotional wrote poem capture feelings,False
1834,probably one favorite resources share people unfamiliar terminology,False
1835,inspirational pioneering special education head teacher ania hildrey present virtual adhd conferemce educators day october book conferemce day,False
1836,distinctly putting adhd spectrum isnt synonymous autism said true similarities commonalities theyre comorbid reason,False
1837,moment thought usa things tend happen see uk officer fired assaulting young autistic child downright criminal enough hurting autistic vulnerable kids adults shame u police,False
1838,build support workplace,False
1839,claims warfare lot like class warfare sure theres war going historically onesided gone completely unnoticed uncommented dominating force,False
1840,autism word trying describe millions different people,False
1841,new hearing aid travel travelling deaf hard hearing pandemic hard enough,False
1842,autism would made much difference know back,False
1843,young people adhd report disordered substance use lifetime learn done,False
1844,different realise understanding differences ask assessment life would radically different id diagnosed autism adhd teen instead late thirties,False
1845,experiences really show hiring team benefit business lives people may think little differently also reminder us search things unite us common humanity,False
1846,crime one us crime us,False
1847,kinds diversity enhance worlds argue people least aware least understanding people assume cannot process something trying hard enough worse care,False
1848,hello lovely people delivering lecture parenting adhd morning uk time would like view lecture via zoom please get touch share link happy answer questions throughout,False
1849,never ever totally inappropriate work normalizing kids spectrum depressed committing suicide,False
1850,foundation special wonderful granny started dad recently visited craft centres atlas mountains amazing see far trainees come,False
1851,workplace strength make room via,False
1852,troubling part entire article fact solution waste money time training training developed social justice ideologies zero evidence benefit,False
1853,noticed significant articles autism erased online something make sure articles archived online remain accessible,False
1854,recently shared clonakilty website removed article awarded designation autismfriendly town irish autism advocacy group article described everything town done neurodiversityfriendly inclusive,False
1855,thread noticing significant articles merits articles support paradigm disappearing online feels like minor still relevant parts autism history erased concerns,False
1856,refreshing humbling,False
1857,workplace strength make room via,False
1858,sick equally disturbing whatever fuck training,False
1859,teachers parents clinicians help support minimally children noticing ways child may advocating even without using language watch full webinar nuance today,False
1860,call police get mandatory training officer assaulted young autistic boy school via,False
1861,like get fights never say anything people say thinks without knowing jack shit psychology spreads misinformation take mental health professionals know,False
1862,neurodivergence provoking new mind sight via,False
1863,article sooo disappointing trudging along helpless personality equally warning tempting melodrama doesnt bring equation mothers fault bullshit psychology today united kingdom,False
1864,vital support workplace ensure safe accessible environment ever l teams central role play learn recent blog,False
1865,thank much kind words wapo byline particularly indebted accepting pitch putting us touch peerless creative partner expanding understanding,False
1866,parents autistic children please take note important post,False
1867,acceptance,False
1868,workplace strength make room story dr dr click link image access full article min read,False
1869,made symbol falsely represent,False
1870,wait thought rainbow infinity symbol,False
1871,santas best boy chengsang xmas australia fic fluffy praise kink demisexuality therapy e k,False
1872,workplace strength make room via,False
1873,shout people long dope conversation never heard forgot next day,False
1874,workplace strength make room dana l ott,False
1875,learn companies understand different individuals communicate vary understanding social norms individuals,False
1876,absolutely infuriating seeing liberals saying cops need training replies know beat fucking child would acceptable neurotypical kid,False
1877,sometimes want apologize behalf neurotypicals ugh,False
1878,studying odd help think remiss diagnosis symptoms align much w cptsd sensory issues linked,False
1879,learn companies understand different individuals communicate vary understanding social norms individuals,False
1880,poor treatment common eds pts see final report download many edsers asked asd assessment unfortunately nhss first take included mixing mrs serious mh pt,False
1881,please donate help mother autistic son struggling employment housing transportation half funded one away eviction need,False
1882,learn way teach lean teach way learn,False
1883,criminalisation must stop fundamental abuse autistic persons rights,False
1884,example nearly three children diagnosed adhd anxiety disorder via,False
1885,wonderful words ella medium poetry giving voice unheard thanks ill share voice years cohort students course teach understanding autism,False
1886,great resource schools,False
1887,workforce logiq webinar expanding conversation hiring retaining people autism,False
1888,join texthelp october celebrate secure spot get latest provision meeting diverse learning needs,False
1889,help reach objectives productive removing making easier access,False
1890,yesterday son told loved showing people things buzz learning cared said completely understood people become teachers tell autistic people empathy,False
1891,thread good share v thanks spotting,False
1892,fact fiction,False
1893,strategy cops cyborgs fucking human empathic human feel know handle fellow human distress,False
1894,dyslexia awareness month approaching looking ed tech people could talk beauty benefits ed tech recommendations thanks,False
1895,many employers embracing notion people think learn differently vicki thrasher shares help expedite process,False
1896,oh friends like thing theyre serious never even considered possibility picking one thank insight try organizing bit better looking means x,False
1897,many employers embracing notion people think learn differently vicki thrasher shares help expedite process,False
1898,never dont ever sign high iq simply curiosity dont stick one thing get career find success helps focus things want complete making plans list tasks dos,False
1899,also anxiety response go along wrll,False
1900,logical thinking curiosity evidencebased decision making fresh perspectives benefits brought,False
1901,workplace strength make room,False
1902,sensoryfriendly tourism stella waterhouse,False
1903,workplace classroom strength make room,False
1904,thread supporting findings research lecture based targetting therapy genetherapy take care,False
1905,understanding colleagues flexible work culture individuals reach potential,False
1906,excellent forbes article looking future work plan flex hours hybrid work freelance work support mental health human experience purposedriven work,False
1907,global population implications workplaces,False
1908,feel like parks rec completely accidental showcase ron lesley april andy ben chris tom basically donna jerry nts office,False
1909,adult adhd new disorder fact whilst people date discovery adhd far back sir alexander crichton wrote attention diseases new disorder,False
1910,even begin discuss race ignoring kind thing,False
1911,disabled people single queer person ever born appalachia know thats sure,False
1912,bathroom breaks,False
1913,venting state world matter side,False
1914,fell trap awhile let work together go revised version,False
1915,note often happens movement leader draws attention something ive tweetedthis kind hate abuse directed autistics part encouraged movement okay,False
1916,hey heres post might missed read essentialness selfcare,False
1917,misunderstanding thoreau reading literature life via,False
1918,workplace strength make room via,False
1919,workplace strength make room conversation,False
1920,thank highlighting diagnosed months ago awesome feel alone enjoying special interest,False
1921,disagree article says dna frequently inherited proxy dna driven physiology look fox might think dog dna sequencing know vulpine canine,False
1922,must listen tasmanian dr maddi derrick psychologist diagnosed adhd two boys adhd founder adhd advocacy australia talks society education inspiration,False
1923,distracted child usually uncomfortable child lights odors noises things dont notice may painful student tutoring tips sensory comfort,False
1924,joining us live webinar emma weaver director early year service details register place click,False
1925,understanding,False
1926,great example someone suffering adhd let ban conditions deficits right environment focus strengths potentials fulfil whatever label sen equal stupid less,False
