,tokenized_text,is_after_split_date
4800,sorry know im confused thought judy singer coined term thesis,False
4801,ive done discord server ready youre creator uses fae themes represent disabilities queerness send dm request invite server boosting marginalized voices fun way,False
4802,anyone expects always agree group milieu please unfollow never agree anyone think ive learned allow nuanced thinking become part thought processes,False
4803,reading first pages made eyes roll bad already autistic preferred autism use autism good severe autism,False
4804,loving postpresentation discussion around implementation science partnering schools best support children fantastic conversation also happening seeing dld,False
4805,beautiful,False
4806,seem part wonderful supportive community centered around probably go ahead block community ever made welcome save discord,False
4807,evening conversation mum emotional toll masking whilst fully aware without mentioning masking time always around parents theres,False
4808,think okay disabled students autism bipolar adhd odd etc locked closets restrained meltdown school could vote would say absolutely,False
4809,think okay disabled students autism bipolar adhd odd etc locked closets restrained meltdown school could vote would say absolutely,False
4810,practitioner band posts lowdham grange hmp ranby gartree prisons new developing pathway care would love posts filled speech language therapists,False
4811,theres also trauma element addition considered psychological factors contributes according researchers,False
4812,join us talk judy singer coined term dr lawrence fung nuerodiversity project,False
4813,exhibition announcement completely hustling place manchester central library opens thursday st october brand new work artists direct venture arts studio find,False
4814,learning different ways kids think,False
4815,theres new season gonna binge seasons today,False
4816,book would amazing,False
4817,always brewing ideas one sure lets see currently hopper themes liv still trying illustrate publish continue blog work fulltime lol,False
4818,love,False
4819,well shit sherlock movement saying ages glad rest world finally catching,False
4820,organizations hire leverage talent create inclusive environment via,False
4821,working followup get rest story told get back blogging science blogging good shit moment crowding brain,False
4822,im adult adhd diagnosis yes phd adhd thats thing also bunch autistic traits blog adhd blog network amazing though semihiatus see also write things,False
4823,excited kicking events today interactive workshop focused,False
4824,things stand pretty much time mentioned context trainees difficulty propagates negative stereotypes,False
4825,last time reviewed recruitment process time proactive recruit especially want get best person job,False
4826,awareness,False
4827,gatekeeping adhd symptoms allowed manifest situation roommate warning ranty post lol,False
4828,cross none us realised running donated please donate care,False
4829,im looking intro channel schools club ppl phd students gjajsdkfkgg,False
4830,ready day day workshop embracing thrive roundtable discussing localisation impacts get stuck,False
4831,happy wednesday followers please join helping raise awareness pags unique bespoke assessment goal planning tool mood stars helping children identify emotions tag like share,False
4832,highlighting important topics workshop challenges people intersection queerness face community larger ai world,False
4833,adhd assessment fortnight starting think hp fandom caused queerness,False
4834,announcing queer ai workshop social year highlighting diverse range topics including animal rights castebased discrimination,False
4835,pm stopped working im working document perks us get including hyper focus ironic would hyper focus writing hyper focus probably go bed,False
4836,thanks helpful thing working access housing services local govt,False
4837,stop trying fix,False
4838,member team works learning disabilities issues also level interaction team hrc mental health commission,False
4839,news yesterday thought important remind others cure autism lifelong latest collection celebrates challenges,False
4840,yesterday clubhouse talked growing adhd dyslexia conditions caused variations human brain interested concept interesting talk,False
4841,friendly reminder popularized preexisting term e,False
4842,,False
4843,perpetuating outdated info stereotypes using identityfirst language worrying autistic student member bps attended excellent webinar last presenters could easily rewrite publication acceptable way,False
4844,weeks struggled get anything last days bulldozing way work piling glad understand shame lifting,False
4845,interested autism probably autistic,False
4846,changing autism conversation,False
4847,tips managing unstructured times school,False
4848,folks u k please sign important petition h,False
4849,love spectrum back makes hearts feel full michael wonderful entire cast wonderful lovely wish get see screens,False
4850,preventing would meant id much less successful career id opened new doors people among many things,False
4851,,False
4852,individuals receive interventions help face fewer barriers challenges without detracting human rights sense belonging absolutely,False
4853,kia ora rory terms grants set funder te hiringa hauora talked said wanted make sure issues around conflated mental distress,False
4854,preventing autism comment dm like share thoughts allies please share retweet etc like many autistic views possible,False
4855,language ever tire writing ask user experiences advice regarding care,False
4856,write big one presss blog id like see changed disability community next years,False
4857,post earthquake like everything several mm place must fix,False
4858,believe could training include deescalation training connection background info communities area cops get training te reo nz sign language recognizing responding,False
4859,calling students interested mental health want meet others similar experiences join mental health society students without lived experience find,False
4860,highly commended year mj achievement awards recognition work support workplace,False
4861,age representation voices louder ever still face issues people ghosted disclosing dx autism adhd ofc people wont gel last time checked someones mannerisms quirks dont change due dx disclosure,False
4862,dyslexia means difficulties mainly loads positive attributes listen joint podcast wonderful october talk technology support,False
4863,sure youre looking found great book radical guide women adhd embrace live boldy break barriers,False
4864,positive strengths project diverse advantage people autistic spectrum excel learning enhancing subjects skills resourced personal development space,False
4865,business case supporting work,False
4866,positive strengths project diverse advantage dyslexic person monitor situations issues bigger picture perspectives,False
4867,little bit feedback one participants group sessions relaxed easy going everyone friendly made feel welcome young person aged,False
4868,positive strengths project diverse advantage person adhd excel without concentration breaks,False
4869,ever tried colour tinted dyslexia reading glasses listen subscribe,False
4870,positive strengths project diverse advantage dyspraxic person advantage problemsolving strategic,False
4871,ya thats neurdivergence,False
4872,business case supporting work,False
4873,love born freak got divergent mind work,False
4874,business case supporting work,False
4875,crucial make informed decisions selecting behaviour analyst child info visit,False
4876,business case supporting work,False
4877,mmm children hospitalised infections closer medical scrutiny whilst sick probably less masking wonder pattern carries intakes children injured accidents,False
4878,business case supporting work,False
4879,absolutely long overdue,False
4880,people things different way get end sometimes giving us chance show,False
4881,wow finally booker prize redeems book winner poetic hymn beauty nature stars read short review spoilers,False
4882,awesome represented media especially television,False
4883,brain charity employment team really looking forward opportunity promote workplace liverpool business fair october,False
4884,next masterclass series takes place tomorrow pm dr mary doherty dr doherty conversation professor fiona mcnicholas ucd topic autism medicine register via eventbrite,False
4885,blog cover fired job better prepare moment comes,False
4886,untapped pool immense potential,False
4887,understanding basic training accessibility assistive technology form part foundation teaching qualification case currently,False
4888,shout coláiste clavin ireland registering take part celebration,False
4889,fascinating discussion intersections queer identities supported,False
4890,researchers looking individuals autism spectrum disorder diagnosis ages research study examine effectiveness tms restricted repetitive behavior asd register,False
4891,follow link read rhodas story,False
4892,yearold nt girls better sniffing seasoned professionals everyone tiktok needs stop selfdiagnosing go find nearest grade cheerleader theyll know whether ur immediately,False
4893,,False
4894,want make teaching inclusive curious support learners tune october learn,False
4895,thought day asked intervene young autistic family member child education system video presentation reception period children another sws la people would good idea imv,False
4896,taught talked schools started educating children young age know understand neurotypes save lot ill health improve quality life overall,False
4897,day kicking thinking queerly hosted fabulous thank starting clear explanation using queer inclusive term,False
4898,people leaving malicious reviews vulnerable woman targeted community relentless harassment,False
4899,hbr done pieces might suit heres one also cant recommend neurotribes highly enough,False
4900,center academic excellence hosted jenny root phd professional development called universal design learning framework learn cae visit,False
4901,congratulations melwood ability awards impact award winner autism work program work helping organizations realize benefits join us october honor winners,False
4902,shout st josephs catholic primary school surrey registering take part celebration,False
4903,employers starting see autism advantage employees read,False
4904,tune today learn work program,False
4905,literature,False
4906,hello annelaure nice meet may interested upcoming talk part speaker series,False
4907,may interested learning neurodiversty school,False
4908,hugely excited hear tonight topic evening still time join us even catch last talks recorded,False
4909,highly commended year mj achievement awards recognition work support workplace,False
4910,range differences brain function behavioral traits anu mandapati vp inclusion explains untapped potential recruiting team employees read,False
4911,ur telling whole time neurodivergency,False
4912,check latest episode featuring listen subscribe,False
4913,support de goals,False
4914,thanks inspiration credit heidi journey facebook,False
4915,autism resources youth adult transition,False
4916,acceptance information morning amanda maguire wed september session join amanda presentation following themes process acceptance,False
4917,typical interviews narrow filter encourage folks good interviewing discouraging qualitative assessment engineers typically imprint interview use validation rarely look change techniques,False
4918,enter new school year psychologists warn parents teachers toxic environment children living autism may lead diagnosis ptsd,False
4919,shout central queensland university australia registering take part celebration,False
4920,autism courage always roar sometimes quite voice end day saying try tomorrow,False
4921,heyo map mentorship advantage program look awesome events semester,False
4922,wonder long take give trying fit existing work structures say fuck start support service tbh like truly wondering right,False
4923,business case supporting work,False
4924,thought spirituality couldnt factor according dsm also would cause development multiple alters,False
4925,thats good question one twitterfriendly answer almost many origins endogenic systems many endogenics multiple reasons many reasons complicated spirituality big ones tho,False
4926,looking earn professional certificate check learning differences certificate offered online educators professionals work students apply,False
4927,im starting think mental conditions small thread promise im busy whole rant,False
4928,often gap friendly marketing companies reality accommodations workplace good example experience autistic dedicated program,False
4929,conversation came talking anxiety accessing healthcare due fatmisia ableism gps didnt get mental illness,False
4930,joining cofounders today uncover power learn efforts create future everyone welcomed included,False
4931,ill fantasycon weekend reading angels l friday evening panels religion horror saturday youre going please say hi,False
4932,eys program may advertises,False
4933,check new article spoke four incredible women community workplace obsession eq levels,False
4934,mental health screening assessments,False
4935,dont know appropriate thought talking doctor sounds fairly typical special interest,False
4936,business case supporting work,False
4937,shout st peters church england voluntary controlled primary school essex registering take part celebration,False
4938,ever lasting effect think,False
4939,sometimes people check inclusion representation boxes remain skeptical hallmark indeed upcoming holiday movie featuring black autistic character played black autistic actor story,False
4940,honestly could start anywhere great mental health rep hurricane season become planet gorgeously written books realistically depict characters nuance highly rec,False
4941,good news even movement fight,False
4942,queer poly disabled autistic feminist adhd finished master counseling work college students currently makes difference world see someone queer someone autistic blast running group,False
4943,fascinating points raised today misconceptions education communication lots think take use within thank expert hosting,False
4944,andrew discuss whether medicating children right approach check episode,False
4945,congratulations great meet person description lifechanging many room,False
4946,nurses spare hour empty wall mound touchy feely fabric staple gun make sensory wall,False
4947,range differences brain function behavioral traits vp inclusion explains untapped potential recruiting team employees,False
4948,parenting podcast helping teen get motivated dr norrine russell listen wherever get podcasts,False
4949,easy autism stay kind,False
4950,education show useful within seminars workshops take look previous comments event book ticket unmissable day,False
4951,part process like gives space investigate new interesting ways factors writing acting dada fellows include lancashirebased writerperformer adam fenton find,False
4952,want genz know us millennials struggling different way regarding one also makes things worse us getting kind help frigging expensive,False
4953,hey twitter friends please help need subscribers youtube channel able create unique url update improve big love help much appreciated,False
4954,encouraging organizations reap huge benefits terms innovation creativity diversity thought deep dive orgs need talent,False
4955,encouraging organizations reap huge benefits terms innovation creativity diversity thought deep dive orgs need talent,False
4956,crew got wanted evidence parents wrong thats encouraging autism flourish research mess,False
4957,bad analogy something cured nice try though unless might want sit one,False
4958,unto breach looking forward induction tomorrow starting back begin research supervision examining criminal responsibility defendants age,False
4959,recap lower echelon prd prm soc self unaware low medium reality processing reflection replication short term memory higher echelon emp aut asp self aware high reality processing rationalization long term memory spectrum,False
4960,enter follow rt first post thread reply fave book disability rep limited autism mg international ok ends sun,False
4961,individuals like face different challenges comes recruitment career progression since people selection criteria assessments must embrace nonneurotypical traits,False
4962,consistency key often hear often ensure happening schools often experience schools involved,False
4963,please dont offended try explain something dont understand everybody great explaining always great understanding thats iq issue either side anger never required,False
4964,really looking forward presenting evening pm topic getting ready employment part series public talks,False
4965,good thing mind detecting autism history tied eugenics find information pretty trivially look need watch detects disabilities data,False
4966,dont understand applications day age dont take account information presented web pages affect many people pursue resources advertised,False
4967,workplace strength make room,False
4968,paradigm might suggest autistic distress may lead diagnosis label needs updating pathological model might prevented least help coach parents communication styles needs,False
4969,ready get coached wondering started,False
4970,happy chat anytime genuine offer learned much adhd determined help us understand many people told cried realised via adhd tweets newsletter,False
4971,diagnosis distress getting video feedback positive parenting creates better interaction childs communication style needs need reunderstand dx means outside pathology within model medicine,False
4972,good news online training still spaces perfect professionals looking develop knowledge access inclusion people within organisation book,False
4973,aat narrated presentation developed another research group collaboration autistic adults features st person autistic narratives content diagnostic characteristics autistic strengths challenges sensory sensitivities,False
4974,subject close hearts mine included whether personally professionally exciting day children young people attend,False
4975,thank exciting p wrote,False
4976,love nothing see affirmative approach available kids services,False
4977,celebration great initiative local infants school response families amazing tell lot school whether take time resources,False
4978,interesting subject ive learning bit eye connection might work case,False
4979,nobody side ever want ms talk side forgotten profound severe non verbal side want talk wonderful autistic want changed well truth ugly son pain,False
4980,happy autumn equinox time year wear whatdo shirt comfiest shirt planet beleaf us find,False
4981,latest jewish special education daily thanks,False
4982,rereading singer birth idea,False
4983,probably exciting important webinar series irish autism services ever see difference affirmative assessment makes adults vital extend model kids,False
4984,book shop featuring authors authors alignment values respect autistic communityfunds help support autistic team creators,False
4985,business case supporting work,False
4986,office career strategy assistant dean executive director maureen reilly writes effective selection retention practices,False
4987,r back celebrating sunday cst hrs follower celebration stream games would yall like play sunday u want play hmu ill update new official stream schedule coming days,False
4988,upcoming webinars thanks open disciplines,False
4989,today talk political journalist advocate author broken changing autism conversation eric shares stories insight advocacy discusses environments like schools places employment created mind,False
4990,crucial make informed decisions selecting behaviour analyst child info visit,False
4991,tweet ever heres actual link article,False
4992,great article workplace provide competitive edge,False
4993,read dei profspectives defining celebrating written faculty staff students also exciting news please save date october information coming soon read,False
4994,dyscalculia much difficulty maths,False
4995,hosting free webinar series help clinicians adapting paradigm child adolescent services,False
4996,different behavioural characteristics including adhd nothing new illustrated ancient writings corners world fact people still told adhd thing indicative denial,False
4997,wanna like brené brown,False
4998,better understanding different ways people work learn ways talk become increasingly important,False
4999,many different ways people learn society seems struggle understanding describing accommodating differences,False
5000,agree dedicating april discussion work great work space,False
5001,sometimes see dyslexia adhd autism dyspraxia neurodifferences referred disabilities sociologist coined shift stigma neurodevelopmental differences strengths instead weaknesses,False
5002,one day soon want start coaching early careers help get tech especially extenuating circumstances lower grades etc hard stressful sometimes done anyway need help meantime dms open,False
5003,teachers act way towards nonverbal students age classroom period,False
5004,thank publishing article communication across neurodivide,False
5005,immediately explained case choose kids come would never call student race finished talking differences great,False
5006,looking forward tonight session supporting childminders across northern ireland understand early years,False
5007,study explained presenting outline views hope help people form views study based description outcomes rather media reporting,False
5008,premium effect white noise reading skills memory recall children find,False
5009,analogy vs neurodivergence uk office usa office diverse episodes diverge,False
5010,hey yeah super fucked hey aba babies uh extremely gross unethical people irb okay ashamed disease masking ideal outcome,False
5011,different students different learning needs recent blog tackles classroom educators create inclusive learning environment everyone,False
5012,rounds facebook thought lovely way broach primary pupils,False
5013,autism diagnosis say child explains think,False
5014,happy birthday simon sometimes feel isolating hope year find people also need stronger together keep fighting fight,False
5015,hey heres post might missed read essentialness selfcare,False
5016,article hits many right buttons sadly believe outdated rigid practices schools catering neurotypical children devastating consequences children speak mum one,False
5017,write large one presss blog id like see changed disability community next years,False
5018,highly recommend congratulations eliza wait copy arrive x,False
5019,organizations implement successful programs see benefits firsthand common misconceptions individuals autism become obsolete join us learn benefits workforce register,False
5020,variation human brain regarding mental functions usually refers mental illness,False
5021,im concerned aba providers coopting language theyre going make aba advertised even sneaky way every single time pretty much using autistic people make aba therapy look different always damn thing,False
5022,thanks giving us shoutout right working toward releasing free resource pack spring,False
5023,thrilled welcome chris bonnello oaklands today inspiring advocate gave staff top tips supporting autistic pupils amusing thought provoking cpd thankyou chris,False
5024,another slt tiktok raising awareness slt,False
5025,also likei nonverbal around parents didnt talk baby communicated themi barely spoke wasnt like oops didnt talk kid enough brains different thats,False
5026,whats something wish people would accepting regarding object permanence problem add makes hard remember things exist theyre front suck keeping texts emails,False
5027,hon member garcia says lack education detrimental affects students bill fight students believed included garcia says,False
5028,hon member reginio opposition says lack education extremely sad bill massive step right direction say,False
5029,social model,False
5030,neurodivergence provoking new mind sight via,False
5031,bill crucial students says hon member duong theres ignorance surrounding people live thus need normalise say,False
5032,strange fogginess causes stop feeling like brain like faraway place see horizon quite reach alsie gray,False
5033,handle feeling different im wits end,False
5034,hon member aseta government refuting bill says bill reckless flawed term isnt defined properly says aseta,False
5035,sponsor bill hon member dayao says neither bad good different education system denies students right learn learn say,False
5036,vary naturally understanding encouraging individuals fully engaged society reap rewards,False
5037,autism storm different boat,False
5038,check stanford summit,False
5039,first bill day legislative assembly debated soon hoppers crossing secondary college refuted ballarat bill fighting schools ill live tweeting debate stay tuned,False
5040,adhd comics tiktok videos great straightforward visualizations adhd phenomena comics moment ohhh actual thing always appreciate others intersection chronic illness,False
5041,massive final day debates sustainably agriculture incentives education schools compulsory first nations education measures prevent sexual harassment workplace watch,False
5042,im perfectionist wants needs broad ideas follow refine thats areas art also navigate unknown habits need sort rules standards art world destroyed,False
5043,reason compassion kindness taught cant sit pass exam employers universities interested grades academic subjects,False
5044,cw ableism prevent autism excuse read right neurotypicals charge leading researches,False
