,tokenized_text,is_after_split_date
0,ha dont adhd dont h pound every time hear h helpful hyperactivity less adults internalised especially women,False
1,tips helping child content,False
2,watching youtube channel adhd women tend present inattentive mask struggles fuck explains legit adhd twitter community would able volunteer studies gender diversity,False
3,found twitter jonathan mitchell tom clements felt alone found fb rhetoric couldnt relate found tribe,False
4,important offer frequent breaks shorter sessions child concussion tbi let child lead brain injury tbi help student,False
5,anyone moon pal,False
6,people often confuse word term note terms coined person,False
7,defense ive never seen say anything like religion seems root bigotry agree people use autism excuse shitty make harder community,False
8,know made meme accurate except part autistic people mean neurotypicals think autistic people educating things bad harmful us mean,False
9,story worm composting nesting partner bought composting worm farm asked name brain smashed dr worm might giants w house tv show gregory z house memorial worm bin born,False
10,giving autistic children ptsd school dont understand autistic kids create toxic environment,False
11,good article help save lives severely children wander sure infuriate movement,False
12,uk researcher dr damian milton critique use applied behavioural analysis aba behalf manifesto steering group,False
13,alex janvier school staff adaptability programs students complex needs working hard set welcoming safe learning focused spaces students ready welcome amazing students,False
14,hey heres post might missed read essentialness selfcare,False
15,say someone credentials behind name feel like learn lot graduate school msw,False
16,autism kids hence word spectrum,False
17,reached feedbacks left shop eeee amazing,False
18,credentialled instructors support adults developmental disabilities parttime studies program,False
19,autistic kids keeping schools closed destroying childrens mental health missing angle,False
20,many employers embracing notion people think learn differently vicki thrasher shares help expedite process,False
21,seems fairly accurate though usual questions posed emotional reactions people events fail take account expect adjusted somehow would fall far closer chaotic good,False
22,one authors calls vile sadly thats acceptable supported leaders dont see vilifying autistics improves wellbeing,False
23,check beat short film black autistic boy finding unique way cope meltdown alone film created alongside consultants autistic advocates,False
24,know hiring confers competitive edge businesses learn cultural financial advantages incorporating workplace,False
25,moved medical model focus always developing nonautistic peoples understanding autism enable change social media used powerfully salute big shout,False
26,great im available discussion autism im activist wont abused disrespected needs challenged,False
27,idea behind conditions autism seen perfectly normal neurological differences people,False
28,love,False
29,found good read however annoyed hindsight backed tackling issues gun control childhood mental illness etc handwaved away would made story harder tell,False
30,musings one quest self knowledge,False
31,many people anything accept acknowledge unresolved childhood trauma hence proliferation self diagnosed adhd autism trans etc demand instead world adapts person complex trauma speaking,False
32,joining us live webinar emma weaver director early year service adhd foundation details register place click,False
33,interesting read bit close home school especially middle school destroyed bullied struggled social skills emotional regulation instead understanding senco said school report emotionally immature,False
34,proud see many autistic learning disabled people developing delivering oliver training way us learn listening communities understand far better neurotypical people ever,False
35,really interesting webinar recognising skills talent everyone workplace little bit different,False
36,next sunflower soirée fri st oct pm features wonderful speaking girls optional peer networking session pm connect chat great opportunity network tickets start,False
37,usually assume nd person playing playing character character also nd minecraft roleplayer isnt going turn roleplay,False
38,hi ex exlead autism edu nas advisory teacher focus mths online live conf birminghamnasen theschooltoolkit eds jhs,False
39,youre wondering eccentric creative people driven look new twists political correctness,False
40,limit hammer could use whole tool kit start phonics add tools based dyslexic strengths dyslexia tool kit expanded edition,False
41,embrace,False
42,one way look job helping autistic kids see matter constructing person raw materials build person,False
43,emotional impulsiveness deficient emotional selfregulation desr included symptoms dsm integral part emotional dysregulation increases risks impairments throughout adulthood,False
44,first responders supports dealing today many resources behavioral health suicide prevention task force montgomer,False
45,look lens abuse lens traits abuse makes lot sense settler colonial state,False
46,goes along previous post great ways support workplace inspiring workplaces,False
47,heard hadnt work actively share ideas im learning great things inspire stockholm worth following,False
48,excited privileged discussing upcoming neurocyber cic seminar series power diversity cybersecurity tickets fri sep eventbrite,False
49,paper book chapter written academically pp model intersection social medical models also wrote overlap divergence medical model free,False
50,recent article discusses benefits employing autistic person help create inclusive autismfriendly workplace reflects general population read full article,False
51,ever wondered make impact learn style tils workshops supports accessibility,False
52,see new piece written founder director explains crucial nature better understanding classics hub help next asterion going forward,False
53,please join neurodiverty together server,False
54,blog cover another topic students often fear school year approaches meeting principal,False
55,please share important messages lighting,False
56,join us next whilst explore different words people use talking provide practical takeaways develop organisation talks,False
57,people joined openly actively engaging discussion nursing profession generative way work together share good practice improve experience students registrants across profession,False
58,part able sync right reliably flexibly able go sync time basically going ones idiosyncratic rhythm detaches one people world even oneself,False
59,many employers embracing notion people think learn differently vicki thrasher shares help expedite process,False
60,may ask,False
61,sit watch learn autism learn see treat people people right exist live dignity,False
62,content creator necessarily creating content like involved please get touch via email address bio,False
63,folks offered opportunity bring panel back london october want make sure representative community possible panel,False
64,proud mom tweet autistic son drove east lothian edinburgh back bus yesterday applied new passport embassy would unthinkable months ago,False
65,wellbeing wednesday health make everything think either adds vitality energy spirit possess takes away ann wigmore,False
66,list medicalised terms socalled typical development still part,False
67,sharing huge years tests doc visits lot travel sickness meds learned extreme motion sensitivity dizziness likely due sensory processing issues seem package deal particular brand,False
68,property let talk property let work estate agents landlords every day property let,False
69,seems suggesting distributed cognition group level socially optimal,False
70,fact fiction,False
71,also issues ideological perspective social model supporter intrinsically including persons hence naturally treat nonautistic persons pda autistic persons pda,False
72,interested discourse analysis check research tool developed used matters project,False
73,thread functioning labels levels harmful also accurate,False
74,brand new service coming please share families need service check,False
75,next unjudged event noon bst sept feature story life lorna mchugh events opportunities listen stories lives women broaden perspectives register,False
76,lets talk around us friends loved ones coworkers continue make efforts educate staff provide resources raise awareness combat stigmas surround disabilities welcome talent proudly,False
77,right launches today spoken incredible roster experts series inc loneliness need real selfcare looks like ep drop every wed next wks,False
78,child autism giving hard time hard time,False
79,harrop lab recruiting soon focus females gender eye tracking please send postbac ras postdocs way,False
80,benefits different law firms embrace partner emma bartlett senior associate wonu sanda write,False
81,hiring employees benefits everyone hiring practices levels ensure initiatives ongoing process oneanddone project strength workforce atd,False
82,liaise together whilst also jobs studies commitments people away others need mental health breaks abused community call,False
83,something inclusive plural community generally good respecting individual differences e accept respect systems different whether thats origin switching differences love yall,False
84,critical diagnosticians often one first frame autism families consider moving away medical model deficitbased story balanced view autism,False
85,protect defend people companies countries charge need racial gender identity physical cybersecurity community change meet coming challenge,False
86,really enjoyed training today thinks knew others really got thinking,False
87,video working memorys website please take look youll find topics stimulate debate get conversation going whether introducing workspace discussing,False
88,yes lookup good follow important listen autistic people,False
89,culturally relevant pedagogy article applies insight culturally relevant pedagogy paradigm reframes autism adhd dyslexia neurodevelopmental conditions,False
90,longer say prenatal diagnosis choice hands know structure say society open society scientists must also ensure work benefits everyone,False
91,anxiety ocd learning disorders stress trauma mimic adhd symptoms sometimes adhd,False
92,time next hosting panel behalf join guests informative discussion subject tech still free tickets left,False
93,hemel hempstead womans blog nominated bap award super publicity pda profile autism,False
94,song always reminded ocd,False
95,common misconception autism love please rt,False
96,welcome spoon,False
97,id like tag since creates excellent content philosophy politics,False
98,give local charity share care free ways help give local charity sharing cause extraordinary,False
99,gm employers take part survey run gm learning disability employer network understand challenges opportunities face employing people people learning disabilities,False
100,parents wishing seek support diagnosis,False
101,many employers embracing notion people think learn differently vicki thrasher shares help expedite process,False
102,engaging reality movement politics id argue partly due fact yall didnt invent framework cant redefine center yall,False
103,white affords yall would rather continue pathologize nd people complicit propagating eugenics via lite movement,False
104,best thing dyslexia ability translate peoples words visual systems little brain effort already see saying even cant,False
105,assessments provide dyspraxia assessments legal education employment purposes provide assessments zoom facetoface psychologists experience related conditions,False
106,happy wednesday lovely twitter folk weve lots new followers recently thought wed share short film tells exactly ready smile lot,False
107,nice working version talk linked pinned tweet company,False
108,greetings cape cod,False
109,need talk far often see conversations ignored inadequately addressed conversations problem poor support massive long term damage mental health,False
110,clearly see insane tweets digging things academic grades literally prove good smart literally struggled school flourish,False
111,kindly shared introduction workplace pm book free webinar emailing diversityninclusionbartshealthnhsnet,False
112,congratulations directemployers partners leading expert haley moss promote disability inclusion diversity workplace argus press,False
113,wishing everyone best luck best year ever,False
114,good morning cape cod,False
115,one expert one knows enough autism expert even experts still learning one gets final say limitations capabilities needs,False
116,,False
117,looking scholars pastors great work intersection theology bonus bonus bonus folks identify bringing perspectives diversity race class gender conversations thanks suggestions,False
118,lucky going hear short version rant smart remarks getting full directors cut,False
119,talking benefits team thrilled speak kellee grimes mba rn adac latest podcast episode chats ada plan sponsors maintain compliance concerning long covid dei mental health wellness programs,False
120,wishing every success pga season british challenge,False
121,way reps talking types twitter really quite disheartening another good reason suspicious whole shebang,False
122,young royals new standard representation communities films shows representation queerness differing ethnicities races socioeconomic statuses characters cast well made series better,False
123,strengths related dyslexia dyspraxia asc problem solving fault finding invention pattern analysis daughter creative artistic well good problem solving numbers give notice beauty world lifelong,False
124,thanks opening watched danish tv hope understanding evolves rapidly high functioning adhd would looved turned sibling mine,False
125,challenges dsm arising many quarters another,False
126,im trying hard though please help daughter many others like sign rt,False
127,first priority address need shift practice medical model model learning origins models look like practice reflecting internalised ableism robust understanding first step,False
128,blog live whoohoo,False
129,black white thinking autistic mind please rt,False
130,talking benefits team thrilled speak kellee grimes mba rn adac latest podcast episode chats ada plan sponsors maintain compliance concerning long covid dei mental health wellness programs,False
131,proposal session acceptance focus understanding difference goal oriented misbehavior established alfred adler sensory social needs children,False
132,providing environment sensitive needs autistic students benefits students,False
133,whether exploring planets staying one books featuring pro disabled multicultural characters fantastic worlds,False
134,prospective doctoral candidate researching book incredible also references privileged complete undergraduate research project,False
135,hyannis,False
136,work towards global ban eugenics practices could threaten eliminate,False
137,photos yearly golf match dad pirates cove,False
138,love way even count invisible disability needs read wonder ever heard word,False
139,part lab philosophy studying autism need stop focusing comparing autistic allistic individuals terms deficits instead investigate autistic development looks like neutral perspective,False
140,autism kids notice realize including attitude towards,False
141,yeah diagnosis helpful cause helped understand stopped thinking pure idiot medication whole discussion reflexion personnaly need studies focus things evening,False
142,anyone experience running inclusive projects taking account needs disabilities etc case studies top tips appreciated anyone,False
143,new release feminine macabre volume ii womans journal things strange unusual,False
144,please join neurodiverty together server,False
145,next daily promotion colin etches openly jokes words ted talk get free tickets,False
146,auticon global consulting firm recently opened salt lake city office works technologists autism seeking jobs place companies willing accommodate needs,False
147,shou mei class listening lecture helps focus,False
148,independent living zetetick donates empower hope independent living zetetick housing donate croydon people,False
149,today pleased announce launch diagnosis support pack dsp coproduced families families following diagnosis diagnosis e g autism adhd visit scan qr code,False
150,today pleased announce launch diagnosis support pack dsp coproduced families families following diagnosis diagnosis e g autism adhd visit scan qr code,False
151,value diversity inclusion ssc individuals spectrum identify learning social disorders invited apply computer science positions september,False
152,listen latest show hr happy hour supporting workplace ed thompson,False
153,fantastic example students silkmore primary academy stafford displaying knowledge regarding fabulous inset day magnificent staff,False
154,sending hugs knowing smiles parents dealing go new school year,False
155,sent newsletter today time quite lot exciting stuff share named amazing upcoming indie debuts dystopian gems also cool interview guest post friendship pic alttext,False
156,anyone access paper neurodivergence role epistemic cognitive marginalization mylène legault jeannicolas bourdon pierre poirier,False
157,also something noticed diagnoses assessment diagnosis something like adhd asd going change someone thinks behaves gives context already thinking behaving,False
158,conversations sharing life experiences maybe even giving good advice monthly zooms come join us truly good time together facebook,False
159,talking annie calhoun today connection performing arts executive functioning join us pm cst bring questions send us wont able make stream live,False
160,educate empower evolve excellence,False
161,hello new wiki written nds nts need lived experience writers trying reach everyone could rt would epic thank advocacy,False
162,hello trying spread awareness new wiki written nds nts need lived experience writers trying reach everyonehttps tcoiqbdkivwh also feel free add blog post nd websites,False
163,hello trying spread awareness new wiki written nds nts need lived experience writers trying reach everyone,False
164,helping parents caregivers navigate world important us launched sandi lynn geller memorial family resource center provide support resources families community,False
165,love data web scraping ponies moment trying get word wiki nd nt need lived experience writers,False
166,love dr fungs concept reverse job fair part stanford project others done,False
167,hoping could help nd community helping get word wiki nd nt need lived experience writers,False
168,hi n advocate hoping could help nd community helping get word wiki nd nt need lived experience writers,False
169,hi autism advocate hoping could help nd community helping get word wiki nd nt need lived experience writers,False
170,cw national autistic society say people getting needs met local social services,False
171,need huge support creators struggling find way make impact known extra streaming gear sponsors exposure need help pick pieces left behind destruction caused want harm us,False
172,neurolinguistically diverse legal workplace,False
173,tendency researchers dismiss autistic people criticize movement general fringe problem cannot ignore large segment population purport helping expect research harmful,False
174,even werent fears eugenics research history repeating would still big concern find anyway,False
175,hey community looking forward next saturday september boys end summer beach event powerhouse point pm lets celebrate end summer together,False
176,ironically trend dismissing advocates x type people exactly kind overpathologizing theories critique advocates diverse approach prejudices us reductive,False
177,never focused except relation disability refuse distance social movement benefit platform hypocritical throw bus politically convenient,False
178,dont forget vote help decide next bps campaign great proposals covering important topics including environment climate change supporting refugees covid recovery supporting pupils study mens mental health class,False
179,guess difference autism research medical model increasingly question model one suggests different ways human context proportions finding look questionable still,False
180,parents kids additional needs always grateful progress perfection,False
181,engaging camp someone wants learn person worried terms like even someone supports please reply dm,False
182,saying anyone specific things definitely overlap connective tissue issues immune disorders anesthetic tolerance reactivity things like med tape adhesive,False
183,hear saying think blame youngers personally suspect understand adhd people struggle stick anything fully ignite excite,False
184,honoured celebration included article featuring trailblazers creating inclusive learning environments students,False
185,honoured celebration included article featuring trailblazers creating inclusive learning environments students,False
186,focusing tech auticon opens utah office,False
187,fantastic opportunity companies projects autistic community autistic community,False
188,agreed especially commonality hypermobility related conditions autistic voice well listened research,False
189,tomorrow covering everything diversity embracing accommodations individuals workplace tune est,False
190,cities designed populations allages playground aims change,False
191,back school son tomorrow part like parent cant wait larger part feeling anxious hopefully years teacher better understanding kid enough doesnt need teachers stress,False
192,parents teachers social care health professionals register free training webinars bi monthly meetings shape future public services children send berkshire register via link,False
193,published even mean,False
194,heres summary exciting research know music training dramatically improves reading outcomes music dyslexia,False
195,wrote nowhere say work autistics one two claim work nds coalition many different kinds nds know autistics nds umbrella,False
196,grading quickly turn classroom toxic dyslexic student way win student may resort acting stress grading cause bad behavior,False
197,listen latest show hr happy hour supporting workplace ed thompson,False
198,hey heres post might missed read essentialness selfcare,False
199,listen voice vast majority voices autistic rights movements listen voices support independence choices beef erasure higher needs,False
200,voices need heard everyone needs pathway good job modified hiring practices accommodate applicants,False
201,college transitions employment back us indiegogo,False
202,kofi senpai notice disability rights autistic content,False
203,hey heres post might missed read essentialness selfcare,False
204,anyone tell autistic side awkward social encounters please rt,False
205,autism anxiety sensory overload sensory key,False
206,chief diversity officer refusing speak w student raised concerns scientific social content taught program,False
207,meeting social standards w e r societies necessarily desirable,False
208,weird cool thing fact possible sign well form hyperfixation,False
209,ironically people actually works plurals whatever reason lolololol,False
210,latest issue camping magazine online diversity equity inclusion issue features articles race conversations camp gender inclusion enhancing inclusion campers sensoryprocessing concerns,False
211,im asking cite sources claims judy singer generally accepted one coined term sociology honors thesis id say makes relevant authority def nd,False
212,really need google youre incapable looking medical studies dont know,False
213,exactly defined medical literature,False
214,judy singer coined term says otherwise,False
215,use slinky calming stone class fidget modeling students rocks modeling use tool help focus helpful many,False
216,r adhders r run people run harassment campaigns contribute doxxing fyi,False
217,teen online book club meets sat reading brave james bird nonstereotypical presentation stories power families chronic pain telling story,False
218,specialty license plates available visit click autismrelated specialty license plate order plate,False
219,yeah ur kinda quirky thank u,False
220,anyone anyone,False
221,refute besides dont think normal human could use magic,False
222,grieving autistic everyone said would get better first weeks never jess hudgins tpga,False
223,dani bullshit mods r adhders worked mods r adhdpride r run harassment campaign r adhd mods also doxxed really kind community want support,False
224,yall could refrain jumping conclusions youd see antipositivity actually agree movement professes support,False
225,excited sponsor year help us kick weekend free virtual event discussing inclusion workplace register,False
226,r adhd super toxic dont recommend going instead r adhders r adhdwomen super nice well r sub collects adhd tipps reddit subs good including r adhd forgot name though,False
227,dont remember saw analogy nerotype settings sound board mixer frequencies mixer like nerotraits light sensitivity task initiation decoding etc,False
228,children autism like mirrors see good,False
229,read movement agree itd problematic widespread everything ive read refers extreme instances antiadhd autism aholes agenda would probably antiadhd autism aholes anyway,False
230,researching schools kid must looked last months today first time one explicitly said aba encourage students mask celebrate cried,False
231,oh dont worry consciously actively learn social skills adult college difference vs teens night day im still perfect haha,False
232,premium essential factors dyslexic students employees grow flourish read,False
