,tokenized_text,is_after_split_date
1413,kids cant learn way teach perhaps teach way learn,False
1414,volunteering websites one find volunteers charity rely creating ability give work social media web print,False
1415,many steps autism journey instead counting steps make steps count,False
1416,many autistic people recover socializing please rt,False
1417,worried aspie daughter started first fulltime professional job sales tech company last summer loves well resources,False
1418,love guest autism specialist teacher researcher trainer mentor nd dyslexia bipolar wrote paper autism persistent absencelet know like information,False
1419,,False
1420,people suffer autism yep us proudly enjoying,False
1421,autistic didnt anyone know read blog,False
1422,shout tuckahoe elementary school virginia united states registering take part celebration,False
1423,excited share million students taking part celebration worldwide please encourage childs school sign,False
1424,london eye mystery better choice enjoyed dont know good representation,False
1425,medical professional making effort destigmatize refuse use label check comments thread actual medical professionals trying diminish importance conversation,False
1426,come take peek kickstarter see eutopian story ai minds kiddos,False
1427,workshop neurips looks sooooo good love includes intersection issues like caste animals labor rights,False
1428,literature cc via,False
1429,uc davis summit debate movement shannon rosa matthew belmonte,False
1430,valuing autism benefits society whole,False
1431,default web development web support assistant victoria outlines create cognitive diversity latest blog post,False
1432,today yarn database find pride cowl longtime knitter crocheter newly minted designer motif symbolizes infinite diversity people,False
1433,excited share million students taking part celebration worldwide please encourage childs school sign,False
1434,many autistic people experience sensory overload leading burnout impacts mental health study media highlights ways help prevent manage effects burnout,False
1435,thanks business librarian elizabeth price putting together roses newest display work invites explore skills challenges unique perspective workspace give,False
1436,shout holy trinity c e secondary school crawley registering take part celebration,False
1437,spirituality connection mental health,False
1438,one first dinners husband family thanksgiving dinner early newly dating heckin nervous,False
1439,welcome landmark private members bill,False
1440,monthly ot assistive tech meetup tonight pm topic affirming ot assistive tech autistic perspective register,False
1441,well said absolutely agree worries whilst idea radical new old time word neurotypical refers individual accepts doctrine without question parental state religious,False
1442,identification need one thing actually providing specialist teaching another agree urgently need schools quality first teaching stretches far,False
1443,quote book read recently sums quite well think,False
1444,deprecating autism improved security must migrate autism account account january,False
1445,really shameful think itv morning need training better understanding equality act,False
1446,episode three first podcast season patrick discusses bobbie brandybuck works trust department please listen subscribe,False
1447,thats key point doctors clueless utterly useless providing help misdiagnosed mismedicated disabilty bc fools,False
1448,needed today,False
1449,weeks episode tmt time nationally regarded therapist eileen devine joins evan discuss benefits leading empathy circling back respectful workplace listen full episode,False
1450,great article largely unknown web,False
1451,special interest animals mum let get pets already dog,False
1452,knowing dyslexia might bring sigh relief also causes concerns important actions take,False
1453,youve got,False
1454,often quick assume person intent based behaviour observe,False
1455,check latest digest details upcoming events,False
1456,executive functioning need decide whats important urgent wait till later need decide well need really straight away linkedin,False
1457,still believe people thought still think vaccines cause autism autism celebrated anyway society adds much,False
1458,often someone giving hard time hard time,False
1459,conversation coworker last hour info dumped theories behind minds work left said interested know gain new ways thinking talking yrs older,False
1460,understand represents autism lemniscate symbol infinity represents infinite variations human personally dont use symbol much except people ask put logo something,False
1461,nice see courtesy really glad people getting platforms like happy hour talk life like makes much easier safer us world understands us x,False
1462,always advocate mental health chronic illness disability feel like slippery slope bc get unfair focus much negative makes depressed,False
1463,change needed housing crisis yes change needed get housing people learning disabilities fact generally social housing needs step,False
1464,educator classroom something celebrate,False
1465,wonderful time year us celebrate got dyslexia sometimes whole christmas thing feel little overwhelming,False
1466,ptc chief people officer jill larsen explains celebrating employees workplace,False
1467,autism primary care module one done ongoing resource used reference primary care providers see module ubc cpd partner circa,False
1468,also heavily influenced psychology discussion around diversity biological autism disabilities autism least way benefit structure dont simply store contextual boundaries words describe relationships,False
1469,really means via,False
1470,improve research skills phil,False
1471,bonus coverage interviews reality tv neurological disabilities play reality television much apple spotify,False
1472,classroom creating inclusive sunday school,False
1473,theoretically plausible connect intergenerational trauma propensity anx dep exacerbated expressed result specific racial trauma direct knowledge existing research makes connections,False
1474,one big topic another importance understanding jenny offord educating us,False
1475,development day thursday using opportunity raise awareness running workshop shocked hear today people signed running workshop personas,False
1476,great discussion,False
1477,wed like hear views experiences teachers working pupils support students receive schools colleges short survey,False
1478,free webinar workspace considerations welcome support p est dec presenter dr lauren gant discuss role psychological safety creating effective workplaces register,False
1479,wellbeingdriven productivity lens racket,False
1480,working hard imagine new ways working fostering sense belonging employee population read matters workplace,False
1481,ive worked mostly males career four features show consistently varying proportions autism adhd giftednes high iq psychopathy antisociality mostly latter,False
1482,think issues,False
1483,traits particularly factor side always put autism ive dated enough psychopaths narcissists intimately familiar factor traits,False
1484,consider concept social movement aims depathologize destigmatize neurodevelopmental disorders ndd includes diagnoses like autism spectrum differences adhd syndrome learni,False
1485,would anyone use hammer theres whole tool kit use tools based dyslexic strengths dyslexia tool kit expanded edition phonics isnt enough,False
1486,trouble finding theres onesizefitsall fix instead need discover derails unique brains share personal kryptonite keep thanks post,False
1487,essential provide frequent breaks child concussion tbi let child lead brain injury tbi help student,False
1488,installation london bridge sponsored bam nuttall celebrates gorgeous,False
1489,excited dialling recruitment webinar soon hosted dei team im perspective lets attract fresh talent game,False
1490,inappropriate things balance asset opting gender stereotypes mental health issues usually part gatekeeping process eg personality disorders body rather gender dysmorphia believe watch wait kids,False
1491,important response announcement regarding screening uk schools,False
1492,download neurotribes legacy autism future ebook download,False
1493,plans upcoming benefit get family list talk created cobotics c mon give us signal boost break need studio please cheers,False
1494,question audience paradigm currently appropriated medical industries neoliberal business interests nt privileged version philosophers avoid appropriating nd paradigm discussing already existing philosophical concepts,False
1495,first time viewing lars real girl definitely enjoyed offbeat comedy biggest strength found lars real girl gentle relatable portrayal comforting themes compassion,False
1496,eighth sense maureen bennie,False
1497,small bites big talks w peers next guy gathering join dads male caregivers tuesday december pm longhorn steakhouse sugar land registration preferred required,False
1498,refers variation human brain regarding sociability learning attention mood mental functions nonpathological sense around since late come wide usage past years experience,False
1499,true lot,False
1500,make speaking career work someone position know told could hugely successful reaching way people hmm,False
1501,lot modern discourse still operates hans aspergers definitions giftedness vs intellectual disability must rooted concept well language heres primer,False
1502,autismwhere neurology matters stay kind,False
1503,one tattoo second one tbd,False
1504,awesome episode,False
1505,us first nft collective disabled artists autism adhd etc showing world beauty diversity accelerating disabled artists economic independence founded sisters autistic sister tara,False
1506,feel like stupid teenager time guided caffeine horniness,False
1507,nathan constantly tells dad wanna everything watching,False
1508,exponential get adhd person room get billion ideas companies need levels,False
1509,wife reality tv star watching breaking point broken folks,False
1510,new today,False
1511,listening neurotribes one ear pod walking around datacenter work mad hell listening early mindset eugenics called war weak breaks heart,False
1512,thank starting address inequalities education system embracing also need think,False
1513,still learn tech hiring great place start thanks chief industrialorganizational cc,False
1514,complex skin deep,False
1515,evening pleasure taking part webinar recruitment prospective officers answering qs experiences roles student officer answering alongside attended webinar back may,False
1516,herein lies real tragedy get support need freedom way practically explode incredible feats yet nt word exception great mykola help prove contribute,False
1517,seriously amazing month took time organize thoughts given k build site fun took time organize code promoted work also fun thing thrive,False
1518,autism smallest success often joyous,False
1519,important thread important dont use mean neuroatypical undermines concept includes everyone,False
1520,mental health systems incredibly flawed recognise treat symptoms simplistically ignore real causes labels mental illness means high risk causing iatrogenic harm increasing complex illhealth revolving door,False
1521,kinda wanna get verified public support center must count valid publication purposes right k followers imagine wit power classic mykola brought validation authority blue check,False
1522,trying educate disability chronical illness trying get know interact include people telling first person stories trying amplify voices keeping eyes ears mind heart open,False
1523,may add agency run another press author terri duncan,False
1524,adhd,False
1525,let talk gift disappointment autistic people please rt,False
1526,resulting pileon really fun dms however werent entertaining making fun somebody dont know reasons dont understand hobbies weight looks whatever fucking lame,False
1527,days mind blown today wonderful stunned load colleagues brilliant talk lucky hear someone honest practical suggestions making work better,False
1528,great hear talk teaching school children proud contributed first rotation project excited see progressing along,False
1529,people disabilities mood disorders trauma personality disorders areas psychotherapy psychiatry psychopharmacology fucking important field advances knowledge dramatically,False
1530,ecological model built idea conserving biodiversity necessary sustainable flourishing planet respecting necessary sustainable flourishing human society,False
1531,new job role gain general manager passionate want make difference developing membership offering good networker able foster links community business leaders apply,False
1532,im glad self knowledge something acquired much later around us understanding leads acceptance always happy meet people get,False
1533,nasuwt wed like hear views experiences teachers working pupils support students receive schools colleges short survey,False
1534,marvelous projects like exist tn welcome input want join lets start future project,False
1535,days go addvance advent calendar top tips survive festive season,False
1536,finally caught beautiful insightful documentary thank sharing story raising awareness christine,False
1537,work struggle find helpful memes raise awareness anyone suggest sources please,False
1538,boris johnson please share hancock please extend dyslexia bill screen sign petition via,False
1539,agree access support needs equitable person centred guess sense people conditions diagnosed relevant support given classifying social movement feels bit lives matter,False
1540,looking forward new exciting collaborations many talented forward thinking people inspired work projects around education creative freedom,False
1541,flag personally behalf group autism insurance line taken presenter production team relation non visible disability far acceptable,False
1542,believe schools even elftaught teamed us whole library films call experts available free members today,False
1543,sleeps til christmas ho ho hold expectations,False
1544,meltdowns happen person completely overwhelmed,False
1545,agree poor bit jab couple blunders like phil,False
1546,know people autism asc motor difficulties dcd many dont get physical therapy embrace,False
1547,know people dyslexia dcd dyspraxia well embrace,False
1548,boris johnson please share hancock please extend dyslexia bill screen sign petition via,False
1549,us person centred equitable,False
1550,zeteticks new chair explains might want charity trustee helping essentials life martin chair trustees zetetick lead,False
1551,di inspired us growing charting path defied norm find sister influential women raised bar rest us aspire next catchup,False
1552,hi hello bit mia wanted pop say participating panel tomorrow details excited highlighting,False
1553,making discourse movement gotten way saying quiet part loud believe class biologically intellectually inferior subhuman people need kept prisons guardianship,False
1554,select society learns early school system hard create inclusive society see children two autism one child combined developmental disorder child,False
1555,thinking persons guide autism uc davis summit debate movement shannon rosa matthew belmonte,False
1556,new guidelines regarding school attendance maintain children autism syndrome developmental disabilities need attend schools initially brought adverse effects,False
1557,boris johnson please share hancock please extend dyslexia bill screen sign petition via,False
1558,people frequently need workplace accommodations headphones prevent auditory overstimulation activate maximally leverage abilities competitive advantage,False
1559,recommend story stanford medical school project wonderful work aimed ultimately changing culture conventional views,False
1560,book appointment,False
1561,eclectic mix accurate thanks,False
1562,yes ive seen happen heres research music training improve reading outcomes post summarize exciting research music dyslexia,False
1563,thank please extend bill include early assessment support fir grieving strengths supporting challenges help make happen,False
1564,early support turn challenges strengths unique special skills changing education elasticity environments ways support young people families needed support brave initiative,False
1565,thank great news indeed wonder children could screened early assessment secures early support better person development learning mental health wellbeing long term matter state coffers long term,False
1566,please tthe earlier assess provide support better person development learning long term mental health wellbeing also pockets state coffers,False
1567,know podcast centers around nd bout deep dive fuck outta itthank recommendation,False
1568,pod thing neuroscience,False
1569,lot people ignorant autism including reporters educate jumping armchair diagnosis wagon,False
1570,increase diagnoses necessarily increase autism along point maybe recognize human condition,False
1571,autistic people make friends please rt,False
1572,first responders supports dealing team experts sharing experiences projects want emails please let know,False
1573,one caar directors dr punit shah spoke importance similarities research heres dr shah awarded award work still catch talk,False
1574,dreadful question invited show raise awareness importance timely screening identifying dyslexia phil making joke jibe matt time place,False
1575,hello warm welcome new followers old ones still love guys thank support hope like tweets,False
1576,wonderful time year us find little stressful,False
1577,diversity across media allowing opportunities actors overlooked historically whitewashed industry showcasing stories people colour disabilities lbtq stories etc,False
1578,tomorrow workplace conference looks excel celebrate individuals part well hearing speakers dr jill miller,False
1579,miss danielle kingdons webinar session event youd like watch view session youtube channel,False
1580,listening podcast part regular cpd one coaching absolute goldmine gold minds,False
1581,packedfull tessitura peerled gatherings including canada tessitura community mental wellness analytic coffee women tech check regional topical affinity groups info use tessitura login,False
1582,cochair civil service workforce jess panellists explore companies people needs private vs register today,False
1583,looks like could interesting,False
1584,thank awesome reading list,False
1585,area thought might find connecting useful,False
1586,international advisory board conversation morning focused amazing conversation much think idea much need learn,False
1587,gripping historical tales love stories adventures thrillers eight books teens feature disability characters stories themes,False
1588,fantastic need royal colleges recognise formally support doctors within policy improving wellbeing resilience retention,False
1589,dyscalculia specific persistent difficulty understanding numbers lead diverse range difficulties mathematics would love hear experiences often overlooked condition,False
1590,really destroy self esteem kind,False
1591,moon landing initiative brings nfts supports art nonprofits cointelegraph moon landing initiative brings nfts supports art nonprofits cointelegraph via financely group,False
1592,moon landing initiative brings nfts supports art nonprofits cointelegraph,False
1593,reasons employment isnt working autistic people read blog,False
1594,pleasure working marie members interest would like hear maries firsthand experiences autism supporting others follow along today,False
1595,ulla problem dyslexics classes uni lecturers provided knowledge deal classes helps,False
1596,im currently studying parttime pgdip autism asperger syndrome sheffield hallam university diagnosed autistic daughter diagnosed,False
1597,webinar getting disability inclusion right partnership theres still time signup virtual event taking place tomorrow disability inclusion register,False
1598,congratulations caitlin year impressive winning performance final english speaking unions sixth form public speaking competition caitlin spoke powerfully neurodivergence care,False
1599,new podcast lovely chat ian robertson professor psychology speak anxiety medicalisation human behaviour great craic like hear positivity human brain dog bless,False
1600,tomorrow learn create inclusive work environments individuals autism free online interactive q david crisp renowned autism trainer speaker health social care trainer autism needs assessor,False
1601,editor wants tackle awkward phrasing comma overall unclear seems conflate neurodivergence also definitely either conditions writer trying suggest variations conditions,False
1602,im sure profiler whether relevant though,False
1603,supposed read,False
1604,criticism way trying clarify terms meant function way biodiversity know common usage tends use way,False
1605,meantime looked one study nearly years ago inferring us might persuaded take cure perhaps havent bought research access newer data equal support medical help medical things never,False
1606,people responding confused vs everyone diversity formed entire groups specifically us fall within norms,False
1607,proud announcing new video library appearing free part diversity inclusion application exciting able help school find simple solutions inclusive practice,False
1608,neurotypicals part tend forget often,False
1609,autism hours serenity reigns good idea hulking great interest amongst communities read,False
1610,chloe yap interview tune learn link microbiome,False
1611,neurotypical syndrome spectrum autism faith gifts,False
1612,neurotypical syndrome spectrum autism faith gifts,False
1613,proud interview featured talk new project plus related advantages challenges,False
1614,join john okane free masterclass days,False
1615,saint joseph university launches work minor national organizations increasingly seek hire candidates,False
1616,although autism adults said cost billion year uk part autistic community satisfied feels system serves well,False
1617,important organisation autisticled short focus support lacking design way works,False
1618,richly deserved congrats team creating beautiful insight unique way looking world,False
1619,letter one wiki volunteers skip member community finds helpful,False
1620,hsp adhd rsd acronyms go towards explosion research interest top continuing research autism brains different acceptance accommodation necessary contend still largely trapped circle disorderdoom,False
1621,communication easier clear point,False
1622,acknowledging provide support,False
1623,ellis enthusiastic advocate awareness workplace personal story share around delighted announce joining us ambassador,False
1624,pandemic impacted us recent times academic dr christine grant launched project investigate shift working home impacts people disabilities find,False
1625,forties sara rankin realised living learning differences developed strategies achieve academic goals sara embraced finds key success,False
1626,listen talk ndsa pathway programme conference,False
1627,recruit train lay mentors support mentor autistic adults starting journey discovering autism pathway programme desired career tool programme,False
1628,asked dumb question knew dyslexic one time spoken use wrong better next time,False
1629,weeks chat weeks reading corner focus intersectionality starts,False
1630,holly also dyslexic must laughing hard inside please take hancock example folk,False
1631,organisation focus priorities expressed recognised autistic people providing way works adults like us informed lived experience,False
1632,adjustments flexibility two favourite words accessibility everyone costs nothing less,False
1633,saint josephs university launches work minor national organizations increasingly seek hire candidates,False
1634,friendly guide expect clinic appointment need help much go get started,False
1635,friendly guide expect clinic appointment need help much go get started,False
1636,support candidates evangelist founder author bestselling book work shares tips insights,False
1637,end pushing blog tomorrow december remaining blogs friday december saturday december thanks understanding,False
1638,might common questions personally gone dealing throughout pandemic impacted way life make special adjustments,False
1639,aim promote understanding autism different mental functioning system goes different brain wiring,False
1640,together group forum met created self advocacy ndsa nonprofit helps autistic people realise potential achieve goals,False
1641,need sensitive strivers never greater via,False
1642,honored delighted well emotionally moved insights provided pilot course english language learning,False
1643,today im mostly busy planning,False
1644,dont think selfdx would meaningfully contribute stigma diagnosis stigma historically presently people shitty mental health,False
1645,psyching hour webinar friday funding call midjan deadline strong tell youve got noone caring responsibilities leadership team without telling youve got noone etc energy,False
1646,learning watershed moment positions differences neurology autism adhd normal variation within human diversity deficit disorder part diversity talent needs respected protected,False
1647,best thing sharing latest monologue people reaching sharing similar experiences lots love anyone else,False
1648,tickets released join dr kurt sylvan philosophy university southampton explore philosophy part uk disability history month friday december gmt online,False
1649,employing type person youre putting business risk says latest hr review episode podcast diversity month also talking wit,False
1650,members partners join us today pm online session looking adam welsh director senior talent agent session supported members partners emailed details,False
1651,icymi entrepreneurs learn differently,False
