,tokenized_text,is_after_split_date
4040,also believe celebrate sexual diversity actually supporting heteronormativity celebrate racial diversity supporting racism celebrate supporting ableism embracing diversity subverts hierarchies,False
4041,thank much spread necessary share info spanish,False
4042,struggle finding dr diagnoses adhd adults far challenging thought found pocket price get tested ridiculous,False
4043,want mandated reading every educator understand stop teaching literally give us executive dysfunction harm educations come nonsense,False
4044,matters boy read yrs old spotted talent awarded rogers broke conventions designed world iconic buildings,False
4045,talk children birds bees,False
4046,days go addvance advent calendar top tips survive festive season,False
4047,year teachers plan first reading writing units jan check free winnie pooh units explore resources section blog planning resources included,False
4048,yes know thats exactly movement important theres nothing wrong us societal conventions preestablished social protocols need away,False
4049,see ableism right youre pretending understand think funny like youre deliberately poking vulnerable points,False
4050,thoughtful look experiences professionals think differently way majority expect work,False
4051,somebody tech battled mental health issues entire life honoured talk,False
4052,essence owe anyone functioning labels receive humane treatment get acceptance knowing difference neurotype accepting normal human variation,False
4053,good one marie good morning absolutely need understanding forms,False
4054,big fan remote work endless reasons flexibility supports accessibility global teams juggle handson projects different locations worry stinkin office bathroom could go another time,False
4055,thanks dear toughest stream medical fraternity still challenge scientists world possible try explore field career since blessed extreme intelligence,False
4056,national stress awareness day zetetick common zetetick celebrating national stress awareness day held first wednesday november,False
4057,people wired differently,False
4058,learning realizing lgbtq quarantine,False
4059,oh,False
4060,neurodivergence provoking new mind sight via,False
4061,eugenics kills people want anything helps none death hate movement people,False
4062,nonautistic family members take step back controlling narratives autistic lives autistically experience world,False
4063,great journalist toolkits talk respectfully reductively,False
4064,october launched sensational special educational needs podcast celebrating empowering parents carers strengthening childrens superpowers stay date latest episodes,False
4065,look found recently books amazing autistic author,False
4066,friend,False
4067,could next gain general manager apply january find looking individual passionate wants make difference developing membership offering apply,False
4068,exact experience buzz switched vaping benign nicotine see caffeine benevolent kind acquaintance even beneficial folks probl monster framed alan carr combustion monster need fight,False
4069,agile world wellness talk wonderful becca francis turned adhd superpower,False
4070,read may impact learning literacy skills students new blogpost full article,False
4071,could like dr shaun murphy someday good genius doctor despite,False
4072,line mental illness fuzzy,False
4073,celebrate raise awareness featured part series joanna grace addressed challenges encountered autistic women birthing people member read insightful articles full website,False
4074,autistic flow attention detail autistic,False
4075,one expressions neurodivergence hyperfixation one rewuirement dramaturgy shortterm hyperfixation dramaturgy expression neurodivergence response,False
4076,sexual orientation,False
4077,continue put new designs charity drive store bit bit lots work setting stuff worth embrace shirt hoodie shown pretty popular,False
4078,rip richard rogers thank showing us rebellious selfexpression divergent thinking achieve richard rogers obituary guardian,False
4079,celebrating power community achieved work together despite combination hostile environment brexit covid leading enhanced,False
4080,,False
4081,know full story believe get reduced sentence possiblity exonerated extremely possibility judge account,False
4082,last year outstanding contribution research deserves nomination year want champion anyone pushing boundaries community tell us,False
4083,shout croxteth community primary school liverpool registering take part celebration,False
4084,relevant today age,False
4085,sending much love everyone else targeted monster man place community members real community would first defend,False
4086,december newsletter fellowship call diversity cohort meets music collabs evolvability social mind global,False
4087,might like nick walker two podcasts exploring creativity queer theory mental health creativity ii paradigm cognitive liberty scientific oppression,False
4088,know late uk pm gmt pm pst january ill conversation navigating life come join,False
4089,fashion embrace via,False
4090,authors write build perspective arguing autistic thriving rendered invisible unthinkable interlocking forms testimonial hermeneutical injustice,False
4091,new paper preprint available epistemic injustice good human life academic robert chapman havi carel accepted publication journal social philosophy,False
4092,time flog paper diagnostic pathway works context children young people part realist evaluation,False
4093,use term special interest spin something else would love hear personally prefer autistic enthusiasms,False
4094,inviting parents hear experts early recognition intervention autism spectrum disorders help children please sign free,False
4095,social mobility ambassador law champion lynette wieland features article students valuing experience theyre usually translatable think read,False
4096,shout dublin scioto high school ohio registering take part celebration,False
4097,tonight disability mental health night call us,False
4098,blog continue covering marvel cinematic universe representation autism community covering third spider man film way home,False
4099,therell always subset humans seeking relief psychotropics even hypothetical absence nicotine thered usage natural compounds preference least harmful effective total abstinence illusion,False
4100,watch abridged version play mum undiagnosed hilarious short play written q theatre,False
4101,help us achieve initiative aims proud appointed three ed consultant partners share expertise key areas focus physical disability mental health,False
4102,levels school provide bespoke specialist education children unable mainstream schools due mental health goal level academic social arena enable achieve success happiness,False
4103,journalists heres talk autism respectfully public support center,False
4104,try act normal early age conditioned believe broken,False
4105,excited share awarded hmea grant grant provide resources work program connects individuals comprehensive job training ongoing supports,False
4106,disability night call us pm,False
4107,tonight mental health disability night call us pm,False
4108,love see would love see web well chat sometime,False
4109,difficulty maintaining friendships,False
4110,trying hardest never good enough,False
4111,startrek political startrek fucking pointed accepted exploited,False
4112,kinda picked hobby find character meant represent shows,False
4113,thread like growing undiagnosed adhd copy right owned hem,False
4114,embrace responsibility make inclusion daily thought get rid word inclusion theodore melfi,False
4115,feb rd module send provision joined panel close research practice gap give workable strategies classroom,False
4116,important information exasperated friend dont need cure autism makes humanity kinda awesome dont think,False
4117,think piec eon,False
4118,rounded worst phrases still place working home wfh world read blog workplace jargon,False
4119,spharc celebrated coffee talk series included discussions intersectionality disability gender race transition employment celebrating access recordings transcripts,False
4120,shout memorial junior high school new york registering take part celebration,False
4121,given new clarity want focus beyond seconds tune yearend episode hear new direction im taking podcast,False
4122,trainees gate enjoying art workshops working using watercolours canvas drawings information gate workshops offer please visit website,False
4123,launched gold mind training early katie friedman whirlwind activity lot fun opportunities new learning much besides pleasure training coaches mento,False
4124,book,False
4125,consultant psychiatrist helen read told bbc girls less likely exhibit behaviours typically attributed boys adhd would criticised peers people,False
4126,easy house tips cosy zetetick make home season summer well truly behind us still plenty look forward,False
4127,wishing everyone happy christmas everyone adhd foundation charity happy healthy peaceful new year anything else let make year kindness thing really matters,False
4128,fair say one popular channels lgbt disability networks decided create charity calendar went treat us heres furry furry friends,False
4129,amen enough autism hold people back work discrimination,False
4130,visit mental health helplines reach even christmas day,False
4131,interview david friedman founder ceo autonomy works talent key future work support autistic talent workplace,False
4132,struggled zoom sun gutted missed im new memberwill similar events meno diagnosed adhd aprilbeen going peri impacted conditions ie adhd bipolar pmddxx,False
4133,looking difference opinion movement taking,False
4134,,False
4135,eyhc currently working research project explores youth homelessness lens looking young people happy interviewees happy peer researchers information please get touch,False
4136,found old learned neurotypical,False
4137,reply,False
4138,couldnt agree something celebrated,False
4139,absolute shocking state affairs disabilities community massively impacted particularly carers often told sw abandon children garda stations e cant cope seriously aces trauma anyone,False
4140,pickedup awesome piece lets continue support diversity types web nfts including,False
4141,practical ways help language delay post,False
4142,year companies invest technology move operations online year making online experience better accessible texthelps cto explores,False
4143,tonight mental health night give us call line open tonight pm,False
4144,rt identity work sharif persaud view highlights persauds solo exhibition autograph new online photography gallery autograph dec,False
4145,love idea intuitive eating feel like chronic illness medication trauma long term eating disorders prevent ever able get,False
4146,great guidelines think write autism,False
4147,article everyone read focus autism holds lessons many fall outside norm thanks posting,False
4148,sometimes climbing management position constantly worrying day everyone realize arent qualified deserving whats like,False
4149,autisma sensory meltdown temper tantrum,False
4150,wooooo managed actually start stream poggers maybe gameplay later,False
4151,many people associate difficulty eye contact autism couldnt truth people adhd many disorders conditions difficulty eye contact many reasons let explain,False
4152,adhd significant part experience therefore formative character personality like please,False
4153,reason grateful diagnosed education workings brain made possible enabled connect group like minds,False
4154,hope share experience found please,False
4155,tradition traditional,False
4156,hi still reply email protected characteristic,False
4157,brilliant important,False
4158,please join neurodiverty together server,False
4159,trying teach someone brain neurotypical brain never work properly anything wrong brain trying make something,False
4160,may mentally ill wanting experimental gene therapy libtard u respect,False
4161,students removed lose learning fall behind time become alienated disenfranchised dr ross greene,False
4162,traditional discipline policies protocols reactive reflexive focusing primarily consequences dr lori l desautels,False
4163,course online classes come difficulties dyslexic children find ways help post eschool success dyslexia,False
4164,talk autism respectfully public support center,False
4165,music therapists especially position writing otherwise communicating autistic people manner please read prior publishing research creating course materials music therapy educator,False
4166,know lot going trying singlehandedly save democracy also know care people get overlooked talked work encounter autistic people may help,False
4167,dont know dont seem use twitter often hope see wrote thing journalists better job talking autism would mean world looked maybe shared,False
4168,hear big part movement coming challenge accepted definitions phrases nonspeaking accurate okay insist doctors etc change things,False
4169,blue whether realize voice means lot lot undiagnosed autistic people wonder would willing share document geared writers speak autism respect,False
4170,link goal provide journalists professionals tools need cover people without harming us really bad,False
4171,im huge fan work would mean lot time space took look piece wrote advising journalists speak autism respect feedback welcome,False
4172,adhd things,False
4173,often hiring managers looking folks job well fit existing company culture fitting culture requirement joseph riddle executive director workplace,False
4174,likely go one three ways gender crisis youll discover adhd youll start livestreaming niche hobby tiktok dont make rules,False
4175,warm cheerful support inclusion faith god alternate approaches,False
4176,great sounding program affirming therapists via programs help get better care disabled patients please share dm,False
4177,excerpt chat boonie sripom lorran garrison full episode check podcast player voice america empower youtube,False
4178,independent living zetetick housing donate croydon people first zetetick delighted able giveback croydon people first donation judith,False
4179,tonight mental health disability night need talk us topics evening,False
4180,looking new job recruiting exciting roles wwwcaretradeorg,False
4181,business case online accessibility new intensified recent years via,False
4182,prefer use terms neurodivergence please note guy responding advocating schizophrenia acceptance,False
4183,journey thus far learned growth area possible focus simplicity work resolve complexity committed vision simple microshifts use complexity source inspiration,False
4184,excited working aced ambassador delivering campaign challenging need reform outdated traditional educational system great meet,False
4185,uncommon someone dyslexia neurodiversities call cooccurring conditions,False
4186,favourite thing streaming social aspect love chatting viewers talking anything subjects jump one thing another gotta love chat,False
4187,gift everyone gifts different say adhd autism worse one maybe glad affects special interests encyclopedic amount knowledge great many things,False
4188,tweets replying say nt people study us friends family teachers mean ones teach autism autistic people know,False
4189,autistic cake day profile said talk formal dx adhd year thinking autistic traits pinned tweet,False
4190,gatekeeping adhd lmao neurological condition oh dunno adjudicated medical professionals lmao resent social media accounts made real personality quirk,False
4191,adhd like great box wait put stuff totally forget months,False
4192,please join neurodiverty together server,False
4193,zeteticks new chair explains might want charity trustee helping essentials life martin chair trustees zetetick lead,False
4194,also need permission activities home bruh cares god watching damn home sheesh hate feeling antsy days blows nt without feeling buzzy buzz buzz white noise,False
4195,going link story autism marijuana say infuriating constantly see mainstream media frame autism something overcome autistic children lost stop autistic people need support cures,False
4196,new paper accepted watch space,False
4197,looks like essay written time,False
4198,thank much author kay kerr list books insight autism picture books ya,False
4199,counterpoint wanting mutilate body never comes mentally sound healthy place personally think important attack narrative surgery affirmative etc scratch surface theres always trauma abuse mental illness etc,False
4200,job telling people error creating supportive constructive environment provide structured detailed feedback clients,False
4201,ahead listen nenad manasijevic discuss pressure points student accommodation reimagining light covid particular focus,False
4202,autism diagnosis change explains think differently,False
4203,great article praslova shares people make great leaders employees,False
4204,christmas time creating weird wonderful family traditions,False
4205,added books recommended reading list looking great reads upcoming winter break,False
4206,learning instant emotional bond data makes lot sense like shocking amount sense kind relief also makes little mad,False
4207,say also case grew internet didnt know certainly couldnt access worldwide community,False
4208,audiobook download neurotribes legacy autism future,False
4209,good stuff happening around,False
4210,id like see hear lgbtq advocacy groups issue given represents existential threat also venn diagram terfs antineurodiversity critics eclipse,False
4211,annual research review shifting normal science autism science,False
4212,society damn obsessed punishment retribution,False
4213,ive thinking several years enough say recognize stop using obvious ableist language anyone wants act way consistent real compassion others needs understand cont,False
4214,heres great list kids books feature p almost catalog,False
4215,join professional development workshop click see info register tickets,False
4216,people mental problems slowness shouldnt find love either let alone get air time since someone doesnt seem neurotypical means excluded might surprised common really,False
4217,since knighted sir simon baroncohen comes sometimes guess queen elizabeth proponent course british followers free correct im getting something wrong,False
4218,im really sorry mixed neurotype households really hard unless everyone fully onboard committed,False
4219,gn sweet dreams artist francesca lewis,False
4220,push ko talaga talks abt bcos need understand real thing something came,False
4221,see people asperger syndrome bright thread rich tapestry life tony attwood,False
4222,science naturally exciting best handson outdoors videos thrown homeschool science students dyslexia,False
4223,companies looking tech leaders guidance products leadership like partnership walking walk,False
4224,break negative cycle practice selfcompassion read,False
4225,isnt mental health autism adjacent work trying help journalists less harm write autistic people would consider amplifying article please,False
4226,,False
4227,hey hey hey look timestamp recap,False
4228,given thought destabilised sense self pandemic thing def exacerbated least severely understimulated unbearably overstimulated times hate,False
4229,awesome trade show ideas virtual inperson,False
4230,timely question working multiple streams address medical ableism aotearoa new zealand maintaining nonpublic register clinicians one next steps,False
4231,concept recognises brain function behavioural traits simply indicators diverse human population unfortunately working practices designed inclusive natural variations leading discrimination,False
4232,autismnot able speak thing anything say,False
4233,disability f damaged fallen world thats ppl broken result sin av must due poor lifestyle vax damage,False
4234,basked typical world grows stable far long long since left thriving chaos playful intellectual spite unity abided perfect appropriate introversion,False
4235,fairness andrew think might degree play looking eye part,False
4236,quite fine line genius madness probably needs therapy leads life problems otherwise work great bet people started cities k years ago would made great nft projects today vice versa,False
4237,know people adhd dcd dyspraxia well people different dont live boxes embrace,False
4238,hey hchip trav make surrealist abstract pop art images share themes human experience spirituality important mind fuzz,False
4239,housing choices ah yes housing choices often determined us housing authority whether learning disability housing choices essential,False
4240,neurodivergence provoking new mind sight via,False
4241,could please though wrote essay feminist advocacy reaaally couldve used concrete source topic,False
4242,seems matters great deal whether start position minimizing iatrogenic harm diagnostic harm position minimizing harms untreated adhd manifestations position appreciative phenomenon,False
4243,far happens trauma theres almost many reasons endogenic systems big three due due spiritual reasons due putting effort training brain perceive belonging one person,False
4244,explain test scores fail show dyslexic student really understands reading test scores dyslexia,False
4245,source im nd including adhd struggle substances heres links,False
4246,think one talk autism respectfully public support center,False
4247,unh u program introduces students w id campus life students gain skills knowledge help navigate real world,False
4248,kept hearing lazy dirty disorganized understand burnout executive functioning feel like getting believe massive fucking betrayal showed sincere genuine care eating soul,False
4249,visit us,False
4250,undiagnosed aggregated untreated traumas dont perceive things triggers living objectively seems ok life,False
4251,regarding post saw instagram embracing calling autism disorder disability two things need coexist disabled disorder dirty words course need cured still disabled,False
4252,setting boundaries around abilities hard embarrassing necessary worth getting better saying dont strictly verbal synchronous conversations certain contexts energy sapping easy others take advantage,False
4253,beyond thankful community helping parents like understand daughter well realize adulthood knew brain wired differently years,False
4254,day flowers soon,False
4255,genius disorder find,False
4256,please read claim care written audience journalists mind many others benefit one best pieces read,False
4257,see sure changes later books perhaps first read adult whole adhd dyslexia halfgod whilst well intended sweet nod son always hit bit acknowledging actual,False
4258,need autistics people help getting tag ive running people use important movement,False
4259,packing big christmas trip north whilst catching reasons cheerful podcast really excellent episode,False
4260,vegetarian,False
4261,celebrate difference love way,False
4262,helps describe define people manifests different ways different people,False
4263,unmasks autism monoray unmasking autism power embracing hidden autistic people,False
4264,theres many parallels well,False
4265,behalf gain group autism insurance team please share december edition neuroinclusion news,False
4266,join inclusion awareness training january gain practical ideas making sure work environment suits diverse range employees relation find,False
4267,want find relationship design affects respond elements relates legislation book design course jan,False
4268,create inclusive workplace welcoming staff fujitsu discuss workplace partnering improve lives autistic people,False
4269,jude morrow set training international cpd accredited training provider approved autistic people goforit programme allowed source finance get business advice mentor read goforit helped jude,False
4270,trying find radio show ago office design autism neurodivergence cannot find sounds please help may,False
4271,feel need diagnosis celebrate anyway wonder might help mum understand always struggled though,False
4272,blog continue discussion marvel cinematic universe representation autism community discussing character ant man,False
4273,considerate christmas let make year loved ones feel included accommodated,False
4274,adjust believe figure ratio males females diagnosed autism misleading read blog autism women work,False
4275,people spectrum often left aside unemployed discover built program hire keep individuals,False
4276,wonderful great job raising awareness understanding autistic spectrum disorders shared groups,False
4277,great see announcement futures programme fantastic initiative bring talented individuals ucc radical humanities laboratory opportunities researchers many disciplines including maternity childhood wellbeing,False
4278,important important comes next sustainable working practices company culture make new employee want stick around,False
4279,hi al may interested discussion autism one contributors adoptive parent talking son autism may acted protection abuse interesting quite blunt hypothesis,False
4280,brand new ethics codes mention autism autistic culture nothing nothing word,False
4281,andy edwards music business executive director research recently wrote experience autism adhd calling music industry inclusive supportive talent,False
4282,ive recently finished watching wonderful episodes souad abdallahs script great critique kuwaiti society social media power gender identity politics family honour beyond highly highly recommended,False
4283,youve apparently know nothing movement way founded nonspeaking autistics advocate everyone especially neurokin communication except behavior communication one communication,False
4284,days go addvance advent calendar top tips survive festive season,False
4285,dont think queen gets say decided honours committee case proponents keen sbc days,False
