,tokenized_text,is_after_split_date
0,school board member attending summit good students precisely like tax dollars cover w nd children,True
1,happy,True
2,reread percy jackson series thoughts neurodivergance nd thread would like preface saying although experience im psychologist neurodivergance diverse might right,True
3,someone attacking autistic adhder two ways meme legally blonde,True
4,happy year,True
5,blessing curse,True
6,thanks chatter year helped probably realize know true lots lots people well,True
7,happy new year cope consulting llc,True
8,sensoryfriendly coworking space design shared offices,True
9,happy new year home,True
10,neither settled humans better masking capabilities animals,True
11,last year group gave focus direction safety met truly inspiratonal people greatful thank everyone support looking forward seeing achieve,True
12,live ringing new year,True
13,learned paradigm changed world view unlocked empathy towards autistic adhd people really everyone since hidden struggles,True
14,happened want know planned drops events projects got sign mailing list receive full roadmap tomorrow,True
15,really wanna go back monopoly guys top way wwe pushes diversity literally marketing care black issues gay issues trans issues care much money brings em,True
16,son adhd difficult fully understand time passes see runs side family many male relatives adhd spectrum respect worry diagnosis medicating children,True
17,forbes year movement came age,True
18,review know different know im alone investigation personality type deeper,True
19,meeting disabled artists around world shared experience became artxv global collective artists selling work nfts showing world beautiful diversity,True
20,thank modeling kindness every day unkind world also thank open honest conversations mental health,True
21,thank open honest conversations life mental health autism also steve thank phone friend professionally year,True
22,community would embrace rather shy away platform would allow disabled artists sell work freely without physical societal constraints world going shake old conservative art industry nfts,True
23,happy new year oba family community instead hoping better year lets work together make better,True
24,st grade told son would never able school classroom bc hes today received st college acceptance letter gave presidential scholars award covers yrs tuition never give,True
25,classes focus black families bc know study experience however anyone prepared discuss parenting disparities racism ableism sexism day reparenting another,True
26,wish single diagnostician specialists one dyslexia one adhd one autism spent months lives seeing different people different conditions one specialist many therapists need trained instead,True
27,happy new year order methinks party reminder monday,True
28,celebrated looked great leaps scientific understanding inventions often reclusive extrovert people leonardo da vinci cavendish branson society needs value,True
29,rt psychiatricnews happy new year january issue psychiatric news available online check psychiatrists say ethical decisionmaking pros cons,True
30,thread growing adhd believing burden broken need fixing constantly criticized punished failures cannot always appropriately control,True
31,new chapter new job role excited championing children anyone else working field sector please connect together much,True
32,happy new year january issue psychiatric news available online check psychiatrists say ethical decisionmaking pros cons,True
33,blog autism suicide jeff snyder autism selfadvocate public speaker,True
34,sensoryfriendly swimming swim lessons,True
35,psychopathy dsmv engrams demonic possession fear losing control oneself nature reality learning trigger warning im sure following might know something,True
36,smart money smart homes zetetick housing provides safe happy supported living homes mainly learning disabled autistic adults complex needs,True
37,know someone would love win free ticket share retweet biased cannot pick specific talk ofc excited bring panel ux content,True
38,cheers silver lining happy gnew year,True
39,going honoured outstanding work raising awareness,True
40,plans need keep moving forward best,True
41,good scientists innovative creative people would describe believe definitely see strength disability,True
42,partly term seeking explain unfortunately coopted authority science neuro prefix language failed inclusion policies form diversity undermining potential selfgiven power selfid,True
43,anyone struggling,True
44,happy new year let hope progress towards achieving true diversity continues everyone sees represented everywhere,True
45,information found frequently linked,True
46,welcomed gearing welcome groundbreaking national exhibition march year,True
47,give wings dreams let come true happy new year,True
48,happy new year going distance theres lot exciting things planned cant wait share,True
49,may take several years children attain full autonomy cleaning dishes info visit,True
50,excellent thread intersectionality movement,True
51,series tackling myths surrounding focus dyslexia myths estimated affect around population read blog dyslexia myths,True
52,brilliant ambassadors talk people realise talk helps everyone life work,True
53,go regular dates wife present childrens activities finish six audio books join advocacy network decorate living dining rooms launch information security blog post least per month,True
54,offer professional education courses varying lengths delivered onsite online mixed formats including selfpaced learning modules interactive lectures facilitated asynchronous workshops q sessions via suitable tools,True
55,growing index community services projects designed progress movement encourage formation new autistic collaborations neurodiventures,True
56,,True
57,need yall know son able endure fireworks magical happy new year may find highest purpose may love little laugh w joy live w compassion,True
58,new episode available,True
59,main staple unable focus call crazy focus task lol might top tier advice,True
60,drax mantis maybe peacemaker feel like youre one filmmakers acknowledges celebrates thank,True
61,neurodivergence provoking new mind sight via,True
62,volunteers charity trustees meeting new normal charity trustees met quarterly board meeting video conference tuesday night new normal way,True
63,autismthere different abilities found yet,True
64,may take several years children attain full autonomy cleaning dishes info visit,True
65,requires original thinking must many thanks sharing article contributing thoughts,True
66,would great trained one specialist many people trained therapy chase around five six diagnosticians one child adult craziness good children parents adults,True
67,embraced people arent wrong puzzling thinking always logical time someone would ask process yall dont time understand explain deemed okay,True
68,work trauma way lots work tends working coach parents would go far say socioeconomic status completely irrelevant poor parenting trauma everywhere swept carpet,True
69,recommend talia hibbert enough whole series three books best thing ever read characters color portrayed beautifully funny sexy playlist front,True
70,dyslexia dyspraxia one specialist together us asc ocd another separate paediatrician hypermobility opthalmic optician meares irliens syndrome speech therapist letter substitution stuttering linked,True
71,imo superheroes make amazing analogy weird popular media hasnt directly made connection yet anyway definitely looking forward video favorite superhero,True
72,got joke ya betterdiagnosed,True
73,say diagnose child dyslexia years old knew something quite right much earlier,True
74,trusted source aaps phony journal wellspring crankery antivax bs esp vax causes autism hoax tort bar played millions aids denialism read devastating analysis org journal,True
75,happy new year entire prentice team,True
76,looking forward seeing one always like spins genuinely,True
77,happy new year resolution stick beloved routines make us happy case means frequent walks hikes stops benches logs even sitting trail beloved routines,True
78,supported housing journey home zeteticks tenants often long journey flying home zetetick journey doesnt end move,True
79,yo friends need hand im looking make video spiderman analogy wanna hear experiences dont fuck,True
80,dear people online group keen see tour many us live places think shows postponed antwerp toronto would consider online event sincerely nds,True
81,nsoumoocs admission understanding fundamentals cyber security nd cycle detail brochure banner admission form,True
82,would also absolutely recommend nick recently published book,True
83,want acceptance,True
84,tired men think dyed hair make manic pixie dream girl,True
85,catching thankful friends able grow explore passions share honesty find friends grow long haul,True
86,happy us beyond door,True
87,diolch yn fawr everyone celebrated us cafe,True
88,yup likely conditions well alongside plus even within type lots differences everyone autistic example fits neat box,True
89,interesting always thought ot role policing remember cahpo conference chief constable talking maj offenders primary issues mental health substance misuse comms love hear role progresses,True
90,without,True
91,well done would love find doctor understands even themself,True
92,english referring people use word instead used objects also includes people severe mental illnesses bipolar schizophrenia,True
93,happy new year friends past year plenty ups downs push new year make sure take time mental health positive environments supportive people,True
94,absolutely forsyth fire emblem,True
95,hi alex able help talk dm interested,True
96,see alexs posts,True
97,rearranging brain get past self harm nonsense self care flesh vessel maintenance housework docking station maintenance pet plant care crew facility maintenance,True
98,educator field three decades maclean gander seen many positive disruptive changes field education important change find heinemann blog,True
99,people age add adhd flourish get plenty movement outdoor play handson learning add adhd tips teachers parents,True
100,put word need motivated selfstarter unless adhd condition gets way case need right treatment impersonate time,True
101,new year ves treating better welcoming self ves conversation enabling inner dialogue,True
102,thanks sharing supporting workplace video ondeckeo martech video hub,True
103,dont take personally us autistics need break social contact,True
104,moots wondering theyre undiagnosed adhd autistic wanna talk dm bc recently identifying fucking life changing everyone deserves someone give safe understanding,True
105,resolution stay positive despite increasing positive covid tests,True
106,real talk blessing curse times discouraged lets forget good come,True
107,launch supply tailor made cannabinoids help ease aspects life focusing cbdv groundbreaking effects,True
108,think mapped would long term accretive model self directed self owned driven way think best drivers understand engines believe networked thought programs offer way nodes network points time,True
109,autism world every accomplishment precious gift,True
110,love fact hosting livestreamed event u thursday follow us facebook instagram youtube join live two weeks see p,True
111,think great idea disclose wherever helps get support need gift learn much us offer,True
112,first read split wide open ignorance around difference indifference means pay carefull attention misunderstanding reading literature life,True
113,available preorder neuroqueer heresies definitive collection nick walkers essays autism neuroqueer theory neuroqueer heresies collects decade worth dr walkers work along lot new material,True
114,ooh forest app one favourites always sharing punc staff students include awareness training trusts universities,True
115,ditching shaming neurodivergence education adapting full range youth absolutely happen many schools still using drugs communication,True
116,failed fails epic others simply stumbles road,True
117,sigh feel like discourse gotten visible problem armchair diagnosing gotten widespread also feels like phenomenon thats around forever ppl using new words diagnostic labels,True
118,might mess around make podcast focused discussing various diagnoses dissecting media representations interviewing fellow peeps,True
119,zetetick housing opens lewes office supported living sussex zetetick housing recently opened new office,True
120,never said autistics obviously however autism implying discussions ultimately unhelpful,True
121,new thought id join gaia redgrave earthsong socially engaged visual artist focusing autoethnography liminal also creative arts consultant happy new year nick,True
122,huge umbrella talk traits specific issues talking things w tourette saying autistics without others overall much often recognised,True
123,amazing crowned world strongest man champion,True
124,pirell mal nazra alchemist godra shes precious ball cuteness,True
125,folks curious resolutions yearly themes attention tunnels contributing little talk l event tuesday evening tickets,True
126,schools getting ready begin new term take time reflect bring empathy classroom beyond little understanding make huge difference,True
127,latest blog post navigating politics,True
128,view stuff changed lot last months much moving away neurodiversitylite conception nd embracing judy original model power dynamic neurominority neuromajority groups matters let shape,True
129,signs always immediately obvious may nursery school age symptoms alcohol exposure start show,True
130,feel like rightly talking lot covid disability immunocompromised folx less complications mental illness beyond bit depressing,True
131,society ready support people promote strengths,True
132,feel similar spectrum say vary hugely spectrum include things like dyslexia dyspraxia etc spectrum traits indicates rather autism adhd dyslexia,True
133,maybe write another post autisms gadfly b die probably great many years left ive sort moved fair number posts knee jerk reactions proponents angered,True
134,create culture workplace everyone supported encouraged despite differenceshttps tcoblycwgorx,True
135,yeah thats probably true time thats ya tried,True
136,even worse nearly autism research focuses making life easier parents teachers autistic children rather individual,True
137,whether something accurate effective must determined people otherwise complete waste time results useless,True
138,neurodiversified accepting writer submissions visit medium publication review submission guidelines learn apply,True
139,looking papers rabbit holes etc work chapter anomalies nd outliers perception synesthesia deja vu autism particularly viewed perspective neurology connectome,True
140,looking educational informative wellwritten articles adhd autism mental health twice exceptionality parenting advocacy education,True
141,neurodiversifieds january call submissions happy new year looking educational informative wellwritten articles adhd autism mental health twice exceptionality parenting advocacy education,True
142,icymi tying loose ends aviation safety,True
143,people appreciate enough,True
144,autistics adhd people different connections many reasons autistics claim identify autism usually societal discrimination struggling,True
145,running training courses,True
146,okay okay,True
147,supported living family need know supported living way giving people learning disabilities autistic people others right live,True
148,seeing fnd nonepileptic seizure research identify strong links people seizures alexithymia learning disabilities myriad things associated wanting yell,True
149,use word experiment need give act instead stay often means lot sensitivity also negative outcomes,True
150,reorganising drawers midnight,True
151,minus diagnosed kept bringing home notes never focused going sometimes wonder meant also kind dont wanna know,True
152,still waiting list assessment appreciate youre busy long wait,True
153,reader,True
154,founding lead effective,True
155,make worst thing major identity karen treisman every learner excel must support emotional educational needs confidence showcase strengths talents,True
156,fellow dev seen incredible journey however akash burnout joke one must know rest person different challenges ex,True
157,discussion allyship used bully organisation use diversity training push agenda unravel autism got noise issues,True
158,parent child embrace complexity everyday let make year strive make school workplaces environments inclusive join us,True
159,absolutely disgusting treatment young autistic adult early years help doesnt exist camhs fit purpose schools unable recognise support failure failure leading trauma responses resulting drugged locked barbaric,True
160,excited announce launching series webinars starting matter best practice recruitment partnership cognassist january email early interest solutionsprotocolcouk,True
161,lets make best year yet,True
162,giving praise remember kids cant expected meet adult standards info visit,True
163,read blog freelancing,True
164,best hugs hes giving without prompting bring tears eyes love special way viewing world im glad see open trying new things new skills gain new independence confidence,True
165,hey android friends could kind service rt im trying get touch awesome women chatted mental illness talk womens perspectives memory dreadful ive forgotten names,True
166,happy birthday pleasure getting know laura since learnt lots send scotland jokes fit christmas crackers top tweets good day laura unicorns setting world alight,True
167,years cycle advocacy transport planning highway engineering end wonderful human means people never get networks people may get networks make decisions based emotion drive date rule engage times move,True
168,first matchday year happy travels home away new ground today,True
169,launch supply tailor made cannabinoids help ease aspects life focusing cbdv groundbreaking effects,True
170,actually fun teaching people peak looking jay saying much hes improved grown cos remember non verbal emotional social anxious child,True
171,neurodivergence provoking new mind sight via,True
172,zeteticks new chair explains might want charity trustee helping essentials life martin chair trustees zetetick lead,True
173,opal newsletter coming back better technical blogs opinion pieces coming soon focusing devops technical subjects inclusion know good writer going channel gift head twitter profile subscribe,True
174,sending much love,True
175,dont even smokers transition vapes safer nicotine alternatives like nicotine pouches surprise one many tobacco advocates adults living issues,True
176,please join neurodiverty together server,True
177,high school teacher possibly help students dont read yet heres without sacrificing classroom time personal time,True
178,looking back notsoimpossible lessons interview left better understanding mention better appreciation unique brain,True
179,courage always roar sometimes quite voice end day saying try tomorrow,True
180,drives nuts bipolar personality disorders brain injury people dont want talk unless uwu shit,True
181,specifically mention sami among things know like feel like publication everyone associated feel proper normal,True
182,first widely believed world uk rife undiagnosed lends review neurotypical things stand weirdos mister,True
183,asd people want treatment breakthroughs cures criticize mr elder probably never heard nd apt description imo,True
184,great work mr p v,True
185,dear media outlets please stop writing autism stop person x stories story passion project entirely likely autistic focus dedication project happening framed strength,True
186,deadwood doesnt get nearly enough praise cast,True
187,many unhealthy coping mechanisms didnt know brain still drink ton coffee top meds knowing emphasizes badly understand mental health issues,True
188,hey know submit info vaers without even doctor hell even report flu vaccine turned hulk,True
189,new people labels,True
190,incredibly wrong,True
191,dear mcyt fandom r interested interested trying diagnose ppl dont know spend time research listening ppl learning treat disabilities making trend ableist fucking stop,True
192,according cigarettes consumed usa smoked adults living issues would include adults smoke smoke smoke,True
193,property maintenance zetetick housing results response times speak,True
194,understand teacher training covers little regard mental health even important,True
195,wolf also really interesting neurodivergence perspective author dyslexic dyspraxic created essentially dyslexic culture within paradigm rather deficitbased one,True
196,let maintain approach beauty individuality collective spectrum adopting linear binary approach clumps together sacrificing belittling disregarding unique lived experiences,True
197,feel free read whole tweet image description meme found randomly searching autistic content long serves education,True
198,think first sections make good description nothing neurodivergence nearer end minority majority misses hierarchy stigma already within community,True
199,blog post concept people neurodivergence neurominority vs neuromajority described basically neurotypical split also ignores lot important concepts within,True
200,focus work within paradigm broadened beyond autism encompass forms neurodivergence time paradigm increasingly gained footholds various realms scholarships literature praises,True
201,term coined autistic australian sociologist named judy singer quickly picked extended upon within autistic activist community,True
202,helping heal internalized oppression development movement origins autistic rights movement spring,True
203,please join neurodiverty together server,True
204,social dynamics similar dynamics manifest around forms human diversity dynamics include unequal distribution social power conversely embraced diversity act source creative potential,True
205,preprint latest academic article epistemic injustice good human life coauthored havi carel forthcoming journal social philosophy,True
206,principles essential form human diversity idea one normal healthy type brain one right style neurocognitive functioning valid idea one normal right gender race culture,True
207,paradigm emergent paradigm understood form human diversity subject social dynamics forms diversity including dynamics power oppression,True
208,found wild looking autistic content nick walker diversity human brains minds infinite variations neurocognitive functioning within species,True
209,yeah anything technically deviates norm would considered like bipolar depression schizophrenia ect ended finding meme id dig find create another image description blurry,True
210,theyre manifestations vast practical everyday level massive differences especially disabling putting together confuse matters far see muddying things,True
211,yep thats position whole movement im certain good chunk population could autistic adhd concurring even know even depression considered everyones everyone autistic,True
212,autism parenting feel like complete failure one minute invincible next,True
213,earth ability use simple social media program imply level someone struggles,True
214,great demonstration autism doesnt mean cant achieve best well done title worlds strongest man fabulous competitors,True
215,clockwise top left show us elle plotting superb characterisation deep passion putting firmly map current children literature,True
216,saying live,True
217,know completely one painful part home ed journey past years best interests kids smile move selective places people things blessed,True
218,using strengthsbased neurodiversityfriendly lens working people families,True
219,podcast disability health inequities definately interested checking blog would live podcast wanted share experience story,True
220,wish doctors especially psychiatrist attend oliver mcgowan mandatory training learning disability autism awareness clinicians decision makers many require better understanding,True
221,shout us would count minority investor uk tick box latinx proud diversity team across genders ethnicities list building needs x bigger next year,True
222,okay continuing previous thread anyone still train weirdsville includes mix bts rose txt untamed mxtx acceptance raise hand glad,True
223,think functioning labels helpful harmful,True
224,followed christian im quite board,True
225,also growing number white women using quirky personality trait social media rather neglecting actual struggles faced suffering even mention experience poc,True
226,say right thing concerned sure red carded many times including individual clinicians,True
227,lets start new year right rita pierson reminds us every kid needs champion,True
228,application neuronormative mental health theory therapies actually largescale gaslighting individuals,True
229,acceptance tshirt donate charity buying fly tshirt,True
230,time friendly reminder communication often challenge thank coming,True
231,doctor eve daleks theory nick autistic aspergers makes sense hes considered weird keeping stuff categorised date order strange behaviour im dyspraxic,True
232,adhd new years resolutions make able keep making keeping make feel even worse ideas achievable ones,True
233,new year arrived taken time consider year ended,True
234,dyslexia tool kit chapter phonics via,True
235,dyslexia tool kit chapter silent reading short via,True
236,long covid neurological impacts like cognitive impairment brain fog describe brain fog someone help understand would say,True
237,autism end autistic adults exist,True
238,casual hypothesis industrial production may place people whose manifests following strict schedules enjoying repetitive tasks niche attention detail embraced excellent workers,True
239,hoping one looks us,True
