,tokenized_text,is_after_split_date
5430,dont know sexuality damn pleasing brain schedule sex,True
5431,exactly cant separate based stereotypical physical strength pretend real sudden also sad totally misses defining actually going people non typical trying blend physically,True
5432,listen new podcast power,True
5433,symptoms overlap conditions homonal imbalance early menopause others rarely receive medical investigation correct dx pd label discredits us valid witnesses health issues,True
5434,sorry wasnt meant meant read leading scholar working bpd,True
5435,joke also metaphor queerness comes hayes code encouraging portrayal queerness aberrant villainous since reclaimed way saying fuck oppressors also vampires hot,True
5436,matters things im learning autistic cou via,True
5437,dont tell proponents,True
5438,hope point find time read article disagree say parts reasoning disagree merri lisa johnson leading scholar working bpd think deserves taken seriously,True
5439,also sa rates age harassment time high pressures porn lesbian girls struggling fit told acting butch triggers trans kids girls long escape gender role position moreso differences,True
5440,looking fabulous senco join lovely school found job tes app,True
5441,stylized sound seem tell us something title song indian cuckoo technique oil painting canvas measurements xxcm year,True
5442,new information hub live,True
5443,trying things differently real boon trying micromanage may work well musk,True
5444,look neurowild facebook clear explanations although referencing literature enough say autistic people like terminology affirming respect views,True
5445,first steps parent adhd diagnosis challenging especially explaining means child advice explain adhd child,True
5446,join masterclass series thursday pm justin carrero workplace inclusion intersectionality welcome register advance via eventbrite,True
5447,follow links bitpaper guide sign receive helpful booklet straight away,True
5448,employers looking women particular cybersecurity roles require fast pattern recognition sharper accuracy greater attention detail,True
5449,blog discuss part prepare disabled child thanksgiving,True
5450,talking three topics social mobility wellbeing future readiness shoo value team differences whether backgrounds mental wellbeing recognise value learn,True
5451,thats awesome pleased autism dx helped parents discover yes never late think theres widespread need awareness,True
5452,refers diversity human minds includes everyone neurotypical,True
5453,please vote following films entered,True
5454,dr niraj arora consultant psychiatrist soke performance corporate services division soke explains organisations embrace gain competitive advantage terms productivity innovation well culture talent retention,True
5455,experienced overt discrimination,True
5456,looking forward packed agenda today found coffee always good start conference listening workplace nd inclusion wellbeing topics,True
5457,fab talking morning workplace following announcement want recruit women,True
5458,temple grandin louis carter business imperative,True
5459,found lot stigma longer work support group topic regularly spoken much support,True
5460,slowly getting used mastodon anyone wants join following back peeps help get advocate community going grow,True
5461,hub open cardiff offering bespoke learning people needs allow men learn essential skills environment adapted needs,True
5462,embracing modern workplace gets done important gets done creating workplaces accommodate individuals gets heart work done read,True
5463,women adhd indispensable guide overcome struggles living adhd embrace practical dre rgw,True
5464,diversity positive natural feature society including need stop trying fit children square boxes shaped small subset causes distress fit restrictive,True
5465,case missed missed exclusive interview zoe catch youtube discuss zoe life successful businesswoman mind,True
5466,life advantage bahwjwhwjsjsjs,True
5467,want read terrific testimonials tutors taken courses,True
5468,come meet discuss independent business psychologist senior consultant genius within charlie talks neurominority conditions dyslexia autism offering guidance support,True
5469,need considerate even youre trying help advice keep mind,True
5470,yes understand views approaches think totally valid saying views approaches build lens also valid,True
5471,one thing really surprisingly happy find fandom complete gender orientation acceptance like met many nd people like another way community makes feel safe authentic,True
5472,demand avoidance adhd thing well asc thing asking friend obviously overcome tendency demands trouble meeting ones make,True
5473,live laugh,True
5474,thank iti network inviting present autistic language hypothesis fantastic opportunity speak professional translators wish time answer great questions,True
5475,know designed launched worlds first app schools also know members get access collective strong experts yesterday worked early years yr staff thanks,True
5476,trainer consultant fin regan leading adhd systems strategies support pupils boarding schools webinar along chair ammy daviespotter thursday december book,True
5477,mean particularly area learning differences mental health,True
5478,dont afraid different afraid,True
5479,p know many gender clinicians gender therapists gender clinics trained experienced assessing diagnosing supporting epic medical failure,True
5480,many autsitic community embrace concept concept forms neurological development healthy valid,True
5481,really enjoying cbi conference amazing meet many leaders corporate work agenda majority already members,True
5482,psychology professor keen teaching psychology,True
5483,adhd motivated clean proceeded buy lots cleaning tools never open package cleaning tools month later pipeline,True
5484,paradigm embrace autism,True
5485,thank look yes definitely much keen align affirming practices think interested came decision rather trying dispute thanks,True
5486,embracing workplace,True
5487,inclusion report would interested know measures end stigma living testimony dyslexic thinking skill recognized dyslexic candidate attempted suicide bomet,True
5488,attending workshop great minds think differently celebrating wellbeing delivered alisonbrown,True
5489,workplace interests issues opportunities siop organizational frontiers jarvyx,True
5490,little talk thursday hoping others join share experiences please rt,True
5491,great honor pleasure presenting workplace conference held bratislava slovakia check live stream conference,True
5492,glad able move environment isolation exclusion damaging wondering uni society daughter involved one ucc made wonderful friends found many like minded people,True
5493,thrilled small part large project create autism self assessment tool includes autistic perspective check article,True
5494,alter assumptions let go rigidity doesnt truly fit us embrace fact sex gender etc makes us different still much common need strict rules assumptions,True
5495,uk music workplace survey results revealed ethnicity gender disability sexual orientation socioeconomic status read,True
5496,whats disappointing gives appearance microsoft podcast women possibility talk equality doesnt mean exclusion needs name change cover points imho,True
5497,men see things say dream things never say robert kennedy,True
5498,employees working tech find perspectives valuable team get tips overcome obstacles hiring process,True
5499,going live lego dinosaur fossils rebuild,True
5500,tomorrow staff students invited join guest speaker inaugural disability history month lecture explore commitment disability inclusion uor register via staff student portals,True
5501,love article conclusions seamlessly fit librarians yes embracing fandom integral part neurodiversityaffirming therapy school librarians need wholeheartandmindedly,True
5502,thank opportunity hear understand,True
5503,latest dyslexia update thanks,True
5504,individuals deserve feel accommodated supported comfortable workplace employee learn,True
5505,join community manager virtual roundtable final day access november november pm pm gmt sign,True
5506,wonderful initiative spirit coming holidays end people mental health issues,True
5507,would say rather disability icouldnt agree fact see world angle,True
5508,free online workshop herts parents carers preparing adulthood wed rd nov book scan qr code image,True
5509,celebration support sign activities campus lived experiences panel discussion november self advocacy disability workshop st december,True
5510,tonight somerville special services sepag invite attend virtual workshop importance creating affirming environment tuesday nov p staff caregivers welcome email tmcdonaldsomervilleschoolsorg link,True
5511,mean collections embrace start making active moves collect preserve heritage people make collections priority curators like juxtapose modern nd collections past stories,True
5512,world cup great opportunity everyone come together however many friends group environments noisy bars packed pub gardens overwhelming experiences,True
5513,difference makes difference bateson paradigm systemic approaches support individuals organisations facilitate helpful conversations autism open access article,True
5514,umbrella term individuals cognitively process differently society considers norm register,True
5515,embracing fandom integral part neurodiversityaffirming therapy,True
5516,help gifted student struggles behavior find identify e students meet needs pd course strategies supporting twiceexceptional learners clicking,True
5517,engaging drama student bess joins today air shes last person open going career choices wings episodes,True
5518,engaging drama student bess joins today air shes last person open going career choices wings episodes,True
5519,embracing workplace,True
5520,youre adhd autistic dyslexic dyspraxic youd like training office drop line consultancy taking bookings next year also applies none id like supportive ally,True
5521,personally behalf group autism insurance investment pm champion group dementia communities commission thank member firms welcome blueprint,True
5522,matthew saunders episode,True
5523,big thanks colleagues hosting morning online talked screen using marvels xmen franchise discuss realworld ableism including eugenicist violence like aba people face daily basis,True
5524,sorry mean include alt text follows library assistant executing slightly awkward social media smile holds copies books heumann reader front display uk disability history month,True
5525,check uk website,True
5526,listening speakers struck many issues voluntary sector raising many years clearly agenda incl transition adulthood race inequality families,True
5527,miss online talk autism speaker tomorrow time location microsoft teams sign,True
5528,time things dont add,True
5529,phonemic awareness cornerstone learning read fluently focus skill ortongillingham based training learn website,True
5530,people conditions cope networking used joke know introvert networking look shoes instead,True
5531,please vote marvelous women uk,True
5532,deadline looming expression interest,True
5533,taking questions next ask anything episode facebook group members would like answer join fb group participate,True
5534,great conference derby today traumainformed practice plenty agenda stop stand see hear latest charanga team,True
5535,introduction maths anxiety deeper dive maths anxiety introduction using manipulatives information click,True
5536,dangerous know teen years time uncertainty exploration risktaking poor body image feeling like dont belong teens especially trauma feel like outsiders need support surgery,True
5537,species myriad dimensions different among others combine might call spectra economic systems different types people feel comfortable living,True
5538,great discussion today,True
5539,hope embraced accepted society adopts inclusive way thinking immediately dismiss someone fit right typical way communicating social approaching situations etc,True
5540,preorder st book workplace rising finally amazon kindle would believe hoops us jumping get book amazon finally delivered device link,True
5541,partnered cibc hire multiple positions toronto deadline apply changed november learn apply visit,True
5542,inspirational athletes autism tony highlighted include chris morgan michael jacques many,True
5543,managing workload person students professionals never found advice works shares creative practical transformative approaches,True
5544,proud sponsors free online day dedicated research resources inspirational perspectives dyslexia literacy differences sign free,True
5545,great insights article outlining evidence linking unique perspective people help bring novel solutions complex problems,True
5546,around corner want say huge thank sponsors still time save spot sign free,True
5547,learn celebrate differences well getting today part colleagues disability network took us fascinating journey history looking attitudes towards disability changed time,True
5548,mental health mean extremely kick ass job fact uncommon systemslevel thinking ability zoom system detail well outofthe box innovative thinking n,True
5549,q engineering insight raising awareness senior mining geotechnical engineer martin griffin advocate equality diversity inclusion focus disability,True
5550,know empowered accept invincible,True
5551,happy thanksgivingan appropriate time share article gianna driver discusses importance creating psychologically safe also embrace one reason thankful,True
5552,try attend two h meetings disability work weird see person bullied disabled,True
5553,implementing culturally responsive practices also includes meeting needs students learn,True
5554,one fall conference masterclasses today ler discusses lived experiences workplace inclusivity towards individuals lens,True
5555,python news remote working one simple fix helps people thrive venturebeat see full article,True
5556,library services looking expand collection better represent authentic narratives disability got recommendation students let us know via morebooks bham scheme,True
5557,stadia need sensory rooms watch video hear first hand difference made harry dad chris,True
5558,autism disability deafness culture disability arguably blindness disabilities indeed wider disabled community speaking blind person w mild hearing loss take opinion,True
5559,claim autistic people heightened abilities unhelpful suggests individuals need exceptional order accepted meena srinivasan changing conversation around workplace,True
5560,know question sounds nonsensical rhetorical aba used change problem behaviours use aba address ableism teach compliant behaviours,True
5561,judy singer australian sociologist coined word around think mainstream use recent,True
5562,enough people world going write need,True
5563,countdown nov seven days away join us next support belonging,True
5564,think would interesting experiment everyday ask lot people watch ask whether version left helped understand solve cube probably say possibly,True
5565,prof better understanding genetic components autism appreciation occurring naturally among people may help combat stigma still exists around autism,True
5566,atlantis editorial board member dr rohini bannerjee discussing recent panel session campus life,True
5567,investigations presence endogenous bufotenine human urine positive viewpoint,True
5568,absolutely amazing employs people cooccurring difficulties also provides support need coaches help thrive companies adopt approach,True
5569,st one last one,True
5570,join us november pt pm et hour continuing education webinar sarah swenson lmhc cover concept applies couples register,True
5571,say bill generation opportunity safeguard people learning disability fill survey,True
5572,superpower kryptonite diversity multitasking creative problem solving strong growth mindset examines superpowers spectrum harness inspire brand marketing,True
5573,trainmaster dorset offering send play session christmas come enjoy minute christmas party giant train tracks christmas crafts december pm book,True
5574,life skills flat means equip students skills need thrive university beyond,True
5575,dwp offering free event ipswich tomorrow rd nov promoting support services help people local area art workshop show feel like neurotypical world pm please share,True
5576,love letter parenting children living doesnt always look like sitcom rich,True
5577,ivymount brings paho incredible group posthigh school students every year sharing abilities helping work get done teaching staff value kindness inclusion,True
5578,appreciating opportunity discuss,True
5579,reminder silence doesnt necessarily mean people feel psychological unsafe might prefer communicate writing thinking deeply taking time articulate ideas simply anything say deaf mute etc,True
5580,delighted support launch abis dei blueprint today laurie edmans cbe states recognition level forms diversity benefit businesses access wider talent pool customers serve,True
5581,aspertools practical guide understanding embracing aspergers autism spectrum disorders neurodiv,True
5582,youre right usually autism adhd odd know kinds disabilities mental illnesses belong,True
5583,masterclass series experience broad range topics worldclass speakers individuals advocates researchers employers register,True
5584,used bad moment told internship contract going extended good opportunity push specific policy within multinational firm,True
5585,fall conference kicks today talks managing change fostering culture values growth talent sharing interactive sessions supporting work recognizing addressing signs toxic workplace improving management skills,True
5586,actually getting designate certain neurotypes atypical undermine idea valid embrace think know enough neurotypes label typical many even know nd,True
5587,financial services thankyou welcome article coming day launches key diversity equity inclusion blueprint,True
5588,think theres certainly higher incidence among people ocd would say ocd classified condition per se,True
5589,stories inclusion help us better workplace allies invisible inclusion erg president jill shares important provides resources employees read,True
5590,introducing new speaker dyslexia show anne currently works send consultant designing bespoke send training programmes schools centred around quality first teaching,True
5591,important seems like laziness like could find white people right mix,True
5592,believe ever planing theraputic intervention plan keep mind importance executive functions,True
5593,important skin tone variations value decision tweet equally important diff society would tend try judge immutable characteristics,True
5594,plans thursday evening come join last event spaces still available,True
5595,join discuss womens health,True
5596,mfw makes time fly reason,True
5597,person sociologist expertise domestic violence academic would think would research facts case apply viewpoint area expertise otherwise look incompetent,True
5598,want black coffee friend family,True
5599,launched new external training programme outdoor activities designed promote team building workplace training bespoke organisations needs profile message information contact us qualitypettypoolorguk,True
5600,autism traveling life journey using different roadmap,True
5601,thrilled found benefit remember whole library content share staff,True
5602,tell understand without telling understand,True
5603,uneducable teacher said counselor agreed doctorate music masters computer science another person us dyslexia tool kit,True
5604,might felt wasnt okay act talk natural way growing masking protective strategy sometimes exactly need,True
5605,tips making holiday party autismfriendly parent autistic child communicate triggers needs host accommodations made necessary,True
5606,autism eating disorders,True
5607,great day full learning things much learning brain amazingly unique every brain individual like fingerprint,True
5608,wow youve idea went medical professionals child years ago knowledge much scarce punishments received im sorry replying initial post,True
5609,published applied maximize potential talents different brains work,True
5610,lot tests empathy based around myopic neurotypicals express empathy rather people experience wind misconceptions misunderstandings empathy,True
5611,proud colleagues today including presented flora harding karen bolton seemed well received future changes help us staff,True
5612,first student enroll managing workplace minor lily bowditch already making industry impact handson professional experience academic coursework,True
5613,im excited share starting new position service development officer mental health suicide prevention team public health im looking forward starting carry work around mental health suicide prevention,True
5614,delighted present webinar adhd comorbidities pm mon nov registered yet,True
5615,extremely fraught relationship extremely ive tried going therapy matters always pressing think gonna hurt,True
5616,autism still disorder officially mentally disordered male believes give birth stripe socalled progress flag absent race present could return allinclusive rainbow perchance,True
5617,hopefully attacking people believing god saying long arent attacking others would also protected disability,True
5618,phrases used talking mental health,True
5619,acknowledging aggressively neurotypical mode thinking therapeutic support approach room wanting special like saying hey feed cat vegan diet give need,True
5620,visiting last night thank us voting said meeting w ensure nation loved replied vote,True
5621,autism hard love easy stay kind,True
5622,calling dental professionals learn ways break barriers support autistic clients new free selfpaced program autism dentistry learn,True
5623,join dr jessica eccles webinar november dr eccles talk overlap associated symptoms conditions register webinar recorded,True
5624,day disability,True
5625,book advice please voucher routledge taylor francis books website claggy recommendations especially links social psychological thanks,True
5626,iccta proud leader advocating inclusion higher education,True
5627,may stay quiet learn love people many shapes colors sizes preferences wonderful ways different make world wonderful,True
5628,sad statistics employers missing superb talent,True
5629,disabilities lead infinite opportunities inclusive pathways success trade school talent like pride industries started parents children disabilities,True
5630,temple grandin louis carter business imperative,True
5631,years first covid lockdown clear longterm impacts mental health especially adults likely feel anxious depressed due disrupted routines,True
5632,ive going virtual conference library topic wow contrast affirming autism topic causing wicked mental whiplash,True
5633,makes wonder diagnostic criteria,True
5634,words les mots,True
5635,strengthbased playbased personcentered approaches autistic kids affirming clearly shaping autistic traits neurotypicalpassing behavior actually harm autistic kids,True
5636,thanks giving screening mention supporting raising awareness,True
5637,workplace rising kindle edition currently new release human resources personnel management thanks get ebook,True
5638,graduate students csudh looking autistic women years old date online hope amplify voices autistic women experiences lens please email mmckinleytoromailcsudhedu interested,True
5639,everyone communicate many socalled severely autistic children never offered functional communication strategies people lives see point,True
5640,check fantastic podcast one best creative writers business im lucky say working since check episode,True
5641,autism awareness responsibility,True
5642,friend great advocate things,True
5643,thank taking part recent webinar sharing step step guide understanding supports available ireland,True
5644,say child meltdown public call raising autism awareness loudly,True
5645,back stock arrives christmas get today available online retailers wherever books sold dont wait theyll sell,True
5646,putting nothing lose bringing attention everything gain people willing read please keep mind dont like using word describe,True
5647,days til show first time visiting bedford bunch properly fab acts really proud get host one night show,True
5648,disparaties black people present nearly every aspect healthcare industry whether maternal care mental health care,True
5649,takes huge amount courage bravery trust belief kudos stepping podium sharing experiences benefit others would otherwise limited realworld knowledge,True
5650,nice know consistent understand level understand politics international current events,True
5651,people say ptsd cptsd included trauma alter brain however havent come across reliable sources yet,True
5652,iccta adopts inclusion statement board representatives meeting,True
5653,beauty,True
5654,current one serves explanation conditions adhd autism explain,True
5655,amazingly talented man great ambassador,True
5656,im getting tested nd doctor said diagnosis heading towards adhd makes sense diagnosed depression anxiety people nd adhd community accept,True
5657,follow thread talk fellow play ambassador,True
5658,oh epq sounds great title,True
5659,ebook radical guide women adhd embrace live boldly break throug download ebook,True
5660,hired work placement program assigned nd mentor would want need person asking friend,True
5661,school normal currently revising health social mock thats taking place next im also working epq,True
5662,great certain types,True
5663,yes counsellors counsellors expertise working,True
5664,cant wait see action get touch think help organisation supporting,True
5665,vaccines cause adults autism,True
