,tokenized_text,is_after_split_date
4334,heres post might missed essentialness selfcare go check click things,True
4335,im advocate led knowing working several educators whove liked reposted tweet year remember theres right way thinking feeling expressing makes world richer,True
4336,im advocate led knowing working several educators whove liked reposted tweet year remember theres right way thinking feeling expressing makes world richer,True
4337,miriam talks concerns people become less cautious despite numbers rising check,True
4338,missed recent live event check recap,True
4339,get ready twitter party pm et diverse book recs bundle giveaway every mins,True
4340,workshop open everyone wants know reasonable adjustments supporting people neurodivergence working environment join sessions,True
4341,nice little webinars afternoon discussing inclusion education,True
4342,great opportunity build upon conversation started,True
4343,high school teacher help students actually cant read yet heres without sacrificing classroom time personal time,True
4344,ive completed module introduction nursing via,True
4345,think wrote somewhere square pegs round holes resonated years ago journaled something using phrase society hunters farmers world,True
4346,one left apply faces portrait project closing date applications pm monday st january would like involved please get touch mikiadjustservicescouk,True
4347,get sharp wit surrounded dull people expand consciousness without first breaking free get lifetime life sheep freedom allowed thrive together,True
4348,afternoon two pupils year created powerpoint home pupils eager raise awareness within class different types neurodivergences impact mental health,True
4349,fastgrowing category organizational employers managers need aware order embrace maximize talents people think differently,True
4350,free online workshop herts parents carers understanding pathological demand avoidance pda tuesday january book,True
4351,best advice starting feel like extremely unproductive weekend failed couple projects kicking challenging helpppppp,True
4352,rt personally behalf group autism insurance thank,True
4353,rt given right tools support people able flourish maximising strengths opposed overcome challenges,True
4354,new podcast alert building supporting workplace listen full podcast,True
4355,illadvised deeply ableist ageist towards members sfu community additional risk factors covid currently reading sfu disability alliance says return inperson classes irresponsible,True
4356,join us february explore edges intersections gender queer theory embodiment creativity somatic psychology human capacity transformation,True
4357,lord mercy children learning differences may harmed misunderstood caregivers believe dangerous uniformed rhetoric crazy pastor,True
4358,neurodevelopmental disorders split lumped disorders different males females join profs edmund sonugabarke jan buitelaar explains,True
4359,please complete survey give us vital feedback,True
4360,stronger think advantages face adversity,True
4361,people uk never better time engage meaningful conversation,True
4362,sorry try,True
4363,implications contradicts idea lower support needs benefit narrative,True
4364,see new movie featuring people living main characters debuts prime video many crew also,True
4365,teacher school staff please consider joining schools taking part celebration march videos presentations posters available,True
4366,please join neurodiverty together server,True
4367,hate sort medication remember take morning night much also many left remember order apps forget check,True
4368,autistic literalness attempt smartass please rt,True
4369,okay thats straight old shitty psychiatrist need psychiatrist follows paradigm also used top class kid still got adhd diagnosis cause adhd isnt grades wait lemme send u official dsm criteria adhd diagnosis,True
4370,thank everyone attended penultimate webinar professionals stroud project,True
4371,several times ive seen young people treating community like bunch school cliques shouldnt mix strongly urge read activists learn follow activists together,True
4372,cfp medical humanities fantastic disability already received lot brilliant abstracts still send til next monday info,True
4373,basically think theyre worst reasoning similar lots nd folks auditory processing cant follow sure talk looked looking self stimming seem right,True
4374,love mindset client said possibly reached maximum yet response resonate contact discuss coaching options send message,True
4375,shout chuter ede primary school nottinghamshire registering take part celebration,True
4376,chevron grant employees day mark martin luther king jr birthday federal holiday since go promoting across america,True
4377,thursday,True
4378,navigating foster care hard enough fight rights care experienced person soon found fighting systems excluding disability,True
4379,terrific story toronto argonauts paul walderman journey,True
4380,able define however choose medical diagnosis makes sense us cant access need selfidentify may choose adopt alternative paradigms key concept choice,True
4381,builtin advantages members sense may stronger think,True
4382,gift story inspiring journey building career pro sports living autism spectrum via,True
4383,neurodivergence person abbreviated nd brain works ways differ considered normal neurotypical abbreviated nt neurodivergence important minds unique needed,True
4384,gift story inspiring journey building career pro sports living autism spectrum life like million little pieces every walk life pieces scattered everywhere goal via,True
4385,thank tag good choices def one check book training blog highly recommend add general adhd,True
4386,second session tonight lots questions positive feedback also popped tonight,True
4387,tell understanding accommodation without saying understanding accommodation,True
4388,get im v hypocritical saying tbh chronically incapable starting dealing irl responsibilities much typed irresponsibilities first also mental illness say j,True
4389,management trainings companies discuss common experience way things set ultimately bad company process may trip people fails people across board,True
4390,aussie artist currently first set prints available combine diversity australian bird life beauty planning make available internationally soon let know like,True
4391,think growth place right prioritizing naming fits best neurotypical world respect care community outside scarcity model many pathways honor everyone learn communicate,True
4392,forgetting reading convenience store woman got star call act reading beautifully made,True
4393,afraid fail afraid even trying,True
4394,able provide space people feel safe happy raising awareness understanding acceptance,True
4395,looking recommendations good text explaining movement criticism problems criticism ive sent nice article someone saying bad funding support im able reply properly politely,True
4396,youre supporting one children get assessment team creeping realisation may inherited,True
4397,gift story inspiring journey building career pro sports living autism spectrum,True
4398,thanks lynn learning disability autism collective terms common use job title would need long indeed include syndromes conditions seems odd request helpful ndspg reply,True
4399,discretion led opportunity grateful get continue work fancy letters name hurt either laura kaponer cpss,True
4400,ableism speech pathology,True
4401,critical businesses prioritize workforce every individual brings unique knowledge experiences skills table help drive progress learn,True
4402,discussion test scores fail reveal dyslexic student really understands reading test scores dyslexia,True
4403,curious movement join us tuesday feb pm est pm pst collaborative discussion topic lens lens nonautistic stakeholders register,True
4404,great start presenting liverpool learning summit aldinhe community practice,True
4405,life also impacted fact works way see recognise words patterns never learned phonics incredibly awkward embarrassing years,True
4406,autism choice acceptance,True
4407,many dont like frozen ii excellent attempt normalising hearing voices head equated madness actually happens quite lot people,True
4408,anyone interested would help lot design head juggling balls thought fitting,True
4409,lastly rather forcing treatment taunts ideas normality nd sets intention mentally disabled individuals receive support honors authentic forms diversity selfexpression human existential teaches embrace,True
4410,creating safe space neurodivergence workplace vital successful company culture,True
4411,advocates medical intervention necessary cure fix slow paced mental neurodevelopment instead nd paradigm asks create support systems inclusionfocused services accommodations assistive technologies job trainings,True
4412,science natural response curiosity best handson outdoors videos thrown homeschool science students dyslexia,True
4413,media entertainment industries movement promote misconceptions trivialize autism someone geniunely spectrum get wrong ideas,True
4414,reply whether would whether want tothe movt actually evolving discourse direction determined energy choose participate dont im putting oar like everyone else hoping steer way,True
4415,federal court ordered school district reimburse family read,True
4416,fabulous new books representing characters suitable readers age including rebecca balcárcels half happy tackles biracial guatemalanamerican,True
4417,video good introduction social model disability models allencompassing also spiderman,True
4418,whether would whether want movement evolving discourse direction determined energy choose participate,True
4419,watched stop check absolutely sensational moving funny top huge win representation screen,True
4420,im asked speculate future fate hangs future liberal democracy plague global warming rise autocratic despotism usa bent selfdestruction chances,True
4421,missing rock theory simple yet powerful analogy selective mutism autistic people please rt,True
4422,brain every single individual unique join rsv inspiring victoria mindblowing lecture given neuroscientists followed panel discussion stem professionals,True
4423,someone explain way tolerable say,True
4424,,True
4425,last chance grab spot webinar join monica lynn maddison educator behaviour consultant explore chat inclusion identify educators well families effectively support children,True
4426,refreshing see tech team embracing experienced liability currently taking well known publishing house tribunal approach neurotype,True
4427,moved away undiagnosed discourse neurodivergence continuing talk neurodivergence something diagnosable still within pathology paradigm antithetical movement,True
4428,someone wanted learn books would recommend,True
4429,seriously answer question society neurotypical likely always participate society must accept prevents someone part society would make choice,True
4430,enjoyed reading blog post shares insight process writing,True
4431,speaking upon experiences realizations within growth mental health overall matters within keep great different unique ways everyone,True
4432,concept applies every area spectrum diagnosis es define overall selves individuals may issues deal overcome others depending circumstances thats completely fine,True
4433,thought meant hope someone w mental illness gets help changed due convenience,True
4434,figured may btwn whatever character wearing kara danvers entire soft butch aesthetic years makes want scream also totally flexible whether queerness mental health weird often language knew,True
4435,rainbow infinity symbol,True
4436,yep random hot takes peoples assumptions come along make mad suicide rates accident rates substance abuse goes untreated adhd boys medicated able sit still,True
4437,attention adult autistics attacking wellintentioned neurotypical parents come us advice harms children please rt,True
4438,share journey woman tech help others explore limits contribute society often think nobody sees reads messages know sometimes hard fluent writing,True
4439,new video fidget jewellery alternative fidget toys help adhd autism anxiety,True
4440,hometown return renowned choreographer inyourarea community,True
4441,im founding trans rights movement also supports sex workers polyamory,True
4442,jamie oliver wrote recipes first cookbook back beer mats mirror,True
4443,sensoryfriendly swimming swim lessons,True
4444,unfortunately meeting us halfway still means learn fit neurotypical world grownups learned could saved many unnecessary troubles kids,True
4445,thanks id trying work boss directly think time hr accomodations irony working educational company doesnt actually understand,True
4446,interesting article forbes featuring charlotte valeur member,True
4447,talents big demand management consultants technology companies people think different connect dots new ways solve unsolvable problems break new ground,True
4448,parent interventionist info visit,True
4449,fact workflows actually optimal drives point home somebody take night watch,True
4450,moved outdated image disability big business sees talent within pioneering global community uses ability see think differently make difference,True
4451,first place,True
4452,literally sharing things testimony b created many spaces online normalized kink even less offline resourcing available became change wanted see born,True
4453,find traditional story telling character world building st linear plots dichotomous notions right wrong signature neurotypical mind people included identity stories structured mind,True
4454,year business e launched initiatives embrace nd talent also global collective thinkers using ability think different make difference,True
4455,exactly via,True
4456,moxie theaters staging world premiere diana bubanos play sapience next month focuses offers sensory friendly production curious means read,True
4457,fair years thinking stopped giving fighting illness life fair many million different ways still b happy,True
4458,notice relationship child close like steps take bridge gap,True
4459,system specifically designed reach learners read blog learn system resource speaks students easily implement materials existing curriculum,True
4460,hosting meet greet thursday january gmt teach firsts ambassador programme affinity come ally someone working education disabled join us message details,True
4461,looking forward session today,True
4462,,True
4463,join us pm today zoom seminar legal profession free members nonmembers tickets purchased via link see,True
4464,im australia im different role last year coordinatinated completed autism neurodevelopmental assessments camhs tried model encourage affirming approach theres shift including nd general mhs roles growing,True
4465,come part inclusive india summit find top minds disability inclusion space focusing register,True
4466,mps south west et al much leading way hopefully opening avenues collaboration researchers,True
4467,symptoms misleading,True
4468,gorgeous markmaking lovely students ink sticks feathers gold leaf,True
4469,walk wonderful wytham woods,True
4470,joke everyone skills relation iq hand like adhd autism dyslexia tourette overlapping barrier seen natural ways oh different nah something environment,True
4471,heres another great nomination received category loved reading brilliant work thanks sponsoring category,True
4472,person disability disability something person experiences typically society creates barriers couldnt agree really interesting article,True
4473,lead tomorrows one st tips zachary juergensen gives assist first steps begin build listen full podcast tomorrow,True
4474,emotional reality folks thriving world wasnt designed people like us,True
4475,hope helpful interested also written fair bit issue whats included argument similar judy said different ways recently wrote,True
4476,film tv misrepresented patient talk,True
4477,friend good blog post finding concept useful bipolar check blog linked biog see,True
4478,neurodivergence provoking new mind sight via,True
4479,attended covid vaccine clinic sunday child great set fantastic staff volunteers clinical staff made experience painless possible great see service,True
4480,topic,True
4481,shocking heartbreaking work autistic kids trying educate staff students thank sharing painful memories think people need understand impact actions people,True
4482,second episode global dialogue series speak jonathan hassell one worlds top digital usability thought leaders,True
4483,looks examines people regardless diagnosis develop skills use adults,True
4484,newly identified diagnosed autistic adults adults exploring neurodivergence put together great list book recs ausome book club group dedicated discussing books autism,True
4485,pieces art weapon collection found awesome homes via favorite part knowing everyone owns piece collection able grow along future,True
4486,naturally online classes present difficulties dyslexic students ways help post eschool success dyslexia,True
4487,twitter benchmarking grading agencies help identifying accessibility issues employment health systems looking find barriers people becoming health care providers nurses specifically thank,True
4488,much prefer description described vertically unchallenged really depends perspective someone taller im vertically challenged many faces someone less could described neurodepleted buzzz,True
4489,im discussing navigating parenting mommin like savage thursday jan pst join us,True
4490,autistic culture understanding paradigm would interesting project,True
4491,ok wylan may canonically cute innocent looking dont fucking dare treat like child call smol bean especially light literally unhinged whole ketterdam,True
4492,looking onchain artist creative dev really cool project inspired aim support mental health dm interested,True
4493,achievements even important,True
4494,really grateful providing much inspiration forthcoming meeting making original suggestion contributions ors,True
4495,given permission work home cos literally time could possibly work home except thursdays already bit,True
4496,fussy socks hello minute talk lord saviour,True
4497,learning languages adhd asterion celebrating classics,True
4498,joint meeting explore family justice system discussion led chaired dm info,True
4499,aah previous australian year autism spectrum disorder consider disability see,True
4500,hence im making fiction podcast im tired stories spectrum podcast isnt perfect lead many fall spectrum plugging ok,True
4501,needs led,True
4502,yes increasing diversity needs focus also need acknowledge diversity sometimes invisible already profession lgbt disability,True
4503,funny lot ppl treat transness inherent disability still refuse accept way disabled people say disability affects gender trans medical condition someone says transness comorbid,True
4504,dear teachers,True
4505,autistic people denied least five rights enshrined un declaration human rights thanks bringing attention,True
4506,callout lighting sound technician cues nd showcase showcase feb tech day profit share production dm details,True
4507,autistic people human rights met,True
4508,amazing assemblies learnt unique strengths things people might find tricky help someone finding things tricky good friend,True
4509,yoga sen pda rhett syndrome article,True
4510,academia autistic advantage qualitative research,True
4511,problem recognising girls especially adhd thanks bringing need def talks writing less,True
4512,considering loved one might want read contains discriminatory language,True
4513,adhd brains wired stimulation generally find boredom annoying actively painful recent addition blog julie levy,True
4514,learning disabilities defined norm need embrace different learners rather normalizing brains,True
4515,well needs module implemented deal adhd see lot grassroots football see naughty kid,True
4516,anyone know anything progressing work speakers wondering whether consider getting involved leave alone,True
4517,seems like good way change work culture inclusive rather carve special case one kind neurodivergence missed opportunity bit waste time,True
4518,know grace autism respond beat drum makes awesome,True
4519,considered using help business thrive coverage one clients,True
4520,meet jaimie young boy adhd tic disorder called tourette syndrome hes fidgety naughty really cant help,True
4521,tomorrow final exciting wellness wednesday talk awareness workplace illyana mullins reid derby sign,True
4522,courtesy thomas armstrong phd awardwinning author speaker book power unleashing advantages differently wired brain,True
4523,many interests trainee put bio gonna stick lived experience perspectives family therapy ecotherapy naturebased practise social injustice child adolescent mh formulation polyvagul theory probably grow go,True
4524,abilities ireland hosting series hip hop classes starting monday january st part programme details,True
4525,suzanne clark shares story offers clear practical advice managers wanting manage employees effectively read blog managing employees,True
4526,clinical psychologist said last want label child,True
4527,really interesting new podcast episode office design changing wake covid design focus health sustainability fascinating stuff,True
4528,,True
4529,people human rights met greater understanding allow people live genuinely inclusive society,True
4530,learned much john supporting workplace love folks could help navigates terrible situation,True
4531,extending invitation surgical grand rounds entitled diversity neurosurgery featuring gail rosseau md event take place via zoom wednesday january est,True
4532,community idea great practice lot issues starting afraid word autistic vs neurodivegence distancing disability overwhelmingly white,True
4533,students dyslexia may think bad math jennifer plosz developed dyslexiafriendly math dumb dyscalculia dyslexic mathematics,True
4534,free training workshop corrina wood platypus training considers living sibling sen impact siblings wider family explore might present sibling rivalry importantly support siblings,True
4535,register dr nancy doyle upcoming seminar work opportunity exploitation,True
4536,welcome mark calendars following panel ewoc happy hour hopefully person medicinal chemistry panel process chemistry panel virtual symposium,True
4537,neurotribes legacy autism future,True
4538,ive officially sent payment book club well reading bell hooks margin center facilitated happening late sign help offset cost,True
4539,think anyone involved thinks ally needs watch plus think got,True
4540,looking speaker conference event weve made even easier get touch,True
4541,always amazing resource whole spectrum ages,True
4542,excellent overview office space designed hybrid working models respect needs people,True
4543,two days,True
4544,oh greg boy youve pissed liberals lgbtqia blacks latinos muslims none even compares fire fury brings table,True
4545,launches guide representation planning buying,True
4546,delighted meet today partners new work erasmus ka vet project preliminary partners meeting project officially kicks february look forward sharing information soon,True
4547,hair colour changed performance mockery clearly uncomfortable unnatural forced also maddie previous acting experience autistic actors get refused jobs constantly tell best actor part,True
4548,,True
4549,appreciate response however definition diversity post didnt specify invisible visible diversity diversity includes bame community lgbt disability,True
4550,great session learnt much great starting point develop offer colleagues,True
4551,let give kim advice already tagged rachel dorsey slp else,True
4552,late lot self learning gone grid times anyways put designs together help see different angle,True
4553,hey remember beauty diversity mmm may difficult well get support need together youtube midnyte palace vanilla audio patreon,True
4554,research shown differences refer wiring assumption issues explain facets autism baseless read,True
4555,hassellinc rt second episode global dialogue series speak jonathan hassell one worlds top digital usability thought leaders,True
4556,fascinating team learning session afternoon conditions support one another,True
4557,using nyt spelling bee great way teach ss intro puzzle let kids go chart findings systematic way share strategies discuss likes dislikes related puzzle try home w family members,True
4558,voices calling autistic people human rights met able engage fully genuinely inclusive society via,True
4559,dont see neurotypes specific forms neurology neuro means nerve neurotypes refers kinds bodyminds indicate belief biological essence type write bunch places e g,True
4560,really looking forward listening guest speaker daniel brooke specialists ltd helping us learn thanks organising,True
4561,ooooh ill check titles also see radical guide women adhd embrace live boldly break barriers,True
4562,important need learn much clients colleagues workplace,True
4563,big fan supernatural trope making exception lottie matthews love,True
4564,intersectionality gender expansiveness breathwork,True
4565,women hidden epidemic,True
4566,days left apply faces portrait project closing date applications pm monday st january would like involved please get touch mikiadjustservicescouk,True
4567,child join focus group next looking parent carers child sought healthcare pandemic hour online sign,True
4568,lots webinar attendance cpd workplace oh support planning mental health menopause work focus areas,True
4569,autistic person seem almost eerily calm im anxious please rt,True
4570,parent interventionist info visit,True
4571,sign joint event family law justice find increasingly cropping non court arenas eg interesting hear guest experts,True
4572,great read thank contributing much cyber sec,True
