,tokenized_text,is_after_split_date
1422,often distracted child uncomfortable child lights odors noises things dont even notice may painful student tutoring tips sensory comfort,True
1423,greatest contribution world may something may someone raise,True
1424,tutor dyslexic kids parents call child hits thirdgrade wall heres tell help smart kid flunking third grade,True
1425,wonderful recommendation mickeypedia proceeds sale go helping spread little world today,True
1426,shows brief intervention minutes improve knowledge attitude relation adhd need across spectrum dyslexia adhd autism dyspraxia recognising adults seen settings,True
1427,throw w ends,True
1428,hi set autistic teachers group several networking events education sector also runs professionals network linkedin could good shout,True
1429,read bit haha jk unless yeah maybe overthinking mate really popular around parts though upsets somewhat proponent model,True
1430,fell sobs therapist last told lived life fear things wrong constantly say sorry way endlessly apologizing way brain works acknowledging turning life around,True
1431,happy sunday looking guest podcast discuss networking please tag dm anyone may interested thank,True
1432,skills life volunteer put different class volunteer means make great contribution community something extremely,True
1433,discuss makes good inset day adhd behaviour consultant listen,True
1434,whatever business organisation local authority educational setting third sector belong cpd accredited training would like become champion something,True
1435,heres really weirdly niche issue really itching bupropion approved prescription smoking cessation aid uk proven safe drug could save thousands lives gps allowed prescribe antidepressant,True
1436,online interview tips preparing night see book,True
1437,theres teacher tiktok calls work accessible education uses lot language works segregated classroom said college isnt realistic goal students im like accessible education,True
1438,explain thing quite rigid im find hard pull away anything else like get cuddle also im mood cuddle really hard force need lower threshold,True
1439,top writer psychology read visit follow writing,True
1440,late try receptive affection terrible habit rejecting hugs partner partly pain partly trying push past deserves better affection worth slight pain increase,True
1441,top writer psychology read visit follow undefined profile,True
1442,heres son trying give money,True
1443,good imagine pair programmer teams built like imagine could accomplish,True
1444,spent preparing helping mini adjust high school lockdowns shes asked p covid kicked shes creating something always known processing times fluctuate hugely b c,True
1445,trust done,True
1446,internalized symptoms considered less problematic teachers parents result people whose adhd symptoms disruptive home school much less likely identified diagnosed,True
1447,pretty interesting,True
1448,im okay nft autistic disabled artist jessica cumin drop launching march,True
1449,let challenge limit challenge limits flor pedrola baechtel,True
1450,throw w ends,True
1451,sure adhd yet definitely likely neverending trauma,True
1452,autism parentsyour childs differences taught reevaluate learning process made stronger,True
1453,hurray team youre looking support meantime ive awesome experience theyre neurodiversitypositive lgbtq positive accepting selfdx theyre based guelph everything virtually,True
1454,new dates basw professionals special interest group next meeting tuesday january pm please come along share lets make year change workforce,True
1455,sometimes brilliant intelligent minds shine standardized tests standardized minds diane ravitch,True
1456,adam mardero person lives autism works cause acceptance autism acceptance earned master degree history well bachelor education,True
1457,putting together time line movement extends back mid terms social trends paradigms adequately frame context missing key elements please let know thanks advance part,True
1458,thinking hiring see questions ask first,True
1459,two words cause irreparable damage interneurotype relationships please rt,True
1460,hear check timeline see also keen challenge misogyny women deliberately facilitate mention male friends generally sense misbelonging perceived loners,True
1461,learning disability many group find social connection difficult try conflate poor social skills dark triad psychopathy,True
1462,giving autistic children ptsd school psychology today,True
1463,horrible dream let go job day extracurricular club fair kids group surprised gift tell one girl lay crying floor please tell stay touch,True
1464,thank im usually side giving presentations autism teachers librarians wonderful audience soak someone elses knowledge experience,True
1465,sating sweet tooth trying pineapple whip pumpkin pie caramel apple strawberry whirley pop,True
1466,throw w ends,True
1467,genesis resolution financial crisis challenges advantages current geopolitical situation existential risks mitigations dog,True
1468,get know zetetick housing ever wondered housing options like disabled people supported living means,True
1469,iv found loads adhd accounts look following far seems amazing community lots tips learn,True
1470,hi thank much sharing brother lucky understanding sister lucky understanding family honestly makes life much bearable really hope people open learn,True
1471,plenty daylight left lets keep going make schools safe queer kids embrace return k education time play wonder human development supposed give kids time play outside invest arts education,True
1472,loving webinar embracing inner continuum writer way handle neurodivergence making palatable people experiencing us making experience palatable,True
1473,like brush rug n ignore anything makes conversation actually make sense relief theyre putting words mouth saying stupid didnt say actually ableist isnt,True
1474,people use im offended way silence difference opinion youll know youre truly offensive far selfcritical nts,True
1475,promoting projects social media try thrive attention economy really hard sprinkle top modern adventure,True
1476,topics talk minutes prep time autism adhd paradigm social model disability universal basic income romance novels gentle parenting decolonizing parenting teaching children tools liberation,True
1477,work tail writing love also want earn reasonable amount work many us key word reasonable,True
1478,learnt lot course autism also movement tears psychiatric classifications autism research based,True
1479,someone might still autistic even though act like friends year old autistic son something along lines incredibly invalidating say,True
1480,autism transitions webinar tomorrow monday january pm gmt free tickets link,True
1481,five things talk minutes without preparing social justice cats tech general especially sysadmin stuff teaching disclaimer order,True
1482,excited thrilled happy part coproduction board important muchneeded venture,True
1483,society emphasis placed labour reflected lot discussions regarding latest black health matters blog reflects journey adhd encouraged think beyond framework productivity,True
1484,came across useful site,True
1485,understanding downsides camouflaging ramifications training support models autistic people often implicitly grounded deficitbased framework,True
1486,approach mentioning explaining played mind months everything clicked lifetime feeling different compounded social anxiety fear change particular skills suddenly made sense,True
1487,thanks team committed raise awareness,True
1488,school trafford want deal children children misdiagnosed slipping net,True
1489,love quote without deviation norm progress possible different ways thinking things necessary important,True
1490,veegunary veejanuary veeganuary january rolls around thoughts often turn new year resolutions positive changes make lives,True
1491,must move simply awareness genuine acceptance regarding,True
1492,would good intersection consider often overlooked autistics adhders represented eating disorder populations yet little research connection best tailor clinical practice meet specific needs,True
1493,ways causing harm people told fact elitist movement silences autistic people people deeply dubious agendas platformed major newspaper,True
1494,communicating neuro diverse world become hot topic last years core human difference neuro typical describes majority population generally interact w,True
1495,neurodivergence provoking new mind sight via,True
1496,lived experience key part mh awareness thanks thread creating awareness,True
1497,difficult year covid huge effect aspects lives,True
1498,attention please ha thats clever joke see exciting news meme monday adhdadultuk reviewed charity commission despite james involved officially charity,True
1499,curious incident dog night time im guessing thats mean book somewhat discredited author didnt research writing also masses swearing unsuitable primary thanks though,True
1500,everyones genius legit monk quote passed lore,True
1501,going instant dopamine machine literally whole point adhd spectrum also ok someone experiences something differently ok try relate ppl point socializing better,True
1502,offensive disability affects types humans gender sexuality things disabled people also thing suppose nice noticed people given shit though,True
1503,thank hi tesni analysing survey right specifically asks aversion results published soon meantime link free access recent paper,True
1504,autism youth sports picture books special education k jane eyre,True
1505,autistic people already exist prehistoric age,True
1506,cannot save assange cannot save children woke meaningless assange prison,True
1507,minute discussion topics notes prompts probably need interrupt get word okay bite star wars lotr mcu favourite books education,True
1508,neurological deficit involves injury nervous system like mute comatose loss muscle control deficit way process things,True
1509,randomly came across toolup mentorship scheme last signed mentor im genuinely excited worked first lessons understanding aspects autism fun work tonight fascinates,True
1510,saying evening turning big overhead titty lamp bedroom,True
1511,sadly right lot people prison dyslexia ability dont believe much lack oxygen birth wired differently,True
1512,also suggest people try coding anything helps notice spot patterns please remember dyslexia super power anyone undermines makes mockery must jealous cos dont unique superpower,True
1513,im blessed working boss staff appreciate efficiently utilize also feeling badly work job efforts labor go unappreciated left job,True
1514,many organisations like gchq look encourage people abilities political correct term dyslexia comes large spectrum umbrella different super powers,True
1515,hyperfocus like boss executive dysfunction done right compiled series three stories related ability hyperfocus,True
1516,became advocate self care moms first feel like control lives slow children flourish born,True
1517,workplace,True
1518,happy national mentoring month parallel believe power relationships community created mentoring together make world opportunity stay tuned ig month learn,True
1519,becomes normalized work going go period acculturation nd neurotypical nt cultures connect conflict forbes fascinating article thanks sharing nancy,True
1520,housing somewhere live social care institute excellence leading new commission,True
1521,start new year professional development earning learning differences certificate online check next set courses spring registration ends january,True
1522,intersectionality growing confidence take look topical workplace issues well discussing book free place,True
1523,dyspraxia due next month cant wait pages tasters,True
1524,hi im queer person ambiguous sexuality feel lesbian also aroace cant work draw line cishet proven otherwise bc dont label date girls,True
1525,listening podcast interviewer says recently diagnosed adhd everything makes sense yes ax supports personal understanding insight,True
1526,microsoft believes diversity enriches performance products communities live work lives employees contact us msndmicrosoftcom,True
1527,lost movement,True
1528,governments longawaited review expected soon offering las access programme tailored development training support find,True
1529,know young person would like speak express interest questions please email rebeccaduffuscognusorguk,True
1530,researching gender sexuality race disability looking speakers interdisciplinary seminar series wed love hear dm us info,True
1531,tonight mental health disability night call us pm,True
1532,selfcongratulatory ego circles quite nauseating,True
1533,blog discuss like entrepreneur field selfadvocacy public speaking,True
1534,oh unless add listed im diagnosed anything neurodivers even diagnosis isnt offical im really pissed many people id consider friends constantly using therapist clearly dont care feelings,True
1535,design social prescribing fascinating extracts designing mindfriendly environments,True
1536,remote hearings undermine fundamental rights equality disabled defendants especially susceptible unfair trials proceedings conducted remotely theres reliable system identify defendants learning difficulties mental distress,True
1537,said assesment time next fall,True
1538,feel like growth awareness people able access support something talking broader level,True
1539,ion stories talks specialist tourette syndrome tics projects including ion stories amazon audible spotify itunes google podcasts join ion,True
1540,movement become harmful aeon essays,True
1541,send dm warm kind certified xological b dyworker affirmative trained variety therapeutic modalities proswitch exploring power sensation useful desired looking therapists refer also would love connect,True
1542,need stop harming autistic minors outrageous people taking advantage failing,True
1543,well thats entertaining listening husband demonstrating assessment autism service via video appointment,True
1544,intersection gender,True
1545,oof also hit big time lot saying really common thing experience someone gifted kid hs especially since giftedness often go handinhand glad getting supports think help main,True
1546,nothing wrong great example valuable,True
1547,categories brain built different displays human emotion eg response trauma illness goes beyond able function,True
1548,nothing wrong,True
1549,wait able focus one task long time thing available sign adhd seems like opposite doctors want tell patients failed test,True
1550,nice back new term leading youth theatre squared im excited start playing making new work fantastic members,True
1551,would lie bed desperate things cared immobilized speedier thoughts slower response honest open account one persons experience untreated,True
1552,school ot practice affirming supports selfadvocacy development positive autistic identity encourages autonomy recognizes interdependence childled,True
1553,academia autistic advantage qualitative research,True
1554,tonight mental health night give us call line open tonight pm,True
1555,chewers want need something hard fact dont get jaw ache meet sensory chewing needs enjoy soft springy bounce chewigem dog tags,True
1556,break unemployment cycle programme helps students recent graduates secure employment experience training,True
1557,alone many people spectrum community support helped lot dani fox looking happy picture fourth panel dani says learned waste energy people accept dani,True
1558,useful reflections among engineers engineer include diversity inclusion one four themes,True
1559,sage institute announce launch new journal due seeking editors lead launch starting date spring sage invites expressions interest january,True
1560,proposals set expand use remote hearings criminal proceedings significantly impact right fair trial criminal justice system particularly learning difficulties mental distress,True
1561,staff liverpool learning summit equality diversity inclusion january microaggressions intersectionality lgbtq dyslexia wp access,True
1562,two nice things tonight pm one show talking diagnosis adult women bbc one q event getting best work workplaces free,True
1563,environments skills include strong work ethic great attention detail analytical approach problem solving advocacy vulnerable patients colleagues,True
1564,like embrace may allow flourish use many strengths advantage profession patients,True
1565,signed joint statement organisations impact video audio links criminal proceedings defendants learning difficulties mental health issues info,True
1566,im published phd research single perspective adhd treatment limitations published,True
1567,excellent author fillets current education system citing experience never learned well humans selfdirected education sounds like exciting alternative,True
1568,look gift love self accommodation cure adhd give fucking meth curse ruins life complicated,True
1569,see w p k strangers lovers misunderstandings au modern magic modern fantasy vampires,True
1570,disability night call us pm,True
1571,autismthere different abilities found yet,True
1572,uk gov must defend fair trial rights everyone expansion video links court threatens defendants ability participate effectively particularly w read statement orgs,True
1573,disagree wait nothing happen play part claiming teachers already working hrs another cop teachers try learn expect parents educate u ignorance defence,True
1574,ahead new guidance catering built environment due release spring january spoke experts engineer dyslexia see industry help people thrive,True
1575,free online workshop herts parents carers tue jan caring child book free ticket,True
1576,dyslexia indicates divergent abilities less ability focusing dyslexic strengths key happy successful reading essentials teaching dyslexic child read,True
1577,thank listening family story shining light important overlooked topic proud daughter maggie willing open challenging mental health journey,True
1578,florida school dedicated students expanding,True
1579,book poetry highlights issues medium messages ty book,True
1580,loving neurology inspired flyer wednesday big announcement,True
1581,great invited speak forum supporting inclusive recruitment,True
1582,tonight mon jan pm comedian tv presenter talks ceo dr women needs change,True
1583,east berkshire would like support change local services area come join us next weeks meeting wednesday jan pm pm register link,True
1584,tonight pm january bbc one show angela barnes talks dr tony lloyd ceo ashd foundation charity,True
1585,made comment yall maybe unstan,True
1586,beautiful minds uncovering hidden talents,True
1587,bucks county moms know challenges raising child special needs helping others,True
1588,always proud part ioes community watch special podcast celebrating anniversary talking things department psychology human development,True
1589,makes heart happy see many people working service open mental health seen asset joined nhs attitudes towards staff lived experience different,True
1590,happy new year excited first blog tutoring help build,True
1591,,True
1592,sometimes learning sleight hand magic tricks stim practicing occasionally brighten someones day make someone smile actual trick whats like,True
1593,find joy,True
1594,something motivational start,True
1595,silent,True
1596,happy monday dad back er theres nonzero chance ive passed curse onto kiddo im fine everythings fine,True
1597,public support center,True
1598,one show talking diagnosis believe part,True
1599,hear polystyrene rubbing together squeaking super painful point cant touch stuff curious thing voters,True
1600,also reference yesterday stream want add fun still cut time serious conversations especially case topics affect streamer regarding gender race sexuality nd,True
1601,entering next half session evening body doubling tool used folks helping body double work alongside playlist music plants yes good,True
1602,suffer competition fact,True
1603,problem circumcision self diagnosed complete lack ability cope anything life im happy circumcision misery problem,True
1604,tweets remind movement political movement anything else castration powerful legitimacy,True
1605,ways incorporate everyday business dei initiatives hiring retention practices,True
1606,twitter need help point resources positive autism teenage boys parents new diagnosis especially boy ashamed diagnosis thank,True
1607,children autism observant notice everything including attitude towards,True
1608,firm believer different less crucial understand autism linear,True
1609,work assimilate integrate via forbes,True
1610,hot take essentialist,True
1611,learn strategies work build positive relationships friends peers family fun likeminded peers support team professionals,True
1612,also optional extra curricular club students pupils think know adhd dyspraxia dyslexia anxiety etc get together work range fun projects support school work,True
1613,,True
1614,learning disability asylums abandoned royals victorian genius asylum first purposebuilt asylum people learning disability opened name,True
1615,next east berkshire network meeting taking place wednesday january network aims connect people want improve understanding support children young people,True
1616,tonight mental health disability night need talk us topics evening,True
1617,talk gave team responsibility design designing products accessibility disability,True
1618,startups looking hire talent realise know care spideysenses emotional intelligence join dots want get ahead competitors get know really want,True
1619,shout kingsmead school derby registering take part celebration,True
1620,body language cultural times even contextual within culture facial expressions found universal think ever study controlled,True
1621,someone reading mind ive written piece coming near ish future latest piece contains details different learning styles need take account anything,True
1622,supported internships offer great opportunity learn support work placewhilst giving individual valuable experience cv,True
1623,another constant mocked girl adhd saying everyone oh heck matters,True
1624,trending trashy show good time mention anyone tries use someone around,True
1625,smiles triplets done first dose minimal distress nurse dr polite understanding working childs needs,True
1626,ive said fucking way ever connecting brain computer trust whoever made shit know thing need wake inside computer thats trying assume im neurotypical,True
1627,friends came dorm tonight talked west side story,True
1628,fair warning im mostly follow flood feed disability info summer try post daily questions polls community,True
1629,disability multiply invisiblydisabled usually post since overlaps many disabilities associated communities end engaging many different people im always open learn corrected,True
1630,umm explaining woman might felt slighted easy misread social cues,True
1631,bit late jumping board im really enjoying podcast melds many interests permaculture social justice academic research,True
1632,looks fabulous fun would love huge piece wall artists celebration artists live disabilities one day perhaps,True
1633,find right therapist,True
1634,case anyone needed hear gift sometimes tech malfunction today trainer troubleshooting ocd kicked went got results faster could fix crazy works,True
1635,first live event tune thursday pm central see link details,True
1636,hopefully explain dyslexia numbers put track find better teaching methods coping strategies,True
1637,fred poses shares insights via partnership companies today include part strategy click full story,True
1638,really feeling today combined adhd,True
1639,great article engineering engineering education need support diversity benefit industry individuals,True
1640,ableism discourse terms mental health fucking cesspit,True
1641,oh wear uniqlo heattech airism everything pretty much uniqlo polo neck today jumper still feel intense sensory issue tied know better wanted jumper,True
1642,welcome opinion however multiple mental health issues among depression anxiety adhd help mine see thing happen repeatedly decades sexist bullshit,True
1643,triplets getting ready receive first covid vaccines social stories behavioural support helping understand benefits helped today,True
1644,imagination grants cycle open funding programs support people learn,True
1645,believe immaculate design children children gifted distinct ways must teach children way honors natural brain functioning read bridge gap learning theory educational practice,True
1646,love learning gaining information reading theres nothing panics work mode stack words plus overstimulation peopling really thing arrghh tips brain,True
1647,importance proper evaluation,True
1648,great unless adaptions planning,True
1649,brain network channel lived experience conversations corpus callosum disorders disability healthcare hosted topics included dsp workplace injuries health inequities,True
1650,clear description language terminology great resource increased understanding change chance,True
1651,love see excitement using comics graphic novels increase reading vocabulary heres use fox trot calvin hobbes far side,True
1652,certain anxiety mental health issues,True
1653,depression greater external world collide,True
1654,left place march actively discriminated listen day thick like things dyslexic advantage things,True
1655,weve heard something dyslexia know may heard find,True
1656,go follow yenn purkis page fb calling like long harm anyone want change us become good pretending neurotypical,True
1657,think something like already exists organisation called law looked twitter feed cater bar well,True
1658,knowledge power,True
1659,time kink sexual kink pain management tool management tool way get head straight feel connected partner podcast,True
