,tokenized_text,is_after_split_date
4662,discourse rancid people denying solidarity mad folks based assumption experiences always bad need medical intervention engaged mad pride psychiatric survivors movements shows,True
4663,bringing two enlightening talks glee club jan wed jan science magic mushrooms thu jan science adhd navigating neurotypical world dr james brown,True
4664,identify autistic apply join lived experience panel panel advise government go public consultation learning disability autism bill learn,True
4665,great webinar planning aid essential viewing anyone writing planning documents,True
4666,check guide makes choosing right sensory clothing seamless,True
4667,neurodivergency hard makes compelling bard lets forget sour whats nd superpower,True
4668,please see research reference apprentices,True
4669,dyslexia tool kit expanded edition book great professional development workshop hand books discuss tools wait thank emails teachers,True
4670,might youre hiding burnout supervisor family,True
4671,listened rachel talk autism wholeheartedly recommend need raise awareness educate workforce fab,True
4672,bringing two enlightening talks glee club january sun jan science psychedelics wed jan science adhd navigating neurotypical world dr james brown,True
4673,way think childrens definitely prompting factor,True
4674,ill add sum thoughts raised parent cluster b including cluster b movement make whole movement learn many maaaanyyyyy things hard way,True
4675,brought happiness,True
4676,register experience,True
4677,topic lorna wanted contribute experiences person,True
4678,biological reality humanity like stars two minds alike neu project recently launched set guidance event programming postpandemic world inclusion core brought,True
4679,past year welcomed caregivers group group growing list employee resource groups,True
4680,yeah would totally adhd teleportation goto someone asks superpower want,True
4681,focus conversations around disability shifted merely teaching employees accessibility making sure understand aspects like motion accessibility automated manual testing ai says intuits ted drake,True
4682,im absolutely disgusted way spoke gall refuse autistic woman coleader opportunity correct illinformed comments thought knew better days,True
4683,rainbow goddess guidance featured rainbow goddess celebrating girl god books anthology published,True
4684,critical innovation autistic creativity shaped modern culture talent might key invention company,True
4685,parenting child additional needs like playing sport noone knows rules goal posts keep moving referees players,True
4686,think important recognise autistic people started neurodivergence movement covers whole range experiences neurotipical felt welcomed autistic friends dont identify personally,True
4687,tory msp accuses lowering tone green msp said weaponised gender debate,True
4688,groans maggie chapman makes crude nasty intervention hamilton think wrong weaponise yp way debate say incapable making decisions,True
4689,people deserve thrive workplace,True
4690,even right autism adhd make people transgender believe mistake people still deserve medical privacy dignity grcs designed provide even right theyd wrong,True
4691,im watching scottish parliament proceedings stage gra reform boy howdy ways autism adhd general weaponised super gross boils simple point,True
4692,selftalk impact mental health leading anxiety imposter syndrome lexxic blog explains use selftalk avoid catastrophising develop kinder positive selftalk terms,True
4693,msps dont want called weaponsising maybe treat people respect autonomy deserve foul behaviour certain individuals,True
4694,lacey please rethink post cant opinion science thinking leads kind resistance adults display filling system nonbelievers make difficult people get diagnosis funding,True
4695,fatphobia definitely coming inside house case layer nice serving get lovely trauma sandwich snack years come deserved better us,True
4696,three things extremely hard steel diamond know ones self benjamin franklin,True
4697,awesome able record episode edge podcast inclusive esports clubs celebrating schools early brilliant way end thanks georgia jessica,True
4698,many adults adhd struggle keep friends friendships end warning think top head,True
4699,maggie chapman obviously understanding dare dismiss vulnerability people imply ensuring safeguards protect people threat trans people,True
4700,things make different things make piglet,True
4701,writing autism neurodiversityrelated stuff decade oddly like writing music decade instead band sounds like halifax weve fucking discourse six thousand times already,True
4702,ok member rachael hamiltons family didnt hear,True
4703,healthy make reasons bad look parent defend misinformation,True
4704,correction maggie chapman weaponised,True
4705,rivera workplace rising trend,True
4706,science better people researchers share experiences suggest changes structure science via,True
4707,focus conversations around disability shifted merely teaching employees accessibility making sure understand aspects like motion accessibility automated manual testing ai says intuits ted drake,True
4708,dont use dont mind ppl using important ppl aware,True
4709,know idpol stand needs people learning disabilities public start take notice block sight people like stand non verbal girls give obscuring labels like,True
4710,sixth autism article,True
4711,every organisation needs approaches place properly recognise workplace embrace varied ways working,True
4712,get true diagnosis tell whole story would like share truly danger kinda cult,True
4713,meetings sit hand muttering point lest forget im diagnosed theres clearly going,True
4714,think lot different conditions different aetiologies umbrella understand differences better helps inclusive also aware impact trauma whatever think cause,True
4715,ive updated webpage great articles check special thanks,True
4716,rivera workplace rising trend,True
4717,already sure autistic based previous testing today taken genuine tests look variety things every single one said extremely likely,True
4718,designing workplace employees,True
4719,starting learn debilitating people learning difficulties labelled failures schools big issue,True
4720,tied selfworth statements point must begin slow arduous process breaking free seeing said kaiya stone,True
4721,jedi day focusing parents guardians missed panel event please refer last weeks tuesday bulletin link recording check instagram facebook information,True
4722,unmasking autism power embracing hidden oihjw q,True
4723,know lyric rivera new book ordered mine wait get read,True
4724,stay safe everyone merry christmas happy new year comes page available anytime anyone needs hope meeting new year better future,True
4725,friends families peers rest society please remember need believe us listen us whether understand believe say support children need better world,True
4726,much representation coming light misinformed take causes hopefully educates folks understand condition gives comfort even wrestlers succeed,True
4727,thank teachers teaching assistant icos staff barnardos staff many provide support neurodiversityour children need weunfortunately nowhere near society neurodiversitythe ones helping,True
4728,music,True
4729,biggest challenge sensitive person sensory overload join thursday january learn applicable tools overcoming sensory overload,True
4730,published read latest edition g word quarterly winter packed news partners advisors,True
4731,innovative healthtech company engen turned support greater diversity efforts achieving new outlet company commitment workplace,True
4732,years training got wrestle meet great beings also meeting people look pretty cool end anyone ever questions regarding autism adhd etc happy answer help inform much,True
4733,find community within wrestling also autism adhd sometimes must remember people struggle silence look seem one way enough negativity let focus positivity neurodivergence think beyond creative,True
4734,yeah tell bugbear stuff excludes people well come webinar youre gonna pay attention,True
4735,able understand different types neurodivegences able better serve patients clients many times people received wrong treatment people misunderstood condition,True
4736,reposted iscoveries loved quote posted,True
4737,another term autistic means neurodifferent non neurotypical different ways thinking might autistic dyslexic dyspraxic adhd etc combination describes values form human diversity,True
4738,time holidays circa launched free selfpaced prod program autism early childcare available anyone anywhere learn register,True
4739,doesnt ignore fact lgb people higher rates trans people least neurotypical,True
4740,great gig mions singing awesome wonder clever charity user led organisation pick loose band japan appreciating followers among autism wider scene organise j rock j pop etc fundraising gig could fun,True
4741,lyric rivera expert un reveals new book workplace rising goto book share allies change agents workplaces,True
4742,want say thank information twitter thanks yall suggested best friend back summer might adhd today got official diagnosis lifechanging already means world us,True
4743,personal know like grow struggling dyslexia morning joined dyslexia education symposium talk citys comprehensive approach supporting young people facing challenge,True
4744,really valuable read important topic constantly learning evolving practice definitely something bear mind working wholeschool level,True
4745,change narrative adhd,True
4746,politically charged despite valuable brain types politically charged similar way specific skin colour neurotypes dominate society neurotypical others oppressed,True
4747,principle instead held everyones brains different similar biodiversity experienced nature nature full variation valuable brains also valuable variation,True
4748,rejection medical model medical model holds specific type brain healthy normal brain normal abnormal needs fixed state normality paradigm rejects,True
4749,paradigm consists three main assumptions rejection medical model principle politically charged lets examine individually,True
4750,lets start paradigm paradigm set assumptions influence person views world paradigm thus series assumptions view brains,True
4751,term coined judy singer thesis birth idea journalist harvey blume best explanation nick walkers see,True
4752,lot discussion last certain conditions might subscribe paradigm thought would write dont know paradigm,True
4753,sure chap trying doesnt seem want block folk mental health issue live past,True
4754,history important us today national worldwide turn away democracy toward authoritarianism goes hand hand efforts marginalize mental illness neurological differences,True
4755,epilepsy would covered iirc dont know diabetes im wellversed flags anyway seeing colorful im colorblind,True
4756,dyspraxic person wrapping christmas presents tape loved one motor skills,True
4757,characters loveable pretty much every episode really valuable lesson teach young kids still heartwarming enjoyable older viewers like think theres episode talks another one lesbians,True
4758,bullying always obvious like forms relational abuse tends repeated article guest contributor explains children vulnerable bullying sets cptsd adulthood,True
4759,power unleashing advantages differently wired brain published hardcover neurodivers azxav,True
4760,selfdiscipline overrated neurotypical expectation learning kind work energy level underrated,True
4761,fuck got pronouns,True
4762,ive never connected community like since got involved communities know people worried twitter stick pile burning ashes meet people feel much,True
4763,due said lot teachers today think excuse rather problem,True
4764,nd ibm swag helped create movement,True
4765,power unleashing advantages differently wired brain published hardcover neurodivers tbbrqjo,True
4766,many steps autism journey instead counting steps make steps count,True
4767,think resources used support children grasp naturally forced key recognising particular,True
4768,new video tales beanworld,True
4769,based observations mutuals adhd also important note poc adhd many communities see mental health taboo topic feel need address otherwise struggles seen lazy etc,True
4770,disclose used case legal system inherently fraught normal brain navigate exceptionally difficult brain skips words worse added stress,True
4771,u k heres resource like refer,True
4772,weaponising said person refused let another member autistic person speak matter,True
4773,oh good quote tweet truer words,True
4774,thread gold neurotypicals towards,True
4775,ties lot son recently often expect autistic people change suit society norm change find adapting almost impossible help changing demands expectations,True
4776,adhd talent able read words book thinking completely different topic realising pages along going back recommencing process another times,True
4777,research journal looking research article submissions oriented approach aligns supporting health across lifecourse abstract due december info,True
4778,refers diversity human brain cognition instance sociability learning attention mood mental functions hope helps,True
4779,whoever voted jp special lot answer notes far include natures masculinity palaeontology elitism marmite,True
4780,youre autistic person life interested history shopping holiday gifts please consider book available everywhere,True
4781,extrapolating broad sweep within umbrella come conditions know genetic parent driver saying children traumatised whilst car stands reason parent might,True
4782,things heard chamber today rachael others absolutely appalling dread think folk going autism learning disabilities bill,True
4783,autism also,True
4784,dont miss principal domino risch share experience driving create inclusive future work andrew kitley podcast invisible gift feeds listen,True
4785,lot overlaps atypical face processing atypical auditory visual processing n,True
4786,found info dumping nd thing questioning tf hell nts communicate,True
4787,people uniquely issues sustaining attention working memory people uniquely issues pain perception semantic processing context modulation speech processing n,True
4788,representing arguments protect people may vulnerable weaponising,True
4789,hyperfocused understanding difference learned n inhibition deficit unique adhd ppl adhd ppl dont issues novelty processing adhd ppl might respond better social rewards,True
4790,important element team enhances creative output inspires others think outside outside box reminds apple think different campaign without,True
4791,trying make documentary educations impact children disorders glad see son excelling,True
4792,yay check planner brains,True
4793,discrimination systemic ways defy,True
4794,club visited international day persons disabilities club read move together teaches person unique students cut snowflakes demonstrate snowflakes different like us,True
4795,andrea serves program associate broad futures organization whose mission celebrate creating access cultivating skills revolutionizing workplace learn andrea,True
4796,brilliant,True
4797,dread things others tell ease checking voicemails replying text messages scheduling appointment still complete things time way sometimes lost sometimes found,True
4798,choose best school dyslexic student stressfree focused student interests kinds schools best dyslexia,True
4799,yea body part think ab lmao tho like showering got,True
4800,brains simple enough us understand wed simple couldnt embrace,True
4801,governor hochul announces groundbreaking spring harbor labs million research complex,True
4802,thought perfect tweet earlier cleaning room laundry come post cause hyper focused life remember even remotely thinking,True
4803,feel sad male world masculine assertive enough accepted boys club anyone relate also normative male alexithymia sounds like could maybe,True
4804,c people difference justification explanation really justifying think explaining,True
4805,amazing book informative autism importantly shows important accept embrace vs trying cure made much better advocat parent awesome son happens autistic thanks steve,True
4806,special brain,True
4807,classroom strengthbased strategies help students special needs succeed school life ypkysa,True
4808,nis brings together indian global experts address various aspects multifaceted subject discussions simplify well link different dimensions foster holistic understanding drive appropriate actions watch,True
4809,sumana dutta founder executive director akshadhaa foundation comprehensively addresses subject preparing students development challenges schooling vocational training india summit nis,True
4810,yes currently tma hyperfix si language writing pretty sure autism also becoming si ironic,True
4811,find us apple podcasts,True
4812,kids struggling whether adhd something else need hear good kids trying hard need know wont face struggles alone,True
4813,collin really think elons motives empath labelled neurodivegent person autistic spectrum think hes got cooccurring neurotypes affecting work judgement colin,True
4814,especially sue health care professionals doctors psychologists therapists malpractice failed assess diagnose first,True
4815,beyond excited partnership special event,True
4816,excited share latest addition shop adhd positive tumbler wrap oz skinny tumbler sublimation design inspirational tumbler straight png wrap digital download mental health,True
4817,diversity race ethnicity gender diversity thought check new article written chief inclusion diversity officer dr shirley knowles read,True
4818,let design learning spaces students successful including amazing kids,True
4819,honor join symposium dyslexia public advocate first elected official tourettes syndrome us office always fighting new yorkers receive support deserve,True
4820,scottish parliament today rachel hamilton team terf tried weaponise debate gender recognition reform autistic women asked speak issue rachel hamilton said,True
4821,people living,True
4822,hertfordshire mind network added training courses website available book including understanding self harm understanding practical support managing stress burnout find,True
4823,thanks mentioning us always happy support initiatives tackle barriers inclusion celebrate,True
4824,committed introducing learning disability autism bill ensure everyones rights respected protected theyre looking recruit people help design inclusive consultation new bill apply,True
4825,speak workforce committee sharing story,True
4826,let talk exploring parenthood join comadre marcy special guest sivan hong fellow ausome mom advocate discuss special needs parent,True
4827,sign newsletter keep date news events upcoming workshops wealth resources sign today,True
4828,sign newsletter keep date news events upcoming workshops wealth resources sign today,True
4829,youre struggling find special gift someone check gift ideas people struggle sensory overload,True
4830,high sensitivity often comes combined form autism autism spectrum broad referred instead read importantly talk little little need let people around understand needs,True
4831,reality lying floor half hour morning quiet time daughter overwhelm christmas school combined much go school ready,True
4832,really like tourettes choice simply stop ticcing else would describe tics someone,True
4833,learning disability autism bill lived experience advisory panel recruitment information easy read,True
4834,look building inclusivity initial hiring process developing underutilized talent pipelines assisting leaders roles,True
4835,need support leaders read leaders article,True
4836,year guide published well received successful application funding video project start recruitment drive extending representation courses professions,True
4837,cool yale study nearly children showed smaller fontal cortex brain bit behind forehead adhd people real disorder point,True
4838,latest thames valley daily thanks,True
4839,great vid help find others bit like sign ditto finding information condition manage seek help etc often sense missing puzzle pieces finally coming together help make whole,True
4840,know employees could offer unique strengths skillsets workforce find article eca today,True
4841,vr tours reasonable adjustment,True
4842,universities support talent stem,True
4843,workplace interests issues opportunities siop organizational frontiers ujzmrrc,True
4844,radical guide women adhd embrace live boldly break barriers sjfie,True
4845,unmasking autism discovering new faces qzxf,True
4846,caution fully claim massive lol,True
4847,feel unsupported says study,True
4848,also might explain us invisible ignored illnesses tend cast wrong somehow psychologised nts recognise punish,True
4849,successful inclusive education needs cater naturally occurring variability inevitable part humanity dinah aitken discuss affirmative education,True
4850,day advent calendar last squishy figures,True
4851,days go addvance advent calendar top tips survive festive season,True
4852,call abilities superpowers incredibly valuable todays rapidly changing environment youre leader give competitive edge help succeed everchanging landscape,True
4853,heard idea celebrating unique strengths abilities human mind including way people think focus learn process link information well distinctive way connecting world,True
4854,sending love come autistic yet another one kid heroes turns like coming helps fight stigma felt people everyone part welcoming allowing difference,True
4855,better promotion additional needs national curriculum help children understand need equity equality teach children young hopefully new generation individuals care advocate peers,True
4856,fun games spelling let kids choose activities enjoy collection never ask compete kids,True
4857,lived experience scottish government needs advice,True
4858,new event working therapeutic setting,True
4859,everyone thank continued support look forward exciting opportunities,True
4860,habit stacking reduces friction creating new habit increases chance success leveraging existing habits,True
4861,ever wondered dyslexia landscape looks like new zealand mike styles gives us background amazing journey world interview,True
4862,popular episode breaking generational curses brilliant shared expertise parenting intersections blackness much sure check podcast app choice,True
4863,frustrates often associated autism adhd actually umbrella term many different disorders major literal thinking definitions things get black white something really annoys,True
4864,abstract submission deadline extended pm friday dec submission online,True
4865,ever wondered dyslexia landscape looks like new zealand mike styles gives us background amazing journey world interview,True
4866,looking people lived experience make advisory panel work throughout bill process make voice heard apply thursday january info,True
4867,would like part panel helps shape inclusive consultation proposed learning disability autism bill bill ensure rights autistic people people learning disabilities people protected,True
4868,million dollar question hard find housing people complex needs question hoping answer read,True
4869,companies develop support networks workers dedicated employee resource groups,True
4870,effectively mask adhd around neurotypicals locate mask throw away embrace chaos,True
4871,scottish government looking people learning disabilities autistic people people part new lived experience advisory panel help put together learning disability autism bill,True
4872,open member staff well colleagues family need advice support group aims explore benefits staff networks,True
4873,highly sensitive adhd diagnosis lot research hsp clients go w autism adhd basically def mark w afab autism see mental health good bit,True
4874,thing find ndr person book blog name say ndr diagnosis introduction neurotypical people understand yeah person created autism saying ndr autism,True
4875,nice way support space people needs space visually impaired people using walking wheeling aids make sure streets work everyone,True
4876,key keeping britain safe looking attract talent add valuable skills organisation lexxic help get touch today,True
4877,dont think lot people consider people disabled breakdown potential solidarity like good kind different,True
4878,workplace celebrate,True
4879,maybe also hashtag includes forms well perhaps specific,True
4880,please yes recently adhd diagnosis stressed starting meds wish supportive community around makes managing much complex doctors experience knowledge help need,True
4881,way works parents teaching autistic children,True
4882,rudolph red nosed reindeer divergence accepted hidden superpower christmas song tell us workplace attitudes,True
4883,future check special thanks,True
4884,want know support child adult school workplace start beginning find strengths interests well finding best support student taking person centred approach rather label led,True
4885,people requirements feature vision platform surprise ashamed one us sympathy,True
4886,ableism cissexism heterosexism neuronormativism isms oppression exist primarily big ism capitalism great inequalifier movement visualization via,True
4887,new job support manager send hmp forest bank agecroft road pendlebury salford manchester,True
4888,latest dyslexia update thanks,True
4889,huge year de committee hosting management workshops raising awareness name achievements thank whole de team hard work across look forward updates,True
4890,left glasses shop listening programme adhd women radio trying jumper chatting owner rest case,True
4891,right say postdiagnosis counselling advice available,True
4892,single mother two died brixton academy crush autism campaigner daily mail online via,True
