,tokenized_text,is_after_split_date
1641,excellent normativelyvalenced orientalist oversimplifications perpetuated challenged uk mental healthcare movements healing justice mad pride trouble also potentially reproduce orientalist processes,True
1642,student hugh burke spoke childrens book wrote called way play read watch,True
1643,definitely puzzle piece super belittling harmful comes representing homies hate puzzle piece,True
1644,autistic isnt,True
1645,woof personally things full control due find thankful reflections tweets offer also feel could misunderstood share kind wording others,True
1646,decenter autism movement,True
1647,spent significant amount time past two years researching writing conditions commonly cooccur adhd,True
1648,lightbulb moments realizations put together conclude autistic well adhd things made go oh duh autistic,True
1649,ooh curious spectrum talk specific neurotypes general love see church,True
1650,thank emily kirchermorris welcoming talked reimagining established thought processes using plasticity move toward self others,True
1651,matt dyslexic question screening rather isolation needs addressed gamut happy chat doubt see tweet cheers,True
1652,great meeting today group gr discussion faqs platforms excellent chairing laura,True
1653,fit job coworkers management youre part fortunate actually work tell make fit,True
1654,long thread may missed think mentioned increased social anxiety students feel post covid poss linked also increased poss know another option,True
1655,dyslexia diagnosis comes advice much aimed wallet deciding next step read post dyslexia diagnosis three actions take,True
1656,meta research use key words academic publications created word maps networks visualize use keywords,True
1657,high school students avoid reading may lazy slow maybe dyslexic ways help literacy changes world,True
1658,echp know fact,True
1659,mondays therapy hour coach marie talked lcpc forgiveness catch conversation youtube channel,True
1660,university warwick uk currently conducting research people living fibromyalgia link pain sensitivity looking recruit participants information go study english,True
1661,expert education say partly every day learning experience everyone partly person treasure trove individuality nurtured way,True
1662,read little tear eye want read see companies talking positively used,True
1663,young people come beautiful spectrum types individual unique means diverse working people means keeping flexible mind positive approach,True
1664,beating allegations,True
1665,fuck intersectionality abled cis straight tall judeochristian capitalist upper middle class white men thinking thats governmnets place,True
1666,yes,True
1667,go listen ep relates checkout bit links podcast,True
1668,new reading coffee shop offering homemade soup paninis cakes berkshire live via,True
1669,greatest contribution world may something may someone raise,True
1670,action,True
1671,pleased chair webinar power church england thu dec pm webinar phil groves claire williams discuss relationships power church england book,True
1672,everyone using wrong way actually means proceeds also explain misleading confused way,True
1673,hi ian science maths english tutor working wide range amazing young people others photo people crazy nutty headstrong amazing people,True
1674,thanks thoughtprovoking well informed piece employers shy away work experience candidates,True
1675,attacks seriously saw lot fascination height tall age maybe speculation even shut hard sides aisle quickly unacceptable,True
1676,woman ed leadership pkhe w minoritized identity sexual orientation ability ethnicity mental health immigration citizen status wealth indigeneity language marital status race skin color religion etc,True
1677,dublin winter lights merrion square park relaxed viewings weekend pm pm dates relaxed viewing weekend w e dec w e dec buy tickets,True
1678,factsheet nd media made collaboration adhd australia outlining process disclosing adhd workplace also deciding whether disclose employer,True
1679,things love dyslexia christmas,True
1680,describes idea people experience interact world around many different ways one right way thinking learning behaving differences viewed deficits,True
1681,understanding better using positive way getting cover art book sorted close finishing manuscript ready next year believing trusting bit trite know important nonetheless,True
1682,know tourettes,True
1683,might consider exchanging someone autism autistic person lines identityfirstlanguage instead personfirstlanguage super appreciate willingness learn observation valid least,True
1684,rt mission lower unemployment rate talent,True
1685,would like congratulate spectrum employee josh winning new york state flag contest josh flag strength flag went designs officially recognized nys autism spectrum disorders advisory board,True
1686,please join us next event seminar series language disability panel individuals live partner care treat research aphasia sponsored larry motola linguistics fund,True
1687,unmasking autism power embracing hidden qtknmxe,True
1688,important parents teach children early age learn autism kylen barrons secure copy,True
1689,glad could attend fantastic excellent work mental health inclusion recognised shortlisted proud work beyond,True
1690,supporting developmental needs children,True
1691,hes still gorgeous son yesterday tomorrow,True
1692,explain hancock autism wrongly deemed mental health condition realise emoted endlessly promised act bare minimum statesanctioned abuse autistic people continued poses champion,True
1693,zero shame selfawareness maybe means,True
1694,matt hancock almost nothing help autistic people locked abusive detention nhs health secretary nothing social care registered charity called centre sole director,True
1695,one fav podcast llc university leeds need,True
1696,said couldnt possibly autistic shed made eye contact wasnt playing obliviously corner obvious next knowledge whole thing tailored around kids make adults lives hard ive fuming ever since,True
1697,learnt something new amazing world yesterday fatigue induced tasks perceived dull brain taken long realise kids work even dull,True
1698,help launch annual art contest students dyslexia yrs later turn art show opportunity honor mentor yr career,True
1699,im asking still havent found anything good english know know dont see write,True
1700,encore today breaking stigma w mind yr life founder dr luisa sanz enjoy please help us keep breaking stigmas around yrlife,True
1701,anyone risk sexual violence however higher risk blog outlines people may find hard identify sexual violence relationships read blog,True
1702,got told communication skills good today worried wrong completely unable bear people last hour work crashing sofa minute got home,True
1703,episode myles talks people autism explores acceptance could look like watch let us know social model disability change society views autism,True
1704,coming soon youre interested learning inclusion workplace invite join brytani mcleod next session inclusive practices register early save seat,True
1705,falk associate professor food studies lauraanne minkoffzern one panelists university classroom facilitating supportive classroom environment virtual event thursday hosted,True
1706,change way child views world instead change way world views child,True
1707,please donate epic players yet k goal trying get k make taxdeductible donation page,True
1708,reasonable adjustments workplace training bookable via lmsx training include information implementing ra disability awareness responsibilities trust employees conversations ra policy ra passport,True
1709,dome french partner somehow puts shit daughter likes run run run aforementioned child suspected stylish af blur gender lines ska punk forever agitator lol reynauds,True
1710,specialisterne partnered entrust hire multiple positions shakopee mn deadline apply december nd learn apply visit,True
1711,reminder partnered entrust hire multiple positions ottawa deadline apply december nd learn apply visit,True
1712,even diagnosis dump autistic people especially young women personality disorder hellholes rather put proper compassionaye supportive community care place,True
1713,taking whole complete something takes minutes others complete yet love never dull moment life,True
1714,isnt telling feel autism ensuring society doesnt impose barriers,True
1715,see autistics trending share old important website called autistics org lots things aged really well paints quite picture early organizing like,True
1716,power unleashing advantages differently wired brain published hardcover neurodivers sfhbcag,True
1717,weekend partner brings together experts conversation around intersection ethnicity features speakers g word community rsvp,True
1718,join us days rich diverse exchanges free,True
1719,many struggle things daily progress made still huge stigma surrounding mental health struggle alone less b c challenges x,True
1720,heart happy evening three people reach recently thanking openly talking hard things mainly adhd mental health depression talk even though expert weather x,True
1721,choose done adhd care get access team esteemed boardcertified experts industry,True
1722,social model disability change society views autism episode myles talks people autism explores acceptance could look like,True
1723,exactly system ethical medical diagnosis based cause adopting group symptom label names cause course nonsense causal diagnosics considers factors effects environment,True
1724,completely taken aback number people rode train without kind sound buffer like even showing question,True
1725,making notice whats working understand doesnt work start separate moral judgments experiment new options modify needed,True
1726,,True
1727,discussed general disability well,True
1728,work ban,True
1729,finished history autism future lemme tell ya one hurt,True
1730,new video release tony attwood,True
1731,nice deflection come biological markers homosexuality,True
1732,possible biological links queerness including homosexuality transgender higher likelihood someone qualities mean,True
1733,yup disability,True
1734,maybe think intersectionality abled cis straight tall judeochristian capitalist upper middle class white men,True
1735,great panel today featuring ischools dr hala annabi,True
1736,people denied existence kept knowledge gender identity bio sex real told nb years ago would felt ring true would saved lot mental anguish im even anywhere except,True
1737,go talk sendco complain teachers poor understanding attitude,True
1738,observation journalism journalists need understand standards determining credibility often ableist person tell truth still ramble b seem defensive c talk verbosely make eye contact,True
1739,looking forward talking tomorrow,True
1740,true also true world never healthy place people first place live always challenge nt capable comprehend due shortcoming mental power social behavior,True
1741,join friends future neuro culturally symposium free online speakers inc,True
1742,thearaasks comes life sometimes little challenging surrounding people understand accept encourage journey essential support system,True
1743,premium teaching punctuation using multisensory memory associations help students master rules patterns learn,True
1744,last night ust celebrated hosting art show case featuring artwork student artists houston area event sponsored usts office access disability services benefited scholarship funds,True
1745,video supports across populations,True
1746,one pleased matt hancock registered charity called centre sole director man make selfdiagnosing uncool old matty h,True
1747,diagnosed merely suggests worked hard compensating exhausting work mention young person nobody talking adhd adhders smartest wittiest people know,True
1748,interview autistic adult via,True
1749,already set centre ltd may ideas might,True
1750,already set centre ltd may ideas might,True
1751,criticism thats quite common circles often told correct beliefs different others instinctively disliked many negative automatic thoughts replace positive thoughts,True
1752,ways embrace workplace jd supra,True
1753,equity diversity comprehensive part enterprise agility arrow model learn arrow model whats definition,True
1754,happy bodhi day everyone took part series talks weekend,True
1755,unmasking autism discovering new faces,True
1756,learn inclusion,True
1757,check whats behind door number days advent calendar,True
1758,unfortunately funding challenges mean ive lost job skilled qualitative research report writing editorial admin duties strong knowledge mh sport help finding new role appreciated portfolio cv,True
1759,see matt hancock set something called centre joke,True
1760,putting employability careers team well disability mental health wellbeing support person sounds like recipe get neglected one make space,True
1761,mindful emotion coaching free webinar january acamh aces sig monthly seminars open dr sarah temple draws experience gp share inclusive approach wellness,True
1762,brilliant put place policy thanks session made think much environments stimulus thank,True
1763,attn staff weve received new books today process getting ready borrow youd like borrow get touch us books include dyslexia wound care resilience teams mens mental health,True
1764,see matt hancock set something called centre joke,True
1765,free online event westminster conversations care today pm uk time join webinar passcode details,True
1766,great session hosted yesterday enable employee network dedicated disability coincide disability history month look forward events activities rest month,True
1767,student perspectives experiences student webinar free sign,True
1768,learning autistic teachers neurodiversityinclusive school xard,True
1769,disabled people whf ability autistic people adhders lgbtqia individuals neurodiversityaffirming care,True
1770,essential reading anyone nd child quiet ones underestimated bravo,True
1771,click read story company prioritizes,True
1772,much,True
1773,interested inclusion get ticket event see link,True
1774,term terms used behaviour conditions blog discuss conditions,True
1775,trying realistic might passionate really want get aspect work find get caught web guff fight daily start resent might get lucky,True
1776,neurodivergents may something,True
1777,im thinking organising day camden london nhs social care staff including clinicians disability emphasis lived experiences practical points inclusion learning environment practical life,True
1778,days go addvance advent calendar top tips survive festive season,True
1779,hold date celebration march plenty prewarning prepare one part preparation work towards london marathon running team autism planning host special,True
1780,future maybe say ppl struggling mental wellbeing sexuality instead phrased see would bannable,True
1781,adhd one common neurodiversitys effects woman men equally present variety ways disability adhd protected equality act resolve extra support employers enable flourish,True
1782,looking forward attending workplace conference today hr business partner expecting spark discussion ideas work together support team also means organisation,True
1783,sorry think mean people,True
1784,people cannot make use innate empathy communicate feelings therefore unlike forms nonautistic person ever innately know feels autistic call fundamentally troubling,True
1785,compounding disaster become contemporary vibes based social equity scholarship hands genz formal knowledge discipline let alone sociology psychology underlying feigned expertise,True
1786,leveraging gifts build brighter future generations,True
1787,work lots people rate book geared towards ideology enough practical application generally love author resources etc though,True
1788,introduction inclusion catrina lowri tickets mon jan eventbrite,True
1789,,True
1790,compounding disaster become contemporary vibes based social equity scholarship hands genz formal knowledge discipline let alone sociology psychology underlying feigned expertise,True
1791,think still long way go everyone catch,True
1792,live would search affirming therapist area read bios see specialize areas need,True
1793,promote positive inclusive culture employees feel valued respected supported consider equity diversity help improve morale increase job satisfaction retain best talent foster innovation,True
1794,youre always going people extroverted introverted individuals communities everyone interested participating regular communal meetings assuming one kind anarchism fits ignores cultural,True
1795,please help us get recognised disability nz pour money kids save millions corrections mental health services thankyou highlighting kids behind raids,True
1796,omg making obsessed man,True
1797,work much faster get accomplished sometimes leaders get frustrated cause things way want give space often crush something need better job adjusting workplace,True
1798,paper looks building inclusivity initial hiring process developing underutilized talent pipelines assisting leaders roles,True
1799,great day nhs borders adult mental health services training day looking forward delivering training group new year,True
1800,behalf group autism insurance investment also research institute disabled consumers financial wellbeing disabled people project thank joanne segars obe key insight,True
1801,matt hancock passionate member government introduced austerity measures resulting deaths many nd disabled people untold misery content oversaw numbers reduced covid ally,True
1802,become educated aware within workplace businesses need remember neurodivergence speak engage meaningfully staff candidates,True
1803,girls school possibly club needs different within cohort,True
1804,works site going migrated please standby,True
1805,one onpoint comment treating users personalities cognitive style learning pace gives opportunity make docs accessible,True
1806,always case vinjured think antivaccine came denigrate mothers vinjured kids least injuries normalized ascribed genetics,True
1807,want learn psychotherapy existentialism coaching autism much check workshops existential academy,True
1808,experts working inclusive towards people workplace check advice,True
1809,centre utilisation neoliberal tool cunnt,True
1810,new blog post needs celebrated respected jackie pearson head website read full article,True
1811,friends youre looking freelance work experience writing please drop dm,True
1812,diversity everywhere normal commonplace different hair eye colours understand nd people need justify existence diagnosis document signed often nt professional,True
1813,meet terry dr blánaid gavin talk things terry shares experience late diagnosis course,True
1814,ive spoken people dei work autisticfriendly workplaces recruiting wanted flag extensive guide cc,True
1815,innovation decisionmaking enhanced embrace differences gender identity sexual orientation race ethnicity age physical ability support research healthcare ecosystem,True
1816,people uk clear working environments need people alternative thinking styles emma doyley tells us companies embracing,True
1817,whats purpose experience,True
1818,announcing lost art visual learning,True
1819,webinar emma weaver deputy ceo charity missed explore sibling relationships important childs development tips managing conflict register,True
1820,zach killingback rachael bryan training provider divergent brains took part durham city incubator dci accelerator programme help early stages business find dci,True
1821,parent company hosting workshop today help us gain better understanding work place looking means better take account workplace,True
1822,going giving first lecture today ill focusing autism criminal justice system glad autistic person im given chance talk issues affect,True
1823,listen works,True
1824,google new smartphones help people vision impairments take selfies easily images source today,True
1825,explain hancock autism wrongly deemed mental health condition realise emoted endlessly promised act bare minimum statesanctioned abuse autistic people continued poses champion,True
1826,matt hancock almost nothing help autistic people locked abusive detention nhs health secretary nothing social care registered charity called centre sole director,True
1827,yes behind paywall cant read centre described hancocks register interests aims cause identifying supporting,True
1828,many children parents teaching staff experience unnecessary harm enough councillors mps understand mental illness send need neuroscientists teaching politicians,True
1829,art project going well thank participants support far wonderful celebrity hands coming lookout help spread awareness would dream guest please get touch,True
1830,might exaggerate facial features ensure people know projecting,True
1831,describes idea people experience interact world around many different ways one right way thinking learning behaving differences viewed deficits,True
1832,cai solutions ohio society cpas extend hiring accounting industry leaders refuel talent pipelines,True
1833,anyway would genuinely interested know people think points misrepresent e way academic nonacademic account could inadvertently imply,True
1834,lecture seminar next part philosophy medicine course questions seminar intended provoke critical discussion people think ask ethical stance,True
1835,ltd company rather charity cic obviously,True
1836,pleasure present findings today dvpps project north east probation practitioners part thanks much inviting,True
1837,care come together evening explore institutions practices often hostile fix join pm,True
1838,autism disability different ability,True
1839,describes idea people experience interact world around many different ways one right way thinking learning behaving differences viewed deficits learn,True
1840,excited announce article supporting workplace accepted publication hutson p hutson j inclusivity workplace biopsychosocial interventions promoting competitive adva,True
1841,opportunity talk address really hope come involved show learn also educate viewers tough viewing,True
1842,wrote article defines highlights work community challenges individuals face workplace click read full article,True
1843,help us heard need change please keep sending stories us campaignstourettesactionorguk,True
1844,partner crafted fantastic article industry champion individuals read,True
1845,part new collection recordable stories poems present know someone might resonate please share free go,True
1846,agree say dilution autism inc aspergers local autism group setting group called disabled autistics matter challenging nd narrative wed love hear,True
1847,didnt know term thing ive dealt,True
1848,brill thanks taking time recommend book alot done schools lack education topic hope helps inform,True
1849,home educating autistic child youre worried gaming come talk next wednesday choose price,True
1850,product specialist discusses software helps daytoday tasks workplace,True
1851,twice exceptionality cultural diversity e podcast dr joy lawson davis twiceexceptionality resource guide parents,True
1852,weeks podcast talking emily saunderson late diagnosis came diagnosis one children ever common think thats important highlight also talk workplace,True
1853,month hidden disability make difficult people understand passionate breaking barriers promoting acceptance find training,True
1854,wondering support groups community spectrum thanks,True
1855,future check,True
1856,free neuro culturally diverse symposium bridges e center hold conversations around intersection giftedness learning differences dec,True
1857,galashiels today nhs borders adult mh services discussing mental health supporting sleep adults,True
1858,theres move away term asd word disorder autistic community one labelled inherently disordered concept many different types brain normal,True
1859,thanks inviting us professional learning day left snowy edinburgh come sunny gala,True
1860,latest dyslexia update thanks,True
1861,centre described hancock register interests aims cause identifying supporting conditions sometimes people dont want helping fight battles,True
1862,centre described hancock register interests aims cause identifying supporting conditions,True
1863,autism treatment shifts away fixing condition different ways happy function well even brain typical thoughts,True
1864,bro assessed went private nhs wait list six years long fucking joke piss take,True
1865,missed live event catch,True
1866,robin macpherson led conversation incredible panel including former pupil katharine descamps class part bp global network colin foley national director training adhd foundation,True
1867,please mindful employees make effort learn aware assumptions biases try create working environment supportive inclusive respectful understanding,True
1868,nonsense,True
1869,think cool things expand understanding way relatable informative,True
1870,outsiders bailey glasseswearing strangehairhaving magnetschoolattending horseobsessed losers around bailey feel happy normal nine years old feeling normal rare thing lovely read thank,True
1871,wtf im looking thru apple products funsies see abt,True
1872,mindful emotion coaching free webinar dr sarah temple inclusive traumainformed approach encourage people tap grow internal resources quality award european mentoring coaching council,True
1873,exciting new floreo feature available released custom lesson plans allow coaches create personalized row lessons learners,True
1874,see aspika talks chat tomorrow,True
1875,autistic burnout guest author offers different perspective differently wired,True
1876,weekend partner brings together experts conversation around intersection ethnicity features speakers g word community rsvp,True
