,tokenized_text,is_after_split_date
0,means fill lot excess paperwork deal lot bureaucratic processes sucks time energy could spent better elsewhere,True
1,current explorations may find interest starting point,True
2,matters special education shirt shirt dysleixa shirt mindfulness shirts autism awareness gift equality shirt vijashop,True
3,fantastic post highlighting traditional views deficits people autism redefined,True
4,flip side also independent schools especially designed isnt say school choice rather seems like picking another kid instead bully,True
5,talks disability rights autism strengths based language autism disability sensory challenges solutions intersection lgtbq autism disabilities orgs become borge neurodiversityaware also neurologicaldiversity friendly seeking,True
6,touch autistic person please rt,True
7,october month learn resources,True
8,courage always roar sometimes quite voice end day saying try tomorrow,True
9,speak autism issues also trainings ableism professional development socially clinical practices consulting orgs businesses best practices inclusivity gender diversity happy list,True
10,shit mental health prevent falling love mean alexithymia dont understand feelings regardless hard ive tried know feel love even though family difficult know ive loved pets,True
11,also clarification im shitting nd movement rather identifier rather talking various interpretations label helped harmed others disability dirty word within movement,True
12,october month also celebrate colleagues bps working group held series awareness breakfasts brunches across locations across globe,True
13,awakenings treatment center provides intensive treatment aka syndrome help better understand disorder pathways effective treatment learn,True
14,make read following,True
15,mental illness learning disability chronic illness fabrication attention seeking understandable distressed overwhelmed pain gentle kind considerate understanding listen patients,True
16,focus autism mental health trauma eds disability xxx,True
17,holidays remind acutely aware indescribable see others get excited halloween christmas knowing feels like,True
18,wait work job wants days hours probably wont unlimited sick time pto accommodations,True
19,happy halloween today im going dress ableist,True
20,lots forces really switched think ipldp days speak local force accommodate people dyslexia may even additional support application process,True
21,traditional romance normal person tj clune features ace main character vaguely unexplained,True
22,hello speak lived experience lifelong mental illnesses adhd spinal injuries brain condition chiari malformation,True
23,unique challenges activists face,True
24,blue pumpkins symbol respect gave yellow pumpkin friend peaceful set eyes think children,True
25,result cleaning one closet yet somehow never find charger adhdsmurfs keep hiding em forcing keep buying em,True
26,theres still time register free webinar stepping stones towards decent working conditions november pm explore key topics parttime work racial discrimination tackling burnout menopause support,True
27,presenting final instalment community conversations series piece founder laura chats one new community members monnie experimentation identity definition music industry,True
28,thinking differently autism opinion article,True
29,colleagues bring focus creativity expertise innovation lateral thinking workplace thursday learning disability today hosting free webinar supporting creating work environment sign today,True
30,focus positive aspects autism,True
31,blog discuss helicopter parents guardians,True
32,c set mostly dysregulated behaviours related autism mainstream secondary finding really fit purpose comes,True
33,stated competitive advantage businesses happy endorse wholeheartedly,True
34,recruiting neuro diversity manager fabulous exciting opportunity really make difference peoples lives,True
35,honestly try change keep using fuel creativity work ethic whilst trying mitigate trickier stuff awesome,True
36,suppose telling huh want hear neurodiversityinformed model acceptance affirmation school plus latest join online free public lecture nov pm,True
37,bingo nd broad group sort different needs barriers sometimes helps one group flatten another need discuss help greatest strength flaw concept wrote,True
38,westminster conversations care university westminster,True
39,,True
40,flashback innovate steve hill,True
41,free online workshop herts parents carers supporting siblings wed nd november book scan qr code image,True
42,lots experience facing kind differences especially mental disorder adhd asd lots think one shared everyone hope project become real keep good work,True
43,sometimes feel like tension wanting order also wanting creative wonderfully disordered,True
44,also understand racism medicine massive health issue manifests many ways extremely detrimental health black people especially black women babies talking research socioeconomic factors,True
45,fans social skills mentions neurodiversityaffirmative books teens resources may help,True
46,really bothers used excuse everything something hide behind whole autistic therefore incapable lying really gets nerves lies easily provable,True
47,concept human brains vary variation influences cognitive style join us three people share experiences connecting work innovation register,True
48,lmao fully aware gender bias medical research autistic woman also bpd honestly embarrassing insulting seeing people act like one talked accepted mental disorders,True
49,mindful matters philippines youthled organization aiming spread awareness mental health philippines,True
50,loved ones struggling adhd need support executive function contact us unlock power,True
51,led new discord server us first official volunteers joined new short video every day new unheard thursday edition adhd adults podcast,True
52,loved ones struggling adhd need support executive function contact us unlock power,True
53,comes many forms example queer characters always portrayed queer actors public discussion certain identityrelated topics e g abortion disabilities include people identities,True
54,unmasking autism discovering new faces eci hb,True
55,almost universally ignore ads parts anything capable rotating showing pretty good effort although technically suspect rotate also theres appeal way swivels,True
56,faisal passionate raising awareness helped create training pkg support groups staff london fire brigade uk also created social media awareness channels adhd got worldwide response,True
57,thank kind words community,True
58,yes absolutely states work autistic kids goal providing affirming education huge topic lately bother listening community supposed serving,True
59,ever wondered might like working lendlease diverse flexible inclusive employer choice engage enable empower people learn apply current roles,True
60,autism yes,True
61,talent brings unique strengths business outcomes organizations population remains underemployed download latest whitepaper best practices assessing talent,True
62,company dei policy allinclusive involve employees mental cognitive differences signatory shares looks workplace ways support individuals,True
63,havent yet heard please set aside half hour listen talking diagnosed autism life diagnosis,True
64,troll block,True
65,ciso legal risks risk mitigate jonathan armstrong ceo cordery spotlight cybersecurity holly foxcroft head research cyber stott may,True
66,information business disability forum toolkit,True
67,said theyll update entry suggested take research approach recent decades account,True
68,think differently others want develop strategies enhance grades connect likeminded peers chat friendly specialists specific learning differences thinking differently café nov,True
69,unlearning listening reflective practice essential practitioners want truly embed affirming approaches practice join us consider goals outcomes align paradigm make shift,True
70,hancock came across quite arrogant hes also nd hope people press hold accountable idiotic decisions without picking weird last thing community need misrepresentation,True
71,autism yes,True
72,dyslexia awareness scotland find get involved help build dyslexia friendly scotland tips talking child visit,True
73,considerations creating right culture accommodating workplace beyond emily watton,True
74,month learning school appears send digest come whats important thank interviewing read free,True
75,mentra believes time hiring platforms serve human population,True
76,amos autism mentoring outreach service recruiting new volunteers work service experience working desirable role please contact jeremy information email amoshadorguk,True
77,yes daughter university course harry wanted defend welfare team really great mental health sorry happened harry try hard daughter dsa,True
78,small number places free workshop dont delay book place today working together develop strategy jersey team work dream work,True
79,small changes make big difference accommodating workplaces eg fixed desk parking space different work times shift pattern virtual meetings different ways engage hands chat like function recording meetings,True
80,parenting full correction regardless also full authentic praise remind awesome,True
81,overreader overskimmer continuing dive musicians dr malena mclaren,True
82,youre interested hearing latest alliance project well others amazing join online free public lecture nov pm,True
83,final day get discount selfstudy pd course check pm make sure get great deal visit,True
84,received gold standard recognised innovative year partnership improved visitor experience autistic people increased staff understanding,True
85,violence childhood home born frustration substance abuse low impulse control father teen brothers would beat shit right front say awful things punching holes walls,True
86,founder ceo open next talk importance workplace journey join alex first two talks next tuesday,True
87,creative people disabled know full ideas bring unique perspective,True
88,today marks one year working inflow longest ive ever held job honestly love company actually understands doesnt punish heres another year,True
89,many examples neurodiversityinclusive teaching practices sometimes yp curriculum study reduced studied fewer subjects without consultation b c subjects seen suitable autistic pupils cd mean missing areas strength n,True
90,october month also celebrate colleagues bps working group held series awareness breakfasts brunches across locations across globe,True
91,autism language truly matters,True
92,whilst majority lists put autism adhd related also live rent free heads scottish nationalists never interacted check lists,True
93,introduction maths anxiety deeper dive maths anxiety introduction using manipulatives information click,True
94,good job tagging important video viewed many bullying mentally disabled people encouraging others unacceptable,True
95,happy halloween sec family,True
96,harry douglas starts talk working cbt dispelling myths autism,True
97,constant battle celebrity chef jamie oliver shares struggles dyslexia discusses frustrating resentful childhood learning difficulty,True
98,important running meetings remember parents want walk feeling like child making progress seen celebrated strengths tracie romo,True
99,like henry winkler many dyslexics diagnosed school years,True
100,trustee vacancy use professional knowledge expertise make difference provide advocacy support adults learning disabilities autism,True
101,autism adhd reasonable adjustments asked work tips would give another nd whos going first office role,True
102,thought good thing days,True
103,follow links bitpaper guide sign receive helpful booklet straight away,True
104,mental disorders quoted tweet refers adhd asd etc rest case,True
105,creates community presenting relatable social topics like like concept talking everyone listening without live feedback loop chat provides outlet others share experiences insight without derailing flow talk,True
106,looking forward conference today exploring effectively bridge gap equality diversity inclusion im particularly fascinated need inclusive us form,True
107,part strategy adjustments made enable individuals thrive work make significant difference individual working life potential contribute organisation build lasting career,True
108,sscl alongside parent company sopra steria joint venture nhs sbs celebrate diversity year round eight networks colleagues include lgbtq disability together helping shape workplace better,True
109,company internship policy tempted put line change,True
110,todays struggle son difficulty said still fun event little awareness reminder enjoy spreading joy definitely ok like though overindulge,True
111,fully prepared drop aspect life perceive detrimental well cant afford less strict energy spent,True
112,belong race human race lets end blatant feel seen heard valued regardless workplaces,True
113,mentra one microsoft ai accessibility grantees last year addressing bias recruiting creating employment network built universal design principles ground,True
114,learners asked apprenticeships good one replies supported kaplan,True
115,stop trying fit neurotypical lifestyle understand individual strengths limitations things become much easier help share tips advice found useful well seek support peers,True
116,however people keen highlight adhd isnt bad spoke also plenty positives share finding way overcome barriers adhd neurotypical expectations throws way,True
117,many negative thoughts share trying manage adhd student especially difficult low income multiple deadlines commitments,True
118,classic adhd style october ended finish sharing awareness month content better late never asked members adhd life like perspective,True
119,looking public speaker passionate raising awareness autism,True
120,contributes making safe welcoming inclusive diverse online space doesnt happen intentional helps,True
121,pleased darla swann learning consultant arc present topic classroom oct check blog post summarizing event key takeaways tips,True
122,autism spectrum linear autism brains wired differently still connected heart,True
123,relate aging process join melissa houser executive director brains belong vt learn brain health age three class series starting tomorrow zoom register,True
124,w festivedeals decorative ceramic,True
125,workplace culture changingand better one professional shares embracing dyslexia helped achieve professional success positives workplace,True
126,greatly valued kate grigg ceo charity dyslexia find work compelling changed understanding adhd loved simon baroncohen book pattern seekers exploring autism stem,True
127,important notes work advocates help employers realize one strategy work every person organization,True
128,interested finding ways better support studentsincluding looking educators grade participate computational thinking intervention,True
129,e alert havent already listen hear chat awesome adhd strategies classroom,True
130,focused strengths people autism related disabilities invite visit teacher portal teacher portal contains instructions facilitator pacing guide link google site students,True
131,suffering adhd,True
132,frederick douglass learn read forever free agree post literacy changes world,True
133,currently trending please also maybe even,True
134,stories inclusion help us better workplace allies invisible inclusion erg president jill shares important provides resources employees read,True
135,im torn another dope twitterspace happening time twitter space,True
136,scientist bestselling author autism advocate talked visual thinking need workplace new well section,True
137,comes language truly matters little directive,True
138,awardwinning,True
139,saying fan policies using platform raise awareness dyslexia think quite commendable wish platform like work awareness,True
140,leans learning school wonderful project resource help educators teach pupils speaks dr alyssa alcorn project lead researcher,True
141,mikey raph also adhd brothers whole family got good,True
142,life saint thorlak two minutes via,True
143,want everyone able access timely diagnosis treatment regardless live u k calling government ensure happens help us heard,True
144,anarkittyuwuuniverse okay actually kind starting hate mainstream social media spaces hate infographics look like boring corporate power point slides hate come,True
145,call time analogue curriculum time blindness visual processing challenges everyday skill minefield pupils,True
146,theres also fact opposition neurotypical used mean abnormal think long define strictly brains work way cause disability neurotypical society still relevant,True
147,initial idea leans create free resource primary school educators classrooms learn positive engaging ageappropriate way read leans access free resources todays digest,True
148,beautiful unique gorgeous inside embrace talents,True
149,autistic employees may fluctuating energy ability please rt,True
150,theres lot debate mainly solidarity ppl autism community dont consider autism disability grouping mental disabilities could offensive takes high functioning ppl consideration,True
151,causa saturn think cure,True
152,audhd artist coach talking creative practice relationships estrangement would love included,True
153,latest dyslexia update thanks,True
154,please realise lucky visibility people like nothing never brought,True
155,fair play using celeb raise awareness dyslexia mean fan govt awareness important better platform show watched millions,True
156,im absolutely loving new job director training aane past pleasure training staff boston universitys agganis arena theyve working making arena truly,True
157,join us wednesday relax revel youd like join us via zoom email infomyautismallyorg,True
158,case missed today looks support learning schools,True
159,excited let know three days long awaited dyslexia dialogue want miss amazing dialogue register clicking link dialogue sponsored,True
160,want join webinar use link mark delguidice sara lake,True
161,finally us whether live adhd encourage workplaces give staff voice room work adhd workplace,True
162,infographic made media highlights reasons employ autistic adults strengths including concentration memory problem solving attention detail bring workplaces,True
163,join us webinar session moderated,True
164,spooky monday like welcome november time family hope giving stay cozy everyone,True
165,hope throwing gillick competence principle bus garner support specific demographic young people regardless gender characteristic rights make autonomous decisions maturity,True
166,wonderful thing supporting disability childrens books adrien prize longlist announced verrrry soon,True
167,folks prepare pitches remember use new hashtag marginalized voices includes limited bipoc lgbtqia mental health disability religious minorities,True
168,welp theme today toastmasters meeting nervous,True
169,inspiring informative piece reminding us untapped talent population sadly often overlooked,True
170,world difference embracing e difference via,True
171,questions adhd addictive behaviours find answer joining us live webinar rachel varney therapeutic senco charity exploring subject register,True
172,look sections pas design mind many important elements good advice improve couple observations designers acoustician,True
173,halifax celebrating lgbtq historical figures style artist naomi vona think sir alan turing would impressed tribute,True
174,wow suddenly identical behavioral presentations everybody huh,True
175,coming sat join awesome speakers hear tune u r busy autism archaeology aulos hear master ancient sport q time,True
176,sure twitter love seen instagram,True
177,dwarf fortress basically testament autists capable paradigm,True
178,would want change amazing creativity empathy focus loss cost society ability disability crucially individual needs change societys thinking methods systems,True
179,number positive points tells story,True
180,anyone else feel like november thursday always strong thursday vibe like,True
181,totally really fun way raise awareness great shows many may unaware,True
182,reasons someone might let know autistic gain work school accommodations importantly understanding nonautistic peers something ordinary tpga,True
183,incredibly skeptical millennials genz actually view seeing cant visualize think dont narrate thoughts think tl last weekend lol,True
184,im working coach hes helping feel lot better,True
185,constant battle celebrity chef jamie oliver shares struggles dyslexia discusses frustrating resentful childhood learning difficulty,True
186,children autism observant notice everything including attitude towards,True
187,thank everyone always tune release mixed signals,True
188,love way mindcraft shows creativity used make positive change case diagnosis process champions importance,True
189,word relatively new still changes game community throws us culture full spectrum human brain function,True
190,workplace cecilia fang smashing stigma,True
191,taking part dyslexia inquiry session provided new perspective importance recognising needs people dyslexia workplace including nhs key training staff workplace needs assessment,True
192,aims introduce concept provide info designing help greater range individuals attend successfully feeling comfortable understood,True
193,melanie jameson dyslexia inquiry session important new ideas embedded already going e g action plan,True
194,constant battle celebrity chef jamie oliver shares struggles dyslexia discusses frustrating resentful childhood learning difficulty,True
195,cant think modern phenomenon racist privileged white women privileged overeducated backgrounds wallow echo chambers pronouns white guilt speaking paternalistically patronizingly behalf black culture,True
196,widening employment lens include,True
197,david breakspear criminal justice champion speaking dyslexia inquiry session dyslexia criminal justice system really issue starting taken serious department justice,True
198,join us next catalyst seminar children young people mental health look mental health november pm online register,True
199,without intersectional understanding barriers relevant one many things play part conversations safety innovation need join one conversation,True
200,sensory lighting rainbows popit fidgets favourite things,True
201,weeks human resolve ep interview tics tourette lingering associated cultivating flexibility disorder,True
202,dyspraxia looks like klutziness lack planning neural pathways arent fully synchronized yet dyspraxia tips tutors,True
203,navigating life black woman complicated growing parts identity presented trifecta unique challenges follow day,True
204,oh thats cool must crazy growing house im sure could keep though lol im sure could even nt kids must supermom karin child,True
205,member team asd autism spectrum disorder want take moment acknowledge something avoid embrace,True
206,read pdf unmasking autism discovering new faces android,True
207,subsequently provided decent appropriate neurodiversityaffirming care,True
208,download pdf unmasking autism discovering new faces ipad,True
209,academic focuses language production workplace talks workshops leadership disability ada,True
210,pdf read free unmasking autism discovering new faces bestseller,True
211,real people make argument assume bad things get eliminated fall capitalism without considering medical models function also assuming disability bad need elimination overtly ableist line w eugenics,True
212,welcomes friday november hours free register talks,True
213,thank champion enjoyed collaborating video series highlights ubs partnership auticon employ autistic professionals,True
214,exactly dont like utter acronyms conditions differences brain wiring none autism autism isnt form,True
215,love socialism implies economic model eliminate adhd anyway communism would able reverse conditions lead rise would also able eliminate othering diagnosing etc,True
216,taught public high school years yes accommodated range disability class period every year,True
217,signed join via,True
218,positively one benefits openly academic many awesome nd people ive found met past yr looking forward learning working many research advocacy related,True
219,got autism diagnosis summer well ongoing personal reflection ive learning autism generally relation research areas march well host event architecture planning research practice,True
220,pleased tho little nervous see ppl far registered first event im chairing online pm dec w short talks q brilliant panellists topic matters lot person,True
221,pt critical psychology pt,True
222,interesting symmetry big business prisons recruiting new support manager pilot one innovation profit provision came little late rehabilitation,True
223,looking back realise best representation show ever major characters probably emily one might neurotypical even traits lorelei rory richard paris kirk,True
224,human endless forms wonderful beautiful autism spectrum neurotype share collectively demonstrate consistently divergent empathy deviations typical behaviors perceptions,True
225,love dyslexic students soar things make difference three wishes every child dyslexia,True
226,actually thinking well autism call disorder maybe friends help us understand,True
227,divas daddies fast approaching sure get tickets sell online get pay door ticket link,True
228,dyslexic students enjoy writing tools like texttospeech speechtotext speechtotext dyslexia tool,True
229,thinking today disorder asd insulting autistic autism spectrum,True
230,first large quals coproduced study completed come find found series creative labs provocations designed delivered young people,True
231,autism tragedy ignorance,True
