,tokenized_text,is_after_split_date
1884,support families please help shape occupational therapy online service offer telling us family need please share,True
1885,dont dont respect anything apart warped opinion respect cynically use asinine device interests,True
1886,refers idea brains work differently specifically push acceptance people cognitive differences disabilities,True
1887,may suggest training either nurturing positive autistic identity whole school training tailor hours,True
1888,move avatar series gamified mental exercises like physical gym experience levels interests employees could direct exceptional focus towards solving work challenges,True
1889,early bird tickets afest festival celebrating autism autistic individuals available end december get touch reserve place,True
1890,delighted work offer staff series disability development training workshops first workshops nov disability inclusion training nov celebrating workplace dec embedding inclusive communications,True
1891,person adopted model communication using indigenous cultural elements improves communication nds nts essentially equaliser,True
1892,case missed missed exclusive interview depan catch youtube clicking link please like leave comment subscribe channel,True
1893,using excuse malevolent person cynical abelist well done horrible person,True
1894,factor massively underdiagnosed diagnosis necessary thats conv another time global pop dyslexic yet education via written word wonder many people struggle school,True
1895,looking forward british association supported employment conference come chat us joint workshop november,True
1896,loved article conclusion would help best would normalising really shouldnt difficult much ask assume joining group looks helpful,True
1897,looking forward live webinar morning rachel varney therapeutic senco adhd foundation charity want attend still time reserve place,True
1898,cant believe good teacher would cruel make go especially since memory issues go familys soup,True
1899,mental health health spirituality sabrina teenage witch,True
1900,dark apprentice currently sale end month get friends addicted nikolai medea,True
1901,concept asserts one correct way thinking learning acting variations seen deficiencies people experience interact world around variety ways,True
1902,india summit third edition happening virtually dec brings together people allies advocates policy makers one roof registration link,True
1903,free online virtual conference webinars offer advice support parents carers professionals bedford borough parent carer forum carers bedfordshire bedford borough early help click anymore information sign,True
1904,theres misinformation dont appreciate suggesting doesnt give pass despite valid explanation think acting like injustice others share experiences,True
1905,completely ignore needs people need correspond customer care team,True
1906,judy wrote ago term necessary derivation original term diagnosis political sociological concept allows us conceive inclusive society,True
1907,evolution knows whats best wouldnt say defects rather superpowers neurosivergent lifelong streak ranking st id even go claim neurotypical people incapable many intellectual tasks sadly,True
1908,highlightly extension excited announce v highlightly extension chrome highlightly lets find key information text quickly empowering readers,True
1909,entrepreneurship min virtual panel discussion partnership marking years global entrepreneurship free register,True
1910,includes teachers case studies interviews new african school case study,True
1911,entrepreneurship min virtual panel discussion partnership marking years global entrepreneurship free register,True
1912,besides would bpd defined mental illness exclude nd cohort whatever cause bipolar individual thinks experiences life differently nt person paradigm applies,True
1913,expected views diverse terms captured almost everyone distinct worldview nature experiences trauma emotional distress mental health challenges,True
1914,e thing giftedness isnt people e condition listed original tweet theyre gifted,True
1915,ta voice sports building blocks inclusion,True
1916,latest dyslexia update thanks,True
1917,ok searching gifted trauma nothing,True
1918,take minutes today consider insights,True
1919,lots really useful links uni,True
1920,really useful university,True
1921,gay genetic genetic know exact causation something make invalid non existent outside anatomy,True
1922,workplace webinar thursday nov pm gmt still book cant make live webinar dont worry registrants get recording,True
1923,first article ta voice series today hear lisa ta mum rugby helped children build core values address sensory needs,True
1924,great meeting bb council today discussed make bb marketing accessible attractive everyone coincidentally found fab blog dyslexia journey thought would share,True
1925,watch short video discover different types coaching available specialisterne ireland wondering coaching type best suited goals contact infoirelandspecialisternecom find,True
1926,help us support football children portfield school competing mini football tournament football therapy merley cobham showcasing amazing skills resilience donate,True
1927,lifelong sentient science experiment lawyer actually understands concept evidence many researchers fields mental health psychiatry apparently correlation based medicine harms systematically,True
1928,someone whole different bag helps time sensecheck thinking saying unfortunately often amused think say anyway,True
1929,adhd ireland launching research based adult adhd app today wonderful research based tool adhd well partners families friends,True
1930,may apparent crowd lol lot room generally,True
1931,discovered series really good via,True
1932,early bird tickets afest festival celebrating autism autistic individuals available limited period get touch reserve place,True
1933,thematic programme nov,True
1934,matter hard try make day book work individual note books work either ordered filofax type folder keep sectioned one place,True
1935,design mind firstoftheirkind national guidelines published proud sponsor new alongside jean hewitt technical author guidance,True
1936,everything woke woke woke woke woke woke couple hours ago already feel sleepy etc,True
1937,team created following advice guidance page conjunction nd staff students,True
1938,investment knowledge pays best interest benjamin franklin,True
1939,dont forget join fb group submit questions upcoming ask anything episode remember fb group members able participate visit join,True
1940,introduction maths anxiety deeper dive maths anxiety introduction using manipulatives information click,True
1941,hard get balance right people thave trouble holding space deep grief comes latediagnosed always err side toxic positivity,True
1942,treat people autism consultant created guide help communicate better people autism highly recommended download free,True
1943,ty making donating us site,True
1944,proud launch toolkit learn toolkit help teams assess buildings people disabilities dementia,True
1945,actually starting bother people quick brand label see negative defect need right environments shouldnt treated like everyone else,True
1946,exciting year research program read discover key takeaways implement make difference,True
1947,forget book free ticket webinar clubs centres tomorrow november pm pm book free ticket today,True
1948,making sure incorporate different kinds teaching methods lessons ensure teach types learners ideas use planning lessons,True
1949,workplace need training yes yes,True
1950,early bird tickets afest festival celebrating autism autistic individuals available end december get touch reserve place,True
1951,make easier support work via,True
1952,proud sponsored bring umbrella project schools across countryside st chads mission raise awareness across lancashire primary schools partnership,True
1953,cant make community engagement events still make voice heard let us know think priorities learning disabilities autism bill survey,True
1954,thank boyer planning inviting us part cpd session planning toolkit aims facilitate encourage greater engagement planning process,True
1955,blooming awesome thank much,True
1956,great conversation talked awareness acceptance challenges important middle grade take listen thank dana,True
1957,reminder pm looking forward fantastic webinar,True
1958,updated sharing learning differences demo deck,True
1959,attention please autism activist advocate yt channel make infographics tweet podcast blog anything else need help,True
1960,working fundamental principle none us ever done learning hour workshop gives experienced leaders opportunity learn complex subject learn,True
1961,school hey thing people page discussing autism like,True
1962,join syracuse ctr excellence jedi workshop learn register,True
1963,tomorrow night well pm pm next community engagement event join us discuss people learning disability campaign bill,True
1964,great lineup much looking forward chairing heres event link,True
1965,fault school today aiming meet needs teenager aln mental health issues causing school related anxiety wellbeing trusted adults mentoring classroom support study skills,True
1966,opinion media must start representing people intersection social identities stop playing stereotypes,True
1967,might youre running late spend entire time coming acceptable excuse rehearsing splutter come moment,True
1968,absolutely fascinating characteristic human beings could spend lifetime exploring understanding,True
1969,realize physical impairment different right realize fandom set autistics ppl w adhd right found offensive cuz felt targeted,True
1970,measure skills abllsr assessments items used assessments curricula get kit plus youll get exclusive suggestion sheets help use kit,True
1971,share appropriate branches including adhd manifest differently different people even different contexts lifestages many adults picture impulsive kid middle school class stop tapping foot,True
1972,tomorrow pm est join disability network southwest michigan webinar highlighting register,True
1973,underway lene trish presenting affirming approach,True
1974,really works felt something mainstream media teens yrs ago mid lucky neuro sensitivity acute ive avoided vast amounts conditioning,True
1975,chief exec fantastic work around disability inclusion holding inaugural day conference earlier december inclusion looks like,True
1976,online panel conversation dec pm close people registered info month go thought id share highlights four speakers,True
1977,autismtell forget teach may remember involve learn,True
1978,almost remember give nonprofit organizations profits makes special go high hopes foundation nh,True
1979,knowing us issues might connection issue im sure annoy lot others,True
1980,completely agree upcoming chapter describe criticisms parents informed controversies informed social model disability value autistic parents making informed decisions,True
1981,sorry say due circumstances beyond control take decision cancel working therapy online conference november apologise disappointment working quickly possible issue refunds,True
1982,episode cybertech talks panel share experiences within industry listen snippet hear panel discuss definition means,True
1983,tuesday october students year invited take part virtual workshop babcock aimed students range breath fresh air students,True
1984,one biggest life goals start foundation help people type details works feel like gone life need give back others like,True
1985,superpowers olive hickmott talks michael whitehouse,True
1986,incredible start yesterday ready day us conference heres todays agenda opening conversations suicide work understanding mental wellbeing lgbtq community mental wellbeing,True
1987,calling employers open supporting help support sharing experiences first kind nd work research project find visit,True
1988,mark start disability history month next ive interviewed newsletter itll going live wednesday paywalled users get,True
1989,led university edinburgh scientists first time pinpointed large number genes reliably associated dyslexia read,True
1990,love article black woman filled hope,True
1991,aventido passionate positive impact lives use define jargon used within industry,True
1992,wealth information available supporting students teachers join nov webinar explore intersection wellbeing productivity,True
1993,clarify chemical imbalance brain differently wired brain individual unique challenges gifts,True
1994,thinking often left agenda going forward looking create workplaces disability needs front center,True
1995,follow critically acclaimed joe wells want political comedy anymore show identity pressures finding social media fame edinburgh april,True
1996,us lives want know visit,True
1997,us lives want know,True
1998,going live lego seinfeld twitch streamer office getting coffee mh,True
1999,else neurosurgeon crave alhamdulilah successful removal truly,True
2000,partners business research study better understand issues people face work looking input businesses individuals take part,True
2001,autisma sensory meltdown temper tantrum,True
2002,got prize best year degree understanding support different struggles undergrad years ago got rd prospects im,True
2003,old big smokey apple london today filmed interviews lovely film producers us fun experience blooper reel cos cant keep straight face,True
2004,things control,True
2005,movement actual argument could made avg life expectancy severely autistic autism indeed terminal disease,True
2006,ivor adair interviewed benefits workplace recent research showing growth neurodiversitybased claims employment tribunal,True
2007,made piece support mental health awareness piece submit project cind chronic illness disability posed question cind mean instantly thought,True
2008,cultures cures brain organoids,True
2009,interesting academics purporting laserfocused reducing harassment underrepresented groups ruthlessly trash despite fact among st major public figures w diagnosis autism spectrum disorder guess real kind,True
2010,please join us next free online event mark global,True
2011,please,True
2012,happy election day staff life important day strongly encourage able go exercise right vote,True
2013,,True
2014,find fulfil potential pacerpointer team,True
2015,spent lot time seeking affirming therapists totally worth,True
2016,point time typically toothbrushes different toothpastes different deodorants note panic get something share tell,True
2017,click book place free cpd events taking place manchester village hotel hyde nd november,True
2018,belong real chat kat created specifically help break stigmas help people know arent alone,True
2019,article samantha nuttall media outlines importance challenging stigma stereotypes surrounding adhd work tips finding tolerant supportive workplace,True
2020,let talk podcast expert speech language therapy service children adults hosted isabella show aims create safe space discussing mental health check show today,True
2021,neurowild instagram create amazing visual resources resisting urge pathologise great step pursuing neurodiversityaffirming practice slt paying lip service idea actually facilitating autistic empowerment,True
2022,ahhh wish realised want pick brains things around nonhierarchical mentoring networks pop email would loved say hi,True
2023,know asked students colvin share answers learn full episode talk tuesday claim free tshirt watching,True
2024,gets frustrating sometimes self diagnosis okay radical stance many people wrap minds around people really comprehended agreed perspective would assigning value diagnosis,True
2025,excited panels idea expect schedule looks exciting,True
2026,one way better support colleagues workplace training come along embracing session thursday november sign,True
2027,finally got round setting couple dm groups mentioned one ocd support tweet sharing one tweet sharing like join either reply dm,True
2028,black woman filled hope,True
2029,would anyone else like adding dm tweet sharing group like reply dm,True
2030,unmasking autism discovering new faces hardcover april price free shipping,True
2031,autismjust look directly mean listening,True
2032,always happy chat help establish need want emphasise e g general inclusive behaviours language antiracism working etc see network could help,True
2033,join online next wednesday november pm pst informative talk supporting cognitive accessibility work teams register,True
2034,music study improves reading outcomes perfect discuss research post music dyslexia,True
2035,topic mental health issues,True
2036,join entrepreneur educator author consultant tomorrow hosts first linkedin audio event future dyslexia workplace reserve place tune tomorrow pm pm,True
2037,weve looking mediating symptoms asd wrong way check article using vr support asd,True
2038,video clip app action,True
2039,us lives find support available,True
2040,mastodon sounds complicated people circles migrating staying put,True
2041,check article inclusion cultural heritage institutions,True
2042,recommend checking stanford project year virtual summit know info education supporting kids various experts etc great work,True
2043,youve got passion got daniel murphy joe sproulle part cast discuss theatre dont miss heartwarming show playing november,True
2044,twitter fine exactly way millions patients mh issues gave us chance practice saying hard things loud,True
2045,adhd growth mindset poster hard things sign poster brain mental health affirmation printable wall art mariapalito,True
2046,including people disabilities task way beyond recruitment aim strong screenreaders many groups feel excluded read post whole story,True
2047,autism parents child autism autism child,True
2048,thank jan inspirational team sterts open air theatre arts centre cornwall enthusiasm commitment today session supporting workplace,True
2049,fun timeline cleanse wanna see one videos someone took without knowing also obvious example astounding quite frankly,True
2050,forms neurodivergence intrinsic acquired bipolars intrinsically makes neurominority neurocognitive style condition goes multidimensionals ndaffirming term dyslexics,True
2051,im gona panel tomorrow pm flexibility thought tv info,True
2052,person one official fulltime role year portfolio career find whole work vibe oppressive feels like brainwashing alternative know least half network paye,True
2053,room excited new classroom posters,True
2054,lol wait hear isnt autism adhd even didnt autism adhd plural system inherently coiner literally includes chiari malformations ptsd smh,True
2055,identify office expect adapt policies practices culture via,True
2056,infinite pleasure would love deeper chat w around kink amongst things,True
2057,provide quality case management families navigate systems necessary support child neurodevelopmental conditions passion helping children teens adults families navigating,True
2058,also inclusive people great idea,True
2059,want thank former coach taking time schedule meet nicholas giuffre amazing meet rudy nick share basketball knowledge,True
2060,please help reach goal copies fantastic middle grade bigfoot mystery donated title schools libraries get fun swag signed copies,True
2061,anxiety tears ever part reading please never force student read aloud especially front others oral reading hard,True
2062,makes sense conventional virtuesignaling seems weird aspy engineers relates something wrote couple years ago,True
2063,get social skills supports work asd learner conversation empathy additional social skills vital development,True
2064,homosexuality etc removed dsm put back dsm autism research real lgb members look closely autism claiming charlatan dont claim serious developmental disorder personal sexuality expression,True
2065,students silent reading must taught instead oral reading heres min video dyslexia tool kit chapter silent reading via,True
2066,updated sharing learning differences demo deck,True
2067,india summit rd edition happening virtually dec register summit aims create awareness india encourage organisations make nd part inclusion system,True
2068,let us know website updated key information around look new mindmate information hub worries concerns child send team also support,True
2069,specialisterne partnered fintrac hire multiple positions canada deadline apply november learn apply visit,True
2070,feedback please add category covers autism adhd dyslexia dyspraxia tourettes etc,True
2071,pdf download ebook power unleashing advantages differently wired brain published hardcover epub,True
2072,sad uni lecturer superbly supportive welcome fab work,True
2073,first article ta voice series today hear lisa ta mum rugby helped children build core values address sensory needs,True
2074,thinking thing saw results come nonetheless someone praying guys well supporting lone star state,True
2075,,True
2076,school psychology superpower advocating misunderstood students disabilities,True
2077,know job consists odd focuses today got network favorite discuss neuroscience implementing sensory rooms programs elementary middle school,True
2078,thought diversity helps organizations solve problems build better products better serve diverse customer bases support implementing inclusive hiring practices giving people space necessary best work,True
2079,mean autistic oradhd means neurotypes including neurotypicality neurodivergence refers neurotypes deviate typical,True
2080,pdf kindle download learning autistic teachers neurodiversityinclusive school read,True
2081,fluid theory evolving breadth essentially anyone thinks condition provides strengths consider,True
2082,wild someone hr still ask victim emotional labor offending person filed complaint,True
2083,get picture,True
2084,icymi last published bundle podcasts london awesome thoughtprovoking conversation talked things mental health thanks chatting colin,True
2085,maybe success isnt feeling normal like handle everything well easily people perhaps success making peace shannon ashley,True
2086,nursing needs open feature rcn education conference earlier year,True
2087,first joint adhd asd assessments years ago years ago completed process via internet social media found representation autism related traits instead lack deficit,True
2088,vicechair invited talk women travelling community offices today fantastic hour sharing experiences thank enid woolmington invite,True
2089,im currently reading unmasking autism devon price phd absolutely fascinating read better understanding means learners benefit learning,True
2090,autism accepted without needing explanation,True
2091,grade students riverside elementary took part peer acceptance understanding discussion activity students expanded knowledge autism exploring social communication sensory famous individuals,True
2092,put knowledge test,True
2093,diversity equity inclusion dei program leaves employees falling short,True
2094,im member worlds watched disability podcast w watching louis theroux would love show talk mental health please let know,True
2095,could please add category,True
2096,gift proud wonderful big love,True
2097,paper looks building inclusivity initial hiring process developing underutilized talent pipelines assisting leaders roles,True
2098,autism oxford uk conference anxiety autism january kings centre oxford tickets available website scan qr code posters,True
2099,meet cpen reader reading pen features enhanced ai improve accessibility boost reading confidence,True
2100,im found full time permanent job supports way brain works havent needed adjustments hours sessional uncertain roles orgs work wasnt priority sad kind workplace rare,True
2101,amazing,True
2102,thanks feedback janet looking forward working schools mats coming months drawing research also hoping research make difference,True
2103,part unite union sorted online event everyone author paul mcneill competition prizes including copies book encourage learning wed nov pm,True
2104,also misdiagnosed teens grew undiagnosed genetic parentinfant attachment secure maladaptive responses children environment create toxic complex emotional ruptures feedback loops eg untreated,True
2105,would act someone discloses years one made cruel assumptions autistic feels like heads explode initially handle explain,True
2106,,True
2107,emily amazing docs apply girls lot boys share autistic profile historically diagnosed great resources,True
2108,book full practical things help students read wait share team amazon review dyslexia tool kit expanded edition,True
2109,masking adhd appearing people closer neurotypical common sometimes called camouflaging obvious reasons sometimes impression management,True
2110,like wrote girls presenting autism kanner nazi let george frankl modern ideas ignored ha case jewish video history soon discuss,True
2111,thankful given us opportunity raise awareness neuroinclusivity school parish something extremely passionate,True
2112,definitely autism brains wired differently,True
2113,fundraising judy singer judy deserves wonderful woman worked years helping us mostly free time give back go use word logos pay,True
2114,said conducive waking working ninetofive job centre kept tryin force crazy arse hour contract jobs like phone suits demand come yeah going work literally,True
2115,thinking well skill taught improving cognitive skills games,True
2116,yeah changelings specifically legacy changeling lore likely prepsychology explanation specifically explanation autistic traits nobody knew autism plus whole swapped baby meshes nicely abdl themes,True
2117,might finally manage household chores youre home alone everyone else asleep,True
2118,like wheel,True
2119,power unleashing advantages differently,True
2120,please rt,True
