,tokenized_text,is_after_split_date
3287,lot brand content gurus social media bold fonts colors grab customers attention blatant unawareness fact people react sounds colors isnt problem ignorance,True
3288,used text speech app phone first time tonight shut proud allowing use accessibility tool like even though felt awkward first,True
3289,atypiqueers meetup lgbtq meetup autism thursday december pm central,True
3290,know target executive functioning ef holiday activities excellent opportunity foster skills helps caregivers successful joyous holiday season,True
3291,exciting news school psychology proud present new msc developmental science info including entry requirements,True
3292,recently spoke journalist short documentary experiences article dropped today subscribe black ballad read full,True
3293,microlink wants share great article assistive technology impact child education make education inclusive,True
3294,vault include resources downloads articles topics anxiety lgbtq monthly webinars recognised mental health experts expro players monthly online meetings mental health playbooks,True
3295,got officially upgraded possible adhd probable adhd bingo card getting pretty full,True
3296,going uncritically accept psychiatric terminology might well copy paste list neurodevelopmental mental behavioral disorders dsm photo cake say dont would make sense,True
3297,supporting across talent cycle useful tips advice embracing within organization download copy latest paper,True
3298,excellent read parents journey understanding daughters experience mimics cooccurring issues arise services take notice,True
3299,future check,True
3300,raised issue consensus bpd personality diagnoses types apply language concepts used best affirmed people apply also different notions,True
3301,attend workplace look reasons book ticket tcoglexaxulaw,True
3302,shirt speech therapy shirt cota slpa speech pathology aac shirt sped teacher shirt gifts inclusion shirt inclusion shirt vijashop,True
3303,less,True
3304,christmas wonderful time full excitement joy harder helen training lead reflecting time year particular challenge families w children w additional needs,True
3305,however doesnt mean completely useless use way works yet find txist understands help maybe theres element,True
3306,probably terf gc types love pretend paraphilias also theres bunch flags covering handily aggregated,True
3307,disability neglected area woefully low employment rates set inclusive workplace see autism initiative started generate positive change,True
3308,need see examples marriages working tapped need know work see proof,True
3309,please ways promote business nigeria,True
3310,well sensory difference yet sad sensonal affective disorder spectrum life child adult easy take every thing,True
3311,news scottish government looking recruit people take part consultation new learning disability autism bill,True
3312,retail hospitality sector accessible people living conditions,True
3313,learning disability autism bill achieve,True
3314,word seems ablistic id rather say since one would like see anomalous,True
3315,silent struggles workers unlike counterparts workers attentiondeficit hyperactivity disorder often find left behind via,True
3316,socially acceptable put headphones middle conversation,True
3317,control impulse stop picking lips skin since child watching tv reading,True
3318,,True
3319,according chartered occupational psychologist nicola james attraction strategy thinkers means enhancing creativity agility within business information,True
3320,new partners gain making amazing gains mission wake uk workforce untapped neuro talent witness joined gain workplace,True
3321,brilliant insights great quote monday panel discussion looking understanding disability,True
3322,adhd inside distracted mind brain trap dmn tpn lifechanging guide turning gi auvtzhp,True
3323,art autobiography life story awelewa used photography turn advantage speaks creative journey using regular people models artistic journey,True
3324,caroline foster perfectly explains business case social moral economic unlock talent,True
3325,stress relief products dont know please tell haha think brilliant well done lego group come embrace integrated daily routines recruiter,True
3326,next two books involve romantic relationships readers ship hearts content focus things one deep dive culture competing training next,True
3327,happy holidays everyone whatever season brings scattergram team hopes filled love light deserve,True
3328,vodability iconic person award goes michele mead michele supported many projects also one trainers trained people making huge impact across vodafone huge congratulations michele,True
3329,ep time joined founders kirsten sascha uncommon topic working groups,True
3330,autism journey never planned sure love tour guide,True
3331,many challenges around workplace raised thoughtprovoking article agree idea stakeholders allin make process including individuals company successful,True
3332,one spot left january pm pm register navigating path selfdiscovery teens spectrum disorder via,True
3333,noneasy read version,True
3334,easy read version,True
3335,want voice heard scottish government setting lived experience advisory panel ensure autistic people central driving learning disability autism bill looking recruit people join panel,True
3336,neurodivergence asset latest article isle man examiner details championing diversity patchwork personalities within teams make sure go get copy,True
3337,astrology must take account bc even supposed like,True
3338,radical guide women adhd embrace live boldly break barriers pikbr,True
3339,lucky assert work affirmative school,True
3340,bhiodh e math cuideigin le dhol air phanail tha seo learning disability autism bill lived experience advisory panel,True
3341,school understanding shaped model might hear parent different way,True
3342,thing scares arent going stop covid vaccines rfk jr bigtree etc get grubby hands going war childhood vaccines autism theres war coming subject,True
3343,language used discuss nd offensive othering aim challenge existing status quo awareness developing concept redefined however changes perceptions language take time,True
3344,looking forward artists painting mural st ever mural art project,True
3345,thats spirit,True
3346,todays free cle pm square pegs round holes exploring legal profession info registration,True
3347,social work went seminars cultural competence interact different groups ethnic cultural sub cultural religious age gender disabilities success really oppositional argumentative paranoid clients,True
3348,biological reality humanity like stars two minds alike neu project recently launched set guidance event programming postpandemic world inclusion core brought,True
3349,honored list panelist first ever summit,True
3350,education access turned classrooms hell neurodivergence,True
3351,power,True
3352,hate beauty standards,True
3353,top im offering daily free consultations anyone identifies person underrepresented background including limited lgbtqia people color people accessibility needs marginalized genders others,True
3354,thought would reshare dr doyles article christmas gave advice making holiday feel free share tips comments,True
3355,affirmative education really delighted written piece dr dinah aitken another chance translate concept practical ideas schools,True
3356,laila got super creative making spear wholly mammoth passionate working young people make products inclusive open playful possible,True
3357,looking recruit people take part panel help design inclusive consultation new learning disability autism bill,True
3358,theme bsava announces keynote congress speaker via,True
3359,day advent calendar another sticky squeeze ball blue one,True
3360,natural strengths around work known research conative mind click,True
3361,please find details christmas opening times please feel free send email message hertsaddvanceorg closed reply return,True
3362,okay weird one anyone experience w diagnosis within uk pretty distressing stuff come abt want work actually happening lol,True
3363,learn resource media,True
3364,think meantime diagnosis widely considered victimblaming slur research confirms used justify abusing already abused people included better say trauma conditions something similar,True
3365,tw death know data refers england guarantee figures million miles scotland let tell one thing better get autism learning disabilities bill moving utterly scandalous,True
3366,actually really excited lot phil mind scholars work around relationship madness wish philosophers general committed disseminating kind work ways consumable general public,True
3367,ive updated webpage great articles check special thanks,True
3368,welcome back pen pencil eraser top fidgets,True
3369,free online play therapy courses h jen taylor overview play therapy theories understanding ableism play therapy affirming play therapy,True
3370,neurodiversityrelated things events case hadnt guessed,True
3371,report chief inspector prisons suggests entirely possible half people entering prison system form condition lets start conversation,True
3372,think used use still denial autistic thought couldnt speak autistics literally experiencing autism,True
3373,dont afraid focused determined hopeful empowered michelle obama,True
3374,learning disability autism bill lived experience advisory panel recruitment information easy read,True
3375,dyslexia tool kit expanded edition book perfect professional development workshop hand books discuss tools wait thank emails teachers,True
3376,mindful emotion coaching free webinar dr sarah temple share inclusive traumainformed approach wellness approach quality award european mentoring coaching council,True
3377,problem education system understanding inclusive awful,True
3378,quote listener wanted thank panelists affirming theology much needed churches academic theology alike breath godbreathed fresh air,True
3379,hybrid future accounts covid illness work home symptoms youre well enough without fear passing anything also accounts,True
3380,tik tok searches ableist apparently,True
3381,liked comment comes wanted thank panelists affirming theology much needed churches academic theology alike breath godbreathed fresh air,True
3382,isnt disorder please dont call one applies talk people talk breath spectrum disorder,True
3383,greatest contribution world may something may someone raise,True
3384,like conversations weve last three years particularly sessions,True
3385,listen learn laura vital aware access supportive lauras top tips public speaking work life balance,True
3386,episode new freelance corner series orla ben joined laura wallis freelance writer speaker expertise womens healthcare mental health listen episode test knowledge short,True
3387,looking new listening check lcn podcast episode speak blogger aspiring lawyer phil steventon lawyer blog,True
3388,like grow autism journalist sue nelson diagnosed autism late life made see childhood habits completely new light,True
3389,great explanation difference,True
3390,appreciate learning considerations,True
3391,teachers impress impact kids loved text senior saying teacher sweetest,True
3392,need say video making cookies child brought immediate tears understand support parents raising children know heart every step matter small monumental get hugs,True
3393,thank discussions ranged support disabilities important better understanding disclosure disabilities work educate take positive inclusive approach supporting disabilities,True
3394,today part disability history month neuro development team held celebrating uniqueness event focusing strengths weaknesses team offered resources peer family support,True
3395,could part like physically impossible start task everything else hand seems easy dont actually take sort mindlessly consume doctor plenty nd folk circle struggle,True
3396,folks know resources readings journals videos whatever related indigenous perspectives,True
3397,great discussions dr blánaid gavin ucd recording ready shortly,True
3398,worry still bookstagrammer ignore chronic illness either huge part life inbox always open anyone needs chat anything chronic illness mental health welcome mythicreader,True
3399,article psychologist bozena zawisz discusses personal experience interventions fostered selfesteem son link,True
3400,difficult problems wont solved local leaders avoid difficult data conversations meaningful reasonable accommodation caregiving neighbors,True
3401,change narrative adhd,True
3402,would like understand adecco support,True
3403,tips neurodiversefriendly communication new video hope helpful like please share,True
3404,possibly student adhd necessary assume worst kids talking probably even old enough drink legally,True
3405,dyspraxia dcd associated overlap variety diagnoses dyspraxia dcd may impact individuals ability make smooth movements speech language ability plan organize,True
3406,living northern hemisphere finding winter tough feeling tired sluggish check episode therapy hour brandon tessers lcpc talks seasonal,True
3407,head youtube channel find webinars fantastic speakers joanna grace steve silberman covered topics masking eating disorders managing life transitions free watch anytime,True
3408,key learnings paper st provided knowledge person involved,True
3409,proud board member united college success ufcs good come together person finally fantastic group creating change youth honored part journey,True
3410,autistic person minimal support needs job sounds articulate autistic someone needs high degree support cannot speak whose movement differences apparent tpga,True
3411,living northern hemisphere finding winter tough feeling tired sluggish check episode therapy hour lcpc talks seasonal,True
3412,join team ultranauts inc company hiring initiative bring inclusive talent forefront perks,True
3413,console someone apologize,True
3414,join team ultranauts inc company hiring initiative bring inclusive talent forefront perks,True
3415,finding really interesting frustrating reading history autism c steve silbermans neurotribes,True
3416,day disability recap content management usability director barb iannucci discusses web accessibility best practices,True
3417,words interview linked reply attach along w couple essays tweet w links work listen ktoe interview st,True
3418,shouldnt despise term instead people use thanks pointing ya,True
3419,reminder partnered canadian national railway hire multiple positions edmonton ab learn apply visit,True
3420,join journey stories rhyme reading,True
3421,started raising voice never knew always felt urge take pain give happiness life goal,True
3422,parent response form report point challenges pupils autism face suggest staff training day classroom theory mind social interaction challenges sorry read report,True
3423,yeah im totally cool used nonmental illness differences actually makes sense legit mental illness though,True
3424,could even think brain processing would stay lifetime would equate painted box brain doom,True
3425,please clarify position supporting disabilities carers please team seem lacking training matter,True
3426,icymi autistic lead character positive representation really good series hope get series cw violence etc,True
3427,know okay poses problem entirely fault try hard enough,True
3428,pleased presenting online conference topic addressing mathematics classroom,True
3429,et al present innovations field psychological approach provides additional viewpoints biopsychosocial models perspective medical model,True
3430,awn continued grow voice national stage expanded ways serve community time inviting others join us moving movement towards justicecentered work yearend newsletter,True
3431,true im entirely sure id place autism doesnt seem like mental illness adamantly refuse call depression debilitating anxiety mental illness,True
3432,rebranded neurodiversitybased nonprofit org formerly known diverseneuro excited whats come follow us,True
3433,spring release hide shh illustrated nathalia takeyama shares two sisters go game learning become spies teaches includes,True
3434,well theres medication possibility also might give reassurance rather us lazy disorganised anxious etc could help reasonable adjustments work fantasise allowed start late,True
3435,autism parentsfocus child needs public thinks,True
3436,id say opening start sensitive depiction really doubt sort movie,True
3437,doug making big changes today someone told made free make mistakes find freedom try new things use fear tool episode doug cornfield,True
3438,well formed significant part one lectures philosophy health disease module finished delivering sense hopefully reached wider audience,True
3439,unmasking autism discovering new faces hjdcery,True
3440,unexpected expense okay anxious worrying navigating relationship impulse purchases adhd new stimulating possibly difficult project also exciting engagement content creators,True
3441,advocates neurodevelopmental disabilities necessarily fight ideologies movement many organizations advocating awareness various conditions,True
3442,feel sorry young folks whose passionate interests space electric vehicles thought theyd found neurocousin formerly richest man earth role models integrity important,True
3443,laughing others meltdowns especially asd spectrum confidence worlds tolerance,True
3444,wonderful speak mental health inclusion podcast thank hosting also want thank team arranging opportunity,True
3445,speaking question entry points learners saying question makes wonder schools created,True
3446,untreated adhd like try touch bottom swimming pool life preserver doesnt matter hard try something holding back,True
3447,last gathered gosford agm reflected work throughout voted direction next year go joined together plan form team work public sphere onwards,True
3448,affirming language guidelines printable handout follow along many resources opportunities connection networking upcoming year,True
3449,championing accessibility prioritising people identify living disability experience smooth inclusive recruitment employee journey hope inspires organisations,True
3450,ive found mastodon medicore poor performance hypertouchy community zero tolerance really unless conforms idea right way youre bogstandard left progressive expect hassled lectured,True
3451,giving school psychology today,True
3452,right medical personnel suggest major part problem maid never offered option poverty nds need acceptance death poverty needs ended via govt economic policy,True
3453,professors side phrase excuse bad time management ridiculous considering quite literally symptom multiple neurodevelopment disorders,True
3454,watching makes feel relate main character wooyoungwoo autistic person like im happy see multiple tv shows movies recent years,True
3455,actual diagnostic process took months lucky find affirming place stressful anxious regret nothing selfdx could never trust much,True
3456,actually read intended superpower,True
3457,husband pretty much family kids kind result problems solved unique ways see world differently share strengths weaknesses society whole wed solved big issues,True
3458,workplace interests issues opportunities siop organizational frontiers xjkio,True
3459,beautiful explanation actual definition put practice education,True
3460,organization crucial ready support employees lifes events prepared help adjust new way working living creating inclusive culture help prepared,True
3461,reflecting unmasking families living siblings beautiful difficult years trying make sense world place truly know unmasked,True
3462,bravo tour de force reflexive engagements w diagnostic categories borderline experience mad studies critical disability studies medical humanities feminist neuroqueer new materialism exciting scholarship,True
3463,day urge make toast call meal today mussels put em sheet add lemon juice cheese salt,True
3464,also normalizing something bad happen focusing adding tools need combat personal toolkit rather seeing failing weakness helps focus solutions rather guilt shame,True
3465,loving awareness imagery,True
3466,thinking queerly medievalism wizardry young adult texts issn issn hnmehp,True
3467,talked twitch streamer hour school system failures modern parenting actual conversations without need spectacle equally fulfilling exhausting,True
3468,moment,True
3469,autism parents lacking discipline picking battles difference,True
3470,dublin winter lights merrion square park relaxed viewings weekend pm pm dates relaxed viewing left december buy tickets,True
3471,meet veramed group veramed stories episode via informative discussion supportive working environment also proud mam,True
3472,extremely helpful videos someone know personally check neuropathy mini series w dr nelson nerve via,True
3473,reading helped recover devastating diagnosis inattentive adhd,True
3474,people bipolar disorder considered breaking,True
3475,could engage lead uni understand support adjustments available could stay brand moan university role demand cut stupid waste money either,True
3476,physical difference brain cant cured parenting methods small adaptations like make huge difference child whos life already hard child needed wheelchair would blame parents making climb stairs,True
3477,post edited mayor eric adams sen bill cassidy neuralign headline dyslexia symposium columbia univ dec,True
3478,ridiculous statement visible,True
3479,wonder councils field day cutting services ndm enables,True
3480,covers things like adhd dyslexia autism spectrum disorder asd conditions affect people view think behave world click link select understanding,True
3481,view plurality simply facet cultures accepted pathologised way draw fake binary line says like people plural often always traumagenic,True
3482,partnership asked carry essential research cost living crisis short online survey,True
3483,date reporting recommends multidisciplinary hubs rather gender clinics acknowledgement bullying body image issues etc underlying issue gender dysphoria risks puberty blockers known,True
3484,people like biomarkers perfect biomarker sensitive specific asd people would still like,True
3485,biomarkers asd biomarkers topical atm biomarkers good thing allow better diagnosis,True
3486,totally get coming fan music talented stunning trail blazer xx,True
3487,national guidelines support children autism celebrates abc news,True
3488,neurotribes legacy autism future hgrsq,True
3489,incredibly sad reiterates professionals understand support wonder yp negatively impacted mental health l,True
3490,free seasonal support pack parents child,True
3491,ny mayor eric adams sen bill cassidy neuralign headline dyslexia symposium columbia university dec,True
3492,sadly tend advocates think literal eugenics genocide autists autist choose think instead listen obey,True
3493,classroom strengthbased strategies help students special needs succeed school life fdizuaq,True
3494,day amazing recorded st episode season impact inclusion podcast listen us discuss,True
3495,noneasy read version like read response proposed bill scottish ethnic minority autistics access,True
3496,panel play central role work proposed learning disability autism bill full details contained within adverts linked easy read version,True
3497,likely aware consulting scot gov regarding proposed learning disability autism bill happy share advertisements lived experience advisory panel proposed bill live,True
3498,hiring parexel statistical programmer hiring initiative remote roles,True
3499,anyway chance connect wider community autistic friendly lack numbers means less intersections build also connect spec ints,True
3500,may occur due genetic disorder acquired brain injury consult leading today,True
3501,journey taken working change mental health space make mistakes mistakes cause pain respond mistake goal creating healing social change something else congratulations,True
3502,get mailing list one autistic christian unexpectedly leadership academically sociologist theologian currently working theological biblical understanding,True
3503,fuck intersectionality abled cis straight tall judeochristian capitalist upper middle class white men ok watch,True
3504,hmm let see long lasts,True
3505,contain multitudes friend bet depression component package complexity whether asd adhd something else work like debuff meant live like machines work nonstop toxic soul surroundings,True
3506,sparkling ruby done much community owe apology deserve way treated helps lot people cruel mean spirited play fair disgusting watch mean u,True
3507,another example importance training acceptance,True
3508,study contradictions,True
3509,new age bad vibers intolerant,True
3510,yay training january,True
3511,quite possibly schema superior task hand probably guessing context perhaps succeed domain might lol maybe come handy day hard say,True
3512,unmasking autism discovering new faces sxsxb,True
3513,latest dyslexia update thanks,True
3514,need support leaders read leaders article,True
3515,direct towards good resources learn would help,True
3516,love potential genuine ignorance disdained replies everyone supposed informed wise area reply takes cake narrow unsupportive unimaginative knowing know jfc,True
3517,beautiful festive season everyone huge thank support look,True
3518,although would temper enthusiasm adhd superpower really superpower pleased investigation dance music turned feedback got genuinely touching,True
3519,kassandra pierre diverse career path working cybersecurity industry speaks crest passion work importance asking help order grow within industry,True
3520,vivid memory reading recognising im writing book reading margins motherhood want write chapter trying find books explore theme,True
3521,new post autism christmas,True
3522,priviledge lifetime become truly carl jung,True
