,tokenized_text,is_after_split_date
2862,supported living extras zetetick housing provides support care providers tenants make lives little bit easier,True
2863,love love tweeted quotation everyone something,True
2864,cannot great things small things great way said napoleon hill embrace different,True
2865,autism storm different boat,True
2866,im curious thoughts think people whose brains dont immediately pick social cues cant good leaders think hanlons razor attributing stupidity could attributed psychsafe term,True
2867,tonight mental health disability night call us pm,True
2868,non executive director worrying increase investments fund dangerous conversion therapies,True
2869,bonus points actually reflected didnt dismiss whole thing insert bad reason dismiss whole thing dont want learn help certain people,True
2870,need build robust ecosystem neurodivergents order key prerequisite enhance awareness empathy every level community isr committee hosting webinar awareness workplace,True
2871,ott shirt today appropriately modelled,True
2872,amen really like adhd woman adhd,True
2873,happy birthday reverend dr martin luther king jr,True
2874,autism kiddos nft common one treated care,True
2875,supported living homes improve lives people learning disabilities zetetick housing understand care providers want support clients,True
2876,future listening different show episode january sharon hooley aj valliant,True
2877,please see website information workshops,True
2878,exciting announcement weve sponsored charity hidden capacities dont twitter check insta fb,True
2879,consider think perspective found thoughtful,True
2880,think possible imagined worlds best facilitator guarantee psychologically safe space people collaborate talking meetings workshops online face face,True
2881,thanks great review ready identify address barriers keeping stuck contact today message,True
2882,want set record straight people think adhd vs adhd adhd wish people knew adhd let start conversation,True
2883,neurotypes valued idealized others considered lessthan really asking,True
2884,autistic spectrum prefer identityfirst language functioning labels ableist reductionist inaccurate,True
2885,workplace manages different employees carefully works oust stigma benefits invaluable good read work,True
2886,new webinar anxiety ts specialist teacher katie skinner information book spot please visit website,True
2887,things put together hundred others tapestry adhd still good job form great relationships happy healthy loved stigmatised really different rest major way,True
2888,happening soon justice dialogue beyond stigma dialogue advocacy mental health stem zoom registration,True
2889,tom stoltman harnesses superpower become worlds strongest man,True
2890,tonight mental health disability night need talk us topics evening,True
2891,joint statement impact video audio links criminal proceedings defendants learning difficulties mental health issues,True
2892,meet jaimie young boy adhd tic disorder called tourette syndrome hes fidgety naughty really cant help,True
2893,likely incorrectly diagnosed anxiety first dangerous try box within specific parameters absolutely guarantee know least dozen undiagnosed nd people know,True
2894,thought would stop taking new things since im thrilled see focus im basically obligated tell submit call looking forward,True
2895,please join final lecture series discuss recognizing intersection lead meaningful disabled people,True
2896,please join final lecture series discuss recognizing intersection lead meaningful disabled people,True
2897,new year often means new goals lets talk best practices setting goals make sure theyre specific measurable achievable weeks article,True
2898,happy birthday reverend dr martin luther king jr,True
2899,undercurrent movement time autistics speak autistics disabling forms sometimes need nonautistics advocate pushback different ability people,True
2900,join us medical humanities fantastic neurodivrsity disability february available,True
2901,new colormind black people cant adhd mental illness bl via,True
2902,life waiting storm pass learning dance snow,True
2903,thank much great way start year,True
2904,honestly would lot easier people didnt leave tic disorders conversations largely become centered around adhd autism,True
2905,regardless age race gender national origin religion ethnicity sexual orientation disability status native language gender identity aspect makes unique,True
2906,reason passionate using term correctly refer people ignoring dismissing entire concept,True
2907,hi please complete survey accessing adult services health mental health well children services would like know aspects experience,True
2908,interchangeable terms mean thing thing person individual cant,True
2909,unique makes beautiful,True
2910,fit born stand dr seuss,True
2911,think coming conversation changing changing conversation least fields directly working autism,True
2912,hey want invest little bit time reading margin center bell hooks qualified nd guide come sign learn event free accepts donations offset cost,True
2913,happy birthday reverend dr martin luther king jr,True
2914,per hour skylarks kate king breaking barriers learning karen gibb pictured mindfulness learning vb tutorings victoria burns learning read kayleigh rapson,True
2915,typical neurotypical post hope love post instead making pronouncements high sara works trenches clients conveys compassion reality,True
2916,clicked awesome,True
2917,wow right feels,True
2918,kerry advocate neurodiversityaffirming approaches im sure session enlightening education practitioners early years supporting kiddos,True
2919,come along chat,True
2920,islands brilliance uwm receive funding establish research lab focused creativity,True
2921,excited delivering session february superstars last months excited work,True
2922,autism awareness training tomorrow students delighted support raising awareness irelands national autism charity,True
2923,many steps autism journey instead counting steps make steps count,True
2924,struggle falling asleep staying asleep texas,True
2925,questions regards would love input also know spell,True
2926,academic team ready help call new perspectives visit us online utah,True
2927,join us february explore edges intersections gender queer theory embodiment creativity somatic psychology human capacity transformation,True
2928,today hope see special tamis session cohosted lynnicia massenburg martin luther king jr day info dm bring friend,True
2929,agree top priority remember local stats approx ish showing splds id conservatively guess closer wider population,True
2930,almost unique inset webinars choose schools colleges jmc really pioneers area training,True
2931,definitely need make priority tackling healthcare issues nd patients including training needs colleagues awareness nd colleagues including reasonable adjustments allow us thrive,True
2932,social survival strategy used people situations understood welcomed hear first webinar wednesday february pm,True
2933,hiatus need questions return asking spectrum women february way get burning autism questions ready comment send infobeccalorycom,True
2934,perhaps reason tactically superior modern force whole hearted acceptance philosophy e g unit autistic teens join israeli army,True
2935,hyper means overly energetic greek root means implying excess exaggeration means hyper always physical mind overly energetic,True
2936,less anyone suffer,True
2937,thought long ago normies admitted mentally ill genius chance competing us intellectually,True
2938,open welcoming individuals workplace different perspectives skills backgrounds really benefit team made team better,True
2939,sensory issues occur across spectrum please dont push narrative theres thing severe autism certain levels experience specific things,True
2940,love weird bastion rest society intersection lgbt ends little like anything else,True
2941,ready band practice tonight,True
2942,also implying parents fault must therefore child blaming child born certain way disorder something needs cured difference vile,True
2943,employees valuable productive members workforce build culture supports heres,True
2944,math educator paper artist paula beardellkrieg shares story raising two children dyslexia dysgraphia math difficulties read,True
2945,today honor legacy martin luther king jr,True
2946,maths tutor teacher still classroom looking accredited cpd workshop enhance teaching,True
2947,tonight delivered awareness training session amazing daughter coaches developed house feel massive gap going truly inclusive,True
2948,pathologising things different neurotypes please read differences necessarily deficits environment culture disabling,True
2949,sensory meltdown temper tantrum stay kind,True
2950,suffer autism adhd suffer neurotypical medical experts spreading misinformation based ignorance adversely affecting general population behaviour towards neurotype please educate making pronouncements,True
2951,even though time happy happy life turned psychological thriller,True
2952,language terms definitions age,True
2953,please research paradigm opposed pathology paradigm see autism illness bipolar also different neurotype hope people soon stop calling disorder,True
2954,maths tutor teacher still classroom looking accredited cpd workshop enhance teaching book tickets,True
2955,going start getting radical systems work children fit pre packaged box based stereotypes history results assumptions,True
2956,find notion adhd friendly templates personal use notion need change become adhd friendly support,True
2957,use language influences individual collective sense reality intentionally choosing words one impactful steps one take towards creating inclusive world striving,True
2958,put application faces,True
2959,know mad studies contributors interests include counseling trauma survivor research psychiatry survivors antipsychiatry clinical psychology sociology research mental health social inequalities art therapy,True
2960,join wednesday january pm est second part benefits series panel explore implementation program register,True
2961,looks like launching business relaunching opal blog technical inclusion tech career blogs relaunching opal newsletter dopamine rush rushing nervous excited,True
2962,thrilled shortlisted hero year award glad diversity inclusion finally getting recognised dei initiatives events,True
2963,love autistic people always amazing certain things like someone say thinks gay insulted lol someone thinks autistic honestly would understand lol,True
2964,bringing minds mix companies broaden thinking spur big breakthroughs keep cutting edge,True
2965,ive struggled symptoms histamine intolerance years without even realising many related found recently thanks symptoms become intense interesting links eds macs,True
2966,care providers source property supported living one key principles best practice,True
2967,starting think comes next concept builds resistant coopted next iteration towards equal equitable society lot exciting watered,True
2968,think interesting point term coopted watered used inauthentically point meaningless many frustrating also stage civil rights movements shows power dynamic changing,True
2969,writes treatment white space becomes visual representation neural pathways writing sharing choices form language symbolism feared,True
2970,another resource,True
2971,want join progressive team undertake affirmative adult autism assessments fully remote salary line hse psychologists living uk welcome apply info contact us infoadultautismie,True
2972,brilliant online cpd day coming feb girls presented wonderful naomi moore insightful inspiring valuable workshop anyone supporting children young people pm,True
2973,poster dyslexia reading conference nyc since,True
2974,future learn great platform excellent design easy use using since continuing education cpd learn autism expand knowledge,True
2975,delighted announce working ia expand highly successful aurora program attract skills talents abilities individuals,True
2976,giving ways give zetetick without spending money december traditionally time giving prechristian,True
2977,object impermanence occurs young children adults adhd often report similar lack ability realise things necessarily line site sometimes things exist,True
2978,people autism make significant contribution workforce demonstrated aurora program services aus expanding program new career opportunities job seekers autism,True
2979,welcome patreon,True
2980,really unless work rejected multiple special issues,True
2981,need build robust ecosystem neurodivergents order key prerequisite enhance awareness empathy every level community isr committee hosting webinar awareness workplace,True
2982,please forget people autism adhd dyspraxia represent majority eating disorders please please use neurodiversityfriendly framework pathological paradigm,True
2983,islands brilliance uwm receive funding establish research lab focused creativity via,True
2984,correct im wrong tho dont know much yet,True
2985,stop blaming character challenge,True
2986,hi thats hyper fixation month sculpting give follow please ill spam tf twitter lmao thing im living thats wanna call im fecking exhausted,True
2987,gorgeous gorgeous girls apply companies proper transgender inclusion policies well done,True
2988,neurotype dyslexia comes pros cons although dyslexics may struggle reading writing tasks dyslexia impact one intelligence many dyslexics intelligent creative people,True
2989,thank senator hassan shining light,True
2990,share similarities adhd dyslexia reading disorders highly common amongst individuals difficulties executive functions,True
2991,know strengths talents girls,True
2992,starting new things soon still lagging passion projects,True
2993,sensory friendly solutions podcast,True
2994,thing join tell story fan girl amazing professionals balance work every damn day pull us read last sentence voice cutie tiktok,True
2995,work program focuses matching employers individuals autism seeking employment,True
2996,hope able attend panel wednesday discussing workplace wednesday dm deets,True
2997,also argument take consideration oppression like race disability class migrant status sexuality age etc say women inherently bad matter,True
2998,always found image gorgeous,True
2999,black people cant adhd mental illness black community,True
3000,keep posted working topic medical colleges aotearoa new zealand australia,True
3001,understand,True
3002,really excited asked take part thanks gary,True
3003,team working colleagues reps develop targets across four priority areas disability lgbt race equality sex equality read update team,True
3004,clients often facing uphill battle rebecca wones head psychological assessment psychology consultancy recorded three neurodiversityrelated webinars available watch early feb,True
3005,shout naphill walters ash school buckinghamshire registering take part celebration,True
3006,free online workshop herts parents carers tips tools support communication wednesday january book,True
3007,autism hold people back work discrimination,True
3008,def worth read workplace people,True
3009,improve concentration focus chewigem flip pendant super versatile flippable stimmable chewable,True
3010,great team project nishant recently held virtual art exhibition showcase works artists age group amazing initiative read,True
3011,shout petty pool vocational college northwich registering take part celebration,True
3012,often discussions disability feel stagnant experiencing progress realtime however progress reflected retrospectively look back see change bursts long took achieve,True
3013,first honored talk career advice wish known earlier bullish evolve grow senior pst pm est pm bst,True
3014,theres still time submit abstracts ideas suggestions interdisciplin seminar series researching hit us intersectionscardiffacuk loving ideas far,True
3015,another great tuesday morning meeting project team,True
3016,may value note national autistic society clear autism mental illness may recommend fine books dr luke beardon give modern update autism form thing must suffer,True
3017,shout weston park primary school london registering take part celebration,True
3018,blog discuss needs embrace dei head coaches,True
3019,learning things like important part journey open conversations abound topics like helped learn theres nothing wrong theres thing normal n,True
3020,read blog adjust site insightful quote suzanne see lot workplaces worst thing manager autistic employee manage read ensure end nd employees,True
3021,nice links new reports initiatives culture overwork discriminates againast women parents carers disabilities others work live live work,True
3022,well good news nd authors characters new bisac codes juvenile ya books things interest,True
3023,suzanne clark shares story offers clear practical advice managers wanting manage employees effectively read blog managing employees,True
3024,associated glorious strengths thanks image,True
3025,dear tweeps thank much support study huge thanks survey participants joining wild ride go live spreadsheets month see got,True
3026,looking forward concert classical jazz music inclusive evening musicmaking derek paravicini friends featuring young musicians across spectrum pm sat jan abbey,True
3027,article comments conditions shown aged severe anxiety self worth poor work history married kids much luck girls aged,True
3028,february next famly sessions kerry murphy exploring complex area get questions answered learn incorporate neurodiversityaffirming practice setting,True
3029,really proud supporting symposium organised funded need lot work fantasy disability,True
3030,new blog autism sensory overload,True
3031,shout ucen manchester registering take part celebration,True
3032,webtoon like dystopian mindgame overcoming toxic relationships lots paper cranes season complete currently working season,True
3033,know employees workplace may,True
3034,im discovered dyspraxia mid thirties took another years official diagnosis aghast realise cutesy clumsiness simply,True
3035,fastestgrowing fastestchanging possibly exciting sector world read tcovrmdkhb,True
3036,underlying issue never addressed autistic person still upset punished rewards taken away distress unfair horrible way live,True
3037,understanding different children learn differently necessary certainly true community,True
3038,excellent day training great pace feeling sessions great pack thank much,True
3039,great chat morning within workplace hopefully domino cool actions thatll improve inclusivity,True
3040,yeah let add stigma people already suffer compare potential paedophile could promote many ways using many examples,True
3041,fascinating podcast rui nunes amanda matejicek benefits understanding various neurotypes workplace,True
3042,suggest good name staff network work id like slogan like think different diversity comes standard better still single word,True
3043,rt know estimated roughly adults form adhd georgina shares story diagnosed adhd age benefits receiving support workplace thank,True
3044,read jane hatton gives top tips recruiting dont miss workshop february,True
3045,hope part whole concept,True
3046,congratulations islands brilliance uwm receive funding establish research lab focused creativity via,True
3047,taught critical thinking e equate autism adhd mental illness,True
3048,tend separate uncomfortable thoughts feelings info visit,True
3049,want start blogging sure twitter,True
3050,sharing expertise insight us march find,True
3051,fundraising job part time flexible engagement development fundraising job fundraising jobs salary paying per annum pro rata days,True
3052,educator field three decades maclean gander seen many positive disruptive changes field education important change find heinemann blog,True
3053,complex often neglected area workplace inclusion accessibility always keen share articles blogs bring attention subject,True
3054,like babe tf think hatred disabled people comes colonizers violently transplanted onto land people murder attempted genocide displacement horrific terrifying violence,True
3055,autistic adhd person like see white american disabled people whole twitter accounts dedicated tweeting every obscure instance ableism encounter imagine one single tweet settler colonialism,True
3056,know estimated roughly adults form adhd georgina shares story diagnosed adhd age benefits receiving support workplace thank sharing,True
3057,child diagnosed form need help thing need go scan qr code get started,True
3058,child diagnosed form need help thing need go scan qr code get started,True
3059,anyone thoughts ideas dawn marie,True
3060,next spotlighting claire campbelladams runs membership community mums mental health issues come discuss anything everything safe space,True
3061,rich important candid discussion edi advisory group supporting doctors facing discrimination bma work addressing racism work supporting doctors tackling faith discrimination including islamophobia come far edi representation,True
3062,quickscan online programme used indicate whether show signs specific learning difference spld dyslexia take test clicking,True
3063,raises important points adhd stigma cultural differences approaches changes required accessing diagnosis care well making reasonable adjustments work environment,True
3064,n msps agreeing take good hard look punishing schedule anyone someone recovering covid fucking respect jump dogpile despair really,True
3065,planning postdoc application forthcoming presentation conference going exciting year,True
3066,january join monthly meetup network members chance virtually meet members share experiences translators,True
3067,support workplace figures diagnosed academia lot higher looking ward working maria provide training staff support,True
3068,new dbx acoustics beehive york providing short breaks children complex disabilities,True
3069,entering conversations accommodations protocols etc absolutely imperative everyone page heres helpful resource found list commonlyused special education acronyms,True
3070,youre doctor saying thats terrifying way demonise,True
3071,looking individuals aged greater manchester interest arts train champions help make organisations friendly email katie katiestarlingcioorguk find,True
3072,shout naphill walters ash school buckinghamshire registering take part celebration,True
3073,ernst young open hub manchester professional services giant creating jobs city centre focus talent,True
3074,getting work work important read help build,True
3075,islands brilliance uwm receive funding establish research lab focused creativity,True
3076,one biggest elements movement seeks promote understanding plenty upsides brains working differently awareness allyship new day via,True
3077,absolutely loving training today much insightful essential information helping young people additional needs wait share ideas information back bring afternoon,True
3078,forthcoming coffee events dates venues links maze website,True
3079,slot today help childs brain wired differently norm join us pm,True
3080,partnered fantastic leading organisations protocol partnership webinar series covering topics cultural change series relevant education provider find,True
3081,eye february rd like charm publishes magic mystery secrets spells almost time meet ramya knox see exactly ks,True
3082,competitive advantage,True
3083,progress happening chat web designer friday sorting various admin things todo list keeps growing hard go proper adhd hyperfocus,True
3084,adhd adhere theory move like call ableist care,True
3085,happy birthday recommend checking comics,True
3086,realised super fun trait perfectionist without able motivate achieve perfection constantly stuck state anxiety selfdoubt gets worse every day,True
3087,autism means miss others catch catch others miss,True
3088,diversity doesnt mean woman candidate include racial sexual orientation differently abled list goes,True
3089,outstanding podcast debate different deficient,True
3090,join us next tuesday zoom seminar legal profession free members nonmembers tickets purchased via link,True
3091,organisations serious creating culturally psychological safe environments autistic people everyone else need educated nd paradigm nd movement autistic culture educators,True
3092,february pm pm register today navigating path selfdiscovery via,True
3093,couple searches guy doesnt tweets disabled people disability justice neurodivergence st time hes posted autistic people didnt like criticized dems saying voters problem politicians,True
3094,think workplaces understand,True
3095,dear community friends folks others care please boost quoted tweet show support thank,True
3096,often used proxy term handful conditions create opportunity maximise talents think differently,True
3097,oh boy much learn antiracism work love,True
3098,honest liking story one thing id fine critique craft telling stakes dont seem real bullshit,True
3099,fact dont appreciate rep author either youre looking something specific embodied experience doesnt hit mark,True
3100,kids book editors like intrigued premise enjoyed characters appreciated representation highlight us ultimately struggled stakes story dont understand assignment,True
3101,selfcare giving world best instead whats left katie reed,True
3102,everyone welcome join dyslexia ontario member yet advocacy direct instruction come avenues lots research excludes acknowledgment need direct explicit teaching particularly marginalized ss,True
3103,nelson couple jailed causing death eightdayold baby lancashire telegraph,True
3104,today blog cora beth fraser discusses experience autistic classicist introduces,True
3105,referring last slide others context heck would baiting either presented characteristics relatable diagnosis seen behavior character personality really understand bait,True
