,tokenized_text,is_after_split_date
3805,jo cavan gchq director strategy policy engagement said key keeping britain safe gchq talented creative people profile including dyslexia autism dyscalculia dyspraxia,True
3806,anxiety tears never pair reading please dont force student read aloud especially front others oral reading hard,True
3807,couple terms familiarize also spelled youre watching youre witness brilliant cognitive dimensions really appreciate essence remarkable,True
3808,check exciting new alison ratto colleagues tool selfassessing characteristics,True
3809,kind accessibility want see web space building aid everyone,True
3810,former managers colleagues excluded labelled isolated know,True
3811,complete article,True
3812,tell much disability cost,True
3813,people idea expensive disabled disability tax frustrating medical bills specialists equal roughly year thats mention public transport pay etc,True
3814,thinking clearly skill taught improving cognitive skills games,True
3815,autism manage nutrition autism condition caused factors yet determined children autism may respond name repeat movements hands feet read please visit,True
3816,going radical would even go far say every therapist also affirming inclusive even required expected trauma informed afraid nd affirming wild pipe dream,True
3817,convention really comes fruition ill one ppl hugs cool pin within reason glomping knocking stim toys display booth,True
3818,tiktok done irreparabile harm struggle way gotten people talking adhd autism conflicting even comorbid opposed two badly defined differentiated conditions things,True
3819,encountered word sang thought beautiful word encompasses reality god many different ways build brain kathleen seidel,True
3820,seeking proposals firstever proof alliance caregiver conference may proposals due january learn submit proposal,True
3821,initially gave lot think also lot laugh honesty think likely absolutely correct one myriad movement branding issues,True
3822,bipolar disorder neurodivergence,True
3823,last engaging panel disclosure workplace w mark dipietro andrew garcia jan coplan rachel brown gets lived experiences folks throughout journey,True
3824,might freeze clam go blank etc someone asks project thats still progress walks youre working,True
3825,giving,True
3826,going suggest looking possibility view criminal long nhs making people wait breaking guidelines waiting times clinics kiddo deserves love relate situation,True
3827,autism neurological networking autism think differently neural connections possible us think like neurotypical bad ways nts basic af amazing lot ways,True
3828,yeah often many advantages,True
3829,disgusting please use excuse cna commentary autistic may make elon musk think differently,True
3830,go,True
3831,today marks first day thought next weeks wed take look history tourettes key players discovery far weve come since join us,True
3832,one main roles prison rehabilitate help offenders read find benefits tackling dyslexia justice system,True
3833,dwp holding free event aiming promote support services available help people workshop using art represent feel like neurotypical world pm pm hold ip ln,True
3834,women sought jobs gchq bae systems,True
3835,start uk disability history month celebrating colleagues disabilities range activities across month part year theme share ways take care health wellbeing,True
3836,radical guide women adhd embrace live boldly break barriers,True
3837,opening uk disability history month blog take look,True
3838,playing part fostering environment people empowered play considerable strengths dyslexia dyspraxia staff network aims explore benefits make trust accessible,True
3839,love dealing boss nice job friendly stim toys basement spend h per day brand scab especially try recruit dating site wait see even,True
3840,huge thank sophie team helpers raising huge total via go fund page tourettes action overwhelmed generosity,True
3841,could poor spelling also super power,True
3842,someone pleased supporting event event marks years global entrepreneurship free register,True
3843,good also v importantly cyp disability unaccompanied asylum seeking cyp would v happy discuss helpful,True
3844,join discussion pm min virtual panel discussion partnership marking years global entrepreneurship free register,True
3845,join discussion pm min virtual panel discussion partnership marking years global entrepreneurship free register,True
3846,people estimated businesses must proactive designing workplaces employees thrive,True
3847,delighted hear aware disability area thats historically overlooked collection delighted see theres prize help towards addressing hopefully one day add ya prize,True
3848,lots academics publish neurodiversityinformed research autism adhd including many others top head,True
3849,good points understand attention given range issues affect trainee progress like linguistic cultural factors life circumstances course poorly designed training conditions agree generic label unhelpful,True
3850,women sought jobs gchq bae systems,True
3851,still time sign tomorrow gerontology tonic session lynsey stewart present research dementia,True
3852,individuals deserve feel accommodated supported comfortable workplace employee learn,True
3853,final newsletter featuring annual essay prize open submissions funding boost research early career researchers new workshop series launched read,True
3854,backlog young people waiting diagnosis treatment continues grow cause problems families clinical teams thats developed new pathway,True
3855,easily overlooked autistic traits inspired handle autismhappyplace,True
3856,incredibly proud years pupils permanent exclusions also incredibly proud staff share values find schools services,True
3857,early bird tickets afest festival celebrating autism autistic individuals available limited period get touch reserve place,True
3858,key keeping britain safe gchq talented creative people profile including dyslexia autism dyscalculia dyspraxia conditions affect ability process different forms information,True
3859,isnt political conversation ideological conversation business conversation diverse workforces make profitable futurefocused innovation ready,True
3860,really useful thread providing insight showering immense challenge attention planning memory boredom energy levels transition reasons thread growing type,True
3861,diverse libraries webinar representations children reading national literacy trust,True
3862,possible violation patient privacy differences scammers junk bond traders stylistic psychopathy conspicuous consumption social responsibility cocaine adderall philandering enm polyamory,True
3863,imagine coach doctor first labour terrified guest episode puts ability cope hormones parenting adhd link bio,True
3864,course also quite fond seeing defining impairments condition following moved away thinking autism condition needs eliminated fixed thinking autism part exists across humankind,True
3865,seeing earnest open made feel seen validated return also friends also hours long convos youre amazing,True
3866,strength,True
3867,like autism question asked parents autistic child watch grow interact world find,True
3868,free online workshop herts parents carers understanding anxiety thursday november pm book scan qr code image,True
3869,love seeing story need remember every day many people feel left world world mainly designed tiny lens heavy neurotypical biases creating much pain,True
3870,pinsent masons amazing work supporting workplace recent best health wellbeing initiative firms employees people law,True
3871,officially disability history month runs december creates opportunity celebrate achievements people raise awareness tell us plan celebrating,True
3872,little help important resarch calling hr l ta edi specialists enclosed campaign gain better data inform practice policy make lasting change create index col,True
3873,hey using joke pretty tired mention hugely problematic given influence thanks providing opportunity learn guess,True
3874,much people education children talk embracing sometimes positivity really extend reality future accommodates adults think every single little thing catered think even basic,True
3875,selection bias poll starters followers already self identity consider fringe culture culture conformists cant cope yes diversity standard neurotypical myth,True
3876,imagine demanded official diagnosis kids call gifted selfid valid neurodivergence illness medical model model disability,True
3877,really interesting watching session ashley rina today techshare pro event thank sharing,True
3878,cant prevent meltdowns full video thomas henley youtube channel,True
3879,places left new training sessions early next year sessions free attend simply seminar discussion participation encouraged,True
3880,autistic children often challenges neurotypical children overall wellbeing autistic children families harmed frame autism terms deficits alone et al,True
3881,live,True
3882,jo cavan gchq director strategy policy engagement said key keeping britain safe gchq talented creative people profile including dyslexia autism dyscalculia dyspraxia,True
3883,going live world warcraft retail new content,True
3884,key keeping britain safe gchq talented creative people profile good enough good enough,True
3885,encourage students check indicators specific learning differences spld dyslexia click get started,True
3886,city guilds foundation running survey employers individuals gain true picture workplace take part via,True
3887,trainings talk language say using old language language thats longer preferred actually microaggression check article tips stopping microaggression progress,True
3888,depression mental health disorders mum lived squalor one hardest things even openly say defo smelly scruffy kid poor mh looking back defo sort went unchecked extreme hoarding,True
3889,talking someone yesterday shift seems slowly happening around people actively advocating change women sought jobs gchq bae systems,True
3890,thank informative presentation autism,True
3891,prhs first inclusion speaker series session staff awareness excellent really interesting hear coach hannah ashenden personcentred approach workplace considers great talents everyone bring,True
3892,miss signing newsletter heres opportunity stay touch click get scoop,True
3893,latest dyslexia update thanks,True
3894,wearing new inspired awaiting take part entrepreneurship event three loves,True
3895,owner video states behaviours noticed prediagnosis normal child behaviours emphasis frequency delays regression suggest,True
3896,yes great see sadie henderson journey print read,True
3897,one main roles prison rehabilitate help offenders read find benefits tackling dyslexia justice system,True
3898,empowering moment south chair opened stating dyslexia video alison shares thoughts universities could adapt teaching methods inclusive students,True
3899,osa jo tietää moved away thinking autism condition needs eliminated fixed thinking autism part exists across humankind,True
3900,forgotten innocent tim minchin comedy music joy matilda musicals guardian via,True
3901,sexual orientation age gender ethnicity proxies diversity may reflect diversity thought experience essential selection processes inclusive spaces made accessible order reflect advance genuine diversity,True
3902,pulling together sample recovery workers compliment practice feedback lead us thinking additions make kits help sensory needs conversations,True
3903,raising feedback camhs camhs experience result feedback continue put feedback across,True
3904,british spy agency gchq weapons manufacturer bae systems issued appeal attract women work cybersecurity jobs,True
3905,key keeping britain safe love positive attitude coming latest recruitment drive,True
3906,someone clear dyslexia children affect speech pronunciation dyslexia adults affect memory processing speech conflicting message getting,True
3907,deborah reid speaking,True
3908,blog post shows long sentences important part writing thats interesting sometimes feedback given might imply long sentences bad reality complex im clear relates though expand,True
3909,tracing roots ensure child misunderstood bullying humiliation school thanks learning impairment good see converted class special needs assessment center makadara,True
3910,encouraging see black folks embracing generations stigma stemming racism selfconsciousness intelligence every family deserves joy able fully embrace whole selves,True
3911,earlier month riba journal covered new pas outlines considerations jean hewitt farhad rahim involved forming guidance,True
3912,polar explorer ann bancroft used athletics exploring motivation confidence builder encourage succeed,True
3913,proud inheritance,True
3914,becomes st uk insurer take industry transformer membership,True
3915,share insights dyslexia may help understanding collating research student condition may difficult,True
3916,sign events lived experiences panel discussion november self advocacy disability workshop st december,True
3917,libertarians take everything literally zero sarcasm radar dont joke easy,True
3918,call old fashioned im beginning think whole thing setting mentally ill population back immeasurably,True
3919,patience,True
3920,missed ectrims check conference highlights ectrims neurodiem,True
3921,mean think common coping skills pushed really lose autonomy places promoting autonomy workspaces social spaces etc arent asked cope survive,True
3922,research shows people attempt higher rates neurotypicals new us suicide crisis hotline resources love check,True
3923,looking dynamic speaker talk reach today interested special thanks assistance creating video,True
3924,dismiss tend think terms neuro adaptable rather neurotypical spectrum exists much call many axises intelligence spectrum intelligence multidimensional everyone exists somewhere space,True
3925,think next frontier going need brains table period heather christieburns,True
3926,saw tshirt relate mind like internet browser ten tabs open three frozen idea music coming,True
3927,next move onto subject specifically go enabling talent thrive workplace delighted joined louise calvert meike bliebenicht meena srinivasan paulette cohen,True
3928,tools fill gaps creates instead car bought laptop typing became creative release helping capture racing adhd thoughts constantly filling head,True
3929,concept many brain types normal e g autism adhd dyslexia dyspraxia dyscalculia,True
3930,uconn cee pushing frontiers engineering education reframing,True
3931,autismwe fit box help realize box,True
3932,leaving school poor academic grades diagnosed dyslexia running successful business journey,True
3933,might chat strangers elevators even really dont want avoid coming across rude someone never see,True
3934,want position ally start getting terminology right people people diversity something requires multiple people,True
3935,mental illness thing dude,True
3936,anthony pacilio highlighted workplace recent panel speaking specifically skills workers,True
3937,nbcc understanding business november cet uk time register,True
3938,rainbow spectrum pride peer support group celebrates explores intersection b n autistics slgbtqia open adults across ontario group pay thursday month pls share,True
3939,neurowild creates incredible child friendly illustrations,True
3940,matters special education shirt shirt dysleixa shirt mindfulness shirts autism awareness gift equality shirt vijashop,True
3941,students silent reading must taught instead oral reading heres min video dyslexia tool kit chapter silent reading via,True
3942,know smart gadgets also said trigger adult adhd certain cases share experience,True
3943,thanks really informative session eys morning,True
3944,get female leaders,True
3945,exactly besides loads better people designated poster child whatever literally anyone else would,True
3946,organisations want recruit women autism dyslexia adhd work cybersecurity roles key keeping britain safe gchq talented creative people profile,True
3947,autism adhd fall umbrella idds makes different jayne leonard breaks article last year,True
3948,also take look book lists amazing reads diversity autism much,True
3949,experimenting part slow living experiment add todo items agenda reader regret tell able contain agenda overfilled todo lists,True
3950,want everyone able access timely diagnosis treatment regardless live u k calling government ensure happens help us heard,True
3951,whether share personal journey initial autism diagnosis becoming lawyer dismantling disability bias explaining tying everything together accessible individualized presentation sure walk away feeling inspired,True
3952,jessica kidwell discusses listening highlighting voices selfadvocates important latest click link watch,True
3953,dont let get away hijacking feminism hijacking gay rights even movement last one find especially offensive personally due autism rights work ive seen cited people used trans autistics,True
3954,novelty rainbow infinity women men girl g notebook matte finish cover planner journal lined college r yyfu,True
3955,come join december thanks sharing click link register,True
3956,one main roles prison rehabilitate help offenders read find benefits tackling dyslexia justice system,True
3957,learned something new csf lactate,True
3958,hassellinc adrian childs shares experience,True
3959,aspie world starting youtube full video thomas henley youtube channel,True
3960,north apartments provo firstofitskind affordable community dedicated seniors adults autism issues galloway proudly providing civil engineering surveying construction administration services,True
3961,like zone level get always unannounced,True
3962,um yes obviously researchers known decades nicotine helps people issues including proved studies nicotine patches odd deny truth,True
3963,class neurosurgery applicants want get know share eras hobbies showcase various talents bring field neurosurgery,True
3964,highly recommended book nd affirming read kids know school budgets squeezed ive bought copy kids schools hope little things like make difference future generations,True
3965,women sought jobs gchq bae systems interesting,True
3966,could psydiversity say evolved suit different age different challenges diverse cognitive style modern cookie cutter civilisations cognitive styles arent helping evolution weeding mechanism,True
3967,adrian childs shares experience,True
3968,shoutout hosting first game night featured newly developed games engage involve motivate neurotypical audiences asked playtester put games test passed,True
3969,join us collaborative virtual plc esc region unpack autism public education november session discuss trauma trauma informed care buzz words imperative learning,True
3970,new contribution inspiring actionable innovations greg bendisgrab superpower interested writing us let us know,True
3971,last least talking experience racism selfishly decided phd working capture voices collective experience,True
3972,cw job interviews,True
3973,acknowledges diversity minds means includes neurotypical aim recognize biological fact must accept support affirm forms neurodivergence,True
3974,know autism,True
3975,value,True
3976,fantastic presentation acceptance affirmation classroom thank making available free participants outside u k,True
3977,listening present paradigm exploring common misunderstandings need change expectations beliefs facilitating rather correcting creating environments people,True
3978,couple things may use well,True
3979,working various research projects sometimes talk online im cerebral palsy adhd hoping connect others,True
3980,getting ready personal perspectives panel showing man behind curtain,True
3981,continued conversation team discusses reimagining recruitment new accessibility innovation vlog,True
3982,tune tonight pm hear discuss workplace break barriers preventing autistic people finding jobs,True
3983,great see hope making appropriate reasonable adjustments employees employers need training understand effectively accomodate workplace help,True
3984,testing green belt target,True
3985,know multitasking especially technology slows productivity changes absorb information increase superficiality relationships visit youtube channel helpful tips,True
3986,looking forward lecture today,True
3987,thrilled announce next public lecture centre development one really special one,True
3988,oh like needed reasons please content ideas especially organizing like us neurodivergents home til ep adhd,True
3989,sibling support youth clubs partnership contact,True
3990,great read new bsi guide design mind built environment much overlap found research supporting public places designed enabling autistic people,True
3991,going upcoming space join,True
3992,woman living extreme poverty ridiculous hope people get pennypincher syndrome hopefully get rid,True
3993,fulfil potential pacerpointer team,True
3994,next instalment access areas series magazine looks music industry asks izzy bee phillips thoughts,True
3995,one last thing terms writing characters personalities established first establish sexuality diversity later,True
3996,introduction using manipulatives teach maths course available special price november go find,True
3997,fsc recommends first steps better employees increase transparency process available supports implement companywide awareness training offer flexibility work arrangements,True
3998,creating inclusive policies allow individuals retain meaningful employment companies benefit largely untapped pool talented candidates,True
3999,nov report future skills centre provides insights recommendations employers wanting expand inclusion practices support employees thrive workplace,True
4000,tips seconds neurodiversefriendly communication like please share,True
4001,hi every sunday night pm etd find updates recordings searching hash tag go great lengths maintain safe space discussions around autism,True
4002,proactive inclusion accessibility designing employees thrive,True
4003,one main roles prison rehabilitate help offenders read find benefits tackling dyslexia justice system,True
4004,know empowered accept invincible,True
4005,,True
4006,learnt much recent years breaking barriers understanding,True
4007,trauma made pronounced dealing trauma turns things around caitriona risk,True
4008,caitriona trauma dwells every part body adds risk,True
4009,long voting opens would love vote alongside comment mighty women uk,True
4010,final speaker discussion panel catriona nicholls sits ucds working group catriona speak lived experience risk,True
4011,yes absolutely strongly believe linear communication constraints block lot potential present day teams folks learn differently exist different places spectra need learning dont cater gcd,True
4012,would make smudge sense working definition afaik label slap bunch behaviours dont real explanaition yet,True
4013,thank featuring autistic person treating sensitively another step towards,True
4014,painful watch parents autistic son allies instead publicly declare war autistic adults children grow cases already dismiss valuable advice autistic advocates provide,True
4015,autism grievance parents generally like parents autistic children significant disabilities except instead targeting libs grievance parents forums run target autistic disability activists,True
4016,mondays hour coach asked lcpc questions catch conversation youtube channel,True
4017,fantastic design agency barcelona,True
4018,evidence also autism damage difference function useful past always around always around people everywhere like people general,True
4019,friday hosting svp disability panel discussion joined panelists kirkpatrick come learn make paleontology diverse ecosystems study,True
4020,speaking someone taught kids sen definitely made better teacher,True
4021,think different people like different things books particularly given readers good editor help make sure youre making conscious choices write effect,True
4022,floating idea used experience coaching young people develop public speaking confidence programme adults separately debating mental health would people interested,True
4023,youre parent autistic child adult also horrified magastyle disinformation please know skeptical getting autism information people im going call grievance parents,True
4024,different different good,True
4025,journeys podcast team conversation family autism journey,True
4026,journeys podcast team conversation family autism journey,True
4027,absolutely fantastic great people organisation wonderful chelsea taking proactive lead working helping people adhd thrive,True
4028,relevant truth opposed accurate facts also art forms study humanity,True
4029,hes proponent whos said anyone says autism pathology put jail really shouldnt come shock,True
4030,visited local garden centre c today find christmas present someone love mckenzie mr okane ended getting lost model village,True
4031,autism love hope acceptance understanding listening respect kindness bravery,True
4032,dyslexia greatest strength dyslexia made resilient never stopped achieving goals disclosed dyslexia day got promoted inspired others open,True
4033,found fab talk autistic girls project seen key unlocked world elisabeth wiklander via,True
4034,love meet designers different brains,True
4035,cut paste hot takes fix relationship friendship life never work much less make sense anymore nt vs nd dichotomy overly popularized social media discourse life human interaction complex shit,True
4036,offers great advice parents christina di vincenzo ed bcba supervisor,True
4037,employees conditions like autism dyslexia often extraordinary skills offer workplaces best support employees,True
4038,thank yes indeed right aspergers real please luke educate insulting,True
