,tokenized_text,is_after_split_date
0,leaders support embrace untapped potential talent via,True
1,sources article grounded paradigm alfie kohn uses pathological language critiques behaviorism gold may something else coming stay tuned,True
2,friends looking young champions say education system champions advocates info,True
3,times imagine wonderful support child bam turn thrown deep end,True
4,adhd symptoms jennifer went eight doctors ninth finally diagnosed alone news,True
5,looking perfect gift someone adhd done covered list great gift ideas,True
6,lucky leaders like gil aguilar gil overcome champion lead shares challenges successes developer,True
7,relate things comment thank honeyman,True
8,investing dyslexic adhd key success investment pays big dividends,True
9,next stop oh calcutta kolkata city joy,True
10,adults immoral unethical deluded chose ideology ethics idea comes may justice prevail harmed,True
11,check new scifi novel chrome world release audible,True
12,tweets esp go walk silence like superior person like luv u jerky insincere low key crapping imo,True
13,fyi productive good person worthwhile useful making difference good day,True
14,us viable becomes static need sort audio input cut allow block constant stream consciousness focus weird know wild,True
15,writing sprints discussions gift giving live hours pm est cest acst,True
16,sure new ones reddit always goto disability ra communities wonderful resources,True
17,absolutely sensory breaks hands key ss highlighting,True
18,people interact world many different ways discuss inclusivity accessibility world,True
19,potential cant help thinking highlights undertones racism ableism ageism lack understanding around herd mentality worst,True
20,holidays near consider enamel pins loved ones,True
21,away k,True
22,hi sian completed shared survey interesting youre master student would really appreciate could complete share survey pgt health uk hope dissertation goes well,True
23,learning lockdown challenges,True
24,asparagus bunch could bc fab debut friendship school troubles sweets funny shortlisted,True
25,new post tata power ihcl organize first multisectoral national r,True
26,conversation yesterday tech specifically inclusion led interesting debate build product inclusive make default inclusive elements feature turn,True
27,diversity inclusion endeavors go beyond gender diversity honoured part valuable drive meaningful change disability inclusion learn,True
28,embracing workplace,True
29,brain charity training supports organisations understand tag business would benefit contact trainingthebraincharityorguk find information,True
30,recommend organisation highly commitment sharing insights resources amazing want learn please follow,True
31,represent mental models software even people use completely different mental models access opensource,True
32,know want know planning taking part bringing awareness disabilities let us know comment section,True
33,create golden age interface design able harness people mental models represent software close gap people think differently,True
34,lack understanding appreciation workplace makes life pretty hard aspies,True
35,open door starting today doit solutions days free resources open door every day see whats,True
36,im going host arguments topic asking questions trying understand repeating harmful myths im sure dont understand paradigm think ignore,True
37,trauma geek trauma education please help us understand npd symptoms abusive exerted toward another human,True
38,free fact sheets schools parents tips strategies everything download,True
39,coming home allday neuropsychological assessment wanting curl ball cry also questions stupid dont take account variables madness,True
40,really good thread essentially psychiatric neglect abuse child uk mental health system uncommon many mental health systems adopt flawed symptomonly treatments ignore also adverse affects environment,True
41,im beginning sv felt neurodiversitycoding cast penny even eevee backpack idk intentional wasnt youve stumbled golden gholdengo opportunity nd representation,True
42,tending overshare symptom youre answering question something matters matter part relationship youre defined hetero need know going date,True
43,rt schock mastodon lol sam erika p serena hillman thing normal exploration opportunities research,True
44,autistic think time aut community gets support future autism support look like help w data,True
45,evil,True
46,royal commission published new research provides unique insight lives people learning disabilities experienced state faithbased institutional care,True
47,advent im sending visual link resource day mst team beeu todays visual,True
48,since see lot folks trying include stuff frankly awful since lot nd folks abused people traits id rather someone social circles liable manipulate use others pawns,True
49,great attended conference everything supporting people economy inactive big big theme,True
50,thanks sharing,True
51,action,True
52,finance manager scotland leading charity full time linlithgow hybrid working,True
53,range differences way human beings experience interpret world around latest blog looks examples whether organisation needs anything,True
54,managed find novel main character whos review english french au gré des perséides cc,True
55,mark years international day persons disabilities hosting event theme hidden disabilities join us show support friday december pm student life,True
56,love man always eloquent paradigm must change speaking abilityre disability history month event,True
57,know folks deliver talks workplace got pal need support area,True
58,landed store incredible pots made students autism project sales help fund futures incredible young people,True
59,today marks start days advent calendar check back day reveal free resource factsheet head website reveal factsheet behind door number,True
60,gets second discussion brewing folks talk people literally cannot thats thread million tweets deep,True
61,continuous quality improvement lead reflects community practice helped create welcoming empowering spaces staff members patients read sophias blog post,True
62,content inclusive accessible vital question ask want content reach connect entire audience repurpose content mind,True
63,big issues word thats perhaps another time distinguishing developmental disorders autism adhd psychiatric illness clinical depression much useful,True
64,q intersect race read blog victoria atanda find,True
65,expert course maybe conditions related like autism adhd spectrums diseases like depression experience,True
66,love lets improve working lives people helping unlock unique talents innovative contributions bring business world society,True
67,blog share always yearly rendition one solitary life dr james allan francis reminder holidays really,True
68,autistic person every day struggle nagging thoughts going die alone poor relatively young,True
69,teachers get decent training upset campaign,True
70,personality disorders dont belong movement movement self acceptance different fostering acceptance society opposed changing oneself,True
71,good clear overview different learning disorders,True
72,happy awarded completely free bursary places attend takes kinds minds conference conference whole community afford please email us request bursary dozens places,True
73,one goal movement might changing material social conditions trust clinicians norm becomes possible remain rarity,True
74,personal note worry interacts mental health know anxiety stress reduce cognitive bandwidth making behavioural biases pronounced whole sitaution inequitable could indirectly discriminatory n,True
75,another paradigm starts different axioms assumptions clinical approaches cant learned one requires work actively using revalue reinterpret everything mental functioning ability,True
76,good luck write show tweets voice record thoughts put spot hope listened important points make need support also new stuff dbt tbc,True
77,great meeting gave informative interesting talk told us new book sale thanks hosting,True
78,clinical training expertise whether psychiatric psychotheraputic whatever else dont make someone expert neurodivergence viewed paradigm anything may hinder understanding,True
79,days free online advent calendar,True
80,tell understand without saying understand,True
81,workplace interests issues opportunities siop organizational frontiers gaehx j,True
82,interesting research mediterranean diet leads better cognitive functions memory,True
83,props fellow villager edi coordinator took time offer great advice reference info started putting together documentation one number voices contribute work,True
84,latest dyslexia update,True
85,delighted participate todays event abilityre event world disability awareness day ceo tony lloyd joined charlotte valeur ceo talking,True
86,looking forward discussing experience psychiatrist,True
87,nd session hearing colleague discuss trainee challenged practical skills searching understanding leads label better struggling difficult nb applies seniors,True
88,plans include strategic outreachfocused approach prioritises marginalised groups within community including sex workers asexual folks intersex folks transform bathroom facilities make wheelchair accessible,True
89,important open read recent blog,True
90,im sharing helpful insights december help spread festive cheer sharing posts family friends,True
91,seventh regular paper issue cities new directions urban geography,True
92,people uk meaning population processes information learns differently many businesses time rethink workspace ensure inclusive find,True
93,thanks jenny great see delighted able present event,True
94,cn people new research reveals employers objectify nd workers would,True
95,seen situations company takes adult autism expects results gives real work needless say placements never succeed,True
96,want take part christmas challenge raise money umbrella project join friend george wildrunners help run distance london north pole time christmas day learn,True
97,discussing role metabolic dysregulated intrauterine environment infant neurodevelopment,True
98,delighted announce fae mell hosting takeover show discuss health social care delighted joined amelia pace join live december pm,True
99,priviledge lifetime become truly carl jung,True
100,podcast back episode joined khushboo chabria specialist transformational leader khushboo talks discovering impacted way worked listen,True
101,message nonautistic ppl tell ok mean ppl need space need allies allow happen also need understand actually entails,True
102,listening work webinar work place bit teary moment god used cold stoic children ruined damn fucking emotions,True
103,thank much facilitating visit enlightening look forward returning january visit hub employment hub,True
104,think giving examples could good way signpost people learn personally always try stay within narratives rather focusing pathologising diagnoses,True
105,eww brain thing,True
106,feel lucky work company values mental health awareness strength never expected stem team thats emotionally open much better previous job result,True
107,interesting neuroimaging eyetracking pupillometry data social side,True
108,justice warrior,True
109,child received diagnosis may wondering go find support area signposts resources may need go get started tag someone might find useful,True
110,proud become member business nib charity find excellent work,True
111,introducing flexible learning plans cognassist providing personalised got whole lot easier new feature allows tutors tailor support modules learner receives platform,True
112,help prof amanda kirby doit solutions understand better support create inclusive workforce includes understanding training support needs nuanced appreciation,True
113,honor part conference todays breakout session mental health lgbtq community thank equal asia foundation stichting equala foundation shane bhatla ryan joseph figueiredo f,True
114,important pnas paper concerning substance dualism emerging tom prospects autism correlating physicalism attenuation dualism mindbody divide also somehow squares whiteheads mentalphysical poles continuum,True
115,someone kids book community told outout twitter book bios etc talking much publicly means youre part problem thoughts,True
116,glad see brain scientists taking seriously yet author still seems assume medicalised conception neurotype fact paradigm shouldnt expect neurotypes defined shared biomarkers,True
117,disability network meeting via ms teams wednesday st december noon open meeting staff member identifies disabled living long term physical mental health condition,True
118,sharing ideas entender training good practice methodology content,True
119,st december well counting christmas day sensory toy advent calendar day reveal different sensory toy pc set link bio day decompression mini basketball,True
120,classroom strengthbased strategies help students special needs succeed school life tytyb q,True
121,tomorrow join associate professor anna dsouza semester ongoing fridays series theyll explore topics supporting utilizing lens dei,True
122,workplace toolkit help organization recruit hire retain advance workers benefit advantages work source earn,True
123,would like nominate human trials achieve goal legitimately trying good,True
124,eating soup fork animator hanna norbergwilliams portrays via cutlery confusion via,True
125,gladly welcome guest speaker gaye kassir assembly talked us theme specifically autism ms kassir key message patience supporting someone autism shows autistic traits,True
126,today people team led informative training whether currently us new first derivative passionate supporting ensuring make working us work,True
127,know people counting christmas counting january conference anxiety autism days go,True
128,power unleashing advantages differently wired brain imdg,True
129,getting ready go dentist ive packed weighted blanket loop earplugs ear defenders small wooden cubes squeeze squishy foam thing cant find eye mask ankle weights starfleet academy shirt wish luck,True
130,cant believe ranting education game design trans rights im followers short apologies everyone joined one thing nonsense timeline really multiple accounts,True
131,hey coming uni two workshops one tonight h german time comparing lived autistic experiences academic theories others next saturday neurodiversityfriendly learning environments interested shoot dm,True
132,one area wide spectrum related traits one day understood account huge amount currently thought treated differently lieu treating people individuals even currently names hugely varied,True
133,would work people people autism adhd,True
134,great gift guide also great autistic entrepreneur designs sells unique disability pride merchandise,True
135,de diversity equity inclusion strategic priority hr inclusion employees often overlooked read blog written shown,True
136,great talk social media module today wonderful social media activism,True
137,,True
138,today ive delivered flagship embracing workplace autism training bespoke version matching needs requesting organisation first time ever organisation wasnt anything healthcare education,True
139,csu spur nears completion near stock show complex via,True
140,celebrate family pretendcity dec ill storytime reading new book pirates go vacation learn event visit,True
141,clear pathway calling government ensure happens help us heard please keep sending stories us campaignstourettesactionorguk,True
142,launched employment partnership tpi provide business support services leveraging talents team adults address critical needs university,True
143,well written article call action equitable spaces individuals living disabilities chiara student comes ahead international day persons disabilities dec,True
144,think bionic reading,True
145,great free event organised client help parents get expert tips dealing children wellattended proved useful,True
146,fact matter may unintentionally violating employee rights americans disabilities act ada,True
147,honest helpful affirming insightful session family centered practice excited see next steps ot supportive part thanks giving time experience us,True
148,great meeting today oxleas forensic community team bracton centre learning first hand colleague effort build fairer oxleas amazing team,True
149,autismthere missing pieces fit together make different picture,True
150,really proud chiara student written important piece living w invisible disabilities places work learning support,True
151,newsletter december newsletter live information new team members rachel connal jes clare well information upcoming webinars conference check,True
152,using paradigm therapies education requires ongoing reflection unlearning listening learning people matter course youre set one must constantly challenge assumptions insidious ableism etc,True
153,works video,True
154,curious relates learning disabilities podcast features interviews leading experts field wealth information recommendations areas learning,True
155,looks interesting itakom takes kinds minds conference,True
156,speaker announcement onyinye udokporo entrepreneur educator dyslexic author consultant content creator founder ceo enrich learning business started aged,True
157,pdu oftheday live webinar dec top every employer list pdu free,True
158,schools universities airports bids councils businesses wanting participate umbrella project click contact joshbealeadhdfoundationorguk,True
159,talk lot believe imperative workplace success employees weve seen influx hiring initiatives put place strategies retention check piece john elder robison,True
160,events returning inperson took part virtual conversation wednesday law amazing panel included michael alessandri william pelham iris escarra debra sydnor thx invite,True
161,w savingforall decorative ceramic,True
162,solving problem autism exclusion work designing inclusive systems help solve inclusion wellbeing problems creating better future work employees backgrounds,True
163,ready christmas contact amazing learning support team support email learningsupportbppcom,True
164,quote day life like riding bicycle keep balance must keep moving albert einstein,True
165,pupil leadership team talking part learning,True
166,mindful emotion coaching free webinar dr sarah temple share inclusive traumainformed approach wellness approach quality award european mentoring coaching council,True
167,halifax campus today joined therapeutic interaction specialist skye skye lists best qualities playfulness unconditional acceptance nose curiosity ability evoke moments empathy,True
168,important work highlighting primarily represented negative attitudes british press changing crucial building truly inclusive society celebrates,True
169,autism accepted without needing explanation,True
170,given spectrum placement im surprised even noticed,True
171,interested speech language literacy development checkout see hear speak podcast,True
172,written article reflect ableism neurodiversityinformed neurodiversityaffirming practice includes reflection tool reflections journey,True
173,jack ellis joins us burnt chef journal talk openly passionately diagnosis adhd years ago conversation jack kris also explore manner subjects including intrusive thoughts medication challenging whys,True
174,anyone pdf chapter reader want send someone dont seem copy,True
175,succeed dyslexias head training assessments donna stevenson shares top tips inclusive working environment read,True
176,matters special education shirt shirt dysleixa shirt mindfulness shirts autism awareness gift equality shirt vijashop,True
177,drs jill dardig william l heward discuss new book lets make contract contracts helpful children autism spectrum benefit understanding clear expectations receiving positive feedback,True
178,know workplace new guide provides overview benefits challenges workforce along guidance supporting employees,True
179,come closing statements clear opened many new approaches hope delivered widely sustainably,True
180,need approach drive real impact learn mission lower rate talent deanna cuadra,True
181,spring release hide shh illustrated nathalia takeyama shares two sisters go game learning become spies teaches includes,True
182,yeah yeah actively want murder people actually tolerate long manifest bets fuck fuck hope never fall victim accident causes society write,True
183,knowledge teacher speaking childs individual language way retain information nurturing instead curbing emotional intelligence social awareness integrity ethics personal attention etc,True
184,mostly nonspeaking autistic son become several magnitudes happier parenting experience become significantly less fraught thanks autistic guidance,True
185,wish lived country something wonderful like destigmatization immediately taken advantage capitalist healthcare system powered corporate greed hey america right,True
186,companies high engagement clear definition compared lowengagement companies notable finding dei policies address gender sexuality ethnicity age parental veteran religion sidelined,True
187,companies high engagement clear definition compared lowengagement companies notable finding dei policies address gender sexuality ethnicity age parental veteran religion sidelined,True
188,wonderful work team anxiety depression adolescence linked theyve previously shown importance hm people,True
189,musk promised us free speech twitter brought back bots insurrectionists like trump mtg talking curing disabilities computer chip wake trying control people minds,True
190,halfwritten essay interview went autistic person interviewed large corporations recruitment autistic people crunch numbers nice things say made look good,True
191,love air wrong,True
192,heart support pleased announce launch new program aimed expanding attract retain diverse talent,True
193,know empowered accept invincible,True
194,keep pulse latest happenings world work w edition time running take survey embrace,True
195,perfect demonstration leading example,True
196,create content mind right get go include audience planning phase make repurposing distributing process much smoother,True
197,perhaps elon musk example workforce,True
198,join fellow parents caregivers latest family series education opportunity parent advisory council meeting pm campus sign contact lindsay questions lwagnerleagueschoolcom,True
199,today join us first annual day disability virtual events pm making accessible pm campus experiences disability ableism,True
200,amazing way end inclusion diversity conference thank chris quickfall discussing utilise ensure organisation thrives,True
201,ways embrace workplace,True
202,never discourage anyone continues make progress matter slow,True
203,ntt data celebrate celebrated launch network look forward fantastic work create inclusive workplace employees learn,True
204,get giving tuesday slipped mind heres another chance donate year,True
205,please give one chance,True
206,recognizing two minds alike see mission lower unemployment rate talent,True
207,helping clients come conversation bridges holiday parties bridge one part conversation another thought dancing stars topics hear people talking,True
208,students may bring written reasonable adjustments university also designed pocket guide personalize gives information,True
209,check actuallyautistic hashtag also might helpful,True
210,rcn also website including videos lived experience guidance documents,True
211,cant fucking stand promote transgenderism promote didnt know horrific wtaf,True
212,communication written dyslexic person trouble meaning sentences words please afraid ask clarification,True
213,also think auto signature husband helps lot communication written dyslexic person trouble meaning sentences words please afraid ask clarification,True
214,normalising asking questions reasonable adjustments start placement making really clear areas supportive quiet areas ready set students staff use offer anyway,True
215,next prediction need professionals broaden search net need diversity community perspectives make things better,True
216,false start,True
217,succeed dyslexias head training assessments donna stevenson shares top tips inclusive working environment read,True
218,student nurses given training,True
219,people tend dislike standard criteria believe narrow capture autism certain narrow cultural contexts,True
220,continuing theme bad ideas autism revisionism,True
221,nfts create conversations remove bias stigmas around mental health,True
222,november month wyoming man creative business opening doors world understand via read,True
223,true many area neurodivergence uncommon brings challenges many benefits nursing,True
224,key word homeopathy alone give idea either full pseudo science simply outdated scientific research ive come across lot especially regards adhd autism ym case specifically makes furious,True
225,wed love let know fantastic concert taking place friday raise money tourette syndrome hope make support thank paul redmond making happen,True
226,calling school staff work pupils sencos teachers tas beh wellbeing support leadership would super grateful could spare mins fill survey working w schools,True
227,highlighting impact missed adhd impact someone validating suspected diagnosis life changing demand high nationally services investment deliver safe effective care,True
228,support,True
229,would worked every possible way something something ableism,True
230,understanding workplace udemy course,True
231,maybe time admit ye sort issue going,True
232,unmasking autism power embracing hidden syzfszv,True
233,spring release hide shh illustrated nathalia takeyama shares two sisters go game learning become spies teaches includes,True
